{
  "address": "0x83003130d24494fd0B0453BBF03EcdB4526f87A0",
  "abi": [
    {
      "inputs": [],
      "stateMutability": "nonpayable",
      "type": "constructor"
    },
    {
      "inputs": [],
      "name": "ExecuteFlashLoanFailed",
      "type": "error"
    },
    {
      "inputs": [],
      "name": "FlashLoanNotEnabled",
      "type": "error"
    },
    {
      "inputs": [],
      "name": "InsufficientRepayment",
      "type": "error"
    },
    {
      "inputs": [],
      "name": "InvalidComptroller",
      "type": "error"
    },
    {
      "inputs": [
        {
          "internalType": "address",
          "name": "sender",
          "type": "address"
        }
      ],
      "name": "SenderNotAuthorized",
      "type": "error"
    },
    {
      "anonymous": false,
      "inputs": [
        {
          "indexed": false,
          "internalType": "uint256",
          "name": "cashPrior",
          "type": "uint256"
        },
        {
          "indexed": false,
          "internalType": "uint256",
          "name": "interestAccumulated",
          "type": "uint256"
        },
        {
          "indexed": false,
          "internalType": "uint256",
          "name": "borrowIndex",
          "type": "uint256"
        },
        {
          "indexed": false,
          "internalType": "uint256",
          "name": "totalBorrows",
          "type": "uint256"
        }
      ],
      "name": "AccrueInterest",
      "type": "event"
    },
    {
      "anonymous": false,
      "inputs": [
        {
          "indexed": true,
          "internalType": "address",
          "name": "owner",
          "type": "address"
        },
        {
          "indexed": true,
          "internalType": "address",
          "name": "spender",
          "type": "address"
        },
        {
          "indexed": false,
          "internalType": "uint256",
          "name": "amount",
          "type": "uint256"
        }
      ],
      "name": "Approval",
      "type": "event"
    },
    {
      "anonymous": false,
      "inputs": [
        {
          "indexed": false,
          "internalType": "address",
          "name": "borrower",
          "type": "address"
        },
        {
          "indexed": false,
          "internalType": "uint256",
          "name": "borrowAmount",
          "type": "uint256"
        },
        {
          "indexed": false,
          "internalType": "uint256",
          "name": "accountBorrows",
          "type": "uint256"
        },
        {
          "indexed": false,
          "internalType": "uint256",
          "name": "totalBorrows",
          "type": "uint256"
        }
      ],
      "name": "Borrow",
      "type": "event"
    },
    {
      "anonymous": false,
      "inputs": [
        {
          "indexed": false,
          "internalType": "uint256",
          "name": "error",
          "type": "uint256"
        },
        {
          "indexed": false,
          "internalType": "uint256",
          "name": "info",
          "type": "uint256"
        },
        {
          "indexed": false,
          "internalType": "uint256",
          "name": "detail",
          "type": "uint256"
        }
      ],
      "name": "Failure",
      "type": "event"
    },
    {
      "anonymous": false,
      "inputs": [
        {
          "indexed": false,
          "internalType": "address",
          "name": "receiver",
          "type": "address"
        },
        {
          "indexed": false,
          "internalType": "address",
          "name": "underlying",
          "type": "address"
        },
        {
          "indexed": false,
          "internalType": "uint256",
          "name": "amount",
          "type": "uint256"
        }
      ],
      "name": "FlashLoanExecuted",
      "type": "event"
    },
    {
      "anonymous": false,
      "inputs": [
        {
          "indexed": false,
          "internalType": "uint256",
          "name": "oldFlashLoanFeeMantissa",
          "type": "uint256"
        },
        {
          "indexed": false,
          "internalType": "uint256",
          "name": "newFlashLoanFeeMantissa",
          "type": "uint256"
        },
        {
          "indexed": false,
          "internalType": "uint256",
          "name": "oldFlashLoanProtocolShare",
          "type": "uint256"
        },
        {
          "indexed": false,
          "internalType": "uint256",
          "name": "newFlashLoanProtocolShare",
          "type": "uint256"
        }
      ],
      "name": "FlashLoanFeeUpdated",
      "type": "event"
    },
    {
      "anonymous": false,
      "inputs": [
        {
          "indexed": false,
          "internalType": "address",
          "name": "liquidator",
          "type": "address"
        },
        {
          "indexed": false,
          "internalType": "address",
          "name": "borrower",
          "type": "address"
        },
        {
          "indexed": false,
          "internalType": "uint256",
          "name": "repayAmount",
          "type": "uint256"
        },
        {
          "indexed": false,
          "internalType": "address",
          "name": "vTokenCollateral",
          "type": "address"
        },
        {
          "indexed": false,
          "internalType": "uint256",
          "name": "seizeTokens",
          "type": "uint256"
        }
      ],
      "name": "LiquidateBorrow",
      "type": "event"
    },
    {
      "anonymous": false,
      "inputs": [
        {
          "indexed": false,
          "internalType": "address",
          "name": "minter",
          "type": "address"
        },
        {
          "indexed": false,
          "internalType": "uint256",
          "name": "mintAmount",
          "type": "uint256"
        },
        {
          "indexed": false,
          "internalType": "uint256",
          "name": "mintTokens",
          "type": "uint256"
        },
        {
          "indexed": false,
          "internalType": "uint256",
          "name": "totalSupply",
          "type": "uint256"
        }
      ],
      "name": "Mint",
      "type": "event"
    },
    {
      "anonymous": false,
      "inputs": [
        {
          "indexed": false,
          "internalType": "address",
          "name": "payer",
          "type": "address"
        },
        {
          "indexed": false,
          "internalType": "address",
          "name": "receiver",
          "type": "address"
        },
        {
          "indexed": false,
          "internalType": "uint256",
          "name": "mintAmount",
          "type": "uint256"
        },
        {
          "indexed": false,
          "internalType": "uint256",
          "name": "mintTokens",
          "type": "uint256"
        },
        {
          "indexed": false,
          "internalType": "uint256",
          "name": "totalSupply",
          "type": "uint256"
        }
      ],
      "name": "MintBehalf",
      "type": "event"
    },
    {
      "anonymous": false,
      "inputs": [
        {
          "indexed": false,
          "internalType": "address",
          "name": "oldAccessControlAddress",
          "type": "address"
        },
        {
          "indexed": false,
          "internalType": "address",
          "name": "newAccessControlAddress",
          "type": "address"
        }
      ],
      "name": "NewAccessControlManager",
      "type": "event"
    },
    {
      "anonymous": false,
      "inputs": [
        {
          "indexed": false,
          "internalType": "address",
          "name": "oldAdmin",
          "type": "address"
        },
        {
          "indexed": false,
          "internalType": "address",
          "name": "newAdmin",
          "type": "address"
        }
      ],
      "name": "NewAdmin",
      "type": "event"
    },
    {
      "anonymous": false,
      "inputs": [
        {
          "indexed": false,
          "internalType": "contract ComptrollerInterface",
          "name": "oldComptroller",
          "type": "address"
        },
        {
          "indexed": false,
          "internalType": "contract ComptrollerInterface",
          "name": "newComptroller",
          "type": "address"
        }
      ],
      "name": "NewComptroller",
      "type": "event"
    },
    {
      "anonymous": false,
      "inputs": [
        {
          "indexed": false,
          "internalType": "contract InterestRateModelV8",
          "name": "oldInterestRateModel",
          "type": "address"
        },
        {
          "indexed": false,
          "internalType": "contract InterestRateModelV8",
          "name": "newInterestRateModel",
          "type": "address"
        }
      ],
      "name": "NewMarketInterestRateModel",
      "type": "event"
    },
    {
      "anonymous": false,
      "inputs": [
        {
          "indexed": false,
          "internalType": "address",
          "name": "oldPendingAdmin",
          "type": "address"
        },
        {
          "indexed": false,
          "internalType": "address",
          "name": "newPendingAdmin",
          "type": "address"
        }
      ],
      "name": "NewPendingAdmin",
      "type": "event"
    },
    {
      "anonymous": false,
      "inputs": [
        {
          "indexed": true,
          "internalType": "address",
          "name": "oldProtocolShareReserve",
          "type": "address"
        },
        {
          "indexed": true,
          "internalType": "address",
          "name": "newProtocolShareReserve",
          "type": "address"
        }
      ],
      "name": "NewProtocolShareReserve",
      "type": "event"
    },
    {
      "anonymous": false,
      "inputs": [
        {
          "indexed": false,
          "internalType": "uint256",
          "name": "oldReduceReservesBlockDelta",
          "type": "uint256"
        },
        {
          "indexed": false,
          "internalType": "uint256",
          "name": "newReduceReservesBlockDelta",
          "type": "uint256"
        }
      ],
      "name": "NewReduceReservesBlockDelta",
      "type": "event"
    },
    {
      "anonymous": false,
      "inputs": [
        {
          "indexed": false,
          "internalType": "uint256",
          "name": "oldReserveFactorMantissa",
          "type": "uint256"
        },
        {
          "indexed": false,
          "internalType": "uint256",
          "name": "newReserveFactorMantissa",
          "type": "uint256"
        }
      ],
      "name": "NewReserveFactor",
      "type": "event"
    },
    {
      "anonymous": false,
      "inputs": [
        {
          "indexed": false,
          "internalType": "address",
          "name": "redeemer",
          "type": "address"
        },
        {
          "indexed": false,
          "internalType": "uint256",
          "name": "redeemAmount",
          "type": "uint256"
        },
        {
          "indexed": false,
          "internalType": "uint256",
          "name": "redeemTokens",
          "type": "uint256"
        },
        {
          "indexed": false,
          "internalType": "uint256",
          "name": "totalSupply",
          "type": "uint256"
        }
      ],
      "name": "Redeem",
      "type": "event"
    },
    {
      "anonymous": false,
      "inputs": [
        {
          "indexed": false,
          "internalType": "address",
          "name": "redeemer",
          "type": "address"
        },
        {
          "indexed": false,
          "internalType": "uint256",
          "name": "feeAmount",
          "type": "uint256"
        },
        {
          "indexed": false,
          "internalType": "uint256",
          "name": "redeemTokens",
          "type": "uint256"
        }
      ],
      "name": "RedeemFee",
      "type": "event"
    },
    {
      "anonymous": false,
      "inputs": [
        {
          "indexed": false,
          "internalType": "address",
          "name": "payer",
          "type": "address"
        },
        {
          "indexed": false,
          "internalType": "address",
          "name": "borrower",
          "type": "address"
        },
        {
          "indexed": false,
          "internalType": "uint256",
          "name": "repayAmount",
          "type": "uint256"
        },
        {
          "indexed": false,
          "internalType": "uint256",
          "name": "accountBorrows",
          "type": "uint256"
        },
        {
          "indexed": false,
          "internalType": "uint256",
          "name": "totalBorrows",
          "type": "uint256"
        }
      ],
      "name": "RepayBorrow",
      "type": "event"
    },
    {
      "anonymous": false,
      "inputs": [
        {
          "indexed": false,
          "internalType": "address",
          "name": "benefactor",
          "type": "address"
        },
        {
          "indexed": false,
          "internalType": "uint256",
          "name": "addAmount",
          "type": "uint256"
        },
        {
          "indexed": false,
          "internalType": "uint256",
          "name": "newTotalReserves",
          "type": "uint256"
        }
      ],
      "name": "ReservesAdded",
      "type": "event"
    },
    {
      "anonymous": false,
      "inputs": [
        {
          "indexed": false,
          "internalType": "address",
          "name": "protocolShareReserve",
          "type": "address"
        },
        {
          "indexed": false,
          "internalType": "uint256",
          "name": "reduceAmount",
          "type": "uint256"
        },
        {
          "indexed": false,
          "internalType": "uint256",
          "name": "newTotalReserves",
          "type": "uint256"
        }
      ],
      "name": "ReservesReduced",
      "type": "event"
    },
    {
      "anonymous": false,
      "inputs": [
        {
          "indexed": false,
          "internalType": "bool",
          "name": "previousStatus",
          "type": "bool"
        },
        {
          "indexed": false,
          "internalType": "bool",
          "name": "newStatus",
          "type": "bool"
        }
      ],
      "name": "ToggleFlashLoanEnabled",
      "type": "event"
    },
    {
      "anonymous": false,
      "inputs": [
        {
          "indexed": true,
          "internalType": "address",
          "name": "from",
          "type": "address"
        },
        {
          "indexed": true,
          "internalType": "address",
          "name": "to",
          "type": "address"
        },
        {
          "indexed": false,
          "internalType": "uint256",
          "name": "amount",
          "type": "uint256"
        }
      ],
      "name": "Transfer",
      "type": "event"
    },
    {
      "anonymous": false,
      "inputs": [
        {
          "indexed": false,
          "internalType": "address",
          "name": "asset",
          "type": "address"
        },
        {
          "indexed": false,
          "internalType": "address",
          "name": "sender",
          "type": "address"
        },
        {
          "indexed": false,
          "internalType": "uint256",
          "name": "amount",
          "type": "uint256"
        }
      ],
      "name": "TransferInUnderlyingAndVerify",
      "type": "event"
    },
    {
      "anonymous": false,
      "inputs": [
        {
          "indexed": false,
          "internalType": "address",
          "name": "asset",
          "type": "address"
        },
        {
          "indexed": false,
          "internalType": "address",
          "name": "receiver",
          "type": "address"
        },
        {
          "indexed": false,
          "internalType": "uint256",
          "name": "amount",
          "type": "uint256"
        }
      ],
      "name": "TransferOutUnderlying",
      "type": "event"
    },
    {
      "inputs": [],
      "name": "_acceptAdmin",
      "outputs": [
        {
          "internalType": "uint256",
          "name": "",
          "type": "uint256"
        }
      ],
      "stateMutability": "nonpayable",
      "type": "function"
    },
    {
      "inputs": [
        {
          "internalType": "uint256",
          "name": "addAmount",
          "type": "uint256"
        }
      ],
      "name": "_addReserves",
      "outputs": [
        {
          "internalType": "uint256",
          "name": "",
          "type": "uint256"
        }
      ],
      "stateMutability": "nonpayable",
      "type": "function"
    },
    {
      "inputs": [
        {
          "internalType": "bytes",
          "name": "data",
          "type": "bytes"
        }
      ],
      "name": "_becomeImplementation",
      "outputs": [],
      "stateMutability": "nonpayable",
      "type": "function"
    },
    {
      "inputs": [
        {
          "internalType": "uint256",
          "name": "reduceAmount_",
          "type": "uint256"
        }
      ],
      "name": "_reduceReserves",
      "outputs": [
        {
          "internalType": "uint256",
          "name": "",
          "type": "uint256"
        }
      ],
      "stateMutability": "nonpayable",
      "type": "function"
    },
    {
      "inputs": [],
      "name": "_resignImplementation",
      "outputs": [],
      "stateMutability": "nonpayable",
      "type": "function"
    },
    {
      "inputs": [
        {
          "internalType": "contract ComptrollerInterface",
          "name": "newComptroller",
          "type": "address"
        }
      ],
      "name": "_setComptroller",
      "outputs": [
        {
          "internalType": "uint256",
          "name": "",
          "type": "uint256"
        }
      ],
      "stateMutability": "nonpayable",
      "type": "function"
    },
    {
      "inputs": [
        {
          "internalType": "contract InterestRateModelV8",
          "name": "newInterestRateModel_",
          "type": "address"
        }
      ],
      "name": "_setInterestRateModel",
      "outputs": [
        {
          "internalType": "uint256",
          "name": "",
          "type": "uint256"
        }
      ],
      "stateMutability": "nonpayable",
      "type": "function"
    },
    {
      "inputs": [
        {
          "internalType": "address payable",
          "name": "newPendingAdmin",
          "type": "address"
        }
      ],
      "name": "_setPendingAdmin",
      "outputs": [
        {
          "internalType": "uint256",
          "name": "",
          "type": "uint256"
        }
      ],
      "stateMutability": "nonpayable",
      "type": "function"
    },
    {
      "inputs": [
        {
          "internalType": "uint256",
          "name": "newReserveFactorMantissa_",
          "type": "uint256"
        }
      ],
      "name": "_setReserveFactor",
      "outputs": [
        {
          "internalType": "uint256",
          "name": "",
          "type": "uint256"
        }
      ],
      "stateMutability": "nonpayable",
      "type": "function"
    },
    {
      "inputs": [],
      "name": "accessControlManager",
      "outputs": [
        {
          "internalType": "address",
          "name": "",
          "type": "address"
        }
      ],
      "stateMutability": "view",
      "type": "function"
    },
    {
      "inputs": [],
      "name": "accrualBlockNumber",
      "outputs": [
        {
          "internalType": "uint256",
          "name": "",
          "type": "uint256"
        }
      ],
      "stateMutability": "view",
      "type": "function"
    },
    {
      "inputs": [],
      "name": "accrueInterest",
      "outputs": [
        {
          "internalType": "uint256",
          "name": "",
          "type": "uint256"
        }
      ],
      "stateMutability": "nonpayable",
      "type": "function"
    },
    {
      "inputs": [],
      "name": "admin",
      "outputs": [
        {
          "internalType": "address payable",
          "name": "",
          "type": "address"
        }
      ],
      "stateMutability": "view",
      "type": "function"
    },
    {
      "inputs": [
        {
          "internalType": "address",
          "name": "owner",
          "type": "address"
        },
        {
          "internalType": "address",
          "name": "spender",
          "type": "address"
        }
      ],
      "name": "allowance",
      "outputs": [
        {
          "internalType": "uint256",
          "name": "",
          "type": "uint256"
        }
      ],
      "stateMutability": "view",
      "type": "function"
    },
    {
      "inputs": [
        {
          "internalType": "address",
          "name": "spender",
          "type": "address"
        },
        {
          "internalType": "uint256",
          "name": "amount",
          "type": "uint256"
        }
      ],
      "name": "approve",
      "outputs": [
        {
          "internalType": "bool",
          "name": "",
          "type": "bool"
        }
      ],
      "stateMutability": "nonpayable",
      "type": "function"
    },
    {
      "inputs": [
        {
          "internalType": "address",
          "name": "owner",
          "type": "address"
        }
      ],
      "name": "balanceOf",
      "outputs": [
        {
          "internalType": "uint256",
          "name": "",
          "type": "uint256"
        }
      ],
      "stateMutability": "view",
      "type": "function"
    },
    {
      "inputs": [
        {
          "internalType": "address",
          "name": "owner",
          "type": "address"
        }
      ],
      "name": "balanceOfUnderlying",
      "outputs": [
        {
          "internalType": "uint256",
          "name": "",
          "type": "uint256"
        }
      ],
      "stateMutability": "nonpayable",
      "type": "function"
    },
    {
      "inputs": [
        {
          "internalType": "uint256",
          "name": "borrowAmount",
          "type": "uint256"
        }
      ],
      "name": "borrow",
      "outputs": [
        {
          "internalType": "uint256",
          "name": "",
          "type": "uint256"
        }
      ],
      "stateMutability": "nonpayable",
      "type": "function"
    },
    {
      "inputs": [
        {
          "internalType": "address",
          "name": "account",
          "type": "address"
        }
      ],
      "name": "borrowBalanceCurrent",
      "outputs": [
        {
          "internalType": "uint256",
          "name": "",
          "type": "uint256"
        }
      ],
      "stateMutability": "nonpayable",
      "type": "function"
    },
    {
      "inputs": [
        {
          "internalType": "address",
          "name": "account",
          "type": "address"
        }
      ],
      "name": "borrowBalanceStored",
      "outputs": [
        {
          "internalType": "uint256",
          "name": "",
          "type": "uint256"
        }
      ],
      "stateMutability": "view",
      "type": "function"
    },
    {
      "inputs": [
        {
          "internalType": "address",
          "name": "borrower",
          "type": "address"
        },
        {
          "internalType": "uint256",
          "name": "borrowAmount",
          "type": "uint256"
        }
      ],
      "name": "borrowBehalf",
      "outputs": [
        {
          "internalType": "uint256",
          "name": "",
          "type": "uint256"
        }
      ],
      "stateMutability": "nonpayable",
      "type": "function"
    },
    {
      "inputs": [
        {
          "internalType": "address",
          "name": "borrower",
          "type": "address"
        },
        {
          "internalType": "uint256",
          "name": "borrowAmount",
          "type": "uint256"
        }
      ],
      "name": "borrowDebtPosition",
      "outputs": [
        {
          "internalType": "uint256",
          "name": "",
          "type": "uint256"
        }
      ],
      "stateMutability": "nonpayable",
      "type": "function"
    },
    {
      "inputs": [],
      "name": "borrowIndex",
      "outputs": [
        {
          "internalType": "uint256",
          "name": "",
          "type": "uint256"
        }
      ],
      "stateMutability": "view",
      "type": "function"
    },
    {
      "inputs": [],
      "name": "borrowRatePerBlock",
      "outputs": [
        {
          "internalType": "uint256",
          "name": "",
          "type": "uint256"
        }
      ],
      "stateMutability": "view",
      "type": "function"
    },
    {
      "inputs": [
        {
          "internalType": "uint256",
          "name": "amount",
          "type": "uint256"
        }
      ],
      "name": "calculateFlashLoanFee",
      "outputs": [
        {
          "internalType": "uint256",
          "name": "",
          "type": "uint256"
        },
        {
          "internalType": "uint256",
          "name": "",
          "type": "uint256"
        }
      ],
      "stateMutability": "view",
      "type": "function"
    },
    {
      "inputs": [],
      "name": "comptroller",
      "outputs": [
        {
          "internalType": "contract ComptrollerInterface",
          "name": "",
          "type": "address"
        }
      ],
      "stateMutability": "view",
      "type": "function"
    },
    {
      "inputs": [],
      "name": "decimals",
      "outputs": [
        {
          "internalType": "uint8",
          "name": "",
          "type": "uint8"
        }
      ],
      "stateMutability": "view",
      "type": "function"
    },
    {
      "inputs": [],
      "name": "exchangeRateCurrent",
      "outputs": [
        {
          "internalType": "uint256",
          "name": "",
          "type": "uint256"
        }
      ],
      "stateMutability": "nonpayable",
      "type": "function"
    },
    {
      "inputs": [],
      "name": "exchangeRateStored",
      "outputs": [
        {
          "internalType": "uint256",
          "name": "",
          "type": "uint256"
        }
      ],
      "stateMutability": "view",
      "type": "function"
    },
    {
      "inputs": [
        {
          "internalType": "address",
          "name": "initiator",
          "type": "address"
        },
        {
          "internalType": "address payable",
          "name": "receiver",
          "type": "address"
        },
        {
          "internalType": "uint256",
          "name": "amount",
          "type": "uint256"
        },
        {
          "internalType": "bytes",
          "name": "param",
          "type": "bytes"
        }
      ],
      "name": "executeFlashLoan",
      "outputs": [
        {
          "internalType": "uint256",
          "name": "",
          "type": "uint256"
        }
      ],
      "stateMutability": "nonpayable",
      "type": "function"
    },
    {
      "inputs": [],
      "name": "flashLoanAmount",
      "outputs": [
        {
          "internalType": "uint256",
          "name": "",
          "type": "uint256"
        }
      ],
      "stateMutability": "view",
      "type": "function"
    },
    {
      "inputs": [],
      "name": "flashLoanFeeMantissa",
      "outputs": [
        {
          "internalType": "uint256",
          "name": "",
          "type": "uint256"
        }
      ],
      "stateMutability": "view",
      "type": "function"
    },
    {
      "inputs": [],
      "name": "flashLoanProtocolShareMantissa",
      "outputs": [
        {
          "internalType": "uint256",
          "name": "",
          "type": "uint256"
        }
      ],
      "stateMutability": "view",
      "type": "function"
    },
    {
      "inputs": [
        {
          "internalType": "address",
          "name": "account",
          "type": "address"
        }
      ],
      "name": "getAccountSnapshot",
      "outputs": [
        {
          "internalType": "uint256",
          "name": "",
          "type": "uint256"
        },
        {
          "internalType": "uint256",
          "name": "",
          "type": "uint256"
        },
        {
          "internalType": "uint256",
          "name": "",
          "type": "uint256"
        },
        {
          "internalType": "uint256",
          "name": "",
          "type": "uint256"
        }
      ],
      "stateMutability": "view",
      "type": "function"
    },
    {
      "inputs": [],
      "name": "getCash",
      "outputs": [
        {
          "internalType": "uint256",
          "name": "",
          "type": "uint256"
        }
      ],
      "stateMutability": "view",
      "type": "function"
    },
    {
      "inputs": [],
      "name": "implementation",
      "outputs": [
        {
          "internalType": "address",
          "name": "",
          "type": "address"
        }
      ],
      "stateMutability": "view",
      "type": "function"
    },
    {
      "inputs": [
        {
          "internalType": "address",
          "name": "underlying_",
          "type": "address"
        },
        {
          "internalType": "contract ComptrollerInterface",
          "name": "comptroller_",
          "type": "address"
        },
        {
          "internalType": "contract InterestRateModelV8",
          "name": "interestRateModel_",
          "type": "address"
        },
        {
          "internalType": "uint256",
          "name": "initialExchangeRateMantissa_",
          "type": "uint256"
        },
        {
          "internalType": "string",
          "name": "name_",
          "type": "string"
        },
        {
          "internalType": "string",
          "name": "symbol_",
          "type": "string"
        },
        {
          "internalType": "uint8",
          "name": "decimals_",
          "type": "uint8"
        }
      ],
      "name": "initialize",
      "outputs": [],
      "stateMutability": "nonpayable",
      "type": "function"
    },
    {
      "inputs": [
        {
          "internalType": "contract ComptrollerInterface",
          "name": "comptroller_",
          "type": "address"
        },
        {
          "internalType": "contract InterestRateModelV8",
          "name": "interestRateModel_",
          "type": "address"
        },
        {
          "internalType": "uint256",
          "name": "initialExchangeRateMantissa_",
          "type": "uint256"
        },
        {
          "internalType": "string",
          "name": "name_",
          "type": "string"
        },
        {
          "internalType": "string",
          "name": "symbol_",
          "type": "string"
        },
        {
          "internalType": "uint8",
          "name": "decimals_",
          "type": "uint8"
        }
      ],
      "name": "initialize",
      "outputs": [],
      "stateMutability": "nonpayable",
      "type": "function"
    },
    {
      "inputs": [],
      "name": "interestRateModel",
      "outputs": [
        {
          "internalType": "contract InterestRateModelV8",
          "name": "",
          "type": "address"
        }
      ],
      "stateMutability": "view",
      "type": "function"
    },
    {
      "inputs": [],
      "name": "isFlashLoanEnabled",
      "outputs": [
        {
          "internalType": "bool",
          "name": "",
          "type": "bool"
        }
      ],
      "stateMutability": "view",
      "type": "function"
    },
    {
      "inputs": [],
      "name": "isVToken",
      "outputs": [
        {
          "internalType": "bool",
          "name": "",
          "type": "bool"
        }
      ],
      "stateMutability": "view",
      "type": "function"
    },
    {
      "inputs": [
        {
          "internalType": "address",
          "name": "borrower",
          "type": "address"
        },
        {
          "internalType": "uint256",
          "name": "repayAmount",
          "type": "uint256"
        },
        {
          "internalType": "contract VTokenInterface",
          "name": "vTokenCollateral",
          "type": "address"
        }
      ],
      "name": "liquidateBorrow",
      "outputs": [
        {
          "internalType": "uint256",
          "name": "",
          "type": "uint256"
        }
      ],
      "stateMutability": "nonpayable",
      "type": "function"
    },
    {
      "inputs": [
        {
          "internalType": "uint256",
          "name": "mintAmount",
          "type": "uint256"
        }
      ],
      "name": "mint",
      "outputs": [
        {
          "internalType": "uint256",
          "name": "",
          "type": "uint256"
        }
      ],
      "stateMutability": "nonpayable",
      "type": "function"
    },
    {
      "inputs": [
        {
          "internalType": "address",
          "name": "receiver",
          "type": "address"
        },
        {
          "internalType": "uint256",
          "name": "mintAmount",
          "type": "uint256"
        }
      ],
      "name": "mintBehalf",
      "outputs": [
        {
          "internalType": "uint256",
          "name": "",
          "type": "uint256"
        }
      ],
      "stateMutability": "nonpayable",
      "type": "function"
    },
    {
      "inputs": [],
      "name": "name",
      "outputs": [
        {
          "internalType": "string",
          "name": "",
          "type": "string"
        }
      ],
      "stateMutability": "view",
      "type": "function"
    },
    {
      "inputs": [],
      "name": "pendingAdmin",
      "outputs": [
        {
          "internalType": "address payable",
          "name": "",
          "type": "address"
        }
      ],
      "stateMutability": "view",
      "type": "function"
    },
    {
      "inputs": [],
      "name": "protocolShareReserve",
      "outputs": [
        {
          "internalType": "address payable",
          "name": "",
          "type": "address"
        }
      ],
      "stateMutability": "view",
      "type": "function"
    },
    {
      "inputs": [
        {
          "internalType": "uint256",
          "name": "redeemTokens",
          "type": "uint256"
        }
      ],
      "name": "redeem",
      "outputs": [
        {
          "internalType": "uint256",
          "name": "",
          "type": "uint256"
        }
      ],
      "stateMutability": "nonpayable",
      "type": "function"
    },
    {
      "inputs": [
        {
          "internalType": "address",
          "name": "redeemer",
          "type": "address"
        },
        {
          "internalType": "uint256",
          "name": "redeemTokens",
          "type": "uint256"
        }
      ],
      "name": "redeemBehalf",
      "outputs": [
        {
          "internalType": "uint256",
          "name": "",
          "type": "uint256"
        }
      ],
      "stateMutability": "nonpayable",
      "type": "function"
    },
    {
      "inputs": [
        {
          "internalType": "uint256",
          "name": "redeemAmount",
          "type": "uint256"
        }
      ],
      "name": "redeemUnderlying",
      "outputs": [
        {
          "internalType": "uint256",
          "name": "",
          "type": "uint256"
        }
      ],
      "stateMutability": "nonpayable",
      "type": "function"
    },
    {
      "inputs": [
        {
          "internalType": "address",
          "name": "redeemer",
          "type": "address"
        },
        {
          "internalType": "uint256",
          "name": "redeemAmount",
          "type": "uint256"
        }
      ],
      "name": "redeemUnderlyingBehalf",
      "outputs": [
        {
          "internalType": "uint256",
          "name": "",
          "type": "uint256"
        }
      ],
      "stateMutability": "nonpayable",
      "type": "function"
    },
    {
      "inputs": [],
      "name": "reduceReservesBlockDelta",
      "outputs": [
        {
          "internalType": "uint256",
          "name": "",
          "type": "uint256"
        }
      ],
      "stateMutability": "view",
      "type": "function"
    },
    {
      "inputs": [],
      "name": "reduceReservesBlockNumber",
      "outputs": [
        {
          "internalType": "uint256",
          "name": "",
          "type": "uint256"
        }
      ],
      "stateMutability": "view",
      "type": "function"
    },
    {
      "inputs": [
        {
          "internalType": "uint256",
          "name": "repayAmount",
          "type": "uint256"
        }
      ],
      "name": "repayBorrow",
      "outputs": [
        {
          "internalType": "uint256",
          "name": "",
          "type": "uint256"
        }
      ],
      "stateMutability": "nonpayable",
      "type": "function"
    },
    {
      "inputs": [
        {
          "internalType": "address",
          "name": "borrower",
          "type": "address"
        },
        {
          "internalType": "uint256",
          "name": "repayAmount",
          "type": "uint256"
        }
      ],
      "name": "repayBorrowBehalf",
      "outputs": [
        {
          "internalType": "uint256",
          "name": "",
          "type": "uint256"
        }
      ],
      "stateMutability": "nonpayable",
      "type": "function"
    },
    {
      "inputs": [],
      "name": "reserveFactorMantissa",
      "outputs": [
        {
          "internalType": "uint256",
          "name": "",
          "type": "uint256"
        }
      ],
      "stateMutability": "view",
      "type": "function"
    },
    {
      "inputs": [
        {
          "internalType": "address",
          "name": "liquidator",
          "type": "address"
        },
        {
          "internalType": "address",
          "name": "borrower",
          "type": "address"
        },
        {
          "internalType": "uint256",
          "name": "seizeTokens",
          "type": "uint256"
        }
      ],
      "name": "seize",
      "outputs": [
        {
          "internalType": "uint256",
          "name": "",
          "type": "uint256"
        }
      ],
      "stateMutability": "nonpayable",
      "type": "function"
    },
    {
      "inputs": [
        {
          "internalType": "address",
          "name": "newAccessControlManagerAddress",
          "type": "address"
        }
      ],
      "name": "setAccessControlManager",
      "outputs": [
        {
          "internalType": "uint256",
          "name": "",
          "type": "uint256"
        }
      ],
      "stateMutability": "nonpayable",
      "type": "function"
    },
    {
      "inputs": [
        {
          "internalType": "uint256",
          "name": "flashLoanFeeMantissa_",
          "type": "uint256"
        },
        {
          "internalType": "uint256",
          "name": "flashLoanProtocolShare_",
          "type": "uint256"
        }
      ],
      "name": "setFlashLoanFeeMantissa",
      "outputs": [
        {
          "internalType": "uint256",
          "name": "",
          "type": "uint256"
        }
      ],
      "stateMutability": "nonpayable",
      "type": "function"
    },
    {
      "inputs": [
        {
          "internalType": "address payable",
          "name": "protcolShareReserve_",
          "type": "address"
        }
      ],
      "name": "setProtocolShareReserve",
      "outputs": [],
      "stateMutability": "nonpayable",
      "type": "function"
    },
    {
      "inputs": [
        {
          "internalType": "uint256",
          "name": "newReduceReservesBlockDelta_",
          "type": "uint256"
        }
      ],
      "name": "setReduceReservesBlockDelta",
      "outputs": [],
      "stateMutability": "nonpayable",
      "type": "function"
    },
    {
      "inputs": [],
      "name": "supplyRatePerBlock",
      "outputs": [
        {
          "internalType": "uint256",
          "name": "",
          "type": "uint256"
        }
      ],
      "stateMutability": "view",
      "type": "function"
    },
    {
      "inputs": [],
      "name": "symbol",
      "outputs": [
        {
          "internalType": "string",
          "name": "",
          "type": "string"
        }
      ],
      "stateMutability": "view",
      "type": "function"
    },
    {
      "inputs": [],
      "name": "toggleFlashLoan",
      "outputs": [
        {
          "internalType": "uint256",
          "name": "",
          "type": "uint256"
        }
      ],
      "stateMutability": "nonpayable",
      "type": "function"
    },
    {
      "inputs": [],
      "name": "totalBorrows",
      "outputs": [
        {
          "internalType": "uint256",
          "name": "",
          "type": "uint256"
        }
      ],
      "stateMutability": "view",
      "type": "function"
    },
    {
      "inputs": [],
      "name": "totalBorrowsCurrent",
      "outputs": [
        {
          "internalType": "uint256",
          "name": "",
          "type": "uint256"
        }
      ],
      "stateMutability": "nonpayable",
      "type": "function"
    },
    {
      "inputs": [],
      "name": "totalReserves",
      "outputs": [
        {
          "internalType": "uint256",
          "name": "",
          "type": "uint256"
        }
      ],
      "stateMutability": "view",
      "type": "function"
    },
    {
      "inputs": [],
      "name": "totalSupply",
      "outputs": [
        {
          "internalType": "uint256",
          "name": "",
          "type": "uint256"
        }
      ],
      "stateMutability": "view",
      "type": "function"
    },
    {
      "inputs": [
        {
          "internalType": "address",
          "name": "dst",
          "type": "address"
        },
        {
          "internalType": "uint256",
          "name": "amount",
          "type": "uint256"
        }
      ],
      "name": "transfer",
      "outputs": [
        {
          "internalType": "bool",
          "name": "",
          "type": "bool"
        }
      ],
      "stateMutability": "nonpayable",
      "type": "function"
    },
    {
      "inputs": [
        {
          "internalType": "address",
          "name": "src",
          "type": "address"
        },
        {
          "internalType": "address",
          "name": "dst",
          "type": "address"
        },
        {
          "internalType": "uint256",
          "name": "amount",
          "type": "uint256"
        }
      ],
      "name": "transferFrom",
      "outputs": [
        {
          "internalType": "bool",
          "name": "",
          "type": "bool"
        }
      ],
      "stateMutability": "nonpayable",
      "type": "function"
    },
    {
      "inputs": [
        {
          "internalType": "address payable",
          "name": "from",
          "type": "address"
        },
        {
          "internalType": "uint256",
          "name": "amountRepayed",
          "type": "uint256"
        }
      ],
      "name": "transferInUnderlyingAndVerify",
      "outputs": [],
      "stateMutability": "nonpayable",
      "type": "function"
    },
    {
      "inputs": [
        {
          "internalType": "address payable",
          "name": "to",
          "type": "address"
        },
        {
          "internalType": "uint256",
          "name": "amount",
          "type": "uint256"
        }
      ],
      "name": "transferOutUnderlying",
      "outputs": [
        {
          "internalType": "uint256",
          "name": "balanceBeforeRepayFlashloan",
          "type": "uint256"
        }
      ],
      "stateMutability": "nonpayable",
      "type": "function"
    },
    {
      "inputs": [],
      "name": "underlying",
      "outputs": [
        {
          "internalType": "address",
          "name": "",
          "type": "address"
        }
      ],
      "stateMutability": "view",
      "type": "function"
    }
  ],
  "transactionHash": "0xcbd5e19928459bb113a0454a051f427ca1ab8fbd1893acb5c64ddcaf398f0139",
  "receipt": {
    "to": null,
    "from": "0x33C6476F88eeA28D7E7900F759B4597704Ef95B7",
    "contractAddress": "0x83003130d24494fd0B0453BBF03EcdB4526f87A0",
    "transactionIndex": 0,
    "gasUsed": "5165409",
    "logsBloom": "0x00000000000000000000000000000000000000000000000000000000000000000000000000000000000000000000000000000000000000000000000000000000000000000000000000000000000000000000000000000000000000000000000000000000000000000000000000000000000000000000000000000000000000000000000000000000000000000000000000000000000000000000000000000000000000000000000000000000000000000000000000000000000000000000000000000000000000000000000000000000000000000000000000000000000000000000000000000000000000000000000000000000000000000000000000000000",
    "blockHash": "0x576095185cea0b7c5a34115578804bcc0fb6b952fdf657803d7e742e7b04d36e",
    "transactionHash": "0xcbd5e19928459bb113a0454a051f427ca1ab8fbd1893acb5c64ddcaf398f0139",
    "logs": [],
    "blockNumber": 66266293,
    "cumulativeGasUsed": "5165409",
    "status": 1,
    "byzantium": true
  },
  "args": [],
  "numDeployments": 8,
  "solcInputHash": "c94efa68858e9e0522e68bfc6cf43cc0",
  "metadata": "{\"compiler\":{\"version\":\"0.8.25+commit.b61c2a91\"},\"language\":\"Solidity\",\"output\":{\"abi\":[{\"inputs\":[],\"stateMutability\":\"nonpayable\",\"type\":\"constructor\"},{\"inputs\":[],\"name\":\"ExecuteFlashLoanFailed\",\"type\":\"error\"},{\"inputs\":[],\"name\":\"FlashLoanNotEnabled\",\"type\":\"error\"},{\"inputs\":[],\"name\":\"InsufficientRepayment\",\"type\":\"error\"},{\"inputs\":[],\"name\":\"InvalidComptroller\",\"type\":\"error\"},{\"inputs\":[{\"internalType\":\"address\",\"name\":\"sender\",\"type\":\"address\"}],\"name\":\"SenderNotAuthorized\",\"type\":\"error\"},{\"anonymous\":false,\"inputs\":[{\"indexed\":false,\"internalType\":\"uint256\",\"name\":\"cashPrior\",\"type\":\"uint256\"},{\"indexed\":false,\"internalType\":\"uint256\",\"name\":\"interestAccumulated\",\"type\":\"uint256\"},{\"indexed\":false,\"internalType\":\"uint256\",\"name\":\"borrowIndex\",\"type\":\"uint256\"},{\"indexed\":false,\"internalType\":\"uint256\",\"name\":\"totalBorrows\",\"type\":\"uint256\"}],\"name\":\"AccrueInterest\",\"type\":\"event\"},{\"anonymous\":false,\"inputs\":[{\"indexed\":true,\"internalType\":\"address\",\"name\":\"owner\",\"type\":\"address\"},{\"indexed\":true,\"internalType\":\"address\",\"name\":\"spender\",\"type\":\"address\"},{\"indexed\":false,\"internalType\":\"uint256\",\"name\":\"amount\",\"type\":\"uint256\"}],\"name\":\"Approval\",\"type\":\"event\"},{\"anonymous\":false,\"inputs\":[{\"indexed\":false,\"internalType\":\"address\",\"name\":\"borrower\",\"type\":\"address\"},{\"indexed\":false,\"internalType\":\"uint256\",\"name\":\"borrowAmount\",\"type\":\"uint256\"},{\"indexed\":false,\"internalType\":\"uint256\",\"name\":\"accountBorrows\",\"type\":\"uint256\"},{\"indexed\":false,\"internalType\":\"uint256\",\"name\":\"totalBorrows\",\"type\":\"uint256\"}],\"name\":\"Borrow\",\"type\":\"event\"},{\"anonymous\":false,\"inputs\":[{\"indexed\":false,\"internalType\":\"uint256\",\"name\":\"error\",\"type\":\"uint256\"},{\"indexed\":false,\"internalType\":\"uint256\",\"name\":\"info\",\"type\":\"uint256\"},{\"indexed\":false,\"internalType\":\"uint256\",\"name\":\"detail\",\"type\":\"uint256\"}],\"name\":\"Failure\",\"type\":\"event\"},{\"anonymous\":false,\"inputs\":[{\"indexed\":false,\"internalType\":\"address\",\"name\":\"receiver\",\"type\":\"address\"},{\"indexed\":false,\"internalType\":\"address\",\"name\":\"underlying\",\"type\":\"address\"},{\"indexed\":false,\"internalType\":\"uint256\",\"name\":\"amount\",\"type\":\"uint256\"}],\"name\":\"FlashLoanExecuted\",\"type\":\"event\"},{\"anonymous\":false,\"inputs\":[{\"indexed\":false,\"internalType\":\"uint256\",\"name\":\"oldFlashLoanFeeMantissa\",\"type\":\"uint256\"},{\"indexed\":false,\"internalType\":\"uint256\",\"name\":\"newFlashLoanFeeMantissa\",\"type\":\"uint256\"},{\"indexed\":false,\"internalType\":\"uint256\",\"name\":\"oldFlashLoanProtocolShare\",\"type\":\"uint256\"},{\"indexed\":false,\"internalType\":\"uint256\",\"name\":\"newFlashLoanProtocolShare\",\"type\":\"uint256\"}],\"name\":\"FlashLoanFeeUpdated\",\"type\":\"event\"},{\"anonymous\":false,\"inputs\":[{\"indexed\":false,\"internalType\":\"address\",\"name\":\"liquidator\",\"type\":\"address\"},{\"indexed\":false,\"internalType\":\"address\",\"name\":\"borrower\",\"type\":\"address\"},{\"indexed\":false,\"internalType\":\"uint256\",\"name\":\"repayAmount\",\"type\":\"uint256\"},{\"indexed\":false,\"internalType\":\"address\",\"name\":\"vTokenCollateral\",\"type\":\"address\"},{\"indexed\":false,\"internalType\":\"uint256\",\"name\":\"seizeTokens\",\"type\":\"uint256\"}],\"name\":\"LiquidateBorrow\",\"type\":\"event\"},{\"anonymous\":false,\"inputs\":[{\"indexed\":false,\"internalType\":\"address\",\"name\":\"minter\",\"type\":\"address\"},{\"indexed\":false,\"internalType\":\"uint256\",\"name\":\"mintAmount\",\"type\":\"uint256\"},{\"indexed\":false,\"internalType\":\"uint256\",\"name\":\"mintTokens\",\"type\":\"uint256\"},{\"indexed\":false,\"internalType\":\"uint256\",\"name\":\"totalSupply\",\"type\":\"uint256\"}],\"name\":\"Mint\",\"type\":\"event\"},{\"anonymous\":false,\"inputs\":[{\"indexed\":false,\"internalType\":\"address\",\"name\":\"payer\",\"type\":\"address\"},{\"indexed\":false,\"internalType\":\"address\",\"name\":\"receiver\",\"type\":\"address\"},{\"indexed\":false,\"internalType\":\"uint256\",\"name\":\"mintAmount\",\"type\":\"uint256\"},{\"indexed\":false,\"internalType\":\"uint256\",\"name\":\"mintTokens\",\"type\":\"uint256\"},{\"indexed\":false,\"internalType\":\"uint256\",\"name\":\"totalSupply\",\"type\":\"uint256\"}],\"name\":\"MintBehalf\",\"type\":\"event\"},{\"anonymous\":false,\"inputs\":[{\"indexed\":false,\"internalType\":\"address\",\"name\":\"oldAccessControlAddress\",\"type\":\"address\"},{\"indexed\":false,\"internalType\":\"address\",\"name\":\"newAccessControlAddress\",\"type\":\"address\"}],\"name\":\"NewAccessControlManager\",\"type\":\"event\"},{\"anonymous\":false,\"inputs\":[{\"indexed\":false,\"internalType\":\"address\",\"name\":\"oldAdmin\",\"type\":\"address\"},{\"indexed\":false,\"internalType\":\"address\",\"name\":\"newAdmin\",\"type\":\"address\"}],\"name\":\"NewAdmin\",\"type\":\"event\"},{\"anonymous\":false,\"inputs\":[{\"indexed\":false,\"internalType\":\"contract ComptrollerInterface\",\"name\":\"oldComptroller\",\"type\":\"address\"},{\"indexed\":false,\"internalType\":\"contract ComptrollerInterface\",\"name\":\"newComptroller\",\"type\":\"address\"}],\"name\":\"NewComptroller\",\"type\":\"event\"},{\"anonymous\":false,\"inputs\":[{\"indexed\":false,\"internalType\":\"contract InterestRateModelV8\",\"name\":\"oldInterestRateModel\",\"type\":\"address\"},{\"indexed\":false,\"internalType\":\"contract InterestRateModelV8\",\"name\":\"newInterestRateModel\",\"type\":\"address\"}],\"name\":\"NewMarketInterestRateModel\",\"type\":\"event\"},{\"anonymous\":false,\"inputs\":[{\"indexed\":false,\"internalType\":\"address\",\"name\":\"oldPendingAdmin\",\"type\":\"address\"},{\"indexed\":false,\"internalType\":\"address\",\"name\":\"newPendingAdmin\",\"type\":\"address\"}],\"name\":\"NewPendingAdmin\",\"type\":\"event\"},{\"anonymous\":false,\"inputs\":[{\"indexed\":true,\"internalType\":\"address\",\"name\":\"oldProtocolShareReserve\",\"type\":\"address\"},{\"indexed\":true,\"internalType\":\"address\",\"name\":\"newProtocolShareReserve\",\"type\":\"address\"}],\"name\":\"NewProtocolShareReserve\",\"type\":\"event\"},{\"anonymous\":false,\"inputs\":[{\"indexed\":false,\"internalType\":\"uint256\",\"name\":\"oldReduceReservesBlockDelta\",\"type\":\"uint256\"},{\"indexed\":false,\"internalType\":\"uint256\",\"name\":\"newReduceReservesBlockDelta\",\"type\":\"uint256\"}],\"name\":\"NewReduceReservesBlockDelta\",\"type\":\"event\"},{\"anonymous\":false,\"inputs\":[{\"indexed\":false,\"internalType\":\"uint256\",\"name\":\"oldReserveFactorMantissa\",\"type\":\"uint256\"},{\"indexed\":false,\"internalType\":\"uint256\",\"name\":\"newReserveFactorMantissa\",\"type\":\"uint256\"}],\"name\":\"NewReserveFactor\",\"type\":\"event\"},{\"anonymous\":false,\"inputs\":[{\"indexed\":false,\"internalType\":\"address\",\"name\":\"redeemer\",\"type\":\"address\"},{\"indexed\":false,\"internalType\":\"uint256\",\"name\":\"redeemAmount\",\"type\":\"uint256\"},{\"indexed\":false,\"internalType\":\"uint256\",\"name\":\"redeemTokens\",\"type\":\"uint256\"},{\"indexed\":false,\"internalType\":\"uint256\",\"name\":\"totalSupply\",\"type\":\"uint256\"}],\"name\":\"Redeem\",\"type\":\"event\"},{\"anonymous\":false,\"inputs\":[{\"indexed\":false,\"internalType\":\"address\",\"name\":\"redeemer\",\"type\":\"address\"},{\"indexed\":false,\"internalType\":\"uint256\",\"name\":\"feeAmount\",\"type\":\"uint256\"},{\"indexed\":false,\"internalType\":\"uint256\",\"name\":\"redeemTokens\",\"type\":\"uint256\"}],\"name\":\"RedeemFee\",\"type\":\"event\"},{\"anonymous\":false,\"inputs\":[{\"indexed\":false,\"internalType\":\"address\",\"name\":\"payer\",\"type\":\"address\"},{\"indexed\":false,\"internalType\":\"address\",\"name\":\"borrower\",\"type\":\"address\"},{\"indexed\":false,\"internalType\":\"uint256\",\"name\":\"repayAmount\",\"type\":\"uint256\"},{\"indexed\":false,\"internalType\":\"uint256\",\"name\":\"accountBorrows\",\"type\":\"uint256\"},{\"indexed\":false,\"internalType\":\"uint256\",\"name\":\"totalBorrows\",\"type\":\"uint256\"}],\"name\":\"RepayBorrow\",\"type\":\"event\"},{\"anonymous\":false,\"inputs\":[{\"indexed\":false,\"internalType\":\"address\",\"name\":\"benefactor\",\"type\":\"address\"},{\"indexed\":false,\"internalType\":\"uint256\",\"name\":\"addAmount\",\"type\":\"uint256\"},{\"indexed\":false,\"internalType\":\"uint256\",\"name\":\"newTotalReserves\",\"type\":\"uint256\"}],\"name\":\"ReservesAdded\",\"type\":\"event\"},{\"anonymous\":false,\"inputs\":[{\"indexed\":false,\"internalType\":\"address\",\"name\":\"protocolShareReserve\",\"type\":\"address\"},{\"indexed\":false,\"internalType\":\"uint256\",\"name\":\"reduceAmount\",\"type\":\"uint256\"},{\"indexed\":false,\"internalType\":\"uint256\",\"name\":\"newTotalReserves\",\"type\":\"uint256\"}],\"name\":\"ReservesReduced\",\"type\":\"event\"},{\"anonymous\":false,\"inputs\":[{\"indexed\":false,\"internalType\":\"bool\",\"name\":\"previousStatus\",\"type\":\"bool\"},{\"indexed\":false,\"internalType\":\"bool\",\"name\":\"newStatus\",\"type\":\"bool\"}],\"name\":\"ToggleFlashLoanEnabled\",\"type\":\"event\"},{\"anonymous\":false,\"inputs\":[{\"indexed\":true,\"internalType\":\"address\",\"name\":\"from\",\"type\":\"address\"},{\"indexed\":true,\"internalType\":\"address\",\"name\":\"to\",\"type\":\"address\"},{\"indexed\":false,\"internalType\":\"uint256\",\"name\":\"amount\",\"type\":\"uint256\"}],\"name\":\"Transfer\",\"type\":\"event\"},{\"anonymous\":false,\"inputs\":[{\"indexed\":false,\"internalType\":\"address\",\"name\":\"asset\",\"type\":\"address\"},{\"indexed\":false,\"internalType\":\"address\",\"name\":\"sender\",\"type\":\"address\"},{\"indexed\":false,\"internalType\":\"uint256\",\"name\":\"amount\",\"type\":\"uint256\"}],\"name\":\"TransferInUnderlyingAndVerify\",\"type\":\"event\"},{\"anonymous\":false,\"inputs\":[{\"indexed\":false,\"internalType\":\"address\",\"name\":\"asset\",\"type\":\"address\"},{\"indexed\":false,\"internalType\":\"address\",\"name\":\"receiver\",\"type\":\"address\"},{\"indexed\":false,\"internalType\":\"uint256\",\"name\":\"amount\",\"type\":\"uint256\"}],\"name\":\"TransferOutUnderlying\",\"type\":\"event\"},{\"inputs\":[],\"name\":\"_acceptAdmin\",\"outputs\":[{\"internalType\":\"uint256\",\"name\":\"\",\"type\":\"uint256\"}],\"stateMutability\":\"nonpayable\",\"type\":\"function\"},{\"inputs\":[{\"internalType\":\"uint256\",\"name\":\"addAmount\",\"type\":\"uint256\"}],\"name\":\"_addReserves\",\"outputs\":[{\"internalType\":\"uint256\",\"name\":\"\",\"type\":\"uint256\"}],\"stateMutability\":\"nonpayable\",\"type\":\"function\"},{\"inputs\":[{\"internalType\":\"bytes\",\"name\":\"data\",\"type\":\"bytes\"}],\"name\":\"_becomeImplementation\",\"outputs\":[],\"stateMutability\":\"nonpayable\",\"type\":\"function\"},{\"inputs\":[{\"internalType\":\"uint256\",\"name\":\"reduceAmount_\",\"type\":\"uint256\"}],\"name\":\"_reduceReserves\",\"outputs\":[{\"internalType\":\"uint256\",\"name\":\"\",\"type\":\"uint256\"}],\"stateMutability\":\"nonpayable\",\"type\":\"function\"},{\"inputs\":[],\"name\":\"_resignImplementation\",\"outputs\":[],\"stateMutability\":\"nonpayable\",\"type\":\"function\"},{\"inputs\":[{\"internalType\":\"contract ComptrollerInterface\",\"name\":\"newComptroller\",\"type\":\"address\"}],\"name\":\"_setComptroller\",\"outputs\":[{\"internalType\":\"uint256\",\"name\":\"\",\"type\":\"uint256\"}],\"stateMutability\":\"nonpayable\",\"type\":\"function\"},{\"inputs\":[{\"internalType\":\"contract InterestRateModelV8\",\"name\":\"newInterestRateModel_\",\"type\":\"address\"}],\"name\":\"_setInterestRateModel\",\"outputs\":[{\"internalType\":\"uint256\",\"name\":\"\",\"type\":\"uint256\"}],\"stateMutability\":\"nonpayable\",\"type\":\"function\"},{\"inputs\":[{\"internalType\":\"address payable\",\"name\":\"newPendingAdmin\",\"type\":\"address\"}],\"name\":\"_setPendingAdmin\",\"outputs\":[{\"internalType\":\"uint256\",\"name\":\"\",\"type\":\"uint256\"}],\"stateMutability\":\"nonpayable\",\"type\":\"function\"},{\"inputs\":[{\"internalType\":\"uint256\",\"name\":\"newReserveFactorMantissa_\",\"type\":\"uint256\"}],\"name\":\"_setReserveFactor\",\"outputs\":[{\"internalType\":\"uint256\",\"name\":\"\",\"type\":\"uint256\"}],\"stateMutability\":\"nonpayable\",\"type\":\"function\"},{\"inputs\":[],\"name\":\"accessControlManager\",\"outputs\":[{\"internalType\":\"address\",\"name\":\"\",\"type\":\"address\"}],\"stateMutability\":\"view\",\"type\":\"function\"},{\"inputs\":[],\"name\":\"accrualBlockNumber\",\"outputs\":[{\"internalType\":\"uint256\",\"name\":\"\",\"type\":\"uint256\"}],\"stateMutability\":\"view\",\"type\":\"function\"},{\"inputs\":[],\"name\":\"accrueInterest\",\"outputs\":[{\"internalType\":\"uint256\",\"name\":\"\",\"type\":\"uint256\"}],\"stateMutability\":\"nonpayable\",\"type\":\"function\"},{\"inputs\":[],\"name\":\"admin\",\"outputs\":[{\"internalType\":\"address payable\",\"name\":\"\",\"type\":\"address\"}],\"stateMutability\":\"view\",\"type\":\"function\"},{\"inputs\":[{\"internalType\":\"address\",\"name\":\"owner\",\"type\":\"address\"},{\"internalType\":\"address\",\"name\":\"spender\",\"type\":\"address\"}],\"name\":\"allowance\",\"outputs\":[{\"internalType\":\"uint256\",\"name\":\"\",\"type\":\"uint256\"}],\"stateMutability\":\"view\",\"type\":\"function\"},{\"inputs\":[{\"internalType\":\"address\",\"name\":\"spender\",\"type\":\"address\"},{\"internalType\":\"uint256\",\"name\":\"amount\",\"type\":\"uint256\"}],\"name\":\"approve\",\"outputs\":[{\"internalType\":\"bool\",\"name\":\"\",\"type\":\"bool\"}],\"stateMutability\":\"nonpayable\",\"type\":\"function\"},{\"inputs\":[{\"internalType\":\"address\",\"name\":\"owner\",\"type\":\"address\"}],\"name\":\"balanceOf\",\"outputs\":[{\"internalType\":\"uint256\",\"name\":\"\",\"type\":\"uint256\"}],\"stateMutability\":\"view\",\"type\":\"function\"},{\"inputs\":[{\"internalType\":\"address\",\"name\":\"owner\",\"type\":\"address\"}],\"name\":\"balanceOfUnderlying\",\"outputs\":[{\"internalType\":\"uint256\",\"name\":\"\",\"type\":\"uint256\"}],\"stateMutability\":\"nonpayable\",\"type\":\"function\"},{\"inputs\":[{\"internalType\":\"uint256\",\"name\":\"borrowAmount\",\"type\":\"uint256\"}],\"name\":\"borrow\",\"outputs\":[{\"internalType\":\"uint256\",\"name\":\"\",\"type\":\"uint256\"}],\"stateMutability\":\"nonpayable\",\"type\":\"function\"},{\"inputs\":[{\"internalType\":\"address\",\"name\":\"account\",\"type\":\"address\"}],\"name\":\"borrowBalanceCurrent\",\"outputs\":[{\"internalType\":\"uint256\",\"name\":\"\",\"type\":\"uint256\"}],\"stateMutability\":\"nonpayable\",\"type\":\"function\"},{\"inputs\":[{\"internalType\":\"address\",\"name\":\"account\",\"type\":\"address\"}],\"name\":\"borrowBalanceStored\",\"outputs\":[{\"internalType\":\"uint256\",\"name\":\"\",\"type\":\"uint256\"}],\"stateMutability\":\"view\",\"type\":\"function\"},{\"inputs\":[{\"internalType\":\"address\",\"name\":\"borrower\",\"type\":\"address\"},{\"internalType\":\"uint256\",\"name\":\"borrowAmount\",\"type\":\"uint256\"}],\"name\":\"borrowBehalf\",\"outputs\":[{\"internalType\":\"uint256\",\"name\":\"\",\"type\":\"uint256\"}],\"stateMutability\":\"nonpayable\",\"type\":\"function\"},{\"inputs\":[{\"internalType\":\"address\",\"name\":\"borrower\",\"type\":\"address\"},{\"internalType\":\"uint256\",\"name\":\"borrowAmount\",\"type\":\"uint256\"}],\"name\":\"borrowDebtPosition\",\"outputs\":[{\"internalType\":\"uint256\",\"name\":\"\",\"type\":\"uint256\"}],\"stateMutability\":\"nonpayable\",\"type\":\"function\"},{\"inputs\":[],\"name\":\"borrowIndex\",\"outputs\":[{\"internalType\":\"uint256\",\"name\":\"\",\"type\":\"uint256\"}],\"stateMutability\":\"view\",\"type\":\"function\"},{\"inputs\":[],\"name\":\"borrowRatePerBlock\",\"outputs\":[{\"internalType\":\"uint256\",\"name\":\"\",\"type\":\"uint256\"}],\"stateMutability\":\"view\",\"type\":\"function\"},{\"inputs\":[{\"internalType\":\"uint256\",\"name\":\"amount\",\"type\":\"uint256\"}],\"name\":\"calculateFlashLoanFee\",\"outputs\":[{\"internalType\":\"uint256\",\"name\":\"\",\"type\":\"uint256\"},{\"internalType\":\"uint256\",\"name\":\"\",\"type\":\"uint256\"}],\"stateMutability\":\"view\",\"type\":\"function\"},{\"inputs\":[],\"name\":\"comptroller\",\"outputs\":[{\"internalType\":\"contract ComptrollerInterface\",\"name\":\"\",\"type\":\"address\"}],\"stateMutability\":\"view\",\"type\":\"function\"},{\"inputs\":[],\"name\":\"decimals\",\"outputs\":[{\"internalType\":\"uint8\",\"name\":\"\",\"type\":\"uint8\"}],\"stateMutability\":\"view\",\"type\":\"function\"},{\"inputs\":[],\"name\":\"exchangeRateCurrent\",\"outputs\":[{\"internalType\":\"uint256\",\"name\":\"\",\"type\":\"uint256\"}],\"stateMutability\":\"nonpayable\",\"type\":\"function\"},{\"inputs\":[],\"name\":\"exchangeRateStored\",\"outputs\":[{\"internalType\":\"uint256\",\"name\":\"\",\"type\":\"uint256\"}],\"stateMutability\":\"view\",\"type\":\"function\"},{\"inputs\":[{\"internalType\":\"address\",\"name\":\"initiator\",\"type\":\"address\"},{\"internalType\":\"address payable\",\"name\":\"receiver\",\"type\":\"address\"},{\"internalType\":\"uint256\",\"name\":\"amount\",\"type\":\"uint256\"},{\"internalType\":\"bytes\",\"name\":\"param\",\"type\":\"bytes\"}],\"name\":\"executeFlashLoan\",\"outputs\":[{\"internalType\":\"uint256\",\"name\":\"\",\"type\":\"uint256\"}],\"stateMutability\":\"nonpayable\",\"type\":\"function\"},{\"inputs\":[],\"name\":\"flashLoanAmount\",\"outputs\":[{\"internalType\":\"uint256\",\"name\":\"\",\"type\":\"uint256\"}],\"stateMutability\":\"view\",\"type\":\"function\"},{\"inputs\":[],\"name\":\"flashLoanFeeMantissa\",\"outputs\":[{\"internalType\":\"uint256\",\"name\":\"\",\"type\":\"uint256\"}],\"stateMutability\":\"view\",\"type\":\"function\"},{\"inputs\":[],\"name\":\"flashLoanProtocolShareMantissa\",\"outputs\":[{\"internalType\":\"uint256\",\"name\":\"\",\"type\":\"uint256\"}],\"stateMutability\":\"view\",\"type\":\"function\"},{\"inputs\":[{\"internalType\":\"address\",\"name\":\"account\",\"type\":\"address\"}],\"name\":\"getAccountSnapshot\",\"outputs\":[{\"internalType\":\"uint256\",\"name\":\"\",\"type\":\"uint256\"},{\"internalType\":\"uint256\",\"name\":\"\",\"type\":\"uint256\"},{\"internalType\":\"uint256\",\"name\":\"\",\"type\":\"uint256\"},{\"internalType\":\"uint256\",\"name\":\"\",\"type\":\"uint256\"}],\"stateMutability\":\"view\",\"type\":\"function\"},{\"inputs\":[],\"name\":\"getCash\",\"outputs\":[{\"internalType\":\"uint256\",\"name\":\"\",\"type\":\"uint256\"}],\"stateMutability\":\"view\",\"type\":\"function\"},{\"inputs\":[],\"name\":\"implementation\",\"outputs\":[{\"internalType\":\"address\",\"name\":\"\",\"type\":\"address\"}],\"stateMutability\":\"view\",\"type\":\"function\"},{\"inputs\":[{\"internalType\":\"address\",\"name\":\"underlying_\",\"type\":\"address\"},{\"internalType\":\"contract ComptrollerInterface\",\"name\":\"comptroller_\",\"type\":\"address\"},{\"internalType\":\"contract InterestRateModelV8\",\"name\":\"interestRateModel_\",\"type\":\"address\"},{\"internalType\":\"uint256\",\"name\":\"initialExchangeRateMantissa_\",\"type\":\"uint256\"},{\"internalType\":\"string\",\"name\":\"name_\",\"type\":\"string\"},{\"internalType\":\"string\",\"name\":\"symbol_\",\"type\":\"string\"},{\"internalType\":\"uint8\",\"name\":\"decimals_\",\"type\":\"uint8\"}],\"name\":\"initialize\",\"outputs\":[],\"stateMutability\":\"nonpayable\",\"type\":\"function\"},{\"inputs\":[{\"internalType\":\"contract ComptrollerInterface\",\"name\":\"comptroller_\",\"type\":\"address\"},{\"internalType\":\"contract InterestRateModelV8\",\"name\":\"interestRateModel_\",\"type\":\"address\"},{\"internalType\":\"uint256\",\"name\":\"initialExchangeRateMantissa_\",\"type\":\"uint256\"},{\"internalType\":\"string\",\"name\":\"name_\",\"type\":\"string\"},{\"internalType\":\"string\",\"name\":\"symbol_\",\"type\":\"string\"},{\"internalType\":\"uint8\",\"name\":\"decimals_\",\"type\":\"uint8\"}],\"name\":\"initialize\",\"outputs\":[],\"stateMutability\":\"nonpayable\",\"type\":\"function\"},{\"inputs\":[],\"name\":\"interestRateModel\",\"outputs\":[{\"internalType\":\"contract InterestRateModelV8\",\"name\":\"\",\"type\":\"address\"}],\"stateMutability\":\"view\",\"type\":\"function\"},{\"inputs\":[],\"name\":\"isFlashLoanEnabled\",\"outputs\":[{\"internalType\":\"bool\",\"name\":\"\",\"type\":\"bool\"}],\"stateMutability\":\"view\",\"type\":\"function\"},{\"inputs\":[],\"name\":\"isVToken\",\"outputs\":[{\"internalType\":\"bool\",\"name\":\"\",\"type\":\"bool\"}],\"stateMutability\":\"view\",\"type\":\"function\"},{\"inputs\":[{\"internalType\":\"address\",\"name\":\"borrower\",\"type\":\"address\"},{\"internalType\":\"uint256\",\"name\":\"repayAmount\",\"type\":\"uint256\"},{\"internalType\":\"contract VTokenInterface\",\"name\":\"vTokenCollateral\",\"type\":\"address\"}],\"name\":\"liquidateBorrow\",\"outputs\":[{\"internalType\":\"uint256\",\"name\":\"\",\"type\":\"uint256\"}],\"stateMutability\":\"nonpayable\",\"type\":\"function\"},{\"inputs\":[{\"internalType\":\"uint256\",\"name\":\"mintAmount\",\"type\":\"uint256\"}],\"name\":\"mint\",\"outputs\":[{\"internalType\":\"uint256\",\"name\":\"\",\"type\":\"uint256\"}],\"stateMutability\":\"nonpayable\",\"type\":\"function\"},{\"inputs\":[{\"internalType\":\"address\",\"name\":\"receiver\",\"type\":\"address\"},{\"internalType\":\"uint256\",\"name\":\"mintAmount\",\"type\":\"uint256\"}],\"name\":\"mintBehalf\",\"outputs\":[{\"internalType\":\"uint256\",\"name\":\"\",\"type\":\"uint256\"}],\"stateMutability\":\"nonpayable\",\"type\":\"function\"},{\"inputs\":[],\"name\":\"name\",\"outputs\":[{\"internalType\":\"string\",\"name\":\"\",\"type\":\"string\"}],\"stateMutability\":\"view\",\"type\":\"function\"},{\"inputs\":[],\"name\":\"pendingAdmin\",\"outputs\":[{\"internalType\":\"address payable\",\"name\":\"\",\"type\":\"address\"}],\"stateMutability\":\"view\",\"type\":\"function\"},{\"inputs\":[],\"name\":\"protocolShareReserve\",\"outputs\":[{\"internalType\":\"address payable\",\"name\":\"\",\"type\":\"address\"}],\"stateMutability\":\"view\",\"type\":\"function\"},{\"inputs\":[{\"internalType\":\"uint256\",\"name\":\"redeemTokens\",\"type\":\"uint256\"}],\"name\":\"redeem\",\"outputs\":[{\"internalType\":\"uint256\",\"name\":\"\",\"type\":\"uint256\"}],\"stateMutability\":\"nonpayable\",\"type\":\"function\"},{\"inputs\":[{\"internalType\":\"address\",\"name\":\"redeemer\",\"type\":\"address\"},{\"internalType\":\"uint256\",\"name\":\"redeemTokens\",\"type\":\"uint256\"}],\"name\":\"redeemBehalf\",\"outputs\":[{\"internalType\":\"uint256\",\"name\":\"\",\"type\":\"uint256\"}],\"stateMutability\":\"nonpayable\",\"type\":\"function\"},{\"inputs\":[{\"internalType\":\"uint256\",\"name\":\"redeemAmount\",\"type\":\"uint256\"}],\"name\":\"redeemUnderlying\",\"outputs\":[{\"internalType\":\"uint256\",\"name\":\"\",\"type\":\"uint256\"}],\"stateMutability\":\"nonpayable\",\"type\":\"function\"},{\"inputs\":[{\"internalType\":\"address\",\"name\":\"redeemer\",\"type\":\"address\"},{\"internalType\":\"uint256\",\"name\":\"redeemAmount\",\"type\":\"uint256\"}],\"name\":\"redeemUnderlyingBehalf\",\"outputs\":[{\"internalType\":\"uint256\",\"name\":\"\",\"type\":\"uint256\"}],\"stateMutability\":\"nonpayable\",\"type\":\"function\"},{\"inputs\":[],\"name\":\"reduceReservesBlockDelta\",\"outputs\":[{\"internalType\":\"uint256\",\"name\":\"\",\"type\":\"uint256\"}],\"stateMutability\":\"view\",\"type\":\"function\"},{\"inputs\":[],\"name\":\"reduceReservesBlockNumber\",\"outputs\":[{\"internalType\":\"uint256\",\"name\":\"\",\"type\":\"uint256\"}],\"stateMutability\":\"view\",\"type\":\"function\"},{\"inputs\":[{\"internalType\":\"uint256\",\"name\":\"repayAmount\",\"type\":\"uint256\"}],\"name\":\"repayBorrow\",\"outputs\":[{\"internalType\":\"uint256\",\"name\":\"\",\"type\":\"uint256\"}],\"stateMutability\":\"nonpayable\",\"type\":\"function\"},{\"inputs\":[{\"internalType\":\"address\",\"name\":\"borrower\",\"type\":\"address\"},{\"internalType\":\"uint256\",\"name\":\"repayAmount\",\"type\":\"uint256\"}],\"name\":\"repayBorrowBehalf\",\"outputs\":[{\"internalType\":\"uint256\",\"name\":\"\",\"type\":\"uint256\"}],\"stateMutability\":\"nonpayable\",\"type\":\"function\"},{\"inputs\":[],\"name\":\"reserveFactorMantissa\",\"outputs\":[{\"internalType\":\"uint256\",\"name\":\"\",\"type\":\"uint256\"}],\"stateMutability\":\"view\",\"type\":\"function\"},{\"inputs\":[{\"internalType\":\"address\",\"name\":\"liquidator\",\"type\":\"address\"},{\"internalType\":\"address\",\"name\":\"borrower\",\"type\":\"address\"},{\"internalType\":\"uint256\",\"name\":\"seizeTokens\",\"type\":\"uint256\"}],\"name\":\"seize\",\"outputs\":[{\"internalType\":\"uint256\",\"name\":\"\",\"type\":\"uint256\"}],\"stateMutability\":\"nonpayable\",\"type\":\"function\"},{\"inputs\":[{\"internalType\":\"address\",\"name\":\"newAccessControlManagerAddress\",\"type\":\"address\"}],\"name\":\"setAccessControlManager\",\"outputs\":[{\"internalType\":\"uint256\",\"name\":\"\",\"type\":\"uint256\"}],\"stateMutability\":\"nonpayable\",\"type\":\"function\"},{\"inputs\":[{\"internalType\":\"uint256\",\"name\":\"flashLoanFeeMantissa_\",\"type\":\"uint256\"},{\"internalType\":\"uint256\",\"name\":\"flashLoanProtocolShare_\",\"type\":\"uint256\"}],\"name\":\"setFlashLoanFeeMantissa\",\"outputs\":[{\"internalType\":\"uint256\",\"name\":\"\",\"type\":\"uint256\"}],\"stateMutability\":\"nonpayable\",\"type\":\"function\"},{\"inputs\":[{\"internalType\":\"address payable\",\"name\":\"protcolShareReserve_\",\"type\":\"address\"}],\"name\":\"setProtocolShareReserve\",\"outputs\":[],\"stateMutability\":\"nonpayable\",\"type\":\"function\"},{\"inputs\":[{\"internalType\":\"uint256\",\"name\":\"newReduceReservesBlockDelta_\",\"type\":\"uint256\"}],\"name\":\"setReduceReservesBlockDelta\",\"outputs\":[],\"stateMutability\":\"nonpayable\",\"type\":\"function\"},{\"inputs\":[],\"name\":\"supplyRatePerBlock\",\"outputs\":[{\"internalType\":\"uint256\",\"name\":\"\",\"type\":\"uint256\"}],\"stateMutability\":\"view\",\"type\":\"function\"},{\"inputs\":[],\"name\":\"symbol\",\"outputs\":[{\"internalType\":\"string\",\"name\":\"\",\"type\":\"string\"}],\"stateMutability\":\"view\",\"type\":\"function\"},{\"inputs\":[],\"name\":\"toggleFlashLoan\",\"outputs\":[{\"internalType\":\"uint256\",\"name\":\"\",\"type\":\"uint256\"}],\"stateMutability\":\"nonpayable\",\"type\":\"function\"},{\"inputs\":[],\"name\":\"totalBorrows\",\"outputs\":[{\"internalType\":\"uint256\",\"name\":\"\",\"type\":\"uint256\"}],\"stateMutability\":\"view\",\"type\":\"function\"},{\"inputs\":[],\"name\":\"totalBorrowsCurrent\",\"outputs\":[{\"internalType\":\"uint256\",\"name\":\"\",\"type\":\"uint256\"}],\"stateMutability\":\"nonpayable\",\"type\":\"function\"},{\"inputs\":[],\"name\":\"totalReserves\",\"outputs\":[{\"internalType\":\"uint256\",\"name\":\"\",\"type\":\"uint256\"}],\"stateMutability\":\"view\",\"type\":\"function\"},{\"inputs\":[],\"name\":\"totalSupply\",\"outputs\":[{\"internalType\":\"uint256\",\"name\":\"\",\"type\":\"uint256\"}],\"stateMutability\":\"view\",\"type\":\"function\"},{\"inputs\":[{\"internalType\":\"address\",\"name\":\"dst\",\"type\":\"address\"},{\"internalType\":\"uint256\",\"name\":\"amount\",\"type\":\"uint256\"}],\"name\":\"transfer\",\"outputs\":[{\"internalType\":\"bool\",\"name\":\"\",\"type\":\"bool\"}],\"stateMutability\":\"nonpayable\",\"type\":\"function\"},{\"inputs\":[{\"internalType\":\"address\",\"name\":\"src\",\"type\":\"address\"},{\"internalType\":\"address\",\"name\":\"dst\",\"type\":\"address\"},{\"internalType\":\"uint256\",\"name\":\"amount\",\"type\":\"uint256\"}],\"name\":\"transferFrom\",\"outputs\":[{\"internalType\":\"bool\",\"name\":\"\",\"type\":\"bool\"}],\"stateMutability\":\"nonpayable\",\"type\":\"function\"},{\"inputs\":[{\"internalType\":\"address payable\",\"name\":\"from\",\"type\":\"address\"},{\"internalType\":\"uint256\",\"name\":\"amountRepayed\",\"type\":\"uint256\"}],\"name\":\"transferInUnderlyingAndVerify\",\"outputs\":[],\"stateMutability\":\"nonpayable\",\"type\":\"function\"},{\"inputs\":[{\"internalType\":\"address payable\",\"name\":\"to\",\"type\":\"address\"},{\"internalType\":\"uint256\",\"name\":\"amount\",\"type\":\"uint256\"}],\"name\":\"transferOutUnderlying\",\"outputs\":[{\"internalType\":\"uint256\",\"name\":\"balanceBeforeRepayFlashloan\",\"type\":\"uint256\"}],\"stateMutability\":\"nonpayable\",\"type\":\"function\"},{\"inputs\":[],\"name\":\"underlying\",\"outputs\":[{\"internalType\":\"address\",\"name\":\"\",\"type\":\"address\"}],\"stateMutability\":\"view\",\"type\":\"function\"}],\"devdoc\":{\"author\":\"Venus\",\"events\":{\"Failure(uint256,uint256,uint256)\":{\"details\":\"`error` corresponds to enum Error; `info` corresponds to enum FailureInfo, and `detail` is an arbitrary contract-specific code that enables us to report opaque error codes from upgradeable contracts.*\"}},\"kind\":\"dev\",\"methods\":{\"_acceptAdmin()\":{\"details\":\"Admin function for pending admin to accept role and update admin\",\"returns\":{\"_0\":\"uint Returns 0 on success, otherwise returns a failure code (see ErrorReporter.sol for details).\"}},\"_addReserves(uint256)\":{\"params\":{\"addAmount\":\"The amount of underlying tokens to add as reserves\"},\"returns\":{\"_0\":\"uint Returns 0 on success, otherwise returns a failure code (see ErrorReporter.sol for details).\"}},\"_becomeImplementation(bytes)\":{\"params\":{\"data\":\"The encoded bytes data for any initialization\"}},\"_reduceReserves(uint256)\":{\"params\":{\"reduceAmount_\":\"Amount of reduction to reserves\"},\"returns\":{\"_0\":\"uint Returns 0 on success, otherwise returns a failure code (see ErrorReporter.sol for details).\"}},\"_setComptroller(address)\":{\"details\":\"Admin function to set a new comptroller\",\"returns\":{\"_0\":\"uint Returns 0 on success, otherwise returns a failure code (see ErrorReporter.sol for details).\"}},\"_setInterestRateModel(address)\":{\"details\":\"Governance function to accrue interest and update the interest rate model\",\"params\":{\"newInterestRateModel_\":\"The new interest rate model to use\"},\"returns\":{\"_0\":\"uint Returns 0 on success, otherwise returns a failure code (see ErrorReporter.sol for details).\"}},\"_setPendingAdmin(address)\":{\"details\":\"Admin function to begin change of admin. The newPendingAdmin must call `_acceptAdmin` to finalize the transfer.\",\"params\":{\"newPendingAdmin\":\"New pending admin.\"},\"returns\":{\"_0\":\"uint Returns 0 on success, otherwise returns a failure code (see ErrorReporter.sol for details).\"}},\"_setReserveFactor(uint256)\":{\"details\":\"Governor function to accrue interest and set a new reserve factor\",\"returns\":{\"_0\":\"uint Returns 0 on success, otherwise returns a failure code (see ErrorReporter.sol for details).\"}},\"accrueInterest()\":{\"details\":\"This calculates interest accrued from the last checkpointed block up to the current block and writes new checkpoint to storage and reduce spread reserves to protocol share reserve if currentBlock - reduceReservesBlockNumber >= blockDelta\"},\"allowance(address,address)\":{\"params\":{\"owner\":\"The address of the account which owns the tokens to be spent\",\"spender\":\"The address of the account which may transfer tokens\"},\"returns\":{\"_0\":\"The number of tokens allowed to be spent (type(uint256).max means infinite)\"}},\"approve(address,uint256)\":{\"details\":\"This will overwrite the approval amount for `spender`  and is subject to issues noted [here](https://eips.ethereum.org/EIPS/eip-20#approve)\",\"params\":{\"amount\":\"The number of tokens that are approved (type(uint256).max means infinite)\",\"spender\":\"The address of the account which may transfer tokens\"},\"returns\":{\"_0\":\"Whether or not the approval succeeded\"}},\"balanceOf(address)\":{\"params\":{\"owner\":\"The address of the account to query\"},\"returns\":{\"_0\":\"The number of tokens owned by `owner`\"}},\"balanceOfUnderlying(address)\":{\"details\":\"This also accrues interest in a transaction\",\"params\":{\"owner\":\"The address of the account to query\"},\"returns\":{\"_0\":\"The amount of underlying owned by `owner`\"}},\"borrow(uint256)\":{\"params\":{\"borrowAmount\":\"The amount of the underlying asset to borrow\"},\"returns\":{\"_0\":\"uint Returns 0 on success, otherwise returns a failure code (see ErrorReporter.sol for details).\"}},\"borrowBalanceCurrent(address)\":{\"params\":{\"account\":\"The address whose balance should be calculated after updating borrowIndex\"},\"returns\":{\"_0\":\"The calculated balance\"}},\"borrowBalanceStored(address)\":{\"params\":{\"account\":\"The address whose balance should be calculated\"},\"returns\":{\"_0\":\"The calculated balance\"}},\"borrowBehalf(address,uint256)\":{\"params\":{\"borrowAmount\":\"The amount of the underlying asset to borrow\",\"borrower\":\"The borrower, on behalf of whom to borrow.\"},\"returns\":{\"_0\":\"uint Returns 0 on success, otherwise returns a failure code (see ErrorReporter.sol for details).\"}},\"borrowDebtPosition(address,uint256)\":{\"custom:error\":\"InvalidComptroller is thrown if the caller is not the Comptroller.\",\"details\":\"This function checks if the borrow is allowed, accrues interest, and updates the borrower's balance.      It also emits a Borrow event and calls the comptroller's borrowVerify function.      It reverts if the borrow is not allowed, if the market's block number is not current, or if the protocol has insufficient cash.\",\"params\":{\"borrowAmount\":\"The amount of underlying asset to borrow\",\"borrower\":\"The address of the borrower\"},\"returns\":{\"_0\":\"uint Returns 0 on success, otherwise returns a failure code (see ErrorReporter.sol for details).\"}},\"borrowRatePerBlock()\":{\"returns\":{\"_0\":\"The borrow interest rate per block, scaled by 1e18\"}},\"calculateFlashLoanFee(uint256)\":{\"params\":{\"amount\":\"The amount of the flash loan.\"},\"returns\":{\"_0\":\"totalFee The total fee for the flash loan.\",\"_1\":\"protocolFee The portion of the total fee allocated to the protocol.\"}},\"exchangeRateCurrent()\":{\"returns\":{\"_0\":\"Calculated exchange rate scaled by 1e18\"}},\"exchangeRateStored()\":{\"details\":\"This function does not accrue interest before calculating the exchange rate\",\"returns\":{\"_0\":\"Calculated exchange rate scaled by 1e18\"}},\"executeFlashLoan(address,address,uint256,bytes)\":{\"custom:error\":\"FlashLoanNotEnabled is thrown if flash loans are disabled for the asset.SenderNotAuthorized is thrown if the initiator is not authorized to execute flash loan.ExecuteFlashLoanFailed is thrown if the receiver contract fails to execute the operation.InsufficientRepayment is thrown if the repayment (amount + fee) is insufficient after the operation.\",\"custom:event\":\"Emits FlashLoanExecuted event on success\",\"details\":\"Transfers the amount to the receiver contract and ensures that the total repayment (amount + fee)      is returned by the receiver contract after the operation. The function performs checks to ensure the validity      of parameters, that flashLoan is enabled for the given asset, and that the total repayment is sufficient.      Reverts on invalid parameters, disabled flashLoans, or insufficient repayment.      requirements      - The `receiver` address must not be the zero address.      - FlashLoans must be enabled for the asset.      - The `receiver` contract must repay the loan with the appropriate fee.\",\"params\":{\"amount\":\"The amount of asset to be loaned.\",\"initiator\":\"The address that initiated the flash loan.\",\"param\":\"Additional encoded parameters passed with the flash loan.\",\"receiver\":\"The address of the contract that will receive the flashLoan and execute the operation.\"}},\"getAccountSnapshot(address)\":{\"details\":\"This is used by comptroller to more efficiently perform liquidity checks.\",\"params\":{\"account\":\"Address of the account to snapshot\"},\"returns\":{\"_0\":\"(possible error, token balance, borrow balance, exchange rate mantissa)\"}},\"getCash()\":{\"returns\":{\"_0\":\"The quantity of underlying asset owned by this contract\"}},\"initialize(address,address,address,uint256,string,string,uint8)\":{\"params\":{\"comptroller_\":\"The address of the Comptroller\",\"decimals_\":\"BEP-20 decimal precision of this token\",\"initialExchangeRateMantissa_\":\"The initial exchange rate, scaled by 1e18\",\"interestRateModel_\":\"The address of the interest rate model\",\"name_\":\"BEP-20 name of this token\",\"symbol_\":\"BEP-20 symbol of this token\",\"underlying_\":\"The address of the underlying asset\"}},\"initialize(address,address,uint256,string,string,uint8)\":{\"params\":{\"comptroller_\":\"The address of the Comptroller\",\"decimals_\":\"EIP-20 decimal precision of this token\",\"initialExchangeRateMantissa_\":\"The initial exchange rate, scaled by 1e18\",\"interestRateModel_\":\"The address of the interest rate model\",\"name_\":\"EIP-20 name of this token\",\"symbol_\":\"EIP-20 symbol of this token\"}},\"liquidateBorrow(address,uint256,address)\":{\"params\":{\"borrower\":\"The borrower of this vToken to be liquidated\",\"repayAmount\":\"The amount of the underlying borrowed asset to repay\",\"vTokenCollateral\":\"The market in which to seize collateral from the borrower\"},\"returns\":{\"_0\":\"uint Returns 0 on success, otherwise returns a failure code (see ErrorReporter.sol for details).\"}},\"mint(uint256)\":{\"details\":\"Accrues interest whether or not the operation succeeds, unless reverted\",\"params\":{\"mintAmount\":\"The amount of the underlying asset to supply\"},\"returns\":{\"_0\":\"uint Returns 0 on success, otherwise returns a failure code (see ErrorReporter.sol for details).\"}},\"mintBehalf(address,uint256)\":{\"details\":\"Accrues interest whether or not the operation succeeds, unless reverted\",\"params\":{\"mintAmount\":\"The amount of the underlying asset to supply\",\"receiver\":\"The account which is receiving the vTokens\"},\"returns\":{\"_0\":\"uint Returns 0 on success, otherwise returns a failure code (see ErrorReporter.sol for details).\"}},\"redeem(uint256)\":{\"details\":\"Accrues interest whether or not the operation succeeds, unless reverted\",\"params\":{\"redeemTokens\":\"The number of vTokens to redeem into underlying\"},\"returns\":{\"_0\":\"uint Returns 0 on success, otherwise returns a failure code (see ErrorReporter.sol for details).\"}},\"redeemBehalf(address,uint256)\":{\"details\":\"Accrues interest whether or not the operation succeeds, unless reverted\",\"params\":{\"redeemTokens\":\"The number of vTokens to redeem into underlying\",\"redeemer\":\"The user on behalf of whom to redeem\"},\"returns\":{\"_0\":\"uint Returns 0 on success, otherwise returns a failure code (see ErrorReporter.sol for details).\"}},\"redeemUnderlying(uint256)\":{\"details\":\"Accrues interest whether or not the operation succeeds, unless reverted\",\"params\":{\"redeemAmount\":\"The amount of underlying to redeem\"},\"returns\":{\"_0\":\"uint Returns 0 on success, otherwise returns a failure code (see ErrorReporter.sol for details).\"}},\"redeemUnderlyingBehalf(address,uint256)\":{\"details\":\"Accrues interest whether or not the operation succeeds, unless reverted\",\"params\":{\"redeemAmount\":\"The amount of underlying to receive from redeeming vTokens\",\"redeemer\":\", on behalf of whom to redeem\"},\"returns\":{\"_0\":\"uint Returns 0 on success, otherwise returns a failure code (see ErrorReporter.sol for details).\"}},\"repayBorrow(uint256)\":{\"params\":{\"repayAmount\":\"The amount to repay\"},\"returns\":{\"_0\":\"uint Returns 0 on success, otherwise returns a failure code (see ErrorReporter.sol for details).\"}},\"repayBorrowBehalf(address,uint256)\":{\"params\":{\"borrower\":\"The account with the debt being payed off\",\"repayAmount\":\"The amount to repay\"},\"returns\":{\"_0\":\"uint Returns 0 on success, otherwise returns a failure code (see ErrorReporter.sol for details).\"}},\"seize(address,address,uint256)\":{\"details\":\"Will fail unless called by another vToken during the process of liquidation.  Its absolutely critical to use msg.sender as the borrowed vToken and not a parameter.\",\"params\":{\"borrower\":\"The account having collateral seized\",\"liquidator\":\"The account receiving seized collateral\",\"seizeTokens\":\"The number of vTokens to seize\"},\"returns\":{\"_0\":\"uint Returns 0 on success, otherwise returns a failure code (see ErrorReporter.sol for details).\"}},\"setAccessControlManager(address)\":{\"details\":\"Admin function to set the access control address\",\"params\":{\"newAccessControlManagerAddress\":\"New address for the access control\"},\"returns\":{\"_0\":\"uint 0=success, otherwise will revert\"}},\"setFlashLoanFeeMantissa(uint256,uint256)\":{\"custom:access\":\"Only Governance\",\"custom:event\":\"Emits FlashLoanFeeUpdated event on success\",\"params\":{\"flashLoanFeeMantissa_\":\"FlashLoan fee, scaled by 1e18\",\"flashLoanProtocolShare_\":\"FlashLoan protocol fee share, transferred to protocol share reserve\"},\"returns\":{\"_0\":\"uint Returns 0 on success, otherwise returns a failure code (see ErrorReporter.sol for details).\"}},\"setProtocolShareReserve(address)\":{\"params\":{\"protcolShareReserve_\":\"The address of protocol share reserve contract\"}},\"setReduceReservesBlockDelta(uint256)\":{\"params\":{\"newReduceReservesBlockDelta_\":\"block difference value\"}},\"supplyRatePerBlock()\":{\"returns\":{\"_0\":\"The supply interest rate per block, scaled by 1e18\"}},\"toggleFlashLoan()\":{\"custom:access\":\"Only Governance\",\"custom:event\":\"Emits ToggleFlashLoanEnabled event on success\"},\"totalBorrowsCurrent()\":{\"returns\":{\"_0\":\"The total borrows with interest\"}},\"transfer(address,uint256)\":{\"params\":{\"amount\":\"The number of tokens to transfer\",\"dst\":\"The address of the destination account\"},\"returns\":{\"_0\":\"Whether or not the transfer succeeded\"}},\"transferFrom(address,address,uint256)\":{\"params\":{\"amount\":\"The number of tokens to transfer\",\"dst\":\"The address of the destination account\",\"src\":\"The address of the source account\"},\"returns\":{\"_0\":\"Whether or not the transfer succeeded\"}},\"transferInUnderlyingAndVerify(address,uint256)\":{\"custom:error\":\"InvalidComptroller is thrown if the caller is not the Comptroller.\",\"custom:event\":\"Emits TransferInUnderlyingAndVerify event on successful transfer of amount from the receiver to the vToken\",\"details\":\"Can only be called by the Comptroller contract. This function performs the actual transfer of the underlying      asset by calling the `doTransferIn` internal function.      - The caller must be the Comptroller contract.\",\"params\":{\"amountRepayed\":\"The amount of the underlying asset to transfer.\",\"from\":\"The address from which the underlying asset is to be transferred.\"}},\"transferOutUnderlying(address,uint256)\":{\"custom:error\":\"InvalidComptroller is thrown if the caller is not the Comptroller.\",\"custom:event\":\"Emits TransferOutUnderlying event on successful transfer of amount to receiver\",\"details\":\"Can only be called by the Comptroller contract. This function performs the actual transfer of the underlying      asset by calling the `doTransferOut` internal function.      - The caller must be the Comptroller contract.      - If the `to` address is not the protocol share reserve, the flashLoanAmount is incremented by the amount transferred out.\",\"params\":{\"amount\":\"The amount of the underlying asset to transfer.\",\"to\":\"The address to which the underlying asset is to be transferred.\"},\"returns\":{\"balanceBeforeRepayFlashloan\":\"Cash balance after transfer out for comparison in flash loan verification.\"}}},\"title\":\"Venus's VBep20Delegate Contract\",\"version\":1},\"userdoc\":{\"events\":{\"AccrueInterest(uint256,uint256,uint256,uint256)\":{\"notice\":\"Event emitted when interest is accrued\"},\"Approval(address,address,uint256)\":{\"notice\":\"EIP20 Approval event\"},\"Borrow(address,uint256,uint256,uint256)\":{\"notice\":\"Event emitted when underlying is borrowed\"},\"FlashLoanExecuted(address,address,uint256)\":{\"notice\":\"Event emitted when flashLoan is executed\"},\"FlashLoanFeeUpdated(uint256,uint256,uint256,uint256)\":{\"notice\":\"Event emitted when flashLoan fee mantissa is updated\"},\"LiquidateBorrow(address,address,uint256,address,uint256)\":{\"notice\":\"Event emitted when a borrow is liquidated\"},\"Mint(address,uint256,uint256,uint256)\":{\"notice\":\"Event emitted when tokens are minted\"},\"MintBehalf(address,address,uint256,uint256,uint256)\":{\"notice\":\"Event emitted when tokens are minted behalf by payer to receiver\"},\"NewAccessControlManager(address,address)\":{\"notice\":\"Emitted when access control address is changed by admin\"},\"NewAdmin(address,address)\":{\"notice\":\"Event emitted when pendingAdmin is accepted, which means admin has been updated\"},\"NewComptroller(address,address)\":{\"notice\":\"Event emitted when comptroller is changed\"},\"NewMarketInterestRateModel(address,address)\":{\"notice\":\"Event emitted when interestRateModel is changed\"},\"NewPendingAdmin(address,address)\":{\"notice\":\"Event emitted when pendingAdmin is changed\"},\"NewProtocolShareReserve(address,address)\":{\"notice\":\"Event emitted when address of ProtocolShareReserve contract get updated\"},\"NewReduceReservesBlockDelta(uint256,uint256)\":{\"notice\":\"Event emitted when block delta for reduce reserves get updated\"},\"NewReserveFactor(uint256,uint256)\":{\"notice\":\"Event emitted when the reserve factor is changed\"},\"Redeem(address,uint256,uint256,uint256)\":{\"notice\":\"Event emitted when tokens are redeemed\"},\"RedeemFee(address,uint256,uint256)\":{\"notice\":\"Event emitted when tokens are redeemed and fee is transferred\"},\"RepayBorrow(address,address,uint256,uint256,uint256)\":{\"notice\":\"Event emitted when a borrow is repaid\"},\"ReservesAdded(address,uint256,uint256)\":{\"notice\":\"Event emitted when the reserves are added\"},\"ReservesReduced(address,uint256,uint256)\":{\"notice\":\"Event emitted when the reserves are reduced\"},\"ToggleFlashLoanEnabled(bool,bool)\":{\"notice\":\"Event emitted when flashLoanEnabled status is changed\"},\"Transfer(address,address,uint256)\":{\"notice\":\"EIP20 Transfer event\"},\"TransferInUnderlyingAndVerify(address,address,uint256)\":{\"notice\":\"Event emitted when asset is transferred from sender and verified\"},\"TransferOutUnderlying(address,address,uint256)\":{\"notice\":\"Event emitted when asset is transferred to receiver\"}},\"kind\":\"user\",\"methods\":{\"_acceptAdmin()\":{\"notice\":\"Accepts transfer of admin rights. msg.sender must be pendingAdmin\"},\"_addReserves(uint256)\":{\"notice\":\"The sender adds to reserves.\"},\"_becomeImplementation(bytes)\":{\"notice\":\"Called by the delegator on a delegate to initialize it for duty\"},\"_reduceReserves(uint256)\":{\"notice\":\"Accrues interest and reduces reserves by transferring to protocol share reserve\"},\"_resignImplementation()\":{\"notice\":\"Called by the delegator on a delegate to forfeit its responsibility\"},\"_setComptroller(address)\":{\"notice\":\"Sets a new comptroller for the market\"},\"_setInterestRateModel(address)\":{\"notice\":\"Accrues interest and updates the interest rate model using _setInterestRateModelFresh\"},\"_setPendingAdmin(address)\":{\"notice\":\"Begins transfer of admin rights. The newPendingAdmin must call `_acceptAdmin` to finalize the transfer.\"},\"_setReserveFactor(uint256)\":{\"notice\":\"accrues interest and sets a new reserve factor for the protocol using `_setReserveFactorFresh`\"},\"accessControlManager()\":{\"notice\":\"address of accessControlManager\"},\"accrualBlockNumber()\":{\"notice\":\"Block number that interest was last accrued at\"},\"accrueInterest()\":{\"notice\":\"Applies accrued interest to total borrows and reserves\"},\"admin()\":{\"notice\":\"Administrator for this contract\"},\"allowance(address,address)\":{\"notice\":\"Get the current allowance from `owner` for `spender`\"},\"approve(address,uint256)\":{\"notice\":\"Approve `spender` to transfer up to `amount` from `src`\"},\"balanceOf(address)\":{\"notice\":\"Get the token balance of the `owner`\"},\"balanceOfUnderlying(address)\":{\"notice\":\"Get the underlying balance of the `owner`\"},\"borrow(uint256)\":{\"notice\":\"Sender borrows assets from the protocol to their own address\"},\"borrowBalanceCurrent(address)\":{\"notice\":\"Accrue interest to updated borrowIndex and then calculate account's borrow balance using the updated borrowIndex\"},\"borrowBalanceStored(address)\":{\"notice\":\"Return the borrow balance of account based on stored data\"},\"borrowBehalf(address,uint256)\":{\"notice\":\"Sender borrows assets on behalf of some other address. This function is only available   for senders, explicitly marked as delegates of the borrower using `comptroller.updateDelegate`\"},\"borrowDebtPosition(address,uint256)\":{\"notice\":\"open a debt position for the borrower\"},\"borrowIndex()\":{\"notice\":\"Accumulator of the total earned interest rate since the opening of the market\"},\"borrowRatePerBlock()\":{\"notice\":\"Returns the current per-block borrow interest rate for this vToken\"},\"calculateFlashLoanFee(uint256)\":{\"notice\":\"Calculates the total fee and protocol fee for a flash loan..\"},\"comptroller()\":{\"notice\":\"Contract which oversees inter-vToken operations\"},\"constructor\":{\"notice\":\"Construct an empty delegate\"},\"decimals()\":{\"notice\":\"EIP-20 token decimals for this token\"},\"exchangeRateCurrent()\":{\"notice\":\"Accrue interest then return the up-to-date exchange rate\"},\"exchangeRateStored()\":{\"notice\":\"Calculates the exchange rate from the underlying to the VToken\"},\"executeFlashLoan(address,address,uint256,bytes)\":{\"notice\":\"Executes a flashLoan operation.\"},\"flashLoanAmount()\":{\"notice\":\"Amount of flashLoan taken by the receiver\"},\"flashLoanFeeMantissa()\":{\"notice\":\"total fee percentage collected on flashLoan (scaled by 1e18)\"},\"flashLoanProtocolShareMantissa()\":{\"notice\":\"fee percentage of flashLoan that goes to protocol (scaled by 1e18)\"},\"getAccountSnapshot(address)\":{\"notice\":\"Get a snapshot of the account's balances, and the cached exchange rate\"},\"getCash()\":{\"notice\":\"Get cash balance of this vToken in the underlying asset\"},\"implementation()\":{\"notice\":\"Implementation address for this contract\"},\"initialize(address,address,address,uint256,string,string,uint8)\":{\"notice\":\"Initialize the new money market\"},\"initialize(address,address,uint256,string,string,uint8)\":{\"notice\":\"Initialize the money market\"},\"interestRateModel()\":{\"notice\":\"Model which tells what the current interest rate should be\"},\"isFlashLoanEnabled()\":{\"notice\":\"flashLoan is enabled for this market or not\"},\"isVToken()\":{\"notice\":\"Indicator that this is a vToken contract (for inspection)\"},\"liquidateBorrow(address,uint256,address)\":{\"notice\":\"The sender liquidates the borrowers collateral.  The collateral seized is transferred to the liquidator.\"},\"mint(uint256)\":{\"notice\":\"Sender supplies assets into the market and receives vTokens in exchange\"},\"mintBehalf(address,uint256)\":{\"notice\":\"Sender supplies assets into the market and receiver receives vTokens in exchange\"},\"name()\":{\"notice\":\"EIP-20 token name for this token\"},\"pendingAdmin()\":{\"notice\":\"Pending administrator for this contract\"},\"protocolShareReserve()\":{\"notice\":\"address of protocol share reserve contract\"},\"redeem(uint256)\":{\"notice\":\"Sender redeems vTokens in exchange for the underlying asset\"},\"redeemBehalf(address,uint256)\":{\"notice\":\"Sender redeems assets on behalf of some other address. This function is only available   for senders, explicitly marked as delegates of the supplier using `comptroller.updateDelegate`\"},\"redeemUnderlying(uint256)\":{\"notice\":\"Sender redeems vTokens in exchange for a specified amount of underlying asset\"},\"redeemUnderlyingBehalf(address,uint256)\":{\"notice\":\"Sender redeems underlying assets on behalf of some other address. This function is only available   for senders, explicitly marked as delegates of the supplier using `comptroller.updateDelegate`\"},\"reduceReservesBlockDelta()\":{\"notice\":\"delta block after which reserves will be reduced\"},\"reduceReservesBlockNumber()\":{\"notice\":\"last block number at which reserves were reduced\"},\"repayBorrow(uint256)\":{\"notice\":\"Sender repays their own borrow\"},\"repayBorrowBehalf(address,uint256)\":{\"notice\":\"Sender repays a borrow belonging to another borrowing account\"},\"reserveFactorMantissa()\":{\"notice\":\"Fraction of interest currently set aside for reserves\"},\"seize(address,address,uint256)\":{\"notice\":\"Transfers collateral tokens (this market) to the liquidator.\"},\"setAccessControlManager(address)\":{\"notice\":\"Sets the address of the access control manager of this contract\"},\"setFlashLoanFeeMantissa(uint256,uint256)\":{\"notice\":\"Update flashLoan fee mantissa\"},\"setProtocolShareReserve(address)\":{\"notice\":\"Sets protocol share reserve contract address\"},\"setReduceReservesBlockDelta(uint256)\":{\"notice\":\"Governance function to set new threshold of block difference after which funds will be sent to the protocol share reserve\"},\"supplyRatePerBlock()\":{\"notice\":\"Returns the current per-block supply interest rate for this vToken\"},\"symbol()\":{\"notice\":\"EIP-20 token symbol for this token\"},\"toggleFlashLoan()\":{\"notice\":\"Enables or disables flash loan for the market\"},\"totalBorrows()\":{\"notice\":\"Total amount of outstanding borrows of the underlying in this market\"},\"totalBorrowsCurrent()\":{\"notice\":\"Returns the current total borrows plus accrued interest\"},\"totalReserves()\":{\"notice\":\"Total amount of reserves of the underlying held in this market\"},\"totalSupply()\":{\"notice\":\"Total number of tokens in circulation\"},\"transfer(address,uint256)\":{\"notice\":\"Transfer `amount` tokens from `msg.sender` to `dst`\"},\"transferFrom(address,address,uint256)\":{\"notice\":\"Transfer `amount` tokens from `src` to `dst`\"},\"transferInUnderlyingAndVerify(address,uint256)\":{\"notice\":\"Transfers the underlying asset from the specified address.\"},\"transferOutUnderlying(address,uint256)\":{\"notice\":\"Transfers the underlying asset to the specified address.\"},\"underlying()\":{\"notice\":\"Underlying asset for this VToken\"}},\"notice\":\"VTokens which wrap an EIP-20 underlying and are delegated to\",\"version\":1}},\"settings\":{\"compilationTarget\":{\"contracts/Tokens/VTokens/VBep20Delegate.sol\":\"VBep20Delegate\"},\"evmVersion\":\"cancun\",\"libraries\":{},\"metadata\":{\"bytecodeHash\":\"ipfs\",\"useLiteralContent\":true},\"optimizer\":{\"enabled\":true,\"runs\":200},\"remappings\":[]},\"sources\":{\"@openzeppelin/contracts/access/IAccessControl.sol\":{\"content\":\"// SPDX-License-Identifier: MIT\\n// OpenZeppelin Contracts v4.4.1 (access/IAccessControl.sol)\\n\\npragma solidity ^0.8.0;\\n\\n/**\\n * @dev External interface of AccessControl declared to support ERC165 detection.\\n */\\ninterface IAccessControl {\\n    /**\\n     * @dev Emitted when `newAdminRole` is set as ``role``'s admin role, replacing `previousAdminRole`\\n     *\\n     * `DEFAULT_ADMIN_ROLE` is the starting admin for all roles, despite\\n     * {RoleAdminChanged} not being emitted signaling this.\\n     *\\n     * _Available since v3.1._\\n     */\\n    event RoleAdminChanged(bytes32 indexed role, bytes32 indexed previousAdminRole, bytes32 indexed newAdminRole);\\n\\n    /**\\n     * @dev Emitted when `account` is granted `role`.\\n     *\\n     * `sender` is the account that originated the contract call, an admin role\\n     * bearer except when using {AccessControl-_setupRole}.\\n     */\\n    event RoleGranted(bytes32 indexed role, address indexed account, address indexed sender);\\n\\n    /**\\n     * @dev Emitted when `account` is revoked `role`.\\n     *\\n     * `sender` is the account that originated the contract call:\\n     *   - if using `revokeRole`, it is the admin role bearer\\n     *   - if using `renounceRole`, it is the role bearer (i.e. `account`)\\n     */\\n    event RoleRevoked(bytes32 indexed role, address indexed account, address indexed sender);\\n\\n    /**\\n     * @dev Returns `true` if `account` has been granted `role`.\\n     */\\n    function hasRole(bytes32 role, address account) external view returns (bool);\\n\\n    /**\\n     * @dev Returns the admin role that controls `role`. See {grantRole} and\\n     * {revokeRole}.\\n     *\\n     * To change a role's admin, use {AccessControl-_setRoleAdmin}.\\n     */\\n    function getRoleAdmin(bytes32 role) external view returns (bytes32);\\n\\n    /**\\n     * @dev Grants `role` to `account`.\\n     *\\n     * If `account` had not been already granted `role`, emits a {RoleGranted}\\n     * event.\\n     *\\n     * Requirements:\\n     *\\n     * - the caller must have ``role``'s admin role.\\n     */\\n    function grantRole(bytes32 role, address account) external;\\n\\n    /**\\n     * @dev Revokes `role` from `account`.\\n     *\\n     * If `account` had been granted `role`, emits a {RoleRevoked} event.\\n     *\\n     * Requirements:\\n     *\\n     * - the caller must have ``role``'s admin role.\\n     */\\n    function revokeRole(bytes32 role, address account) external;\\n\\n    /**\\n     * @dev Revokes `role` from the calling account.\\n     *\\n     * Roles are often managed via {grantRole} and {revokeRole}: this function's\\n     * purpose is to provide a mechanism for accounts to lose their privileges\\n     * if they are compromised (such as when a trusted device is misplaced).\\n     *\\n     * If the calling account had been granted `role`, emits a {RoleRevoked}\\n     * event.\\n     *\\n     * Requirements:\\n     *\\n     * - the caller must be `account`.\\n     */\\n    function renounceRole(bytes32 role, address account) external;\\n}\\n\",\"keccak256\":\"0x59ce320a585d7e1f163cd70390a0ef2ff9cec832e2aa544293a00692465a7a57\",\"license\":\"MIT\"},\"@openzeppelin/contracts/token/ERC20/IERC20.sol\":{\"content\":\"// SPDX-License-Identifier: MIT\\n// OpenZeppelin Contracts (last updated v4.9.0) (token/ERC20/IERC20.sol)\\n\\npragma solidity ^0.8.0;\\n\\n/**\\n * @dev Interface of the ERC20 standard as defined in the EIP.\\n */\\ninterface IERC20 {\\n    /**\\n     * @dev Emitted when `value` tokens are moved from one account (`from`) to\\n     * another (`to`).\\n     *\\n     * Note that `value` may be zero.\\n     */\\n    event Transfer(address indexed from, address indexed to, uint256 value);\\n\\n    /**\\n     * @dev Emitted when the allowance of a `spender` for an `owner` is set by\\n     * a call to {approve}. `value` is the new allowance.\\n     */\\n    event Approval(address indexed owner, address indexed spender, uint256 value);\\n\\n    /**\\n     * @dev Returns the amount of tokens in existence.\\n     */\\n    function totalSupply() external view returns (uint256);\\n\\n    /**\\n     * @dev Returns the amount of tokens owned by `account`.\\n     */\\n    function balanceOf(address account) external view returns (uint256);\\n\\n    /**\\n     * @dev Moves `amount` tokens from the caller's account to `to`.\\n     *\\n     * Returns a boolean value indicating whether the operation succeeded.\\n     *\\n     * Emits a {Transfer} event.\\n     */\\n    function transfer(address to, uint256 amount) external returns (bool);\\n\\n    /**\\n     * @dev Returns the remaining number of tokens that `spender` will be\\n     * allowed to spend on behalf of `owner` through {transferFrom}. This is\\n     * zero by default.\\n     *\\n     * This value changes when {approve} or {transferFrom} are called.\\n     */\\n    function allowance(address owner, address spender) external view returns (uint256);\\n\\n    /**\\n     * @dev Sets `amount` as the allowance of `spender` over the caller's tokens.\\n     *\\n     * Returns a boolean value indicating whether the operation succeeded.\\n     *\\n     * IMPORTANT: Beware that changing an allowance with this method brings the risk\\n     * that someone may use both the old and the new allowance by unfortunate\\n     * transaction ordering. One possible solution to mitigate this race\\n     * condition is to first reduce the spender's allowance to 0 and set the\\n     * desired value afterwards:\\n     * https://github.com/ethereum/EIPs/issues/20#issuecomment-263524729\\n     *\\n     * Emits an {Approval} event.\\n     */\\n    function approve(address spender, uint256 amount) external returns (bool);\\n\\n    /**\\n     * @dev Moves `amount` tokens from `from` to `to` using the\\n     * allowance mechanism. `amount` is then deducted from the caller's\\n     * allowance.\\n     *\\n     * Returns a boolean value indicating whether the operation succeeded.\\n     *\\n     * Emits a {Transfer} event.\\n     */\\n    function transferFrom(address from, address to, uint256 amount) external returns (bool);\\n}\\n\",\"keccak256\":\"0x287b55befed2961a7eabd7d7b1b2839cbca8a5b80ef8dcbb25ed3d4c2002c305\",\"license\":\"MIT\"},\"@openzeppelin/contracts/token/ERC20/extensions/IERC20Permit.sol\":{\"content\":\"// SPDX-License-Identifier: MIT\\n// OpenZeppelin Contracts (last updated v4.9.0) (token/ERC20/extensions/IERC20Permit.sol)\\n\\npragma solidity ^0.8.0;\\n\\n/**\\n * @dev Interface of the ERC20 Permit extension allowing approvals to be made via signatures, as defined in\\n * https://eips.ethereum.org/EIPS/eip-2612[EIP-2612].\\n *\\n * Adds the {permit} method, which can be used to change an account's ERC20 allowance (see {IERC20-allowance}) by\\n * presenting a message signed by the account. By not relying on {IERC20-approve}, the token holder account doesn't\\n * need to send a transaction, and thus is not required to hold Ether at all.\\n */\\ninterface IERC20Permit {\\n    /**\\n     * @dev Sets `value` as the allowance of `spender` over ``owner``'s tokens,\\n     * given ``owner``'s signed approval.\\n     *\\n     * IMPORTANT: The same issues {IERC20-approve} has related to transaction\\n     * ordering also apply here.\\n     *\\n     * Emits an {Approval} event.\\n     *\\n     * Requirements:\\n     *\\n     * - `spender` cannot be the zero address.\\n     * - `deadline` must be a timestamp in the future.\\n     * - `v`, `r` and `s` must be a valid `secp256k1` signature from `owner`\\n     * over the EIP712-formatted function arguments.\\n     * - the signature must use ``owner``'s current nonce (see {nonces}).\\n     *\\n     * For more information on the signature format, see the\\n     * https://eips.ethereum.org/EIPS/eip-2612#specification[relevant EIP\\n     * section].\\n     */\\n    function permit(\\n        address owner,\\n        address spender,\\n        uint256 value,\\n        uint256 deadline,\\n        uint8 v,\\n        bytes32 r,\\n        bytes32 s\\n    ) external;\\n\\n    /**\\n     * @dev Returns the current nonce for `owner`. This value must be\\n     * included whenever a signature is generated for {permit}.\\n     *\\n     * Every successful call to {permit} increases ``owner``'s nonce by one. This\\n     * prevents a signature from being used multiple times.\\n     */\\n    function nonces(address owner) external view returns (uint256);\\n\\n    /**\\n     * @dev Returns the domain separator used in the encoding of the signature for {permit}, as defined by {EIP712}.\\n     */\\n    // solhint-disable-next-line func-name-mixedcase\\n    function DOMAIN_SEPARATOR() external view returns (bytes32);\\n}\\n\",\"keccak256\":\"0xec63854014a5b4f2b3290ab9103a21bdf902a508d0f41a8573fea49e98bf571a\",\"license\":\"MIT\"},\"@openzeppelin/contracts/token/ERC20/utils/SafeERC20.sol\":{\"content\":\"// SPDX-License-Identifier: MIT\\n// OpenZeppelin Contracts (last updated v4.9.3) (token/ERC20/utils/SafeERC20.sol)\\n\\npragma solidity ^0.8.0;\\n\\nimport \\\"../IERC20.sol\\\";\\nimport \\\"../extensions/IERC20Permit.sol\\\";\\nimport \\\"../../../utils/Address.sol\\\";\\n\\n/**\\n * @title SafeERC20\\n * @dev Wrappers around ERC20 operations that throw on failure (when the token\\n * contract returns false). Tokens that return no value (and instead revert or\\n * throw on failure) are also supported, non-reverting calls are assumed to be\\n * successful.\\n * To use this library you can add a `using SafeERC20 for IERC20;` statement to your contract,\\n * which allows you to call the safe operations as `token.safeTransfer(...)`, etc.\\n */\\nlibrary SafeERC20 {\\n    using Address for address;\\n\\n    /**\\n     * @dev Transfer `value` amount of `token` from the calling contract to `to`. If `token` returns no value,\\n     * non-reverting calls are assumed to be successful.\\n     */\\n    function safeTransfer(IERC20 token, address to, uint256 value) internal {\\n        _callOptionalReturn(token, abi.encodeWithSelector(token.transfer.selector, to, value));\\n    }\\n\\n    /**\\n     * @dev Transfer `value` amount of `token` from `from` to `to`, spending the approval given by `from` to the\\n     * calling contract. If `token` returns no value, non-reverting calls are assumed to be successful.\\n     */\\n    function safeTransferFrom(IERC20 token, address from, address to, uint256 value) internal {\\n        _callOptionalReturn(token, abi.encodeWithSelector(token.transferFrom.selector, from, to, value));\\n    }\\n\\n    /**\\n     * @dev Deprecated. This function has issues similar to the ones found in\\n     * {IERC20-approve}, and its usage is discouraged.\\n     *\\n     * Whenever possible, use {safeIncreaseAllowance} and\\n     * {safeDecreaseAllowance} instead.\\n     */\\n    function safeApprove(IERC20 token, address spender, uint256 value) internal {\\n        // safeApprove should only be called when setting an initial allowance,\\n        // or when resetting it to zero. To increase and decrease it, use\\n        // 'safeIncreaseAllowance' and 'safeDecreaseAllowance'\\n        require(\\n            (value == 0) || (token.allowance(address(this), spender) == 0),\\n            \\\"SafeERC20: approve from non-zero to non-zero allowance\\\"\\n        );\\n        _callOptionalReturn(token, abi.encodeWithSelector(token.approve.selector, spender, value));\\n    }\\n\\n    /**\\n     * @dev Increase the calling contract's allowance toward `spender` by `value`. If `token` returns no value,\\n     * non-reverting calls are assumed to be successful.\\n     */\\n    function safeIncreaseAllowance(IERC20 token, address spender, uint256 value) internal {\\n        uint256 oldAllowance = token.allowance(address(this), spender);\\n        _callOptionalReturn(token, abi.encodeWithSelector(token.approve.selector, spender, oldAllowance + value));\\n    }\\n\\n    /**\\n     * @dev Decrease the calling contract's allowance toward `spender` by `value`. If `token` returns no value,\\n     * non-reverting calls are assumed to be successful.\\n     */\\n    function safeDecreaseAllowance(IERC20 token, address spender, uint256 value) internal {\\n        unchecked {\\n            uint256 oldAllowance = token.allowance(address(this), spender);\\n            require(oldAllowance >= value, \\\"SafeERC20: decreased allowance below zero\\\");\\n            _callOptionalReturn(token, abi.encodeWithSelector(token.approve.selector, spender, oldAllowance - value));\\n        }\\n    }\\n\\n    /**\\n     * @dev Set the calling contract's allowance toward `spender` to `value`. If `token` returns no value,\\n     * non-reverting calls are assumed to be successful. Meant to be used with tokens that require the approval\\n     * to be set to zero before setting it to a non-zero value, such as USDT.\\n     */\\n    function forceApprove(IERC20 token, address spender, uint256 value) internal {\\n        bytes memory approvalCall = abi.encodeWithSelector(token.approve.selector, spender, value);\\n\\n        if (!_callOptionalReturnBool(token, approvalCall)) {\\n            _callOptionalReturn(token, abi.encodeWithSelector(token.approve.selector, spender, 0));\\n            _callOptionalReturn(token, approvalCall);\\n        }\\n    }\\n\\n    /**\\n     * @dev Use a ERC-2612 signature to set the `owner` approval toward `spender` on `token`.\\n     * Revert on invalid signature.\\n     */\\n    function safePermit(\\n        IERC20Permit token,\\n        address owner,\\n        address spender,\\n        uint256 value,\\n        uint256 deadline,\\n        uint8 v,\\n        bytes32 r,\\n        bytes32 s\\n    ) internal {\\n        uint256 nonceBefore = token.nonces(owner);\\n        token.permit(owner, spender, value, deadline, v, r, s);\\n        uint256 nonceAfter = token.nonces(owner);\\n        require(nonceAfter == nonceBefore + 1, \\\"SafeERC20: permit did not succeed\\\");\\n    }\\n\\n    /**\\n     * @dev Imitates a Solidity high-level call (i.e. a regular function call to a contract), relaxing the requirement\\n     * on the return value: the return value is optional (but if data is returned, it must not be false).\\n     * @param token The token targeted by the call.\\n     * @param data The call data (encoded using abi.encode or one of its variants).\\n     */\\n    function _callOptionalReturn(IERC20 token, bytes memory data) private {\\n        // We need to perform a low level call here, to bypass Solidity's return data size checking mechanism, since\\n        // we're implementing it ourselves. We use {Address-functionCall} to perform this call, which verifies that\\n        // the target address contains contract code and also asserts for success in the low-level call.\\n\\n        bytes memory returndata = address(token).functionCall(data, \\\"SafeERC20: low-level call failed\\\");\\n        require(returndata.length == 0 || abi.decode(returndata, (bool)), \\\"SafeERC20: ERC20 operation did not succeed\\\");\\n    }\\n\\n    /**\\n     * @dev Imitates a Solidity high-level call (i.e. a regular function call to a contract), relaxing the requirement\\n     * on the return value: the return value is optional (but if data is returned, it must not be false).\\n     * @param token The token targeted by the call.\\n     * @param data The call data (encoded using abi.encode or one of its variants).\\n     *\\n     * This is a variant of {_callOptionalReturn} that silents catches all reverts and returns a bool instead.\\n     */\\n    function _callOptionalReturnBool(IERC20 token, bytes memory data) private returns (bool) {\\n        // We need to perform a low level call here, to bypass Solidity's return data size checking mechanism, since\\n        // we're implementing it ourselves. We cannot use {Address-functionCall} here since this should return false\\n        // and not revert is the subcall reverts.\\n\\n        (bool success, bytes memory returndata) = address(token).call(data);\\n        return\\n            success && (returndata.length == 0 || abi.decode(returndata, (bool))) && Address.isContract(address(token));\\n    }\\n}\\n\",\"keccak256\":\"0xabefac93435967b4d36a4fabcbdbb918d1f0b7ae3c3d85bc30923b326c927ed1\",\"license\":\"MIT\"},\"@openzeppelin/contracts/utils/Address.sol\":{\"content\":\"// SPDX-License-Identifier: MIT\\n// OpenZeppelin Contracts (last updated v4.9.0) (utils/Address.sol)\\n\\npragma solidity ^0.8.1;\\n\\n/**\\n * @dev Collection of functions related to the address type\\n */\\nlibrary Address {\\n    /**\\n     * @dev Returns true if `account` is a contract.\\n     *\\n     * [IMPORTANT]\\n     * ====\\n     * It is unsafe to assume that an address for which this function returns\\n     * false is an externally-owned account (EOA) and not a contract.\\n     *\\n     * Among others, `isContract` will return false for the following\\n     * types of addresses:\\n     *\\n     *  - an externally-owned account\\n     *  - a contract in construction\\n     *  - an address where a contract will be created\\n     *  - an address where a contract lived, but was destroyed\\n     *\\n     * Furthermore, `isContract` will also return true if the target contract within\\n     * the same transaction is already scheduled for destruction by `SELFDESTRUCT`,\\n     * which only has an effect at the end of a transaction.\\n     * ====\\n     *\\n     * [IMPORTANT]\\n     * ====\\n     * You shouldn't rely on `isContract` to protect against flash loan attacks!\\n     *\\n     * Preventing calls from contracts is highly discouraged. It breaks composability, breaks support for smart wallets\\n     * like Gnosis Safe, and does not provide security since it can be circumvented by calling from a contract\\n     * constructor.\\n     * ====\\n     */\\n    function isContract(address account) internal view returns (bool) {\\n        // This method relies on extcodesize/address.code.length, which returns 0\\n        // for contracts in construction, since the code is only stored at the end\\n        // of the constructor execution.\\n\\n        return account.code.length > 0;\\n    }\\n\\n    /**\\n     * @dev Replacement for Solidity's `transfer`: sends `amount` wei to\\n     * `recipient`, forwarding all available gas and reverting on errors.\\n     *\\n     * https://eips.ethereum.org/EIPS/eip-1884[EIP1884] increases the gas cost\\n     * of certain opcodes, possibly making contracts go over the 2300 gas limit\\n     * imposed by `transfer`, making them unable to receive funds via\\n     * `transfer`. {sendValue} removes this limitation.\\n     *\\n     * https://consensys.net/diligence/blog/2019/09/stop-using-soliditys-transfer-now/[Learn more].\\n     *\\n     * IMPORTANT: because control is transferred to `recipient`, care must be\\n     * taken to not create reentrancy vulnerabilities. Consider using\\n     * {ReentrancyGuard} or the\\n     * https://solidity.readthedocs.io/en/v0.8.0/security-considerations.html#use-the-checks-effects-interactions-pattern[checks-effects-interactions pattern].\\n     */\\n    function sendValue(address payable recipient, uint256 amount) internal {\\n        require(address(this).balance >= amount, \\\"Address: insufficient balance\\\");\\n\\n        (bool success, ) = recipient.call{value: amount}(\\\"\\\");\\n        require(success, \\\"Address: unable to send value, recipient may have reverted\\\");\\n    }\\n\\n    /**\\n     * @dev Performs a Solidity function call using a low level `call`. A\\n     * plain `call` is an unsafe replacement for a function call: use this\\n     * function instead.\\n     *\\n     * If `target` reverts with a revert reason, it is bubbled up by this\\n     * function (like regular Solidity function calls).\\n     *\\n     * Returns the raw returned data. To convert to the expected return value,\\n     * use https://solidity.readthedocs.io/en/latest/units-and-global-variables.html?highlight=abi.decode#abi-encoding-and-decoding-functions[`abi.decode`].\\n     *\\n     * Requirements:\\n     *\\n     * - `target` must be a contract.\\n     * - calling `target` with `data` must not revert.\\n     *\\n     * _Available since v3.1._\\n     */\\n    function functionCall(address target, bytes memory data) internal returns (bytes memory) {\\n        return functionCallWithValue(target, data, 0, \\\"Address: low-level call failed\\\");\\n    }\\n\\n    /**\\n     * @dev Same as {xref-Address-functionCall-address-bytes-}[`functionCall`], but with\\n     * `errorMessage` as a fallback revert reason when `target` reverts.\\n     *\\n     * _Available since v3.1._\\n     */\\n    function functionCall(\\n        address target,\\n        bytes memory data,\\n        string memory errorMessage\\n    ) internal returns (bytes memory) {\\n        return functionCallWithValue(target, data, 0, errorMessage);\\n    }\\n\\n    /**\\n     * @dev Same as {xref-Address-functionCall-address-bytes-}[`functionCall`],\\n     * but also transferring `value` wei to `target`.\\n     *\\n     * Requirements:\\n     *\\n     * - the calling contract must have an ETH balance of at least `value`.\\n     * - the called Solidity function must be `payable`.\\n     *\\n     * _Available since v3.1._\\n     */\\n    function functionCallWithValue(address target, bytes memory data, uint256 value) internal returns (bytes memory) {\\n        return functionCallWithValue(target, data, value, \\\"Address: low-level call with value failed\\\");\\n    }\\n\\n    /**\\n     * @dev Same as {xref-Address-functionCallWithValue-address-bytes-uint256-}[`functionCallWithValue`], but\\n     * with `errorMessage` as a fallback revert reason when `target` reverts.\\n     *\\n     * _Available since v3.1._\\n     */\\n    function functionCallWithValue(\\n        address target,\\n        bytes memory data,\\n        uint256 value,\\n        string memory errorMessage\\n    ) internal returns (bytes memory) {\\n        require(address(this).balance >= value, \\\"Address: insufficient balance for call\\\");\\n        (bool success, bytes memory returndata) = target.call{value: value}(data);\\n        return verifyCallResultFromTarget(target, success, returndata, errorMessage);\\n    }\\n\\n    /**\\n     * @dev Same as {xref-Address-functionCall-address-bytes-}[`functionCall`],\\n     * but performing a static call.\\n     *\\n     * _Available since v3.3._\\n     */\\n    function functionStaticCall(address target, bytes memory data) internal view returns (bytes memory) {\\n        return functionStaticCall(target, data, \\\"Address: low-level static call failed\\\");\\n    }\\n\\n    /**\\n     * @dev Same as {xref-Address-functionCall-address-bytes-string-}[`functionCall`],\\n     * but performing a static call.\\n     *\\n     * _Available since v3.3._\\n     */\\n    function functionStaticCall(\\n        address target,\\n        bytes memory data,\\n        string memory errorMessage\\n    ) internal view returns (bytes memory) {\\n        (bool success, bytes memory returndata) = target.staticcall(data);\\n        return verifyCallResultFromTarget(target, success, returndata, errorMessage);\\n    }\\n\\n    /**\\n     * @dev Same as {xref-Address-functionCall-address-bytes-}[`functionCall`],\\n     * but performing a delegate call.\\n     *\\n     * _Available since v3.4._\\n     */\\n    function functionDelegateCall(address target, bytes memory data) internal returns (bytes memory) {\\n        return functionDelegateCall(target, data, \\\"Address: low-level delegate call failed\\\");\\n    }\\n\\n    /**\\n     * @dev Same as {xref-Address-functionCall-address-bytes-string-}[`functionCall`],\\n     * but performing a delegate call.\\n     *\\n     * _Available since v3.4._\\n     */\\n    function functionDelegateCall(\\n        address target,\\n        bytes memory data,\\n        string memory errorMessage\\n    ) internal returns (bytes memory) {\\n        (bool success, bytes memory returndata) = target.delegatecall(data);\\n        return verifyCallResultFromTarget(target, success, returndata, errorMessage);\\n    }\\n\\n    /**\\n     * @dev Tool to verify that a low level call to smart-contract was successful, and revert (either by bubbling\\n     * the revert reason or using the provided one) in case of unsuccessful call or if target was not a contract.\\n     *\\n     * _Available since v4.8._\\n     */\\n    function verifyCallResultFromTarget(\\n        address target,\\n        bool success,\\n        bytes memory returndata,\\n        string memory errorMessage\\n    ) internal view returns (bytes memory) {\\n        if (success) {\\n            if (returndata.length == 0) {\\n                // only check isContract if the call was successful and the return data is empty\\n                // otherwise we already know that it was a contract\\n                require(isContract(target), \\\"Address: call to non-contract\\\");\\n            }\\n            return returndata;\\n        } else {\\n            _revert(returndata, errorMessage);\\n        }\\n    }\\n\\n    /**\\n     * @dev Tool to verify that a low level call was successful, and revert if it wasn't, either by bubbling the\\n     * revert reason or using the provided one.\\n     *\\n     * _Available since v4.3._\\n     */\\n    function verifyCallResult(\\n        bool success,\\n        bytes memory returndata,\\n        string memory errorMessage\\n    ) internal pure returns (bytes memory) {\\n        if (success) {\\n            return returndata;\\n        } else {\\n            _revert(returndata, errorMessage);\\n        }\\n    }\\n\\n    function _revert(bytes memory returndata, string memory errorMessage) private pure {\\n        // Look for revert reason and bubble it up if present\\n        if (returndata.length > 0) {\\n            // The easiest way to bubble the revert reason is using memory via assembly\\n            /// @solidity memory-safe-assembly\\n            assembly {\\n                let returndata_size := mload(returndata)\\n                revert(add(32, returndata), returndata_size)\\n            }\\n        } else {\\n            revert(errorMessage);\\n        }\\n    }\\n}\\n\",\"keccak256\":\"0x006dd67219697fe68d7fbfdea512e7c4cb64a43565ed86171d67e844982da6fa\",\"license\":\"MIT\"},\"@venusprotocol/governance-contracts/contracts/Governance/IAccessControlManagerV8.sol\":{\"content\":\"// SPDX-License-Identifier: BSD-3-Clause\\npragma solidity ^0.8.25;\\n\\nimport \\\"@openzeppelin/contracts/access/IAccessControl.sol\\\";\\n\\n/**\\n * @title IAccessControlManagerV8\\n * @author Venus\\n * @notice Interface implemented by the `AccessControlManagerV8` contract.\\n */\\ninterface IAccessControlManagerV8 is IAccessControl {\\n    function giveCallPermission(address contractAddress, string calldata functionSig, address accountToPermit) external;\\n\\n    function revokeCallPermission(\\n        address contractAddress,\\n        string calldata functionSig,\\n        address accountToRevoke\\n    ) external;\\n\\n    function isAllowedToCall(address account, string calldata functionSig) external view returns (bool);\\n\\n    function hasPermission(\\n        address account,\\n        address contractAddress,\\n        string calldata functionSig\\n    ) external view returns (bool);\\n}\\n\",\"keccak256\":\"0xaa29b098440d0b3a131c5ecdf25ce548790c1b5ac7bf9b5c0264b6af6f7a1e0b\",\"license\":\"BSD-3-Clause\"},\"@venusprotocol/oracle/contracts/interfaces/OracleInterface.sol\":{\"content\":\"// SPDX-License-Identifier: BSD-3-Clause\\npragma solidity ^0.8.25;\\n\\ninterface OracleInterface {\\n    function getPrice(address asset) external view returns (uint256);\\n}\\n\\ninterface ResilientOracleInterface is OracleInterface {\\n    function updatePrice(address vToken) external;\\n\\n    function updateAssetPrice(address asset) external;\\n\\n    function getUnderlyingPrice(address vToken) external view returns (uint256);\\n}\\n\\ninterface TwapInterface is OracleInterface {\\n    function updateTwap(address asset) external returns (uint256);\\n}\\n\\ninterface BoundValidatorInterface {\\n    function validatePriceWithAnchorPrice(\\n        address asset,\\n        uint256 reporterPrice,\\n        uint256 anchorPrice\\n    ) external view returns (bool);\\n}\\n\",\"keccak256\":\"0x2432799b0d824fc701beb4c30146e912b9aeecf77b5c1635dde6c5fbe6bfc3a7\",\"license\":\"BSD-3-Clause\"},\"contracts/Comptroller/ComptrollerInterface.sol\":{\"content\":\"// SPDX-License-Identifier: BSD-3-Clause\\n\\npragma solidity 0.8.25;\\n\\nimport { ResilientOracleInterface } from \\\"@venusprotocol/oracle/contracts/interfaces/OracleInterface.sol\\\";\\n\\nimport { VToken } from \\\"../Tokens/VTokens/VToken.sol\\\";\\nimport { VAIControllerInterface } from \\\"../Tokens/VAI/VAIControllerInterface.sol\\\";\\nimport { WeightFunction } from \\\"./Diamond/interfaces/IFacetBase.sol\\\";\\n\\nenum Action {\\n    MINT,\\n    REDEEM,\\n    BORROW,\\n    REPAY,\\n    SEIZE,\\n    LIQUIDATE,\\n    TRANSFER,\\n    ENTER_MARKET,\\n    EXIT_MARKET\\n}\\n\\ninterface ComptrollerInterface {\\n    /// @notice Indicator that this is a Comptroller contract (for inspection)\\n    function isComptroller() external pure returns (bool);\\n\\n    /*** Assets You Are In ***/\\n\\n    function enterMarkets(address[] calldata vTokens) external returns (uint[] memory);\\n\\n    function exitMarket(address vToken) external returns (uint);\\n\\n    /*** Policy Hooks ***/\\n\\n    function mintAllowed(address vToken, address minter, uint mintAmount) external returns (uint);\\n\\n    function mintVerify(address vToken, address minter, uint mintAmount, uint mintTokens) external;\\n\\n    function redeemAllowed(address vToken, address redeemer, uint redeemTokens) external returns (uint);\\n\\n    function redeemVerify(address vToken, address redeemer, uint redeemAmount, uint redeemTokens) external;\\n\\n    function borrowAllowed(address vToken, address borrower, uint borrowAmount) external returns (uint);\\n\\n    function borrowVerify(address vToken, address borrower, uint borrowAmount) external;\\n\\n    function executeFlashLoan(\\n        address payable initiator,\\n        address payable receiver,\\n        VToken[] calldata vTokens,\\n        uint256[] calldata amounts,\\n        bytes calldata param\\n    ) external;\\n\\n    function repayBorrowAllowed(\\n        address vToken,\\n        address payer,\\n        address borrower,\\n        uint repayAmount\\n    ) external returns (uint);\\n\\n    function repayBorrowVerify(\\n        address vToken,\\n        address payer,\\n        address borrower,\\n        uint repayAmount,\\n        uint borrowerIndex\\n    ) external;\\n\\n    function liquidateBorrowAllowed(\\n        address vTokenBorrowed,\\n        address vTokenCollateral,\\n        address liquidator,\\n        address borrower,\\n        uint repayAmount\\n    ) external returns (uint);\\n\\n    function liquidateBorrowVerify(\\n        address vTokenBorrowed,\\n        address vTokenCollateral,\\n        address liquidator,\\n        address borrower,\\n        uint repayAmount,\\n        uint seizeTokens\\n    ) external;\\n\\n    function seizeAllowed(\\n        address vTokenCollateral,\\n        address vTokenBorrowed,\\n        address liquidator,\\n        address borrower,\\n        uint seizeTokens\\n    ) external returns (uint);\\n\\n    function seizeVerify(\\n        address vTokenCollateral,\\n        address vTokenBorrowed,\\n        address liquidator,\\n        address borrower,\\n        uint seizeTokens\\n    ) external;\\n\\n    function transferAllowed(address vToken, address src, address dst, uint transferTokens) external returns (uint);\\n\\n    function transferVerify(address vToken, address src, address dst, uint transferTokens) external;\\n\\n    /*** Liquidity/Liquidation Calculations ***/\\n\\n    function liquidateCalculateSeizeTokens(\\n        address vTokenBorrowed,\\n        address vTokenCollateral,\\n        uint repayAmount\\n    ) external view returns (uint, uint);\\n\\n    function liquidateCalculateSeizeTokens(\\n        address borrower,\\n        address vTokenBorrowed,\\n        address vTokenCollateral,\\n        uint repayAmount\\n    ) external view returns (uint, uint);\\n\\n    function setMintedVAIOf(address owner, uint amount) external returns (uint);\\n\\n    function liquidateVAICalculateSeizeTokens(\\n        address vTokenCollateral,\\n        uint repayAmount\\n    ) external view returns (uint, uint);\\n\\n    function getXVSAddress() external view returns (address);\\n\\n    function markets(address) external view returns (bool, uint);\\n\\n    function oracle() external view returns (ResilientOracleInterface);\\n\\n    function getAccountLiquidity(address) external view returns (uint, uint, uint);\\n\\n    function getAssetsIn(address) external view returns (VToken[] memory);\\n\\n    function claimVenus(address) external;\\n\\n    function venusAccrued(address) external view returns (uint);\\n\\n    function venusSupplySpeeds(address) external view returns (uint);\\n\\n    function venusBorrowSpeeds(address) external view returns (uint);\\n\\n    function getAllMarkets() external view returns (VToken[] memory);\\n\\n    function venusSupplierIndex(address, address) external view returns (uint);\\n\\n    function venusInitialIndex() external view returns (uint224);\\n\\n    function venusBorrowerIndex(address, address) external view returns (uint);\\n\\n    function venusBorrowState(address) external view returns (uint224, uint32);\\n\\n    function venusSupplyState(address) external view returns (uint224, uint32);\\n\\n    function approvedDelegates(address borrower, address delegate) external view returns (bool);\\n\\n    function vaiController() external view returns (VAIControllerInterface);\\n\\n    function protocolPaused() external view returns (bool);\\n\\n    function actionPaused(address market, Action action) external view returns (bool);\\n\\n    function mintedVAIs(address user) external view returns (uint);\\n\\n    function vaiMintRate() external view returns (uint);\\n\\n    function authorizedFlashLoan(address account) external view returns (bool);\\n\\n    function userPoolId(address account) external view returns (uint96);\\n\\n    function getLiquidationIncentive(address vToken) external view returns (uint256);\\n\\n    function getEffectiveLiquidationIncentive(address account, address vToken) external view returns (uint256);\\n\\n    function getEffectiveLtvFactor(\\n        address account,\\n        address vToken,\\n        WeightFunction weightingStrategy\\n    ) external view returns (uint256);\\n\\n    function lastPoolId() external view returns (uint96);\\n\\n    function corePoolId() external pure returns (uint96);\\n\\n    function pools(uint96 poolId) external view returns (string memory label);\\n\\n    function getPoolVTokens(uint96 poolId) external view returns (address[] memory);\\n\\n    function poolMarkets(\\n        uint96 poolId,\\n        address vToken\\n    )\\n        external\\n        view\\n        returns (\\n            bool isListed,\\n            uint256 collateralFactorMantissa,\\n            bool isVenus,\\n            uint256 liquidationThresholdMantissa,\\n            uint256 liquidationIncentiveMantissa,\\n            uint96 marketPoolId,\\n            bool isBorrowAllowed\\n        );\\n}\\n\\ninterface IVAIVault {\\n    function updatePendingRewards() external;\\n}\\n\\ninterface IComptroller {\\n    /*** Treasury Data ***/\\n    function treasuryAddress() external view returns (address);\\n\\n    function treasuryPercent() external view returns (uint);\\n}\\n\",\"keccak256\":\"0x8028730d899fdcde683b3ecd55cb3769b67168b05a03b3b9d4f76c54dad0f8fa\",\"license\":\"BSD-3-Clause\"},\"contracts/Comptroller/Diamond/interfaces/IFacetBase.sol\":{\"content\":\"// SPDX-License-Identifier: BSD-3-Clause\\n\\npragma solidity 0.8.25;\\n\\nimport { Action } from \\\"../../../Comptroller/ComptrollerInterface.sol\\\";\\nimport { PoolMarketId } from \\\"../../../Comptroller/Types/PoolMarketId.sol\\\";\\n\\nenum WeightFunction {\\n    /// @notice Use the collateral factor of the asset for weighting\\n    USE_COLLATERAL_FACTOR,\\n    /// @notice Use the liquidation threshold of the asset for weighting\\n    USE_LIQUIDATION_THRESHOLD\\n}\\n\\ninterface IFacetBase {\\n    /**\\n     * @notice The initial XVS rewards index for a market\\n     */\\n    function venusInitialIndex() external pure returns (uint224);\\n\\n    /**\\n     * @notice Checks if a certain action is paused on a market\\n     * @param action Action id\\n     * @param market vToken address\\n     */\\n    function actionPaused(address market, Action action) external view returns (bool);\\n\\n    /**\\n     * @notice Returns the XVS address\\n     * @return The address of XVS token\\n     */\\n    function getXVSAddress() external view returns (address);\\n\\n    function getPoolMarketIndex(uint96 poolId, address vToken) external pure returns (PoolMarketId);\\n\\n    function corePoolId() external pure returns (uint96);\\n}\\n\",\"keccak256\":\"0x454a2e213a5f54fbe7991193b78ae23406234f465c9806f75ee7bf2fe6d1531c\",\"license\":\"BSD-3-Clause\"},\"contracts/Comptroller/Types/PoolMarketId.sol\":{\"content\":\"// SPDX-License-Identifier: BSD-3-Clause\\n\\npragma solidity 0.8.25;\\n\\n/// @notice Strongly-typed identifier for pool markets mapping keys\\n/// @dev Underlying storage is bytes32: first 12 bytes (96 bits) = poolId, last 20 bytes = vToken address\\ntype PoolMarketId is bytes32;\\n\\n \",\"keccak256\":\"0xf68bde30ddd6f8bf08194b493991c2a2ebd3814972f93a804beb9b366004cbe3\",\"license\":\"BSD-3-Clause\"},\"contracts/FlashLoan/interfaces/IFlashLoanSimpleReceiver.sol\":{\"content\":\"// SPDX-License-Identifier: BSD-3-Clause\\npragma solidity 0.8.25;\\n\\n/// @title IFlashLoanSimpleReceiver\\n/// @notice Interface for flashLoan receiver contract, which execute custom logic with flash-borrowed asset.\\n/// @dev This interface defines the method that must be implemented by any contract wishing to interact with the flashLoan system.\\n///      Contracts must ensure they have the means to repay both the flashLoan amount and the associated premium (fee).\\ninterface IFlashLoanSimpleReceiver {\\n    /**\\n     * @notice Executes an operation after receiving the flash-borrowed asset\\n     * @dev Ensure that the contract can return the debt + premium, e.g., has\\n     *      enough funds to repay and has to transfer the debt + premium to the VToken\\n     * @param asset The address of the flash-borrowed asset\\n     * @param amount The amount of the flash-borrowed asset\\n     * @param premium The premium (fee) associated with flash-borrowed asset\\n     * @param initiator The address that initiated the flashLoan operation\\n     * @param param The byte-encoded param passed when initiating the flashLoan\\n     * @return True if the execution of the operation succeeds, false otherwise\\n     */\\n    function executeOperation(\\n        address asset,\\n        uint256 amount,\\n        uint256 premium,\\n        address initiator,\\n        bytes calldata param\\n    ) external returns (bool);\\n}\\n\",\"keccak256\":\"0xa5fb99c22a0f8dd35a316c0e9c7bc365186d646166f0deb013325f8b27c53eb2\",\"license\":\"BSD-3-Clause\"},\"contracts/InterestRateModels/InterestRateModelV8.sol\":{\"content\":\"// SPDX-License-Identifier: BSD-3-Clause\\npragma solidity 0.8.25;\\n\\n/**\\n * @title Venus's InterestRateModelV8 Interface\\n * @author Venus\\n */\\nabstract contract InterestRateModelV8 {\\n    /// @notice Indicator that this is an InterestRateModel contract (for inspection)\\n    bool public constant isInterestRateModel = true;\\n\\n    /**\\n     * @notice Calculates the current borrow interest rate per block\\n     * @param cash The total amount of cash the market has\\n     * @param borrows The total amount of borrows the market has outstanding\\n     * @param reserves The total amnount of reserves the market has\\n     * @return The borrow rate per block (as a percentage, and scaled by 1e18)\\n     */\\n    function getBorrowRate(uint256 cash, uint256 borrows, uint256 reserves) external view virtual returns (uint256);\\n\\n    /**\\n     * @notice Calculates the current supply interest rate per block\\n     * @param cash The total amount of cash the market has\\n     * @param borrows The total amount of borrows the market has outstanding\\n     * @param reserves The total amnount of reserves the market has\\n     * @param reserveFactorMantissa The current reserve factor the market has\\n     * @return The supply rate per block (as a percentage, and scaled by 1e18)\\n     */\\n    function getSupplyRate(\\n        uint256 cash,\\n        uint256 borrows,\\n        uint256 reserves,\\n        uint256 reserveFactorMantissa\\n    ) external view virtual returns (uint256);\\n}\\n\",\"keccak256\":\"0x4d5595e761d50a1431c34b39e72dde6c09b0ebccdbe8c5c4e12c8a2ac7b796e1\",\"license\":\"BSD-3-Clause\"},\"contracts/Tokens/VAI/VAIControllerInterface.sol\":{\"content\":\"// SPDX-License-Identifier: BSD-3-Clause\\n\\npragma solidity 0.8.25;\\n\\nimport { VTokenInterface } from \\\"../VTokens/VTokenInterfaces.sol\\\";\\n\\ninterface VAIControllerInterface {\\n    function mintVAI(uint256 mintVAIAmount) external returns (uint256);\\n\\n    function repayVAI(uint256 amount) external returns (uint256, uint256);\\n\\n    function repayVAIBehalf(address borrower, uint256 amount) external returns (uint256, uint256);\\n\\n    function liquidateVAI(\\n        address borrower,\\n        uint256 repayAmount,\\n        VTokenInterface vTokenCollateral\\n    ) external returns (uint256, uint256);\\n\\n    function getMintableVAI(address minter) external view returns (uint256, uint256);\\n\\n    function getVAIAddress() external view returns (address);\\n\\n    function getVAIRepayAmount(address account) external view returns (uint256);\\n}\\n\",\"keccak256\":\"0x69d2f9e13b7fbf0a29885048503642372d9ba3d37f2427d4b9cffb87eddd925b\",\"license\":\"BSD-3-Clause\"},\"contracts/Tokens/VTokens/VBep20.sol\":{\"content\":\"// SPDX-License-Identifier: BSD-3-Clause\\n\\npragma solidity 0.8.25;\\n\\nimport { IERC20 } from \\\"@openzeppelin/contracts/token/ERC20/IERC20.sol\\\";\\nimport { SafeERC20 } from \\\"@openzeppelin/contracts/token/ERC20/utils/SafeERC20.sol\\\";\\n\\nimport { ComptrollerInterface } from \\\"../../Comptroller/ComptrollerInterface.sol\\\";\\nimport { InterestRateModelV8 } from \\\"../../InterestRateModels/InterestRateModelV8.sol\\\";\\nimport { VBep20Interface, VTokenInterface } from \\\"./VTokenInterfaces.sol\\\";\\nimport { VToken } from \\\"./VToken.sol\\\";\\n\\n/**\\n * @title Venus's VBep20 Contract\\n * @notice vTokens which wrap an ERC-20 underlying\\n * @author Venus\\n */\\ncontract VBep20 is VToken, VBep20Interface {\\n    using SafeERC20 for IERC20;\\n\\n    /*** User Interface ***/\\n\\n    /**\\n     * @notice Sender supplies assets into the market and receives vTokens in exchange\\n     * @dev Accrues interest whether or not the operation succeeds, unless reverted\\n     * @param mintAmount The amount of the underlying asset to supply\\n     * @return uint Returns 0 on success, otherwise returns a failure code (see ErrorReporter.sol for details).\\n     */\\n    // @custom:event Emits Transfer event\\n    // @custom:event Emits Mint event\\n    function mint(uint mintAmount) external returns (uint) {\\n        (uint err, ) = mintInternal(mintAmount);\\n        return err;\\n    }\\n\\n    /**\\n     * @notice Sender supplies assets into the market and receiver receives vTokens in exchange\\n     * @dev Accrues interest whether or not the operation succeeds, unless reverted\\n     * @param receiver The account which is receiving the vTokens\\n     * @param mintAmount The amount of the underlying asset to supply\\n     * @return uint Returns 0 on success, otherwise returns a failure code (see ErrorReporter.sol for details).\\n     */\\n    // @custom:event Emits Transfer event\\n    // @custom:event Emits MintBehalf event\\n    function mintBehalf(address receiver, uint mintAmount) external returns (uint) {\\n        (uint err, ) = mintBehalfInternal(receiver, mintAmount);\\n        return err;\\n    }\\n\\n    /**\\n     * @notice Sender redeems vTokens in exchange for the underlying asset\\n     * @dev Accrues interest whether or not the operation succeeds, unless reverted\\n     * @param redeemTokens The number of vTokens to redeem into underlying\\n     * @return uint Returns 0 on success, otherwise returns a failure code (see ErrorReporter.sol for details).\\n     */\\n    // @custom:event Emits Redeem event on success\\n    // @custom:event Emits Transfer event on success\\n    // @custom:event Emits RedeemFee when fee is charged by the treasury\\n    function redeem(uint redeemTokens) external returns (uint) {\\n        return redeemInternal(msg.sender, payable(msg.sender), redeemTokens);\\n    }\\n\\n    /**\\n     * @notice Sender redeems assets on behalf of some other address. This function is only available\\n     *   for senders, explicitly marked as delegates of the supplier using `comptroller.updateDelegate`\\n     * @dev Accrues interest whether or not the operation succeeds, unless reverted\\n     * @param redeemer The user on behalf of whom to redeem\\n     * @param redeemTokens The number of vTokens to redeem into underlying\\n     * @return uint Returns 0 on success, otherwise returns a failure code (see ErrorReporter.sol for details).\\n     */\\n    // @custom:event Emits Redeem event on success\\n    // @custom:event Emits Transfer event on success\\n    // @custom:event Emits RedeemFee when fee is charged by the treasury\\n    function redeemBehalf(address redeemer, uint redeemTokens) external returns (uint) {\\n        require(comptroller.approvedDelegates(redeemer, msg.sender), \\\"not an approved delegate\\\");\\n\\n        return redeemInternal(redeemer, payable(msg.sender), redeemTokens);\\n    }\\n\\n    /**\\n     * @notice Sender redeems vTokens in exchange for a specified amount of underlying asset\\n     * @dev Accrues interest whether or not the operation succeeds, unless reverted\\n     * @param redeemAmount The amount of underlying to redeem\\n     * @return uint Returns 0 on success, otherwise returns a failure code (see ErrorReporter.sol for details).\\n     */\\n    // @custom:event Emits Redeem event on success\\n    // @custom:event Emits Transfer event on success\\n    // @custom:event Emits RedeemFee when fee is charged by the treasury\\n    function redeemUnderlying(uint redeemAmount) external returns (uint) {\\n        return redeemUnderlyingInternal(msg.sender, payable(msg.sender), redeemAmount);\\n    }\\n\\n    /**\\n     * @notice Sender redeems underlying assets on behalf of some other address. This function is only available\\n     *   for senders, explicitly marked as delegates of the supplier using `comptroller.updateDelegate`\\n     * @dev Accrues interest whether or not the operation succeeds, unless reverted\\n     * @param redeemer, on behalf of whom to redeem\\n     * @param redeemAmount The amount of underlying to receive from redeeming vTokens\\n     * @return uint Returns 0 on success, otherwise returns a failure code (see ErrorReporter.sol for details).\\n     */\\n    // @custom:event Emits Redeem event on success\\n    // @custom:event Emits Transfer event on success\\n    // @custom:event Emits RedeemFee when fee is charged by the treasury\\n    function redeemUnderlyingBehalf(address redeemer, uint redeemAmount) external returns (uint) {\\n        require(comptroller.approvedDelegates(redeemer, msg.sender), \\\"not an approved delegate\\\");\\n\\n        return redeemUnderlyingInternal(redeemer, payable(msg.sender), redeemAmount);\\n    }\\n\\n    /**\\n     * @notice Sender borrows assets from the protocol to their own address\\n     * @param borrowAmount The amount of the underlying asset to borrow\\n     * @return uint Returns 0 on success, otherwise returns a failure code (see ErrorReporter.sol for details).\\n     */\\n    // @custom:event Emits Borrow event on success\\n    function borrow(uint borrowAmount) external returns (uint) {\\n        return borrowInternal(msg.sender, payable(msg.sender), borrowAmount);\\n    }\\n\\n    /**\\n     * @notice Sender borrows assets on behalf of some other address. This function is only available\\n     *   for senders, explicitly marked as delegates of the borrower using `comptroller.updateDelegate`\\n     * @param borrower The borrower, on behalf of whom to borrow.\\n     * @param borrowAmount The amount of the underlying asset to borrow\\n     * @return uint Returns 0 on success, otherwise returns a failure code (see ErrorReporter.sol for details).\\n     */\\n    // @custom:event Emits Borrow event on success\\n    function borrowBehalf(address borrower, uint borrowAmount) external returns (uint) {\\n        require(comptroller.approvedDelegates(borrower, msg.sender), \\\"not an approved delegate\\\");\\n        return borrowInternal(borrower, payable(msg.sender), borrowAmount);\\n    }\\n\\n    /**\\n     * @notice Sender repays their own borrow\\n     * @param repayAmount The amount to repay\\n     * @return uint Returns 0 on success, otherwise returns a failure code (see ErrorReporter.sol for details).\\n     */\\n    // @custom:event Emits RepayBorrow event on success\\n    function repayBorrow(uint repayAmount) external returns (uint) {\\n        (uint err, ) = repayBorrowInternal(repayAmount);\\n        return err;\\n    }\\n\\n    /**\\n     * @notice Sender repays a borrow belonging to another borrowing account\\n     * @param borrower The account with the debt being payed off\\n     * @param repayAmount The amount to repay\\n     * @return uint Returns 0 on success, otherwise returns a failure code (see ErrorReporter.sol for details).\\n     */\\n    // @custom:event Emits RepayBorrow event on success\\n    function repayBorrowBehalf(address borrower, uint repayAmount) external returns (uint) {\\n        (uint err, ) = repayBorrowBehalfInternal(borrower, repayAmount);\\n        return err;\\n    }\\n\\n    /**\\n     * @notice The sender liquidates the borrowers collateral.\\n     *  The collateral seized is transferred to the liquidator.\\n     * @param borrower The borrower of this vToken to be liquidated\\n     * @param repayAmount The amount of the underlying borrowed asset to repay\\n     * @param vTokenCollateral The market in which to seize collateral from the borrower\\n     * @return uint Returns 0 on success, otherwise returns a failure code (see ErrorReporter.sol for details).\\n     */\\n    // @custom:event Emit LiquidateBorrow event on success\\n    function liquidateBorrow(\\n        address borrower,\\n        uint repayAmount,\\n        VTokenInterface vTokenCollateral\\n    ) external returns (uint) {\\n        (uint err, ) = liquidateBorrowInternal(borrower, repayAmount, vTokenCollateral);\\n        return err;\\n    }\\n\\n    /**\\n     * @notice The sender adds to reserves.\\n     * @param addAmount The amount of underlying tokens to add as reserves\\n     * @return uint Returns 0 on success, otherwise returns a failure code (see ErrorReporter.sol for details).\\n     */\\n    // @custom:event Emits ReservesAdded event\\n    function _addReserves(uint addAmount) external returns (uint) {\\n        return _addReservesInternal(addAmount);\\n    }\\n\\n    /**\\n     * @notice Initialize the new money market\\n     * @param underlying_ The address of the underlying asset\\n     * @param comptroller_ The address of the Comptroller\\n     * @param interestRateModel_ The address of the interest rate model\\n     * @param initialExchangeRateMantissa_ The initial exchange rate, scaled by 1e18\\n     * @param name_ BEP-20 name of this token\\n     * @param symbol_ BEP-20 symbol of this token\\n     * @param decimals_ BEP-20 decimal precision of this token\\n     */\\n    function initialize(\\n        address underlying_,\\n        ComptrollerInterface comptroller_,\\n        InterestRateModelV8 interestRateModel_,\\n        uint initialExchangeRateMantissa_,\\n        string memory name_,\\n        string memory symbol_,\\n        uint8 decimals_\\n    ) public {\\n        // VToken initialize does the bulk of the work\\n        super.initialize(comptroller_, interestRateModel_, initialExchangeRateMantissa_, name_, symbol_, decimals_);\\n\\n        // Set underlying and sanity check it\\n        underlying = underlying_;\\n        IERC20(underlying).totalSupply();\\n    }\\n\\n    /*** Safe Token ***/\\n\\n    /**\\n     * @dev Similar to ERC-20 transfer, but handles tokens that have transfer fees.\\n     *      This function returns the actual amount received,\\n     *      which may be less than `amount` if there is a fee attached to the transfer.\\n     * @param from Sender of the underlying tokens\\n     * @param amount Amount of underlying to transfer\\n     * @return Actual amount received\\n     */\\n    function doTransferIn(address from, uint256 amount) internal virtual override returns (uint256) {\\n        IERC20 token = IERC20(underlying);\\n        uint256 balanceBefore = token.balanceOf(address(this));\\n        token.safeTransferFrom(from, address(this), amount);\\n        uint256 balanceAfter = token.balanceOf(address(this));\\n        // Return the amount that was *actually* transferred\\n        return balanceAfter - balanceBefore;\\n    }\\n\\n    /**\\n     * @dev Just a regular ERC-20 transfer, reverts on failure\\n     * @param to Receiver of the underlying tokens\\n     * @param amount Amount of underlying to transfer\\n     */\\n    function doTransferOut(address payable to, uint256 amount) internal virtual override {\\n        IERC20 token = IERC20(underlying);\\n        token.safeTransfer(to, amount);\\n    }\\n\\n    /**\\n     * @notice Gets balance of this contract in terms of the underlying\\n     * @dev This excludes the value of the current message, if any\\n     * @return The quantity of underlying tokens owned by this contract\\n     */\\n    function getCashPrior() internal view override returns (uint) {\\n        return IERC20(underlying).balanceOf(address(this));\\n    }\\n}\\n\",\"keccak256\":\"0x5c7901e5f3c83c48a62b9f4a4287ad51db9963b7a27d72295090759bd29aa7a9\",\"license\":\"BSD-3-Clause\"},\"contracts/Tokens/VTokens/VBep20Delegate.sol\":{\"content\":\"// SPDX-License-Identifier: BSD-3-Clause\\n\\npragma solidity 0.8.25;\\n\\nimport { VBep20 } from \\\"./VBep20.sol\\\";\\nimport { VDelegateInterface } from \\\"./VTokenInterfaces.sol\\\";\\n\\n/**\\n * @title Venus's VBep20Delegate Contract\\n * @notice VTokens which wrap an EIP-20 underlying and are delegated to\\n * @author Venus\\n */\\ncontract VBep20Delegate is VBep20, VDelegateInterface {\\n    /**\\n     * @notice Construct an empty delegate\\n     */\\n    constructor() {}\\n\\n    /**\\n     * @notice Called by the delegator on a delegate to initialize it for duty\\n     * @param data The encoded bytes data for any initialization\\n     */\\n    function _becomeImplementation(bytes memory data) public {\\n        // Shh -- currently unused\\n        data;\\n\\n        // Shh -- we don't ever want this hook to be marked pure\\n        if (false) {\\n            implementation = address(0);\\n        }\\n\\n        require(msg.sender == admin, \\\"only the admin may call _becomeImplementation\\\");\\n    }\\n\\n    /**\\n     * @notice Called by the delegator on a delegate to forfeit its responsibility\\n     */\\n    function _resignImplementation() public {\\n        // Shh -- we don't ever want this hook to be marked pure\\n        if (false) {\\n            implementation = address(0);\\n        }\\n\\n        require(msg.sender == admin, \\\"only the admin may call _resignImplementation\\\");\\n    }\\n}\\n\",\"keccak256\":\"0xd418c6bf1e7ed46fc1923b107a00d42d6df5a1b404275fb46062f77d20b88181\",\"license\":\"BSD-3-Clause\"},\"contracts/Tokens/VTokens/VToken.sol\":{\"content\":\"// SPDX-License-Identifier: BSD-3-Clause\\n\\npragma solidity 0.8.25;\\n\\nimport { IAccessControlManagerV8 } from \\\"@venusprotocol/governance-contracts/contracts/Governance/IAccessControlManagerV8.sol\\\";\\nimport { IProtocolShareReserve } from \\\"../../external/IProtocolShareReserve.sol\\\";\\nimport { ComptrollerInterface, IComptroller } from \\\"../../Comptroller/ComptrollerInterface.sol\\\";\\nimport { TokenErrorReporter } from \\\"../../Utils/ErrorReporter.sol\\\";\\nimport { Exponential } from \\\"../../Utils/Exponential.sol\\\";\\nimport { InterestRateModelV8 } from \\\"../../InterestRateModels/InterestRateModelV8.sol\\\";\\nimport { VTokenInterface } from \\\"./VTokenInterfaces.sol\\\";\\nimport { IFlashLoanSimpleReceiver } from \\\"../../FlashLoan/interfaces/IFlashLoanSimpleReceiver.sol\\\";\\n\\n/**\\n * @title Venus's vToken Contract\\n * @notice Abstract base for vTokens\\n * @author Venus\\n */\\nabstract contract VToken is VTokenInterface, Exponential, TokenErrorReporter {\\n    struct MintLocalVars {\\n        MathError mathErr;\\n        uint exchangeRateMantissa;\\n        uint mintTokens;\\n        uint totalSupplyNew;\\n        uint accountTokensNew;\\n        uint actualMintAmount;\\n    }\\n\\n    struct RedeemLocalVars {\\n        MathError mathErr;\\n        uint exchangeRateMantissa;\\n        uint redeemTokens;\\n        uint redeemAmount;\\n        uint totalSupplyNew;\\n        uint accountTokensNew;\\n    }\\n\\n    struct BorrowLocalVars {\\n        MathError mathErr;\\n        uint accountBorrows;\\n        uint accountBorrowsNew;\\n        uint totalBorrowsNew;\\n    }\\n\\n    struct RepayBorrowLocalVars {\\n        Error err;\\n        MathError mathErr;\\n        uint repayAmount;\\n        uint borrowerIndex;\\n        uint accountBorrows;\\n        uint accountBorrowsNew;\\n        uint totalBorrowsNew;\\n        uint actualRepayAmount;\\n    }\\n\\n    /*** Reentrancy Guard ***/\\n\\n    /**\\n     * @dev Prevents a contract from calling itself, directly or indirectly.\\n     */\\n    modifier nonReentrant() {\\n        require(_notEntered, \\\"re-entered\\\");\\n        _notEntered = false;\\n        _;\\n        _notEntered = true; // get a gas-refund post-Istanbul\\n    }\\n\\n    /**\\n     * @notice Transfer `amount` tokens from `msg.sender` to `dst`\\n     * @param dst The address of the destination account\\n     * @param amount The number of tokens to transfer\\n     * @return Whether or not the transfer succeeded\\n     */\\n    // @custom:event Emits Transfer event\\n    function transfer(address dst, uint256 amount) external override nonReentrant returns (bool) {\\n        return transferTokens(msg.sender, msg.sender, dst, amount) == uint(Error.NO_ERROR);\\n    }\\n\\n    /**\\n     * @notice Transfer `amount` tokens from `src` to `dst`\\n     * @param src The address of the source account\\n     * @param dst The address of the destination account\\n     * @param amount The number of tokens to transfer\\n     * @return Whether or not the transfer succeeded\\n     */\\n    // @custom:event Emits Transfer event\\n    function transferFrom(address src, address dst, uint256 amount) external override nonReentrant returns (bool) {\\n        return transferTokens(msg.sender, src, dst, amount) == uint(Error.NO_ERROR);\\n    }\\n\\n    /**\\n     * @notice Approve `spender` to transfer up to `amount` from `src`\\n     * @dev This will overwrite the approval amount for `spender`\\n     *  and is subject to issues noted [here](https://eips.ethereum.org/EIPS/eip-20#approve)\\n     * @param spender The address of the account which may transfer tokens\\n     * @param amount The number of tokens that are approved (type(uint256).max means infinite)\\n     * @return Whether or not the approval succeeded\\n     */\\n    // @custom:event Emits Approval event on successful approve\\n    function approve(address spender, uint256 amount) external override returns (bool) {\\n        transferAllowances[msg.sender][spender] = amount;\\n        emit Approval(msg.sender, spender, amount);\\n        return true;\\n    }\\n\\n    /**\\n     * @notice Get the underlying balance of the `owner`\\n     * @dev This also accrues interest in a transaction\\n     * @param owner The address of the account to query\\n     * @return The amount of underlying owned by `owner`\\n     */\\n    function balanceOfUnderlying(address owner) external override returns (uint) {\\n        Exp memory exchangeRate = Exp({ mantissa: exchangeRateCurrent() });\\n        (MathError mErr, uint balance) = mulScalarTruncate(exchangeRate, accountTokens[owner]);\\n        ensureNoMathError(mErr);\\n        return balance;\\n    }\\n\\n    /**\\n     * @notice Returns the current total borrows plus accrued interest\\n     * @return The total borrows with interest\\n     */\\n    function totalBorrowsCurrent() external override nonReentrant returns (uint) {\\n        require(accrueInterest() == uint(Error.NO_ERROR), \\\"accrue interest failed\\\");\\n        return totalBorrows;\\n    }\\n\\n    /**\\n     * @notice Accrue interest to updated borrowIndex and then calculate account's borrow balance using the updated borrowIndex\\n     * @param account The address whose balance should be calculated after updating borrowIndex\\n     * @return The calculated balance\\n     */\\n    function borrowBalanceCurrent(address account) external override nonReentrant returns (uint) {\\n        require(accrueInterest() == uint(Error.NO_ERROR), \\\"accrue interest failed\\\");\\n        return borrowBalanceStored(account);\\n    }\\n\\n    /**\\n     * @notice Transfers collateral tokens (this market) to the liquidator.\\n     * @dev Will fail unless called by another vToken during the process of liquidation.\\n     *  Its absolutely critical to use msg.sender as the borrowed vToken and not a parameter.\\n     * @param liquidator The account receiving seized collateral\\n     * @param borrower The account having collateral seized\\n     * @param seizeTokens The number of vTokens to seize\\n     * @return uint Returns 0 on success, otherwise returns a failure code (see ErrorReporter.sol for details).\\n     */\\n    // @custom:event Emits Transfer event\\n    function seize(\\n        address liquidator,\\n        address borrower,\\n        uint seizeTokens\\n    ) external override nonReentrant returns (uint) {\\n        return seizeInternal(msg.sender, liquidator, borrower, seizeTokens);\\n    }\\n\\n    /**\\n     * @notice Begins transfer of admin rights. The newPendingAdmin must call `_acceptAdmin` to finalize the transfer.\\n     * @dev Admin function to begin change of admin. The newPendingAdmin must call `_acceptAdmin` to finalize the transfer.\\n     * @param newPendingAdmin New pending admin.\\n     * @return uint Returns 0 on success, otherwise returns a failure code (see ErrorReporter.sol for details).\\n     */\\n    // @custom:event Emits NewPendingAdmin event with old and new admin addresses\\n    function _setPendingAdmin(address payable newPendingAdmin) external override returns (uint) {\\n        // Check caller = admin\\n        ensureAdmin(msg.sender);\\n\\n        // Save current value, if any, for inclusion in log\\n        address oldPendingAdmin = pendingAdmin;\\n\\n        // Store pendingAdmin with value newPendingAdmin\\n        pendingAdmin = newPendingAdmin;\\n\\n        // Emit NewPendingAdmin(oldPendingAdmin, newPendingAdmin)\\n        emit NewPendingAdmin(oldPendingAdmin, newPendingAdmin);\\n\\n        return uint(Error.NO_ERROR);\\n    }\\n\\n    /**\\n     * @notice Accepts transfer of admin rights. msg.sender must be pendingAdmin\\n     * @dev Admin function for pending admin to accept role and update admin\\n     * @return uint Returns 0 on success, otherwise returns a failure code (see ErrorReporter.sol for details).\\n     */\\n    // @custom:event Emits NewAdmin event on successful acceptance\\n    // @custom:event Emits NewPendingAdmin event with null new pending admin\\n    function _acceptAdmin() external override returns (uint) {\\n        // Check caller is pendingAdmin\\n        if (msg.sender != pendingAdmin) {\\n            return fail(Error.UNAUTHORIZED, FailureInfo.ACCEPT_ADMIN_PENDING_ADMIN_CHECK);\\n        }\\n\\n        // Save current values for inclusion in log\\n        address oldAdmin = admin;\\n        address oldPendingAdmin = pendingAdmin;\\n\\n        // Store admin with value pendingAdmin\\n        admin = pendingAdmin;\\n\\n        // Clear the pending value\\n        pendingAdmin = payable(address(0));\\n\\n        emit NewAdmin(oldAdmin, admin);\\n        emit NewPendingAdmin(oldPendingAdmin, pendingAdmin);\\n\\n        return uint(Error.NO_ERROR);\\n    }\\n\\n    /**\\n     * @notice accrues interest and sets a new reserve factor for the protocol using `_setReserveFactorFresh`\\n     * @dev Governor function to accrue interest and set a new reserve factor\\n     * @return uint Returns 0 on success, otherwise returns a failure code (see ErrorReporter.sol for details).\\n     */\\n    // @custom:event Emits NewReserveFactor event\\n    function _setReserveFactor(uint newReserveFactorMantissa_) external override nonReentrant returns (uint) {\\n        ensureAllowed(\\\"_setReserveFactor(uint256)\\\");\\n        checkAccrueInterest(FailureInfo.SET_RESERVE_FACTOR_ACCRUE_INTEREST_FAILED);\\n\\n        // _setReserveFactorFresh emits reserve-factor-specific logs on errors, so we don't need to.\\n        return _setReserveFactorFresh(newReserveFactorMantissa_);\\n    }\\n\\n    /**\\n     * @notice Sets the address of the access control manager of this contract\\n     * @dev Admin function to set the access control address\\n     * @param newAccessControlManagerAddress New address for the access control\\n     * @return uint 0=success, otherwise will revert\\n     */\\n    function setAccessControlManager(address newAccessControlManagerAddress) external returns (uint) {\\n        // Check caller is admin\\n        ensureAdmin(msg.sender);\\n\\n        ensureNonZeroAddress(newAccessControlManagerAddress);\\n\\n        emit NewAccessControlManager(accessControlManager, newAccessControlManagerAddress);\\n        accessControlManager = newAccessControlManagerAddress;\\n\\n        return uint(Error.NO_ERROR);\\n    }\\n\\n    /**\\n     * @notice Accrues interest and reduces reserves by transferring to protocol share reserve\\n     * @param reduceAmount_ Amount of reduction to reserves\\n     * @return uint Returns 0 on success, otherwise returns a failure code (see ErrorReporter.sol for details).\\n     */\\n    // @custom:event Emits ReservesReduced event\\n    function _reduceReserves(uint reduceAmount_) external virtual override nonReentrant returns (uint) {\\n        ensureAllowed(\\\"_reduceReserves(uint256)\\\");\\n        checkAccrueInterest(FailureInfo.REDUCE_RESERVES_ACCRUE_INTEREST_FAILED);\\n\\n        // If reserves were reduced in accrueInterest\\n        if (reduceReservesBlockNumber == block.number) return (uint(Error.NO_ERROR));\\n        // _reduceReservesFresh emits reserve-reduction-specific logs on errors, so we don't need to.\\n        return _reduceReservesFresh(reduceAmount_);\\n    }\\n\\n    /**\\n     * @notice Get the current allowance from `owner` for `spender`\\n     * @param owner The address of the account which owns the tokens to be spent\\n     * @param spender The address of the account which may transfer tokens\\n     * @return The number of tokens allowed to be spent (type(uint256).max means infinite)\\n     */\\n    function allowance(address owner, address spender) external view override returns (uint256) {\\n        return transferAllowances[owner][spender];\\n    }\\n\\n    /**\\n     * @notice Get the token balance of the `owner`\\n     * @param owner The address of the account to query\\n     * @return The number of tokens owned by `owner`\\n     */\\n    function balanceOf(address owner) external view override returns (uint256) {\\n        return accountTokens[owner];\\n    }\\n\\n    /**\\n     * @notice Get a snapshot of the account's balances, and the cached exchange rate\\n     * @dev This is used by comptroller to more efficiently perform liquidity checks.\\n     * @param account Address of the account to snapshot\\n     * @return (possible error, token balance, borrow balance, exchange rate mantissa)\\n     */\\n    function getAccountSnapshot(address account) external view override returns (uint, uint, uint, uint) {\\n        uint borrowBalance;\\n        uint exchangeRateMantissa;\\n\\n        MathError mErr;\\n\\n        (mErr, borrowBalance) = borrowBalanceStoredInternal(account);\\n        if (mErr != MathError.NO_ERROR) {\\n            return (uint(Error.MATH_ERROR), 0, 0, 0);\\n        }\\n\\n        (mErr, exchangeRateMantissa) = exchangeRateStoredInternal();\\n        if (mErr != MathError.NO_ERROR) {\\n            return (uint(Error.MATH_ERROR), 0, 0, 0);\\n        }\\n\\n        return (uint(Error.NO_ERROR), accountTokens[account], borrowBalance, exchangeRateMantissa);\\n    }\\n\\n    /**\\n     * @notice Returns the current per-block supply interest rate for this vToken\\n     * @return The supply interest rate per block, scaled by 1e18\\n     */\\n    function supplyRatePerBlock() external view override returns (uint) {\\n        return interestRateModel.getSupplyRate(getCashPrior(), totalBorrows, totalReserves, reserveFactorMantissa);\\n    }\\n\\n    /**\\n     * @notice Returns the current per-block borrow interest rate for this vToken\\n     * @return The borrow interest rate per block, scaled by 1e18\\n     */\\n    function borrowRatePerBlock() external view override returns (uint) {\\n        return interestRateModel.getBorrowRate(getCashPrior(), totalBorrows, totalReserves);\\n    }\\n\\n    /**\\n     * @notice Get cash balance of this vToken in the underlying asset\\n     * @return The quantity of underlying asset owned by this contract\\n     */\\n    function getCash() external view override returns (uint) {\\n        return getCashPrior();\\n    }\\n\\n    /**\\n     * @notice Governance function to set new threshold of block difference after which funds will be sent to the protocol share reserve\\n     * @param newReduceReservesBlockDelta_ block difference value\\n     */\\n    function setReduceReservesBlockDelta(uint256 newReduceReservesBlockDelta_) external {\\n        require(newReduceReservesBlockDelta_ > 0, \\\"Invalid Input\\\");\\n        ensureAllowed(\\\"setReduceReservesBlockDelta(uint256)\\\");\\n        emit NewReduceReservesBlockDelta(reduceReservesBlockDelta, newReduceReservesBlockDelta_);\\n        reduceReservesBlockDelta = newReduceReservesBlockDelta_;\\n    }\\n\\n    /**\\n     * @notice Sets protocol share reserve contract address\\n     * @param protcolShareReserve_ The address of protocol share reserve contract\\n     */\\n    function setProtocolShareReserve(address payable protcolShareReserve_) external {\\n        // Check caller is admin\\n        ensureAdmin(msg.sender);\\n        ensureNonZeroAddress(protcolShareReserve_);\\n        emit NewProtocolShareReserve(protocolShareReserve, protcolShareReserve_);\\n        protocolShareReserve = protcolShareReserve_;\\n    }\\n\\n    /**\\n     * @notice Transfers the underlying asset to the specified address.\\n     * @dev Can only be called by the Comptroller contract. This function performs the actual transfer of the underlying\\n     *      asset by calling the `doTransferOut` internal function.\\n     *      - The caller must be the Comptroller contract.\\n     *      - If the `to` address is not the protocol share reserve, the flashLoanAmount is incremented by the amount transferred out.\\n     * @param to The address to which the underlying asset is to be transferred.\\n     * @param amount The amount of the underlying asset to transfer.\\n     * @return balanceBeforeRepayFlashloan Cash balance after transfer out for comparison in flash loan verification.\\n     * @custom:error InvalidComptroller is thrown if the caller is not the Comptroller.\\n     * @custom:event Emits TransferOutUnderlying event on successful transfer of amount to receiver\\n     */\\n\\n    function transferOutUnderlying(\\n        address payable to,\\n        uint256 amount\\n    ) external nonReentrant returns (uint256 balanceBeforeRepayFlashloan) {\\n        if (msg.sender != address(comptroller)) {\\n            revert InvalidComptroller();\\n        }\\n\\n        if (to != protocolShareReserve) {\\n            flashLoanAmount += amount;\\n        }\\n        doTransferOut(to, amount);\\n\\n        balanceBeforeRepayFlashloan = getCashPrior();\\n        emit TransferOutUnderlying(underlying, to, amount);\\n    }\\n\\n    /**\\n     * @notice Transfers the underlying asset from the specified address.\\n     * @dev Can only be called by the Comptroller contract. This function performs the actual transfer of the underlying\\n     *      asset by calling the `doTransferIn` internal function.\\n     *      - The caller must be the Comptroller contract.\\n     * @param from The address from which the underlying asset is to be transferred.\\n     * @param amountRepayed The amount of the underlying asset to transfer.\\n     * @custom:error InvalidComptroller is thrown if the caller is not the Comptroller.\\n     * @custom:event Emits TransferInUnderlyingAndVerify event on successful transfer of amount from the receiver to the vToken\\n     */\\n    function transferInUnderlyingAndVerify(address payable from, uint256 amountRepayed) external nonReentrant {\\n        if (msg.sender != address(comptroller)) {\\n            revert InvalidComptroller();\\n        }\\n\\n        doTransferIn(from, amountRepayed);\\n        flashLoanAmount = 0;\\n\\n        emit TransferInUnderlyingAndVerify(underlying, from, amountRepayed);\\n    }\\n\\n    /**\\n     * @notice Executes a flashLoan operation.\\n     * @dev Transfers the amount to the receiver contract and ensures that the total repayment (amount + fee)\\n     *      is returned by the receiver contract after the operation. The function performs checks to ensure the validity\\n     *      of parameters, that flashLoan is enabled for the given asset, and that the total repayment is sufficient.\\n     *      Reverts on invalid parameters, disabled flashLoans, or insufficient repayment.\\n     *      requirements\\n     *      - The `receiver` address must not be the zero address.\\n     *      - FlashLoans must be enabled for the asset.\\n     *      - The `receiver` contract must repay the loan with the appropriate fee.\\n     * @param initiator The address that initiated the flash loan.\\n     * @param receiver The address of the contract that will receive the flashLoan and execute the operation.\\n     * @param amount The amount of asset to be loaned.\\n     * @param param Additional encoded parameters passed with the flash loan.\\n     * @custom:error FlashLoanNotEnabled is thrown if flash loans are disabled for the asset.\\n     * @custom:error SenderNotAuthorized is thrown if the initiator is not authorized to execute flash loan.\\n     * @custom:error ExecuteFlashLoanFailed is thrown if the receiver contract fails to execute the operation.\\n     * @custom:error InsufficientRepayment is thrown if the repayment (amount + fee) is insufficient after the operation.\\n     * @custom:event Emits FlashLoanExecuted event on success\\n     */\\n    function executeFlashLoan(\\n        address initiator,\\n        address payable receiver,\\n        uint256 amount,\\n        bytes calldata param\\n    ) external nonReentrant returns (uint256) {\\n        if (!isFlashLoanEnabled) {\\n            revert FlashLoanNotEnabled();\\n        }\\n\\n        ensureNonZeroAddress(receiver);\\n\\n        // Check if the caller is authorized to execute flash loans\\n        if (!comptroller.authorizedFlashLoan(initiator)) {\\n            revert SenderNotAuthorized(initiator);\\n        }\\n\\n        // Tracks the flashLoan amount before transferring amount to the receiver\\n        flashLoanAmount += amount;\\n\\n        // Transfer the underlying asset to the receiver\\n        doTransferOut(receiver, amount);\\n\\n        uint256 balanceBefore = getCashPrior();\\n        (uint256 totalFee, uint256 protocolFee) = calculateFlashLoanFee(amount);\\n        uint256 repayAmount = amount + totalFee;\\n\\n        // Call the execute operation on receiver contract\\n        if (!IFlashLoanSimpleReceiver(receiver).executeOperation(underlying, amount, totalFee, msg.sender, param)) {\\n            revert ExecuteFlashLoanFailed();\\n        }\\n\\n        doTransferIn(receiver, repayAmount);\\n        flashLoanAmount -= amount;\\n\\n        if ((getCashPrior() - balanceBefore) < repayAmount) revert InsufficientRepayment();\\n\\n        // Transfer protocol fee to protocol share reserve\\n        doTransferOut(protocolShareReserve, protocolFee);\\n\\n        IProtocolShareReserve(protocolShareReserve).updateAssetsState(\\n            address(comptroller),\\n            underlying,\\n            IProtocolShareReserve.IncomeType.FLASHLOAN\\n        );\\n\\n        emit FlashLoanExecuted(receiver, underlying, amount);\\n        return uint(Error.NO_ERROR);\\n    }\\n\\n    /**\\n     * @notice Enables or disables flash loan for the market\\n     * @custom:access Only Governance\\n     * @custom:event Emits ToggleFlashLoanEnabled event on success\\n     */\\n    function toggleFlashLoan() external returns (uint256) {\\n        ensureAllowed(\\\"toggleFlashLoan()\\\");\\n        isFlashLoanEnabled = !isFlashLoanEnabled;\\n\\n        emit ToggleFlashLoanEnabled(!isFlashLoanEnabled, isFlashLoanEnabled);\\n\\n        return uint(Error.NO_ERROR);\\n    }\\n\\n    /**\\n     * @notice Update flashLoan fee mantissa\\n     * @param flashLoanFeeMantissa_  FlashLoan fee, scaled by 1e18\\n     * @param flashLoanProtocolShare_ FlashLoan protocol fee share, transferred to protocol share reserve\\n     * @return uint Returns 0 on success, otherwise returns a failure code (see ErrorReporter.sol for details).\\n     * @custom:access Only Governance\\n     * @custom:event Emits FlashLoanFeeUpdated event on success\\n     */\\n    function setFlashLoanFeeMantissa(\\n        uint256 flashLoanFeeMantissa_,\\n        uint256 flashLoanProtocolShare_\\n    ) external returns (uint256) {\\n        // update the signature\\n        ensureAllowed(\\\"setFlashLoanFeeMantissa(uint256,uint256)\\\");\\n\\n        emit FlashLoanFeeUpdated(\\n            flashLoanFeeMantissa,\\n            flashLoanFeeMantissa_,\\n            flashLoanProtocolShareMantissa,\\n            flashLoanProtocolShare_\\n        );\\n        flashLoanFeeMantissa = flashLoanFeeMantissa_;\\n        flashLoanProtocolShareMantissa = flashLoanProtocolShare_;\\n\\n        return uint(Error.NO_ERROR);\\n    }\\n\\n    /**\\n     * @notice Initialize the money market\\n     * @param comptroller_ The address of the Comptroller\\n     * @param interestRateModel_ The address of the interest rate model\\n     * @param initialExchangeRateMantissa_ The initial exchange rate, scaled by 1e18\\n     * @param name_ EIP-20 name of this token\\n     * @param symbol_ EIP-20 symbol of this token\\n     * @param decimals_ EIP-20 decimal precision of this token\\n     */\\n    function initialize(\\n        ComptrollerInterface comptroller_,\\n        InterestRateModelV8 interestRateModel_,\\n        uint initialExchangeRateMantissa_,\\n        string memory name_,\\n        string memory symbol_,\\n        uint8 decimals_\\n    ) public {\\n        ensureAdmin(msg.sender);\\n        require(\\n            accrualBlockNumber == 0 && borrowIndex == 0 && (initialExchangeRateMantissa_ > 0),\\n            \\\"market may only be initialized once\\\"\\n        );\\n\\n        // Set initial exchange rate\\n        initialExchangeRateMantissa = initialExchangeRateMantissa_;\\n\\n        // Set the comptroller\\n        uint ComptrollerErr = _setComptroller(comptroller_);\\n\\n        // Initialize block number and borrow index (block number mocks depend on comptroller being set)\\n        accrualBlockNumber = block.number;\\n        borrowIndex = mantissaOne;\\n\\n        // Set the interest rate model (depends on block number / borrow index)\\n        uint InterestModelErr = _setInterestRateModelFresh(interestRateModel_);\\n        require(\\n            (ComptrollerErr == uint(Error.NO_ERROR)) && (InterestModelErr == uint(Error.NO_ERROR)),\\n            \\\"comptroller or interest model initialization failed\\\"\\n        );\\n\\n        name = name_;\\n        symbol = symbol_;\\n        decimals = decimals_;\\n\\n        // The counter starts true to prevent changing it from zero to non-zero (i.e. smaller cost/refund)\\n        _notEntered = true;\\n    }\\n\\n    /**\\n     * @notice Accrue interest then return the up-to-date exchange rate\\n     * @return Calculated exchange rate scaled by 1e18\\n     */\\n    function exchangeRateCurrent() public override nonReentrant returns (uint) {\\n        require(accrueInterest() == uint(Error.NO_ERROR), \\\"accrue interest failed\\\");\\n        return exchangeRateStored();\\n    }\\n\\n    /**\\n     * @notice Applies accrued interest to total borrows and reserves\\n     * @dev This calculates interest accrued from the last checkpointed block\\n     * up to the current block and writes new checkpoint to storage and\\n     * reduce spread reserves to protocol share reserve\\n     * if currentBlock - reduceReservesBlockNumber >= blockDelta\\n     */\\n    // @custom:event Emits AccrueInterest event\\n    function accrueInterest() public virtual override returns (uint) {\\n        /* Remember the initial block number */\\n        uint currentBlockNumber = block.number;\\n        uint accrualBlockNumberPrior = accrualBlockNumber;\\n\\n        /* Short-circuit accumulating 0 interest */\\n        if (accrualBlockNumberPrior == currentBlockNumber) {\\n            return uint(Error.NO_ERROR);\\n        }\\n\\n        /* Read the previous values out of storage */\\n        uint cashPrior = getCashPrior();\\n        uint borrowsPrior = totalBorrows;\\n        uint reservesPrior = totalReserves;\\n        uint borrowIndexPrior = borrowIndex;\\n\\n        /* Calculate the current borrow interest rate */\\n        uint borrowRateMantissa = interestRateModel.getBorrowRate(cashPrior, borrowsPrior, reservesPrior);\\n        require(borrowRateMantissa <= borrowRateMaxMantissa, \\\"borrow rate is absurdly high\\\");\\n\\n        /* Calculate the number of blocks elapsed since the last accrual */\\n        (MathError mathErr, uint blockDelta) = subUInt(currentBlockNumber, accrualBlockNumberPrior);\\n        ensureNoMathError(mathErr);\\n\\n        /*\\n         * Calculate the interest accumulated into borrows and reserves and the new index:\\n         *  simpleInterestFactor = borrowRate * blockDelta\\n         *  interestAccumulated = simpleInterestFactor * totalBorrows\\n         *  totalBorrowsNew = interestAccumulated + totalBorrows\\n         *  totalReservesNew = interestAccumulated * reserveFactor + totalReserves\\n         *  borrowIndexNew = simpleInterestFactor * borrowIndex + borrowIndex\\n         */\\n\\n        Exp memory simpleInterestFactor;\\n        uint interestAccumulated;\\n        uint totalBorrowsNew;\\n        uint totalReservesNew;\\n        uint borrowIndexNew;\\n\\n        (mathErr, simpleInterestFactor) = mulScalar(Exp({ mantissa: borrowRateMantissa }), blockDelta);\\n        if (mathErr != MathError.NO_ERROR) {\\n            return\\n                failOpaque(\\n                    Error.MATH_ERROR,\\n                    FailureInfo.ACCRUE_INTEREST_SIMPLE_INTEREST_FACTOR_CALCULATION_FAILED,\\n                    uint(mathErr)\\n                );\\n        }\\n\\n        (mathErr, interestAccumulated) = mulScalarTruncate(simpleInterestFactor, borrowsPrior);\\n        if (mathErr != MathError.NO_ERROR) {\\n            return\\n                failOpaque(\\n                    Error.MATH_ERROR,\\n                    FailureInfo.ACCRUE_INTEREST_ACCUMULATED_INTEREST_CALCULATION_FAILED,\\n                    uint(mathErr)\\n                );\\n        }\\n\\n        (mathErr, totalBorrowsNew) = addUInt(interestAccumulated, borrowsPrior);\\n        if (mathErr != MathError.NO_ERROR) {\\n            return\\n                failOpaque(\\n                    Error.MATH_ERROR,\\n                    FailureInfo.ACCRUE_INTEREST_NEW_TOTAL_BORROWS_CALCULATION_FAILED,\\n                    uint(mathErr)\\n                );\\n        }\\n\\n        (mathErr, totalReservesNew) = mulScalarTruncateAddUInt(\\n            Exp({ mantissa: reserveFactorMantissa }),\\n            interestAccumulated,\\n            reservesPrior\\n        );\\n        if (mathErr != MathError.NO_ERROR) {\\n            return\\n                failOpaque(\\n                    Error.MATH_ERROR,\\n                    FailureInfo.ACCRUE_INTEREST_NEW_TOTAL_RESERVES_CALCULATION_FAILED,\\n                    uint(mathErr)\\n                );\\n        }\\n\\n        (mathErr, borrowIndexNew) = mulScalarTruncateAddUInt(simpleInterestFactor, borrowIndexPrior, borrowIndexPrior);\\n        if (mathErr != MathError.NO_ERROR) {\\n            return\\n                failOpaque(\\n                    Error.MATH_ERROR,\\n                    FailureInfo.ACCRUE_INTEREST_NEW_BORROW_INDEX_CALCULATION_FAILED,\\n                    uint(mathErr)\\n                );\\n        }\\n\\n        /////////////////////////\\n        // EFFECTS & INTERACTIONS\\n        // (No safe failures beyond this point)\\n\\n        /* We write the previously calculated values into storage */\\n        accrualBlockNumber = currentBlockNumber;\\n        borrowIndex = borrowIndexNew;\\n        totalBorrows = totalBorrowsNew;\\n        totalReserves = totalReservesNew;\\n\\n        (mathErr, blockDelta) = subUInt(currentBlockNumber, reduceReservesBlockNumber);\\n        ensureNoMathError(mathErr);\\n        if (blockDelta >= reduceReservesBlockDelta) {\\n            reduceReservesBlockNumber = currentBlockNumber;\\n            if (cashPrior < totalReservesNew) {\\n                _reduceReservesFresh(cashPrior);\\n            } else {\\n                _reduceReservesFresh(totalReservesNew);\\n            }\\n        }\\n\\n        /* We emit an AccrueInterest event */\\n        emit AccrueInterest(cashPrior, interestAccumulated, borrowIndexNew, totalBorrowsNew);\\n\\n        return uint(Error.NO_ERROR);\\n    }\\n\\n    /**\\n     * @notice Sets a new comptroller for the market\\n     * @dev Admin function to set a new comptroller\\n     * @return uint Returns 0 on success, otherwise returns a failure code (see ErrorReporter.sol for details).\\n     */\\n    // @custom:event Emits NewComptroller event\\n    function _setComptroller(ComptrollerInterface newComptroller) public override returns (uint) {\\n        // Check caller is admin\\n        ensureAdmin(msg.sender);\\n\\n        // Ensure invoke comptroller.isComptroller() returns true\\n        require(newComptroller.isComptroller(), \\\"marker method returned false\\\");\\n\\n        // Emit NewComptroller(oldComptroller, newComptroller)\\n        emit NewComptroller(comptroller, newComptroller);\\n\\n        // Set market's comptroller to newComptroller\\n        comptroller = newComptroller;\\n\\n        return uint(Error.NO_ERROR);\\n    }\\n\\n    /**\\n     * @notice Accrues interest and updates the interest rate model using _setInterestRateModelFresh\\n     * @dev Governance function to accrue interest and update the interest rate model\\n     * @param newInterestRateModel_ The new interest rate model to use\\n     * @return uint Returns 0 on success, otherwise returns a failure code (see ErrorReporter.sol for details).\\n     */\\n    function _setInterestRateModel(InterestRateModelV8 newInterestRateModel_) public override returns (uint) {\\n        ensureAllowed(\\\"_setInterestRateModel(address)\\\");\\n        checkAccrueInterest(FailureInfo.SET_INTEREST_RATE_MODEL_ACCRUE_INTEREST_FAILED);\\n\\n        // _setInterestRateModelFresh emits interest-rate-model-update-specific logs on errors, so we don't need to.\\n        return _setInterestRateModelFresh(newInterestRateModel_);\\n    }\\n\\n    /**\\n     * @notice Calculates the exchange rate from the underlying to the VToken\\n     * @dev This function does not accrue interest before calculating the exchange rate\\n     * @return Calculated exchange rate scaled by 1e18\\n     */\\n    function exchangeRateStored() public view override returns (uint) {\\n        (MathError err, uint result) = exchangeRateStoredInternal();\\n        ensureNoMathError(err);\\n        return result;\\n    }\\n\\n    /**\\n     * @notice Return the borrow balance of account based on stored data\\n     * @param account The address whose balance should be calculated\\n     * @return The calculated balance\\n     */\\n    function borrowBalanceStored(address account) public view override returns (uint) {\\n        (MathError err, uint result) = borrowBalanceStoredInternal(account);\\n        ensureNoMathError(err);\\n        return result;\\n    }\\n\\n    /**\\n     * @notice open a debt position for the borrower\\n     * @dev This function checks if the borrow is allowed, accrues interest, and updates the borrower's balance.\\n     *      It also emits a Borrow event and calls the comptroller's borrowVerify function.\\n     *      It reverts if the borrow is not allowed, if the market's block number is not current, or if the protocol has insufficient cash.\\n     * @param borrower The address of the borrower\\n     * @param borrowAmount The amount of underlying asset to borrow\\n     * @return uint Returns 0 on success, otherwise returns a failure code (see ErrorReporter.sol for details).\\n     * @custom:error InvalidComptroller is thrown if the caller is not the Comptroller.\\n     */\\n    function borrowDebtPosition(address borrower, uint borrowAmount) external override returns (uint256) {\\n        // Reverts if the caller is not the comptroller\\n        if (msg.sender != address(comptroller)) {\\n            revert InvalidComptroller();\\n        }\\n\\n        checkAccrueInterest(FailureInfo.BORROW_ACCRUE_INTEREST_FAILED);\\n\\n        // borrowFresh emits borrow-specific logs on errors, so we don't need to\\n        return borrowFresh(borrower, payable(address(0)), borrowAmount, false);\\n    }\\n\\n    /**\\n     * @notice Calculates the total fee and protocol fee for a flash loan..\\n     * @param amount The amount of the flash loan.\\n     * @return totalFee The total fee for the flash loan.\\n     * @return protocolFee The portion of the total fee allocated to the protocol.\\n     */\\n    function calculateFlashLoanFee(uint256 amount) public view returns (uint256, uint256) {\\n        MathError mErr;\\n        uint256 totalFee;\\n        uint256 protocolFee;\\n\\n        (mErr, totalFee) = mulScalarTruncate(Exp({ mantissa: amount }), flashLoanFeeMantissa);\\n        ensureNoMathError(mErr);\\n\\n        (mErr, protocolFee) = mulScalarTruncate(Exp({ mantissa: totalFee }), flashLoanProtocolShareMantissa);\\n        ensureNoMathError(mErr);\\n\\n        return (totalFee, protocolFee);\\n    }\\n\\n    /**\\n     * @notice Transfers `tokens` tokens from `src` to `dst` by `spender`\\n     * @dev Called by both `transfer` and `transferFrom` internally\\n     * @param spender The address of the account performing the transfer\\n     * @param src The address of the source account\\n     * @param dst The address of the destination account\\n     * @param tokens The number of tokens to transfer\\n     * @return Whether or not the transfer succeeded\\n     */\\n    function transferTokens(address spender, address src, address dst, uint tokens) internal returns (uint) {\\n        /* Fail if transfer not allowed */\\n        uint allowed = comptroller.transferAllowed(address(this), src, dst, tokens);\\n        if (allowed != 0) {\\n            return failOpaque(Error.COMPTROLLER_REJECTION, FailureInfo.TRANSFER_COMPTROLLER_REJECTION, allowed);\\n        }\\n\\n        /* Do not allow self-transfers */\\n        if (src == dst) {\\n            return fail(Error.BAD_INPUT, FailureInfo.TRANSFER_NOT_ALLOWED);\\n        }\\n\\n        /* Get the allowance, infinite for the account owner */\\n        uint startingAllowance = 0;\\n        if (spender == src) {\\n            startingAllowance = type(uint256).max;\\n        } else {\\n            startingAllowance = transferAllowances[src][spender];\\n        }\\n\\n        /* Do the calculations, checking for {under,over}flow */\\n        MathError mathErr;\\n        uint allowanceNew;\\n        uint srvTokensNew;\\n        uint dstTokensNew;\\n\\n        (mathErr, allowanceNew) = subUInt(startingAllowance, tokens);\\n        if (mathErr != MathError.NO_ERROR) {\\n            return fail(Error.MATH_ERROR, FailureInfo.TRANSFER_NOT_ALLOWED);\\n        }\\n\\n        (mathErr, srvTokensNew) = subUInt(accountTokens[src], tokens);\\n        if (mathErr != MathError.NO_ERROR) {\\n            return fail(Error.MATH_ERROR, FailureInfo.TRANSFER_NOT_ENOUGH);\\n        }\\n\\n        (mathErr, dstTokensNew) = addUInt(accountTokens[dst], tokens);\\n        if (mathErr != MathError.NO_ERROR) {\\n            return fail(Error.MATH_ERROR, FailureInfo.TRANSFER_TOO_MUCH);\\n        }\\n\\n        /////////////////////////\\n        // EFFECTS & INTERACTIONS\\n        // (No safe failures beyond this point)\\n\\n        accountTokens[src] = srvTokensNew;\\n        accountTokens[dst] = dstTokensNew;\\n\\n        /* Eat some of the allowance (if necessary) */\\n        if (startingAllowance != type(uint256).max) {\\n            transferAllowances[src][spender] = allowanceNew;\\n        }\\n\\n        /* We emit a Transfer event */\\n        emit Transfer(src, dst, tokens);\\n\\n        comptroller.transferVerify(address(this), src, dst, tokens);\\n\\n        return uint(Error.NO_ERROR);\\n    }\\n\\n    /**\\n     * @notice Sender supplies assets into the market and receives vTokens in exchange\\n     * @dev Accrues interest whether or not the operation succeeds, unless reverted\\n     * @param mintAmount The amount of the underlying asset to supply\\n     * @return (uint, uint) An error code (0=success, otherwise a failure, see ErrorReporter.sol), and the actual mint amount.\\n     */\\n    function mintInternal(uint mintAmount) internal nonReentrant returns (uint, uint) {\\n        checkAccrueInterest(FailureInfo.MINT_ACCRUE_INTEREST_FAILED);\\n\\n        // mintFresh emits the actual Mint event if successful and logs on errors, so we don't need to\\n        return mintFresh(msg.sender, mintAmount);\\n    }\\n\\n    /**\\n     * @notice User supplies assets into the market and receives vTokens in exchange\\n     * @dev Assumes interest has already been accrued up to the current block\\n     * @param minter The address of the account which is supplying the assets\\n     * @param mintAmount The amount of the underlying asset to supply\\n     * @return (uint, uint) An error code (0=success, otherwise a failure, see ErrorReporter.sol), and the actual mint amount.\\n     */\\n    function mintFresh(address minter, uint mintAmount) internal returns (uint, uint) {\\n        /* Fail if mint not allowed */\\n        uint allowed = comptroller.mintAllowed(address(this), minter, mintAmount);\\n        if (allowed != 0) {\\n            return (failOpaque(Error.COMPTROLLER_REJECTION, FailureInfo.MINT_COMPTROLLER_REJECTION, allowed), 0);\\n        }\\n\\n        /* Verify market's block number equals current block number */\\n        if (accrualBlockNumber != block.number) {\\n            return (fail(Error.MARKET_NOT_FRESH, FailureInfo.MINT_FRESHNESS_CHECK), 0);\\n        }\\n\\n        MintLocalVars memory vars;\\n\\n        (vars.mathErr, vars.exchangeRateMantissa) = exchangeRateStoredInternal();\\n        if (vars.mathErr != MathError.NO_ERROR) {\\n            return (failOpaque(Error.MATH_ERROR, FailureInfo.MINT_EXCHANGE_RATE_READ_FAILED, uint(vars.mathErr)), 0);\\n        }\\n\\n        /////////////////////////\\n        // EFFECTS & INTERACTIONS\\n        // (No safe failures beyond this point)\\n\\n        /*\\n         *  We call `doTransferIn` for the minter and the mintAmount.\\n         *  Note: The vToken must handle variations between BEP-20 and BNB underlying.\\n         *  `doTransferIn` reverts if anything goes wrong, since we can't be sure if\\n         *  side-effects occurred. The function returns the amount actually transferred,\\n         *  in case of a fee. On success, the vToken holds an additional `actualMintAmount`\\n         *  of cash.\\n         */\\n        vars.actualMintAmount = doTransferIn(minter, mintAmount);\\n\\n        /*\\n         * We get the current exchange rate and calculate the number of vTokens to be minted:\\n         *  mintTokens = actualMintAmount / exchangeRate\\n         */\\n\\n        (vars.mathErr, vars.mintTokens) = divScalarByExpTruncate(\\n            vars.actualMintAmount,\\n            Exp({ mantissa: vars.exchangeRateMantissa })\\n        );\\n        ensureNoMathError(vars.mathErr);\\n\\n        /*\\n         * We calculate the new total supply of vTokens and minter token balance, checking for overflow:\\n         *  totalSupplyNew = totalSupply + mintTokens\\n         *  accountTokensNew = accountTokens[minter] + mintTokens\\n         */\\n        (vars.mathErr, vars.totalSupplyNew) = addUInt(totalSupply, vars.mintTokens);\\n        ensureNoMathError(vars.mathErr);\\n        (vars.mathErr, vars.accountTokensNew) = addUInt(accountTokens[minter], vars.mintTokens);\\n        ensureNoMathError(vars.mathErr);\\n\\n        /* We write previously calculated values into storage */\\n        totalSupply = vars.totalSupplyNew;\\n        accountTokens[minter] = vars.accountTokensNew;\\n\\n        /* We emit a Mint event, and a Transfer event */\\n        emit Mint(minter, vars.actualMintAmount, vars.mintTokens, vars.accountTokensNew);\\n        emit Transfer(address(this), minter, vars.mintTokens);\\n\\n        /* We call the defense and prime accrue interest hook */\\n        comptroller.mintVerify(address(this), minter, vars.actualMintAmount, vars.mintTokens);\\n\\n        return (uint(Error.NO_ERROR), vars.actualMintAmount);\\n    }\\n\\n    /**\\n     * @notice Sender supplies assets into the market and receiver receives vTokens in exchange\\n     * @dev Accrues interest whether or not the operation succeeds, unless reverted\\n     * @param receiver The address of the account which is receiving the vTokens\\n     * @param mintAmount The amount of the underlying asset to supply\\n     * @return (uint, uint) An error code (0=success, otherwise a failure, see ErrorReporter.sol), and the actual mint amount.\\n     */\\n    function mintBehalfInternal(address receiver, uint mintAmount) internal nonReentrant returns (uint, uint) {\\n        checkAccrueInterest(FailureInfo.MINT_ACCRUE_INTEREST_FAILED);\\n\\n        // mintBelahfFresh emits the actual Mint event if successful and logs on errors, so we don't need to\\n        return mintBehalfFresh(msg.sender, receiver, mintAmount);\\n    }\\n\\n    /**\\n     * @notice Payer supplies assets into the market and receiver receives vTokens in exchange\\n     * @dev Assumes interest has already been accrued up to the current block\\n     * @param payer The address of the account which is paying the underlying token\\n     * @param receiver The address of the account which is receiving vToken\\n     * @param mintAmount The amount of the underlying asset to supply\\n     * @return (uint, uint) An error code (0=success, otherwise a failure, see ErrorReporter.sol), and the actual mint amount.\\n     */\\n    function mintBehalfFresh(address payer, address receiver, uint mintAmount) internal returns (uint, uint) {\\n        ensureNonZeroAddress(receiver);\\n        /* Fail if mint not allowed */\\n        uint allowed = comptroller.mintAllowed(address(this), receiver, mintAmount);\\n        if (allowed != 0) {\\n            return (failOpaque(Error.COMPTROLLER_REJECTION, FailureInfo.MINT_COMPTROLLER_REJECTION, allowed), 0);\\n        }\\n\\n        /* Verify market's block number equals current block number */\\n        if (accrualBlockNumber != block.number) {\\n            return (fail(Error.MARKET_NOT_FRESH, FailureInfo.MINT_FRESHNESS_CHECK), 0);\\n        }\\n\\n        MintLocalVars memory vars;\\n\\n        (vars.mathErr, vars.exchangeRateMantissa) = exchangeRateStoredInternal();\\n        if (vars.mathErr != MathError.NO_ERROR) {\\n            return (failOpaque(Error.MATH_ERROR, FailureInfo.MINT_EXCHANGE_RATE_READ_FAILED, uint(vars.mathErr)), 0);\\n        }\\n\\n        /////////////////////////\\n        // EFFECTS & INTERACTIONS\\n        // (No safe failures beyond this point)\\n\\n        /*\\n         *  We call `doTransferIn` for the payer and the mintAmount.\\n         *  Note: The vToken must handle variations between BEP-20 and BNB underlying.\\n         *  `doTransferIn` reverts if anything goes wrong, since we can't be sure if\\n         *  side-effects occurred. The function returns the amount actually transferred,\\n         *  in case of a fee. On success, the vToken holds an additional `actualMintAmount`\\n         *  of cash.\\n         */\\n        vars.actualMintAmount = doTransferIn(payer, mintAmount);\\n\\n        /*\\n         * We get the current exchange rate and calculate the number of vTokens to be minted:\\n         *  mintTokens = actualMintAmount / exchangeRate\\n         */\\n\\n        (vars.mathErr, vars.mintTokens) = divScalarByExpTruncate(\\n            vars.actualMintAmount,\\n            Exp({ mantissa: vars.exchangeRateMantissa })\\n        );\\n        ensureNoMathError(vars.mathErr);\\n\\n        /*\\n         * We calculate the new total supply of vTokens and receiver token balance, checking for overflow:\\n         *  totalSupplyNew = totalSupply + mintTokens\\n         *  accountTokensNew = accountTokens[receiver] + mintTokens\\n         */\\n        (vars.mathErr, vars.totalSupplyNew) = addUInt(totalSupply, vars.mintTokens);\\n        ensureNoMathError(vars.mathErr);\\n\\n        (vars.mathErr, vars.accountTokensNew) = addUInt(accountTokens[receiver], vars.mintTokens);\\n        ensureNoMathError(vars.mathErr);\\n\\n        /* We write previously calculated values into storage */\\n        totalSupply = vars.totalSupplyNew;\\n        accountTokens[receiver] = vars.accountTokensNew;\\n\\n        /* We emit a MintBehalf event, and a Transfer event */\\n        emit MintBehalf(payer, receiver, vars.actualMintAmount, vars.mintTokens, vars.accountTokensNew);\\n        emit Transfer(address(this), receiver, vars.mintTokens);\\n\\n        /* We call the defense and prime accrue interest hook */\\n        comptroller.mintVerify(address(this), receiver, vars.actualMintAmount, vars.mintTokens);\\n\\n        return (uint(Error.NO_ERROR), vars.actualMintAmount);\\n    }\\n\\n    /**\\n     * @notice Redeemer redeems vTokens in exchange for the underlying assets, transferred to the receiver. Redeemer and receiver can be the same\\n     *   address, or different addresses if the receiver was previously approved by the redeemer as a valid delegate (see MarketFacet.updateDelegate)\\n     * @dev Accrues interest whether or not the operation succeeds, unless reverted\\n     * @param redeemer The address of the account which is redeeming the tokens\\n     * @param receiver The receiver of the tokens\\n     * @param redeemTokens The number of vTokens to redeem into underlying\\n     * @return uint Returns 0 on success, otherwise returns a failure code (see ErrorReporter.sol for details).\\n     */\\n    function redeemInternal(\\n        address redeemer,\\n        address payable receiver,\\n        uint redeemTokens\\n    ) internal nonReentrant returns (uint) {\\n        checkAccrueInterest(FailureInfo.REDEEM_ACCRUE_INTEREST_FAILED);\\n\\n        // redeemFresh emits redeem-specific logs on errors, so we don't need to\\n        return redeemFresh(redeemer, receiver, redeemTokens, 0);\\n    }\\n\\n    /**\\n     * @notice Sender redeems underlying assets on behalf of some other address. This function is only available\\n     *   for senders, explicitly marked as delegates of the supplier using `comptroller.updateDelegate`\\n     * @dev Accrues interest whether or not the operation succeeds, unless reverted\\n     * @param redeemer The address of the account which is redeeming the tokens\\n     * @param receiver The receiver of the tokens, if called by a delegate\\n     * @param redeemAmount The amount of underlying to receive from redeeming vTokens\\n     * @return uint Returns 0 on success, otherwise returns a failure code (see ErrorReporter.sol for details).\\n     */\\n    function redeemUnderlyingInternal(\\n        address redeemer,\\n        address payable receiver,\\n        uint redeemAmount\\n    ) internal nonReentrant returns (uint) {\\n        checkAccrueInterest(FailureInfo.REDEEM_ACCRUE_INTEREST_FAILED);\\n\\n        // redeemFresh emits redeem-specific logs on errors, so we don't need to\\n        return redeemFresh(redeemer, receiver, 0, redeemAmount);\\n    }\\n\\n    /**\\n     * @notice Redeemer redeems vTokens in exchange for the underlying assets, transferred to the receiver. Redeemer and receiver can be the same\\n     *   address, or different addresses if the receiver was previously approved by the redeemer as a valid delegate (see MarketFacet.updateDelegate)\\n     * @dev Assumes interest has already been accrued up to the current block\\n     * @param redeemer The address of the account which is redeeming the tokens\\n     * @param receiver The receiver of the tokens\\n     * @param redeemTokensIn The number of vTokens to redeem into underlying (only one of redeemTokensIn or redeemAmountIn may be non-zero)\\n     * @param redeemAmountIn The number of underlying tokens to receive from redeeming vTokens (only one of redeemTokensIn or redeemAmountIn may be non-zero)\\n     * @return uint Returns 0 on success, otherwise returns a failure code (see ErrorReporter.sol for details).\\n     */\\n    // solhint-disable-next-line code-complexity\\n    function redeemFresh(\\n        address redeemer,\\n        address payable receiver,\\n        uint redeemTokensIn,\\n        uint redeemAmountIn\\n    ) internal returns (uint) {\\n        require(redeemTokensIn == 0 || redeemAmountIn == 0, \\\"one of redeemTokensIn or redeemAmountIn must be zero\\\");\\n\\n        RedeemLocalVars memory vars;\\n\\n        /* exchangeRate = invoke Exchange Rate Stored() */\\n        (vars.mathErr, vars.exchangeRateMantissa) = exchangeRateStoredInternal();\\n        ensureNoMathError(vars.mathErr);\\n\\n        /* If redeemTokensIn > 0: */\\n        if (redeemTokensIn > 0) {\\n            /*\\n             * We calculate the exchange rate and the amount of underlying to be redeemed:\\n             *  redeemTokens = redeemTokensIn\\n             *  redeemAmount = redeemTokensIn x exchangeRateCurrent\\n             */\\n            vars.redeemTokens = redeemTokensIn;\\n\\n            (vars.mathErr, vars.redeemAmount) = mulScalarTruncate(\\n                Exp({ mantissa: vars.exchangeRateMantissa }),\\n                redeemTokensIn\\n            );\\n            ensureNoMathError(vars.mathErr);\\n        } else {\\n            /*\\n             * We get the current exchange rate and calculate the amount to be redeemed:\\n             *  redeemTokens = redeemAmountIn / exchangeRate\\n             *  redeemAmount = redeemAmountIn\\n             */\\n\\n            (vars.mathErr, vars.redeemTokens) = divScalarByExpTruncate(\\n                redeemAmountIn,\\n                Exp({ mantissa: vars.exchangeRateMantissa })\\n            );\\n            ensureNoMathError(vars.mathErr);\\n\\n            vars.redeemAmount = redeemAmountIn;\\n        }\\n\\n        /* Fail if redeem not allowed */\\n        uint allowed = comptroller.redeemAllowed(address(this), redeemer, vars.redeemTokens);\\n        if (allowed != 0) {\\n            return failOpaque(Error.COMPTROLLER_REJECTION, FailureInfo.REDEEM_COMPTROLLER_REJECTION, allowed);\\n        }\\n\\n        /* Verify market's block number equals current block number */\\n        if (accrualBlockNumber != block.number) {\\n            return fail(Error.MARKET_NOT_FRESH, FailureInfo.REDEEM_FRESHNESS_CHECK);\\n        }\\n\\n        /*\\n         * We calculate the new total supply and redeemer balance, checking for underflow:\\n         *  totalSupplyNew = totalSupply - redeemTokens\\n         *  accountTokensNew = accountTokens[redeemer] - redeemTokens\\n         */\\n        (vars.mathErr, vars.totalSupplyNew) = subUInt(totalSupply, vars.redeemTokens);\\n        ensureNoMathError(vars.mathErr);\\n\\n        (vars.mathErr, vars.accountTokensNew) = subUInt(accountTokens[redeemer], vars.redeemTokens);\\n        ensureNoMathError(vars.mathErr);\\n\\n        /* Fail gracefully if protocol has insufficient cash */\\n        if (getCashPrior() < vars.redeemAmount) {\\n            return fail(Error.TOKEN_INSUFFICIENT_CASH, FailureInfo.REDEEM_CASH_NOT_AVAILABLE);\\n        }\\n\\n        /////////////////////////\\n        // EFFECTS & INTERACTIONS\\n        // (No safe failures beyond this point)\\n\\n        /* We write previously calculated values into storage */\\n        totalSupply = vars.totalSupplyNew;\\n        accountTokens[redeemer] = vars.accountTokensNew;\\n\\n        /*\\n         * We invoke doTransferOut for the receiver and the redeemAmount.\\n         *  Note: The vToken must handle variations between BEP-20 and BNB underlying.\\n         *  On success, the vToken has redeemAmount less of cash.\\n         *  doTransferOut reverts if anything goes wrong, since we can't be sure if side effects occurred.\\n         */\\n\\n        uint feeAmount;\\n        uint remainedAmount;\\n        if (IComptroller(address(comptroller)).treasuryPercent() != 0) {\\n            (vars.mathErr, feeAmount) = mulUInt(\\n                vars.redeemAmount,\\n                IComptroller(address(comptroller)).treasuryPercent()\\n            );\\n            ensureNoMathError(vars.mathErr);\\n\\n            (vars.mathErr, feeAmount) = divUInt(feeAmount, 1e18);\\n            ensureNoMathError(vars.mathErr);\\n\\n            (vars.mathErr, remainedAmount) = subUInt(vars.redeemAmount, feeAmount);\\n            ensureNoMathError(vars.mathErr);\\n\\n            address payable treasuryAddress = payable(IComptroller(address(comptroller)).treasuryAddress());\\n            doTransferOut(treasuryAddress, feeAmount);\\n\\n            emit RedeemFee(redeemer, feeAmount, vars.redeemTokens);\\n        } else {\\n            remainedAmount = vars.redeemAmount;\\n        }\\n\\n        doTransferOut(receiver, remainedAmount);\\n\\n        /* We emit a Transfer event, and a Redeem event */\\n        emit Transfer(redeemer, address(this), vars.redeemTokens);\\n        emit Redeem(redeemer, remainedAmount, vars.redeemTokens, vars.accountTokensNew);\\n\\n        /* We call the defense and prime accrue interest hook */\\n        comptroller.redeemVerify(address(this), redeemer, vars.redeemAmount, vars.redeemTokens);\\n\\n        return uint(Error.NO_ERROR);\\n    }\\n\\n    /**\\n     * @notice Receiver gets the borrow on behalf of the borrower address\\n     * @param borrower The borrower, on behalf of whom to borrow\\n     * @param receiver The account that would receive the funds (can be the same as the borrower)\\n     * @param borrowAmount The amount of the underlying asset to borrow\\n     * @return uint Returns 0 on success, otherwise returns a failure code (see ErrorReporter.sol for details).\\n     */\\n    function borrowInternal(\\n        address borrower,\\n        address payable receiver,\\n        uint borrowAmount\\n    ) internal nonReentrant returns (uint) {\\n        checkAccrueInterest(FailureInfo.BORROW_ACCRUE_INTEREST_FAILED);\\n\\n        // borrowFresh emits borrow-specific logs on errors, so we don't need to\\n        return borrowFresh(borrower, receiver, borrowAmount, true);\\n    }\\n\\n    /**\\n     * @notice Receiver gets the borrow on behalf of the borrower address, controls whether to do the transfer\\n     * @dev Before calling this function, ensure that the interest has been accrued\\n     * @param borrower The borrower, on behalf of whom to borrow\\n     * @param receiver The account that would receive the funds (can be the same as the borrower)\\n     * @param borrowAmount The amount of the underlying asset to borrow\\n     * @param shouldTransfer Whether to call doTransferOut for the receiver\\n     * @return uint Returns 0 on success, otherwise revert (see ErrorReporter.sol for details).\\n     */\\n    function borrowFresh(\\n        address borrower,\\n        address payable receiver,\\n        uint borrowAmount,\\n        bool shouldTransfer\\n    ) internal returns (uint) {\\n        /* Revert if borrow not allowed */\\n        uint allowed = comptroller.borrowAllowed(address(this), borrower, borrowAmount);\\n\\n        if (allowed != 0) {\\n            return failOpaque(Error.COMPTROLLER_REJECTION, FailureInfo.BORROW_COMPTROLLER_REJECTION, allowed);\\n        }\\n\\n        /* Verify market's block number equals current block number */\\n        if (accrualBlockNumber != block.number) {\\n            return fail(Error.MARKET_NOT_FRESH, FailureInfo.BORROW_FRESHNESS_CHECK);\\n        }\\n\\n        /* Revert if protocol has insufficient underlying cash */\\n        if (getCashPrior() < borrowAmount) {\\n            return fail(Error.TOKEN_INSUFFICIENT_CASH, FailureInfo.BORROW_CASH_NOT_AVAILABLE);\\n        }\\n\\n        BorrowLocalVars memory vars;\\n\\n        /*\\n         * We calculate the new borrower and total borrow balances, failing on overflow:\\n         *  accountBorrowsNew = accountBorrows + borrowAmount\\n         *  totalBorrowsNew = totalBorrows + borrowAmount\\n         */\\n        (vars.mathErr, vars.accountBorrows) = borrowBalanceStoredInternal(borrower);\\n        ensureNoMathError(vars.mathErr);\\n\\n        (vars.mathErr, vars.accountBorrowsNew) = addUInt(vars.accountBorrows, borrowAmount);\\n        ensureNoMathError(vars.mathErr);\\n\\n        (vars.mathErr, vars.totalBorrowsNew) = addUInt(totalBorrows, borrowAmount);\\n        ensureNoMathError(vars.mathErr);\\n\\n        /////////////////////////\\n        // EFFECTS & INTERACTIONS\\n        // (No safe failures beyond this point)\\n\\n        /* We write the previously calculated values into storage */\\n        accountBorrows[borrower].principal = vars.accountBorrowsNew;\\n        accountBorrows[borrower].interestIndex = borrowIndex;\\n        totalBorrows = vars.totalBorrowsNew;\\n\\n        if (shouldTransfer) {\\n            /*\\n             * We invoke doTransferOut for the receiver and the borrowAmount.\\n             *  Note: The vToken must handle variations between BEP-20 and BNB underlying.\\n             *  On success, the vToken borrowAmount less of cash.\\n             *  doTransferOut reverts if anything goes wrong, since we can't be sure if side effects occurred.\\n             */\\n            doTransferOut(receiver, borrowAmount);\\n        }\\n\\n        /* We emit a Borrow event */\\n        emit Borrow(borrower, borrowAmount, vars.accountBorrowsNew, vars.totalBorrowsNew);\\n\\n        /* We call the defense and prime accrue interest hook */\\n        comptroller.borrowVerify(address(this), borrower, borrowAmount);\\n\\n        return uint(Error.NO_ERROR);\\n    }\\n\\n    /**\\n     * @notice Sender repays their own borrow\\n     * @param repayAmount The amount to repay\\n     * @return (uint, uint) An error code (0=success, otherwise a failure, see ErrorReporter.sol), and the actual repayment amount.\\n     */\\n    function repayBorrowInternal(uint repayAmount) internal nonReentrant returns (uint, uint) {\\n        checkAccrueInterest(FailureInfo.REPAY_BORROW_ACCRUE_INTEREST_FAILED);\\n\\n        // repayBorrowFresh emits repay-borrow-specific logs on errors, so we don't need to\\n        return repayBorrowFresh(msg.sender, msg.sender, repayAmount);\\n    }\\n\\n    /**\\n     * @notice Sender repays a borrow belonging to another borrowing account\\n     * @param borrower The account with the debt being payed off\\n     * @param repayAmount The amount to repay\\n     * @return (uint, uint) An error code (0=success, otherwise a failure, see ErrorReporter.sol), and the actual repayment amount.\\n     */\\n    function repayBorrowBehalfInternal(address borrower, uint repayAmount) internal nonReentrant returns (uint, uint) {\\n        checkAccrueInterest(FailureInfo.REPAY_BEHALF_ACCRUE_INTEREST_FAILED);\\n\\n        // repayBorrowFresh emits repay-borrow-specific logs on errors, so we don't need to\\n        return repayBorrowFresh(msg.sender, borrower, repayAmount);\\n    }\\n\\n    /**\\n     * @notice Borrows are repaid by another user (possibly the borrower).\\n     * @param payer The account paying off the borrow\\n     * @param borrower The account with the debt being payed off\\n     * @param repayAmount The amount of undelrying tokens being returned\\n     * @return (uint, uint) An error code (0=success, otherwise a failure, see ErrorReporter.sol), and the actual repayment amount.\\n     */\\n    function repayBorrowFresh(address payer, address borrower, uint repayAmount) internal returns (uint, uint) {\\n        /* Fail if repayBorrow not allowed */\\n        uint allowed = comptroller.repayBorrowAllowed(address(this), payer, borrower, repayAmount);\\n        if (allowed != 0) {\\n            return (\\n                failOpaque(Error.COMPTROLLER_REJECTION, FailureInfo.REPAY_BORROW_COMPTROLLER_REJECTION, allowed),\\n                0\\n            );\\n        }\\n\\n        /* Verify market's block number equals current block number */\\n        if (accrualBlockNumber != block.number) {\\n            return (fail(Error.MARKET_NOT_FRESH, FailureInfo.REPAY_BORROW_FRESHNESS_CHECK), 0);\\n        }\\n\\n        RepayBorrowLocalVars memory vars;\\n\\n        /* We remember the original borrowerIndex for verification purposes */\\n        vars.borrowerIndex = accountBorrows[borrower].interestIndex;\\n\\n        /* We fetch the amount the borrower owes, with accumulated interest */\\n        (vars.mathErr, vars.accountBorrows) = borrowBalanceStoredInternal(borrower);\\n        ensureNoMathError(vars.mathErr);\\n\\n        /* If repayAmount == type(uint256).max, repayAmount = accountBorrows */\\n        if (repayAmount == type(uint256).max) {\\n            vars.repayAmount = vars.accountBorrows;\\n        } else {\\n            vars.repayAmount = repayAmount;\\n        }\\n\\n        /////////////////////////\\n        // EFFECTS & INTERACTIONS\\n        // (No safe failures beyond this point)\\n\\n        /*\\n         * We call doTransferIn for the payer and the repayAmount\\n         *  Note: The vToken must handle variations between BEP-20 and BNB underlying.\\n         *  On success, the vToken holds an additional repayAmount of cash.\\n         *  doTransferIn reverts if anything goes wrong, since we can't be sure if side effects occurred.\\n         *   it returns the amount actually transferred, in case of a fee.\\n         */\\n        vars.actualRepayAmount = doTransferIn(payer, vars.repayAmount);\\n\\n        /*\\n         * We calculate the new borrower and total borrow balances, failing on underflow:\\n         *  accountBorrowsNew = accountBorrows - actualRepayAmount\\n         *  totalBorrowsNew = totalBorrows - actualRepayAmount\\n         */\\n        (vars.mathErr, vars.accountBorrowsNew) = subUInt(vars.accountBorrows, vars.actualRepayAmount);\\n        ensureNoMathError(vars.mathErr);\\n\\n        (vars.mathErr, vars.totalBorrowsNew) = subUInt(totalBorrows, vars.actualRepayAmount);\\n        ensureNoMathError(vars.mathErr);\\n\\n        /* We write the previously calculated values into storage */\\n        accountBorrows[borrower].principal = vars.accountBorrowsNew;\\n        accountBorrows[borrower].interestIndex = borrowIndex;\\n        totalBorrows = vars.totalBorrowsNew;\\n\\n        /* We emit a RepayBorrow event */\\n        emit RepayBorrow(payer, borrower, vars.actualRepayAmount, vars.accountBorrowsNew, vars.totalBorrowsNew);\\n\\n        /* We call the defense and prime accrue interest hook */\\n        comptroller.repayBorrowVerify(address(this), payer, borrower, vars.actualRepayAmount, vars.borrowerIndex);\\n\\n        return (uint(Error.NO_ERROR), vars.actualRepayAmount);\\n    }\\n\\n    /**\\n     * @notice The sender liquidates the borrowers collateral.\\n     *  The collateral seized is transferred to the liquidator.\\n     * @param borrower The borrower of this vToken to be liquidated\\n     * @param vTokenCollateral The market in which to seize collateral from the borrower\\n     * @param repayAmount The amount of the underlying borrowed asset to repay\\n     * @return (uint, uint) An error code (0=success, otherwise a failure, see ErrorReporter.sol), and the actual repayment amount.\\n     */\\n    function liquidateBorrowInternal(\\n        address borrower,\\n        uint repayAmount,\\n        VTokenInterface vTokenCollateral\\n    ) internal nonReentrant returns (uint, uint) {\\n        checkAccrueInterest(FailureInfo.LIQUIDATE_ACCRUE_BORROW_INTEREST_FAILED);\\n\\n        uint error = vTokenCollateral.accrueInterest();\\n        if (error != uint(Error.NO_ERROR)) {\\n            // accrueInterest emits logs on errors, but we still want to log the fact that an attempted liquidation failed\\n            return (fail(Error(error), FailureInfo.LIQUIDATE_ACCRUE_COLLATERAL_INTEREST_FAILED), 0);\\n        }\\n\\n        // liquidateBorrowFresh emits borrow-specific logs on errors, so we don't need to\\n        return liquidateBorrowFresh(msg.sender, borrower, repayAmount, vTokenCollateral);\\n    }\\n\\n    /**\\n     * @notice The liquidator liquidates the borrowers collateral.\\n     *  The collateral seized is transferred to the liquidator.\\n     * @param borrower The borrower of this vToken to be liquidated\\n     * @param liquidator The address repaying the borrow and seizing collateral\\n     * @param vTokenCollateral The market in which to seize collateral from the borrower\\n     * @param repayAmount The amount of the underlying borrowed asset to repay\\n     * @return (uint, uint) An error code (0=success, otherwise a failure, see ErrorReporter.sol), and the actual repayment amount.\\n     */\\n    // solhint-disable-next-line code-complexity\\n    function liquidateBorrowFresh(\\n        address liquidator,\\n        address borrower,\\n        uint repayAmount,\\n        VTokenInterface vTokenCollateral\\n    ) internal returns (uint, uint) {\\n        /* Fail if liquidate not allowed */\\n        uint allowed = comptroller.liquidateBorrowAllowed(\\n            address(this),\\n            address(vTokenCollateral),\\n            liquidator,\\n            borrower,\\n            repayAmount\\n        );\\n        if (allowed != 0) {\\n            return (failOpaque(Error.COMPTROLLER_REJECTION, FailureInfo.LIQUIDATE_COMPTROLLER_REJECTION, allowed), 0);\\n        }\\n\\n        /* Verify market's block number equals current block number */\\n        if (accrualBlockNumber != block.number) {\\n            return (fail(Error.MARKET_NOT_FRESH, FailureInfo.LIQUIDATE_FRESHNESS_CHECK), 0);\\n        }\\n\\n        /* Verify vTokenCollateral market's block number equals current block number */\\n        if (vTokenCollateral.accrualBlockNumber() != block.number) {\\n            return (fail(Error.MARKET_NOT_FRESH, FailureInfo.LIQUIDATE_COLLATERAL_FRESHNESS_CHECK), 0);\\n        }\\n\\n        /* Fail if borrower = liquidator */\\n        if (borrower == liquidator) {\\n            return (fail(Error.INVALID_ACCOUNT_PAIR, FailureInfo.LIQUIDATE_LIQUIDATOR_IS_BORROWER), 0);\\n        }\\n\\n        /* Fail if repayAmount = 0 */\\n        if (repayAmount == 0) {\\n            return (fail(Error.INVALID_CLOSE_AMOUNT_REQUESTED, FailureInfo.LIQUIDATE_CLOSE_AMOUNT_IS_ZERO), 0);\\n        }\\n\\n        /* Fail if repayAmount = type(uint256).max */\\n        if (repayAmount == type(uint256).max) {\\n            return (fail(Error.INVALID_CLOSE_AMOUNT_REQUESTED, FailureInfo.LIQUIDATE_CLOSE_AMOUNT_IS_UINT_MAX), 0);\\n        }\\n\\n        /* Fail if repayBorrow fails */\\n        uint err;\\n        uint actualRepayAmount;\\n        (err, actualRepayAmount) = repayBorrowFresh(liquidator, borrower, repayAmount);\\n        if (err != uint(Error.NO_ERROR)) {\\n            return (fail(Error(err), FailureInfo.LIQUIDATE_REPAY_BORROW_FRESH_FAILED), 0);\\n        }\\n\\n        /////////////////////////\\n        // EFFECTS & INTERACTIONS\\n        // (No safe failures beyond this point)\\n\\n        /* We calculate the number of collateral tokens that will be seized */\\n        (, uint seizeTokens) = comptroller.liquidateCalculateSeizeTokens(\\n            borrower,\\n            address(this),\\n            address(vTokenCollateral),\\n            actualRepayAmount\\n        );\\n\\n        require(\\n            (err == uint(Error.NO_ERROR)) && (vTokenCollateral.balanceOf(borrower) >= seizeTokens),\\n            \\\"LIQUIDATE_COMPTROLLER_CALCULATE_AMOUNT_SEIZE_FAILED or LIQUIDATE_SEIZE_TOO_MUCH\\\"\\n        );\\n\\n        // If this is also the collateral, run seizeInternal to avoid re-entrancy, otherwise make an external call\\n        if (address(vTokenCollateral) == address(this)) {\\n            err = seizeInternal(address(this), liquidator, borrower, seizeTokens);\\n        } else {\\n            err = vTokenCollateral.seize(liquidator, borrower, seizeTokens);\\n        }\\n\\n        /* Revert if seize tokens fails (since we cannot be sure of side effects) */\\n        require(err == uint(Error.NO_ERROR), \\\"token seizure failed\\\");\\n\\n        /* We emit a LiquidateBorrow event */\\n        emit LiquidateBorrow(liquidator, borrower, actualRepayAmount, address(vTokenCollateral), seizeTokens);\\n\\n        /* We call the defense and prime accrue interest hook */\\n        comptroller.liquidateBorrowVerify(\\n            address(this),\\n            address(vTokenCollateral),\\n            liquidator,\\n            borrower,\\n            actualRepayAmount,\\n            seizeTokens\\n        );\\n\\n        return (uint(Error.NO_ERROR), actualRepayAmount);\\n    }\\n\\n    /**\\n     * @notice Transfers collateral tokens (this market) to the liquidator.\\n     * @dev Called only during an in-kind liquidation, or by liquidateBorrow during the liquidation of another vToken.\\n     *  Its absolutely critical to use msg.sender as the seizer vToken and not a parameter.\\n     * @param seizerToken The contract seizing the collateral (i.e. borrowed vToken)\\n     * @param liquidator The account receiving seized collateral\\n     * @param borrower The account having collateral seized\\n     * @param seizeTokens The number of vTokens to seize\\n     * @return uint Returns 0 on success, otherwise returns a failure code (see ErrorReporter.sol for details).\\n     */\\n    function seizeInternal(\\n        address seizerToken,\\n        address liquidator,\\n        address borrower,\\n        uint seizeTokens\\n    ) internal returns (uint) {\\n        /* Fail if seize not allowed */\\n        uint allowed = comptroller.seizeAllowed(address(this), seizerToken, liquidator, borrower, seizeTokens);\\n        if (allowed != 0) {\\n            return failOpaque(Error.COMPTROLLER_REJECTION, FailureInfo.LIQUIDATE_SEIZE_COMPTROLLER_REJECTION, allowed);\\n        }\\n\\n        /* Fail if borrower = liquidator */\\n        if (borrower == liquidator) {\\n            return fail(Error.INVALID_ACCOUNT_PAIR, FailureInfo.LIQUIDATE_SEIZE_LIQUIDATOR_IS_BORROWER);\\n        }\\n\\n        MathError mathErr;\\n        uint borrowerTokensNew;\\n        uint liquidatorTokensNew;\\n\\n        /*\\n         * We calculate the new borrower and liquidator token balances, failing on underflow/overflow:\\n         *  borrowerTokensNew = accountTokens[borrower] - seizeTokens\\n         *  liquidatorTokensNew = accountTokens[liquidator] + seizeTokens\\n         */\\n        (mathErr, borrowerTokensNew) = subUInt(accountTokens[borrower], seizeTokens);\\n        if (mathErr != MathError.NO_ERROR) {\\n            return failOpaque(Error.MATH_ERROR, FailureInfo.LIQUIDATE_SEIZE_BALANCE_DECREMENT_FAILED, uint(mathErr));\\n        }\\n\\n        (mathErr, liquidatorTokensNew) = addUInt(accountTokens[liquidator], seizeTokens);\\n        if (mathErr != MathError.NO_ERROR) {\\n            return failOpaque(Error.MATH_ERROR, FailureInfo.LIQUIDATE_SEIZE_BALANCE_INCREMENT_FAILED, uint(mathErr));\\n        }\\n\\n        /////////////////////////\\n        // EFFECTS & INTERACTIONS\\n        // (No safe failures beyond this point)\\n\\n        /* We write the previously calculated values into storage */\\n        accountTokens[borrower] = borrowerTokensNew;\\n        accountTokens[liquidator] = liquidatorTokensNew;\\n\\n        /* Emit a Transfer event */\\n        emit Transfer(borrower, liquidator, seizeTokens);\\n\\n        /* We call the defense and prime accrue interest hook */\\n        comptroller.seizeVerify(address(this), seizerToken, liquidator, borrower, seizeTokens);\\n\\n        return uint(Error.NO_ERROR);\\n    }\\n\\n    /**\\n     * @notice Sets a new reserve factor for the protocol (requires fresh interest accrual)\\n     * @dev Governance function to set a new reserve factor\\n     * @return uint Returns 0 on success, otherwise returns a failure code (see ErrorReporter.sol for details).\\n     */\\n    function _setReserveFactorFresh(uint newReserveFactorMantissa) internal returns (uint) {\\n        // Verify market's block number equals current block number\\n        if (accrualBlockNumber != block.number) {\\n            return fail(Error.MARKET_NOT_FRESH, FailureInfo.SET_RESERVE_FACTOR_FRESH_CHECK);\\n        }\\n\\n        // Check newReserveFactor \\u2264 maxReserveFactor\\n        if (newReserveFactorMantissa > reserveFactorMaxMantissa) {\\n            return fail(Error.BAD_INPUT, FailureInfo.SET_RESERVE_FACTOR_BOUNDS_CHECK);\\n        }\\n\\n        uint oldReserveFactorMantissa = reserveFactorMantissa;\\n        reserveFactorMantissa = newReserveFactorMantissa;\\n\\n        emit NewReserveFactor(oldReserveFactorMantissa, newReserveFactorMantissa);\\n\\n        return uint(Error.NO_ERROR);\\n    }\\n\\n    /**\\n     * @notice Accrues interest and adds reserves by transferring from `msg.sender`\\n     * @param addAmount Amount of addition to reserves\\n     * @return uint Returns 0 on success, otherwise returns a failure code (see ErrorReporter.sol for details).\\n     */\\n    function _addReservesInternal(uint addAmount) internal nonReentrant returns (uint) {\\n        checkAccrueInterest(FailureInfo.ADD_RESERVES_ACCRUE_INTEREST_FAILED);\\n        uint error;\\n\\n        // _addReservesFresh emits reserve-addition-specific logs on errors, so we don't need to.\\n        (error, ) = _addReservesFresh(addAmount);\\n        return error;\\n    }\\n\\n    /**\\n     * @notice Add reserves by transferring from caller\\n     * @dev Requires fresh interest accrual\\n     * @param addAmount Amount of addition to reserves\\n     * @return (uint, uint) An error code (0=success, otherwise a failure (see ErrorReporter.sol for details)) and the actual amount added, net token fees\\n     */\\n    function _addReservesFresh(uint addAmount) internal returns (uint, uint) {\\n        // totalReserves + actualAddAmount\\n        uint totalReservesNew;\\n        uint actualAddAmount;\\n\\n        // We fail gracefully unless market's block number equals current block number\\n        if (accrualBlockNumber != block.number) {\\n            return (fail(Error.MARKET_NOT_FRESH, FailureInfo.ADD_RESERVES_FRESH_CHECK), actualAddAmount);\\n        }\\n\\n        /////////////////////////\\n        // EFFECTS & INTERACTIONS\\n        // (No safe failures beyond this point)\\n\\n        /*\\n         * We call doTransferIn for the caller and the addAmount\\n         *  Note: The vToken must handle variations between BEP-20 and BNB underlying.\\n         *  On success, the vToken holds an additional addAmount of cash.\\n         *  doTransferIn reverts if anything goes wrong, since we can't be sure if side effects occurred.\\n         *  it returns the amount actually transferred, in case of a fee.\\n         */\\n\\n        actualAddAmount = doTransferIn(msg.sender, addAmount);\\n\\n        totalReservesNew = totalReserves + actualAddAmount;\\n\\n        /* Revert on overflow */\\n        require(totalReservesNew >= totalReserves, \\\"add reserves unexpected overflow\\\");\\n\\n        // Store reserves[n+1] = reserves[n] + actualAddAmount\\n        totalReserves = totalReservesNew;\\n\\n        /* Emit NewReserves(admin, actualAddAmount, reserves[n+1]) */\\n        emit ReservesAdded(msg.sender, actualAddAmount, totalReservesNew);\\n\\n        /* Return (NO_ERROR, actualAddAmount) */\\n        return (uint(Error.NO_ERROR), actualAddAmount);\\n    }\\n\\n    /**\\n     * @notice Reduces reserves by transferring to protocol share reserve contract\\n     * @dev Requires fresh interest accrual\\n     * @param reduceAmount Amount of reduction to reserves\\n     * @return uint Returns 0 on success, otherwise returns a failure code (see ErrorReporter.sol for details).\\n     */\\n    function _reduceReservesFresh(uint reduceAmount) internal virtual returns (uint) {\\n        if (reduceAmount == 0) {\\n            return uint(Error.NO_ERROR);\\n        }\\n\\n        // We fail gracefully unless market's block number equals current block number\\n        if (accrualBlockNumber != block.number) {\\n            return fail(Error.MARKET_NOT_FRESH, FailureInfo.REDUCE_RESERVES_FRESH_CHECK);\\n        }\\n\\n        // Fail gracefully if protocol has insufficient underlying cash\\n        if (getCashPrior() < reduceAmount) {\\n            return fail(Error.TOKEN_INSUFFICIENT_CASH, FailureInfo.REDUCE_RESERVES_CASH_NOT_AVAILABLE);\\n        }\\n\\n        // Check reduceAmount \\u2264 reserves[n] (totalReserves)\\n        if (reduceAmount > totalReserves) {\\n            return fail(Error.BAD_INPUT, FailureInfo.REDUCE_RESERVES_VALIDATION);\\n        }\\n\\n        /////////////////////////\\n        // EFFECTS & INTERACTIONS\\n        // (No safe failures beyond this point)\\n\\n        // Store reserves[n+1] = reserves[n] - reduceAmount\\n        totalReserves = totalReserves - reduceAmount;\\n\\n        // doTransferOut reverts if anything goes wrong, since we can't be sure if side effects occurred.\\n        doTransferOut(protocolShareReserve, reduceAmount);\\n\\n        IProtocolShareReserve(protocolShareReserve).updateAssetsState(\\n            address(comptroller),\\n            underlying,\\n            IProtocolShareReserve.IncomeType.SPREAD\\n        );\\n\\n        emit ReservesReduced(protocolShareReserve, reduceAmount, totalReserves);\\n\\n        return uint(Error.NO_ERROR);\\n    }\\n\\n    /**\\n     * @notice updates the interest rate model (requires fresh interest accrual)\\n     * @dev Governance function to update the interest rate model\\n     * @param newInterestRateModel the new interest rate model to use\\n     * @return uint Returns 0 on success, otherwise returns a failure code (see ErrorReporter.sol for details).\\n     */\\n    function _setInterestRateModelFresh(InterestRateModelV8 newInterestRateModel) internal returns (uint) {\\n        // We fail gracefully unless market's block number equals current block number\\n        if (accrualBlockNumber != block.number) {\\n            return fail(Error.MARKET_NOT_FRESH, FailureInfo.SET_INTEREST_RATE_MODEL_FRESH_CHECK);\\n        }\\n\\n        // Ensure invoke newInterestRateModel.isInterestRateModel() returns true\\n        require(newInterestRateModel.isInterestRateModel(), \\\"marker method returned false\\\");\\n\\n        // Emit NewMarketInterestRateModel(oldInterestRateModel, newInterestRateModel)\\n        emit NewMarketInterestRateModel(interestRateModel, newInterestRateModel);\\n\\n        // Set the interest rate model to newInterestRateModel\\n        interestRateModel = newInterestRateModel;\\n\\n        return uint(Error.NO_ERROR);\\n    }\\n\\n    /*** Safe Token ***/\\n\\n    /**\\n     * @dev Performs a transfer in, reverting upon failure. Returns the amount actually transferred to the protocol, in case of a fee.\\n     *  This may revert due to insufficient balance or insufficient allowance.\\n     */\\n    function doTransferIn(address from, uint amount) internal virtual returns (uint);\\n\\n    /**\\n     * @dev Performs a transfer out, ideally returning an explanatory error code upon failure rather than reverting.\\n     *  If caller has not called checked protocol's balance, may revert due to insufficient cash held in the contract.\\n     *  If caller has checked protocol's balance, and verified it is >= amount, this should not revert in normal conditions.\\n     */\\n    function doTransferOut(address payable to, uint amount) internal virtual;\\n\\n    /**\\n     * @notice Return the borrow balance of account based on stored data\\n     * @param account The address whose balance should be calculated\\n     * @return Tuple of error code and the calculated balance or 0 if error code is non-zero\\n     */\\n    function borrowBalanceStoredInternal(address account) internal view returns (MathError, uint) {\\n        /* Note: we do not assert that the market is up to date */\\n        MathError mathErr;\\n        uint principalTimesIndex;\\n        uint result;\\n\\n        /* Get borrowBalance and borrowIndex */\\n        BorrowSnapshot storage borrowSnapshot = accountBorrows[account];\\n\\n        /* If borrowBalance = 0 then borrowIndex is likely also 0.\\n         * Rather than failing the calculation with a division by 0, we immediately return 0 in this case.\\n         */\\n        if (borrowSnapshot.principal == 0) {\\n            return (MathError.NO_ERROR, 0);\\n        }\\n\\n        /* Calculate new borrow balance using the interest index:\\n         *  recentBorrowBalance = borrower.borrowBalance * market.borrowIndex / borrower.borrowIndex\\n         */\\n        (mathErr, principalTimesIndex) = mulUInt(borrowSnapshot.principal, borrowIndex);\\n        if (mathErr != MathError.NO_ERROR) {\\n            return (mathErr, 0);\\n        }\\n\\n        (mathErr, result) = divUInt(principalTimesIndex, borrowSnapshot.interestIndex);\\n        if (mathErr != MathError.NO_ERROR) {\\n            return (mathErr, 0);\\n        }\\n\\n        return (MathError.NO_ERROR, result);\\n    }\\n\\n    /**\\n     * @notice Calculates the exchange rate from the underlying to the vToken\\n     * @dev This function does not accrue interest before calculating the exchange rate\\n     * @return Tuple of error code and calculated exchange rate scaled by 1e18\\n     */\\n    function exchangeRateStoredInternal() internal view virtual returns (MathError, uint) {\\n        uint _totalSupply = totalSupply;\\n        if (_totalSupply == 0) {\\n            /*\\n             * If there are no tokens minted:\\n             *  exchangeRate = initialExchangeRate\\n             */\\n            return (MathError.NO_ERROR, initialExchangeRateMantissa);\\n        } else {\\n            /*\\n             * Otherwise:\\n             *  exchangeRate = (totalCash + totalBorrows + flashLoanAmount - totalReserves) / totalSupply\\n             */\\n            uint totalCash = getCashPrior();\\n            uint cashPlusBorrowsMinusReserves;\\n            Exp memory exchangeRate;\\n            MathError mathErr;\\n\\n            (mathErr, cashPlusBorrowsMinusReserves) = addThenSubUInt(\\n                totalCash + flashLoanAmount,\\n                totalBorrows,\\n                totalReserves\\n            );\\n            if (mathErr != MathError.NO_ERROR) {\\n                return (mathErr, 0);\\n            }\\n\\n            (mathErr, exchangeRate) = getExp(cashPlusBorrowsMinusReserves, _totalSupply);\\n            if (mathErr != MathError.NO_ERROR) {\\n                return (mathErr, 0);\\n            }\\n\\n            return (MathError.NO_ERROR, exchangeRate.mantissa);\\n        }\\n    }\\n\\n    function ensureAllowed(string memory functionSig) private view {\\n        require(\\n            IAccessControlManagerV8(accessControlManager).isAllowedToCall(msg.sender, functionSig),\\n            \\\"access denied\\\"\\n        );\\n    }\\n\\n    function ensureAdmin(address caller_) private view {\\n        require(caller_ == admin, \\\"Unauthorized\\\");\\n    }\\n\\n    function ensureNoMathError(MathError mErr) private pure {\\n        require(mErr == MathError.NO_ERROR, \\\"math error\\\");\\n    }\\n\\n    function ensureNonZeroAddress(address address_) private pure {\\n        require(address_ != address(0), \\\"zero address\\\");\\n    }\\n\\n    function ensureAccrueInterest() private {\\n        require(accrueInterest() == uint(Error.NO_ERROR), \\\"accrue interest failed\\\");\\n    }\\n\\n    function checkAccrueInterest(FailureInfo info) private returns (uint) {\\n        uint error = accrueInterest();\\n        if (error != uint(Error.NO_ERROR)) {\\n            // accrueInterest emits logs on errors, but on top of that we want to log the fact that an attempted reserve factor change failed.\\n            return fail(Error(error), info);\\n        }\\n    }\\n\\n    /*** Safe Token ***/\\n\\n    /**\\n     * @notice Gets balance of this contract in terms of the underlying\\n     * @dev This excludes the value of the current message, if any\\n     * @return The quantity of underlying owned by this contract\\n     */\\n    function getCashPrior() internal view virtual returns (uint);\\n}\\n\",\"keccak256\":\"0x1a4405186e489e4467cf6d7ee72c3fede7626ef574a50d03eb982595fe892b2b\",\"license\":\"BSD-3-Clause\"},\"contracts/Tokens/VTokens/VTokenInterfaces.sol\":{\"content\":\"// SPDX-License-Identifier: BSD-3-Clause\\n\\npragma solidity 0.8.25;\\n\\nimport { ComptrollerInterface } from \\\"../../Comptroller/ComptrollerInterface.sol\\\";\\nimport { InterestRateModelV8 } from \\\"../../InterestRateModels/InterestRateModelV8.sol\\\";\\n\\ncontract VTokenStorageBase {\\n    /**\\n     * @notice Container for borrow balance information\\n     * @member principal Total balance (with accrued interest), after applying the most recent balance-changing action\\n     * @member interestIndex Global borrowIndex as of the most recent balance-changing action\\n     */\\n    struct BorrowSnapshot {\\n        uint principal;\\n        uint interestIndex;\\n    }\\n\\n    /**\\n     * @dev Guard variable for re-entrancy checks\\n     */\\n    bool internal _notEntered;\\n\\n    /**\\n     * @notice EIP-20 token name for this token\\n     */\\n    string public name;\\n\\n    /**\\n     * @notice EIP-20 token symbol for this token\\n     */\\n    string public symbol;\\n\\n    /**\\n     * @notice EIP-20 token decimals for this token\\n     */\\n    uint8 public decimals;\\n\\n    /**\\n     * @notice Maximum borrow rate that can ever be applied (.0005% / block)\\n     */\\n\\n    uint internal constant borrowRateMaxMantissa = 0.0005e16;\\n\\n    /**\\n     * @notice Maximum fraction of interest that can be set aside for reserves\\n     */\\n    uint internal constant reserveFactorMaxMantissa = 1e18;\\n\\n    /**\\n     * @notice Administrator for this contract\\n     */\\n    address payable public admin;\\n\\n    /**\\n     * @notice Pending administrator for this contract\\n     */\\n    address payable public pendingAdmin;\\n\\n    /**\\n     * @notice Contract which oversees inter-vToken operations\\n     */\\n    ComptrollerInterface public comptroller;\\n\\n    /**\\n     * @notice Model which tells what the current interest rate should be\\n     */\\n    InterestRateModelV8 public interestRateModel;\\n\\n    /**\\n     * @notice Initial exchange rate used when minting the first VTokens (used when totalSupply = 0)\\n     */\\n    uint internal initialExchangeRateMantissa;\\n\\n    /**\\n     * @notice Fraction of interest currently set aside for reserves\\n     */\\n    uint public reserveFactorMantissa;\\n\\n    /**\\n     * @notice Block number that interest was last accrued at\\n     */\\n    uint public accrualBlockNumber;\\n\\n    /**\\n     * @notice Accumulator of the total earned interest rate since the opening of the market\\n     */\\n    uint public borrowIndex;\\n\\n    /**\\n     * @notice Total amount of outstanding borrows of the underlying in this market\\n     */\\n    uint public totalBorrows;\\n\\n    /**\\n     * @notice Total amount of reserves of the underlying held in this market\\n     */\\n    uint public totalReserves;\\n\\n    /**\\n     * @notice Total number of tokens in circulation\\n     */\\n    uint public totalSupply;\\n\\n    /**\\n     * @notice Official record of token balances for each account\\n     */\\n    mapping(address => uint) internal accountTokens;\\n\\n    /**\\n     * @notice Approved token transfer amounts on behalf of others\\n     */\\n    mapping(address => mapping(address => uint)) internal transferAllowances;\\n\\n    /**\\n     * @notice Mapping of account addresses to outstanding borrow balances\\n     */\\n    mapping(address => BorrowSnapshot) internal accountBorrows;\\n\\n    /**\\n     * @notice Underlying asset for this VToken\\n     */\\n    address public underlying;\\n\\n    /**\\n     * @notice Implementation address for this contract\\n     */\\n    address public implementation;\\n\\n    /**\\n     * @notice delta block after which reserves will be reduced\\n     */\\n    uint public reduceReservesBlockDelta;\\n\\n    /**\\n     * @notice last block number at which reserves were reduced\\n     */\\n    uint public reduceReservesBlockNumber;\\n\\n    /**\\n     * @notice address of protocol share reserve contract\\n     */\\n    address payable public protocolShareReserve;\\n\\n    /**\\n     * @notice address of accessControlManager\\n     */\\n\\n    address public accessControlManager;\\n}\\n\\ncontract VTokenStorage is VTokenStorageBase {\\n    /**\\n     * @notice flashLoan is enabled for this market or not\\n     */\\n    bool public isFlashLoanEnabled;\\n\\n    /**\\n     * @notice total fee percentage collected on flashLoan (scaled by 1e18)\\n     */\\n    uint256 public flashLoanFeeMantissa;\\n\\n    /**\\n     * @notice fee percentage of flashLoan that goes to protocol (scaled by 1e18)\\n     */\\n    uint256 public flashLoanProtocolShareMantissa;\\n\\n    /**\\n     * @notice Amount of flashLoan taken by the receiver\\n     * @dev This is used to track the amount of flashLoan taken to correctly calculate the exchange rate\\n     *      during the flashLoan process. It is added to the total cash when calculating the exchange rate.\\n     */\\n    uint256 public flashLoanAmount;\\n\\n    /**\\n     * @dev This empty reserved space is put in place to allow future versions to add new\\n     * variables without shifting down storage in the inheritance chain.\\n     * See https://docs.openzeppelin.com/contracts/4.x/upgradeable#storage_gaps\\n     */\\n    uint256[46] private __gap;\\n}\\n\\nabstract contract VTokenInterface is VTokenStorage {\\n    /**\\n     * @notice Indicator that this is a vToken contract (for inspection)\\n     */\\n    bool public constant isVToken = true;\\n\\n    /*** Market Events ***/\\n\\n    /**\\n     * @notice Event emitted when interest is accrued\\n     */\\n    event AccrueInterest(uint cashPrior, uint interestAccumulated, uint borrowIndex, uint totalBorrows);\\n\\n    /**\\n     * @notice Event emitted when tokens are minted\\n     */\\n    event Mint(address minter, uint mintAmount, uint mintTokens, uint256 totalSupply);\\n\\n    /**\\n     * @notice Event emitted when tokens are minted behalf by payer to receiver\\n     */\\n    event MintBehalf(address payer, address receiver, uint mintAmount, uint mintTokens, uint256 totalSupply);\\n\\n    /**\\n     * @notice Event emitted when tokens are redeemed\\n     */\\n    event Redeem(address redeemer, uint redeemAmount, uint redeemTokens, uint256 totalSupply);\\n\\n    /**\\n     * @notice Event emitted when tokens are redeemed and fee is transferred\\n     */\\n    event RedeemFee(address redeemer, uint feeAmount, uint redeemTokens);\\n\\n    /**\\n     * @notice Event emitted when underlying is borrowed\\n     */\\n    event Borrow(address borrower, uint borrowAmount, uint accountBorrows, uint totalBorrows);\\n\\n    /**\\n     * @notice Event emitted when a borrow is repaid\\n     */\\n    event RepayBorrow(address payer, address borrower, uint repayAmount, uint accountBorrows, uint totalBorrows);\\n\\n    /**\\n     * @notice Event emitted when a borrow is liquidated\\n     */\\n    event LiquidateBorrow(\\n        address liquidator,\\n        address borrower,\\n        uint repayAmount,\\n        address vTokenCollateral,\\n        uint seizeTokens\\n    );\\n\\n    /*** Admin Events ***/\\n\\n    /**\\n     * @notice Event emitted when pendingAdmin is changed\\n     */\\n    event NewPendingAdmin(address oldPendingAdmin, address newPendingAdmin);\\n\\n    /**\\n     * @notice Event emitted when pendingAdmin is accepted, which means admin has been updated\\n     */\\n    event NewAdmin(address oldAdmin, address newAdmin);\\n\\n    /**\\n     * @notice Event emitted when comptroller is changed\\n     */\\n    event NewComptroller(ComptrollerInterface oldComptroller, ComptrollerInterface newComptroller);\\n\\n    /**\\n     * @notice Event emitted when interestRateModel is changed\\n     */\\n    event NewMarketInterestRateModel(\\n        InterestRateModelV8 oldInterestRateModel,\\n        InterestRateModelV8 newInterestRateModel\\n    );\\n\\n    /**\\n     * @notice Event emitted when the reserve factor is changed\\n     */\\n    event NewReserveFactor(uint oldReserveFactorMantissa, uint newReserveFactorMantissa);\\n\\n    /**\\n     * @notice Event emitted when the reserves are added\\n     */\\n    event ReservesAdded(address benefactor, uint addAmount, uint newTotalReserves);\\n\\n    /**\\n     * @notice Event emitted when the reserves are reduced\\n     */\\n    event ReservesReduced(address protocolShareReserve, uint reduceAmount, uint newTotalReserves);\\n\\n    /**\\n     * @notice EIP20 Transfer event\\n     */\\n    event Transfer(address indexed from, address indexed to, uint amount);\\n\\n    /**\\n     * @notice EIP20 Approval event\\n     */\\n    event Approval(address indexed owner, address indexed spender, uint amount);\\n\\n    /**\\n     * @notice Event emitted when block delta for reduce reserves get updated\\n     */\\n    event NewReduceReservesBlockDelta(uint256 oldReduceReservesBlockDelta, uint256 newReduceReservesBlockDelta);\\n\\n    /**\\n     * @notice Event emitted when address of ProtocolShareReserve contract get updated\\n     */\\n    event NewProtocolShareReserve(address indexed oldProtocolShareReserve, address indexed newProtocolShareReserve);\\n\\n    /**\\n     * @notice Emitted when access control address is changed by admin\\n     */\\n    event NewAccessControlManager(address oldAccessControlAddress, address newAccessControlAddress);\\n\\n    /**\\n     * @notice Event emitted when flashLoanEnabled status is changed\\n     */\\n    event ToggleFlashLoanEnabled(bool previousStatus, bool newStatus);\\n\\n    /**\\n     * @notice Event emitted when flashLoan is executed\\n     */\\n    event FlashLoanExecuted(address receiver, address underlying, uint256 amount);\\n\\n    /**\\n     * @notice Event emitted when asset is transferred to receiver\\n     */\\n    event TransferOutUnderlying(address asset, address receiver, uint256 amount);\\n\\n    /**\\n     * @notice Event emitted when asset is transferred from sender and verified\\n     */\\n    event TransferInUnderlyingAndVerify(address asset, address sender, uint256 amount);\\n\\n    /**\\n     * @notice Event emitted when flashLoan fee mantissa is updated\\n     */\\n    event FlashLoanFeeUpdated(\\n        uint256 oldFlashLoanFeeMantissa,\\n        uint256 newFlashLoanFeeMantissa,\\n        uint256 oldFlashLoanProtocolShare,\\n        uint256 newFlashLoanProtocolShare\\n    );\\n\\n    // @notice Thrown when comptroller is not valid\\n    error InvalidComptroller();\\n\\n    // @notice Thrown when flashLoan is not enabled\\n    error FlashLoanNotEnabled();\\n\\n    // @notice Thrown when the receiver contract execute operation fails\\n    error ExecuteFlashLoanFailed();\\n\\n    // @notice Thrown when the sender is not authorized to do flash loan\\n    error SenderNotAuthorized(address sender);\\n\\n    // @notice Thrown when the repayment is insufficient\\n    error InsufficientRepayment();\\n\\n    /*** User Interface ***/\\n\\n    function transfer(address dst, uint amount) external virtual returns (bool);\\n\\n    function transferFrom(address src, address dst, uint amount) external virtual returns (bool);\\n\\n    function approve(address spender, uint amount) external virtual returns (bool);\\n\\n    function balanceOfUnderlying(address owner) external virtual returns (uint);\\n\\n    function totalBorrowsCurrent() external virtual returns (uint);\\n\\n    function borrowBalanceCurrent(address account) external virtual returns (uint);\\n\\n    function seize(address liquidator, address borrower, uint seizeTokens) external virtual returns (uint);\\n\\n    /*** Admin Function ***/\\n    function _setPendingAdmin(address payable newPendingAdmin) external virtual returns (uint);\\n\\n    /*** Admin Function ***/\\n    function _acceptAdmin() external virtual returns (uint);\\n\\n    /*** Admin Function ***/\\n    function _setReserveFactor(uint newReserveFactorMantissa) external virtual returns (uint);\\n\\n    /*** Admin Function ***/\\n    function _reduceReserves(uint reduceAmount) external virtual returns (uint);\\n\\n    function borrowDebtPosition(address borrower, uint borrowAmount) external virtual returns (uint);\\n\\n    function balanceOf(address owner) external view virtual returns (uint);\\n\\n    function allowance(address owner, address spender) external view virtual returns (uint);\\n\\n    function getAccountSnapshot(address account) external view virtual returns (uint, uint, uint, uint);\\n\\n    function borrowRatePerBlock() external view virtual returns (uint);\\n\\n    function supplyRatePerBlock() external view virtual returns (uint);\\n\\n    function getCash() external view virtual returns (uint);\\n\\n    function exchangeRateCurrent() public virtual returns (uint);\\n\\n    function accrueInterest() public virtual returns (uint);\\n\\n    /*** Admin Function ***/\\n    function _setComptroller(ComptrollerInterface newComptroller) public virtual returns (uint);\\n\\n    /*** Admin Function ***/\\n    function _setInterestRateModel(InterestRateModelV8 newInterestRateModel) public virtual returns (uint);\\n\\n    function borrowBalanceStored(address account) public view virtual returns (uint);\\n\\n    function exchangeRateStored() public view virtual returns (uint);\\n}\\n\\ninterface VBep20Interface {\\n    /*** User Interface ***/\\n\\n    function mint(uint mintAmount) external returns (uint);\\n\\n    function mintBehalf(address receiver, uint mintAmount) external returns (uint);\\n\\n    function redeem(uint redeemTokens) external returns (uint);\\n\\n    function redeemUnderlying(uint redeemAmount) external returns (uint);\\n\\n    function borrow(uint borrowAmount) external returns (uint);\\n\\n    function repayBorrow(uint repayAmount) external returns (uint);\\n\\n    function repayBorrowBehalf(address borrower, uint repayAmount) external returns (uint);\\n\\n    function liquidateBorrow(\\n        address borrower,\\n        uint repayAmount,\\n        VTokenInterface vTokenCollateral\\n    ) external returns (uint);\\n\\n    /*** Admin Functions ***/\\n\\n    function _addReserves(uint addAmount) external returns (uint);\\n}\\n\\ninterface VDelegatorInterface {\\n    /**\\n     * @notice Emitted when implementation is changed\\n     */\\n    event NewImplementation(address oldImplementation, address newImplementation);\\n\\n    /**\\n     * @notice Called by the admin to update the implementation of the delegator\\n     * @param implementation_ The address of the new implementation for delegation\\n     * @param allowResign Flag to indicate whether to call _resignImplementation on the old implementation\\n     * @param becomeImplementationData The encoded bytes data to be passed to _becomeImplementation\\n     */\\n    function _setImplementation(\\n        address implementation_,\\n        bool allowResign,\\n        bytes memory becomeImplementationData\\n    ) external;\\n}\\n\\ninterface VDelegateInterface {\\n    /**\\n     * @notice Called by the delegator on a delegate to initialize it for duty\\n     * @dev Should revert if any issues arise which make it unfit for delegation\\n     * @param data The encoded bytes data for any initialization\\n     */\\n    function _becomeImplementation(bytes memory data) external;\\n\\n    /**\\n     * @notice Called by the delegator on a delegate to forfeit its responsibility\\n     */\\n    function _resignImplementation() external;\\n}\\n\",\"keccak256\":\"0x4c42b6c080e5cd8334649237e7543cdf408d3f583033585a8fe8bcbf55ce9eb5\",\"license\":\"BSD-3-Clause\"},\"contracts/Utils/CarefulMath.sol\":{\"content\":\"// SPDX-License-Identifier: BSD-3-Clause\\npragma solidity 0.8.25;\\n\\n/**\\n * @title Careful Math\\n * @author Venus\\n * @notice Derived from OpenZeppelin's SafeMath library\\n *         https://github.com/OpenZeppelin/openzeppelin-solidity/blob/master/contracts/math/SafeMath.sol\\n */\\ncontract CarefulMath {\\n    /**\\n     * @dev Possible error codes that we can return\\n     */\\n    enum MathError {\\n        NO_ERROR,\\n        DIVISION_BY_ZERO,\\n        INTEGER_OVERFLOW,\\n        INTEGER_UNDERFLOW\\n    }\\n\\n    /**\\n     * @dev Multiplies two numbers, returns an error on overflow.\\n     */\\n    function mulUInt(uint a, uint b) internal pure returns (MathError, uint) {\\n        if (a == 0) {\\n            return (MathError.NO_ERROR, 0);\\n        }\\n\\n        uint c;\\n        unchecked {\\n            c = a * b;\\n        }\\n\\n        if (c / a != b) {\\n            return (MathError.INTEGER_OVERFLOW, 0);\\n        } else {\\n            return (MathError.NO_ERROR, c);\\n        }\\n    }\\n\\n    /**\\n     * @dev Integer division of two numbers, truncating the quotient.\\n     */\\n    function divUInt(uint a, uint b) internal pure returns (MathError, uint) {\\n        if (b == 0) {\\n            return (MathError.DIVISION_BY_ZERO, 0);\\n        }\\n\\n        return (MathError.NO_ERROR, a / b);\\n    }\\n\\n    /**\\n     * @dev Subtracts two numbers, returns an error on overflow (i.e. if subtrahend is greater than minuend).\\n     */\\n    function subUInt(uint a, uint b) internal pure returns (MathError, uint) {\\n        if (b <= a) {\\n            unchecked {\\n                return (MathError.NO_ERROR, a - b);\\n            }\\n        } else {\\n            return (MathError.INTEGER_UNDERFLOW, 0);\\n        }\\n    }\\n\\n    /**\\n     * @dev Adds two numbers, returns an error on overflow.\\n     */\\n    function addUInt(uint a, uint b) internal pure returns (MathError, uint) {\\n        uint c;\\n        unchecked {\\n            c = a + b;\\n        }\\n\\n        if (c >= a) {\\n            return (MathError.NO_ERROR, c);\\n        } else {\\n            return (MathError.INTEGER_OVERFLOW, 0);\\n        }\\n    }\\n\\n    /**\\n     * @dev add a and b and then subtract c\\n     */\\n    function addThenSubUInt(uint a, uint b, uint c) internal pure returns (MathError, uint) {\\n        (MathError err0, uint sum) = addUInt(a, b);\\n\\n        if (err0 != MathError.NO_ERROR) {\\n            return (err0, 0);\\n        }\\n\\n        return subUInt(sum, c);\\n    }\\n}\\n\",\"keccak256\":\"0xb7ca049dc6f4a31c8994ad5fd2093b9f7f60c21495ff8386c7802ef13d9858a7\",\"license\":\"BSD-3-Clause\"},\"contracts/Utils/ErrorReporter.sol\":{\"content\":\"// SPDX-License-Identifier: BSD-3-Clause\\npragma solidity 0.8.25;\\n\\nimport { WeightFunction } from \\\"../Comptroller/Diamond/interfaces/IFacetBase.sol\\\";\\n\\ncontract ComptrollerErrorReporter {\\n    /// @notice Thrown when You are already in the selected pool.\\n    error AlreadyInSelectedPool();\\n\\n    /// @notice Thrown when One or more of your assets are not compatible with the selected pool.\\n    error IncompatibleBorrowedAssets();\\n\\n    /// @notice Thrown when Switching to this pool would fail the liquidity check or lead to liquidation.\\n    error LiquidityCheckFailed(uint256 errorCode, uint256 shortfall);\\n\\n    /// @notice Thrown when trying to call pool-specific methods on the Core Pool\\n    error InvalidOperationForCorePool();\\n\\n    /// @notice Thrown when input array lengths do not match\\n    error ArrayLengthMismatch();\\n\\n    /// @notice Thrown when market trying to add in a pool is not listed in the core pool\\n    error MarketNotListedInCorePool();\\n\\n    /// @notice Thrown when market is not set in the _poolMarkets mapping\\n    error MarketConfigNotFound();\\n\\n    /// @notice Thrown when borrowing is not allowed in the selected pool for a given market.\\n    error BorrowNotAllowedInPool();\\n\\n    /// @notice Thrown when trying to remove a market that is not listed in the given pool.\\n    error PoolMarketNotFound(uint96 poolId, address vToken);\\n\\n    /// @notice Thrown when a given pool ID does not exist\\n    error PoolDoesNotExist(uint96 poolId);\\n\\n    /// @notice Thrown when the pool label is empty\\n    error EmptyPoolLabel();\\n\\n    /// @notice Thrown when a vToken is already listed in the specified pool\\n    error MarketAlreadyListed(uint96 poolId, address vToken);\\n\\n    /// @notice Thrown when an invalid weighting strategy is provided\\n    error InvalidWeightingStrategy(WeightFunction strategy);\\n\\n    // @notice Thrown when no assets are requested for flash loan\\n    error NoAssetsRequested();\\n\\n    // @notice Thrown when invalid flash loan parameters are provided\\n    error InvalidFlashLoanParams();\\n\\n    // @notice Thrown when flash loan is not enabled on the vToken\\n    error FlashLoanNotEnabled();\\n\\n    // @notice Thrown when the sender is not authorized to use flashloan onBehalfOf\\n    error SenderNotAuthorizedForFlashLoan(address sender);\\n\\n    // @notice Thrown when an invalid mode is provided\\n    error InvalidMode();\\n\\n    // @notice Thrown when executeOperation on the receiver contract fails\\n    error ExecuteFlashLoanFailed();\\n\\n    // @notice Thrown when the requested amount is zero\\n    error InvalidAmount();\\n\\n    // @notice Thrown when failing to create a debt position in mode 1\\n    error FailedToCreateDebtPosition();\\n\\n    /// @notice Thrown when attempting to interact with an inactive pool\\n    error InactivePool(uint96 poolId);\\n\\n    enum Error {\\n        NO_ERROR,\\n        UNAUTHORIZED,\\n        COMPTROLLER_MISMATCH,\\n        INSUFFICIENT_SHORTFALL,\\n        INSUFFICIENT_LIQUIDITY,\\n        INVALID_CLOSE_FACTOR,\\n        INVALID_COLLATERAL_FACTOR,\\n        INVALID_LIQUIDATION_INCENTIVE,\\n        MARKET_NOT_ENTERED, // no longer possible\\n        MARKET_NOT_LISTED,\\n        MARKET_ALREADY_LISTED,\\n        MATH_ERROR,\\n        NONZERO_BORROW_BALANCE,\\n        PRICE_ERROR,\\n        REJECTION,\\n        SNAPSHOT_ERROR,\\n        TOO_MANY_ASSETS,\\n        TOO_MUCH_REPAY,\\n        INSUFFICIENT_BALANCE_FOR_VAI,\\n        MARKET_NOT_COLLATERAL,\\n        INVALID_LIQUIDATION_THRESHOLD\\n    }\\n\\n    enum FailureInfo {\\n        ACCEPT_ADMIN_PENDING_ADMIN_CHECK,\\n        ACCEPT_PENDING_IMPLEMENTATION_ADDRESS_CHECK,\\n        EXIT_MARKET_BALANCE_OWED,\\n        EXIT_MARKET_REJECTION,\\n        SET_CLOSE_FACTOR_OWNER_CHECK,\\n        SET_CLOSE_FACTOR_VALIDATION,\\n        SET_COLLATERAL_FACTOR_OWNER_CHECK,\\n        SET_COLLATERAL_FACTOR_NO_EXISTS,\\n        SET_COLLATERAL_FACTOR_VALIDATION,\\n        SET_COLLATERAL_FACTOR_WITHOUT_PRICE,\\n        SET_IMPLEMENTATION_OWNER_CHECK,\\n        SET_LIQUIDATION_INCENTIVE_OWNER_CHECK,\\n        SET_LIQUIDATION_INCENTIVE_VALIDATION,\\n        SET_MAX_ASSETS_OWNER_CHECK,\\n        SET_PENDING_ADMIN_OWNER_CHECK,\\n        SET_PENDING_IMPLEMENTATION_OWNER_CHECK,\\n        SET_PRICE_ORACLE_OWNER_CHECK,\\n        SUPPORT_MARKET_EXISTS,\\n        SUPPORT_MARKET_OWNER_CHECK,\\n        SET_PAUSE_GUARDIAN_OWNER_CHECK,\\n        SET_VAI_MINT_RATE_CHECK,\\n        SET_VAICONTROLLER_OWNER_CHECK,\\n        SET_MINTED_VAI_REJECTION,\\n        SET_TREASURY_OWNER_CHECK,\\n        UNLIST_MARKET_NOT_LISTED,\\n        SET_LIQUIDATION_THRESHOLD_VALIDATION,\\n        COLLATERAL_FACTOR_GREATER_THAN_LIQUIDATION_THRESHOLD\\n    }\\n\\n    /**\\n     * @dev `error` corresponds to enum Error; `info` corresponds to enum FailureInfo, and `detail` is an arbitrary\\n     * contract-specific code that enables us to report opaque error codes from upgradeable contracts.\\n     **/\\n    event Failure(uint error, uint info, uint detail);\\n\\n    /**\\n     * @dev use this when reporting a known error from the money market or a non-upgradeable collaborator\\n     */\\n    function fail(Error err, FailureInfo info) internal returns (uint) {\\n        emit Failure(uint(err), uint(info), 0);\\n\\n        return uint(err);\\n    }\\n\\n    /**\\n     * @dev use this when reporting an opaque error from an upgradeable collaborator contract\\n     */\\n    function failOpaque(Error err, FailureInfo info, uint opaqueError) internal returns (uint) {\\n        emit Failure(uint(err), uint(info), opaqueError);\\n\\n        return uint(err);\\n    }\\n}\\n\\ncontract TokenErrorReporter {\\n    enum Error {\\n        NO_ERROR,\\n        UNAUTHORIZED,\\n        BAD_INPUT,\\n        COMPTROLLER_REJECTION,\\n        COMPTROLLER_CALCULATION_ERROR,\\n        INTEREST_RATE_MODEL_ERROR,\\n        INVALID_ACCOUNT_PAIR,\\n        INVALID_CLOSE_AMOUNT_REQUESTED,\\n        INVALID_COLLATERAL_FACTOR,\\n        MATH_ERROR,\\n        MARKET_NOT_FRESH,\\n        MARKET_NOT_LISTED,\\n        TOKEN_INSUFFICIENT_ALLOWANCE,\\n        TOKEN_INSUFFICIENT_BALANCE,\\n        TOKEN_INSUFFICIENT_CASH,\\n        TOKEN_TRANSFER_IN_FAILED,\\n        TOKEN_TRANSFER_OUT_FAILED,\\n        TOKEN_PRICE_ERROR\\n    }\\n\\n    /*\\n     * Note: FailureInfo (but not Error) is kept in alphabetical order\\n     *       This is because FailureInfo grows significantly faster, and\\n     *       the order of Error has some meaning, while the order of FailureInfo\\n     *       is entirely arbitrary.\\n     */\\n    enum FailureInfo {\\n        ACCEPT_ADMIN_PENDING_ADMIN_CHECK,\\n        ACCRUE_INTEREST_ACCUMULATED_INTEREST_CALCULATION_FAILED,\\n        ACCRUE_INTEREST_BORROW_RATE_CALCULATION_FAILED,\\n        ACCRUE_INTEREST_NEW_BORROW_INDEX_CALCULATION_FAILED,\\n        ACCRUE_INTEREST_NEW_TOTAL_BORROWS_CALCULATION_FAILED,\\n        ACCRUE_INTEREST_NEW_TOTAL_RESERVES_CALCULATION_FAILED,\\n        ACCRUE_INTEREST_SIMPLE_INTEREST_FACTOR_CALCULATION_FAILED,\\n        BORROW_ACCUMULATED_BALANCE_CALCULATION_FAILED,\\n        BORROW_ACCRUE_INTEREST_FAILED,\\n        BORROW_CASH_NOT_AVAILABLE,\\n        BORROW_FRESHNESS_CHECK,\\n        BORROW_NEW_TOTAL_BALANCE_CALCULATION_FAILED,\\n        BORROW_NEW_ACCOUNT_BORROW_BALANCE_CALCULATION_FAILED,\\n        BORROW_MARKET_NOT_LISTED,\\n        BORROW_COMPTROLLER_REJECTION,\\n        LIQUIDATE_ACCRUE_BORROW_INTEREST_FAILED,\\n        LIQUIDATE_ACCRUE_COLLATERAL_INTEREST_FAILED,\\n        LIQUIDATE_COLLATERAL_FRESHNESS_CHECK,\\n        LIQUIDATE_COMPTROLLER_REJECTION,\\n        LIQUIDATE_COMPTROLLER_CALCULATE_AMOUNT_SEIZE_FAILED,\\n        LIQUIDATE_CLOSE_AMOUNT_IS_UINT_MAX,\\n        LIQUIDATE_CLOSE_AMOUNT_IS_ZERO,\\n        LIQUIDATE_FRESHNESS_CHECK,\\n        LIQUIDATE_LIQUIDATOR_IS_BORROWER,\\n        LIQUIDATE_REPAY_BORROW_FRESH_FAILED,\\n        LIQUIDATE_SEIZE_BALANCE_INCREMENT_FAILED,\\n        LIQUIDATE_SEIZE_BALANCE_DECREMENT_FAILED,\\n        LIQUIDATE_SEIZE_COMPTROLLER_REJECTION,\\n        LIQUIDATE_SEIZE_LIQUIDATOR_IS_BORROWER,\\n        LIQUIDATE_SEIZE_TOO_MUCH,\\n        MINT_ACCRUE_INTEREST_FAILED,\\n        MINT_COMPTROLLER_REJECTION,\\n        MINT_EXCHANGE_CALCULATION_FAILED,\\n        MINT_EXCHANGE_RATE_READ_FAILED,\\n        MINT_FRESHNESS_CHECK,\\n        MINT_NEW_ACCOUNT_BALANCE_CALCULATION_FAILED,\\n        MINT_NEW_TOTAL_SUPPLY_CALCULATION_FAILED,\\n        MINT_TRANSFER_IN_FAILED,\\n        MINT_TRANSFER_IN_NOT_POSSIBLE,\\n        REDEEM_ACCRUE_INTEREST_FAILED,\\n        REDEEM_COMPTROLLER_REJECTION,\\n        REDEEM_CASH_NOT_AVAILABLE,\\n        REDEEM_EXCHANGE_TOKENS_CALCULATION_FAILED,\\n        REDEEM_EXCHANGE_AMOUNT_CALCULATION_FAILED,\\n        REDEEM_EXCHANGE_RATE_READ_FAILED,\\n        REDEEM_FRESHNESS_CHECK,\\n        REDEEM_NEW_ACCOUNT_BALANCE_CALCULATION_FAILED,\\n        REDEEM_NEW_TOTAL_SUPPLY_CALCULATION_FAILED,\\n        REDEEM_TRANSFER_OUT_NOT_POSSIBLE,\\n        REDUCE_RESERVES_ACCRUE_INTEREST_FAILED,\\n        REDUCE_RESERVES_ADMIN_CHECK,\\n        REDUCE_RESERVES_CASH_NOT_AVAILABLE,\\n        REDUCE_RESERVES_FRESH_CHECK,\\n        REDUCE_RESERVES_VALIDATION,\\n        REPAY_BEHALF_ACCRUE_INTEREST_FAILED,\\n        REPAY_BORROW_ACCRUE_INTEREST_FAILED,\\n        REPAY_BORROW_ACCUMULATED_BALANCE_CALCULATION_FAILED,\\n        REPAY_BORROW_COMPTROLLER_REJECTION,\\n        REPAY_BORROW_FRESHNESS_CHECK,\\n        REPAY_BORROW_NEW_ACCOUNT_BORROW_BALANCE_CALCULATION_FAILED,\\n        REPAY_BORROW_NEW_TOTAL_BALANCE_CALCULATION_FAILED,\\n        REPAY_BORROW_TRANSFER_IN_NOT_POSSIBLE,\\n        SET_COLLATERAL_FACTOR_OWNER_CHECK,\\n        SET_COLLATERAL_FACTOR_VALIDATION,\\n        SET_COMPTROLLER_OWNER_CHECK,\\n        SET_INTEREST_RATE_MODEL_ACCRUE_INTEREST_FAILED,\\n        SET_INTEREST_RATE_MODEL_FRESH_CHECK,\\n        SET_INTEREST_RATE_MODEL_OWNER_CHECK,\\n        SET_MAX_ASSETS_OWNER_CHECK,\\n        SET_ORACLE_MARKET_NOT_LISTED,\\n        SET_PENDING_ADMIN_OWNER_CHECK,\\n        SET_RESERVE_FACTOR_ACCRUE_INTEREST_FAILED,\\n        SET_RESERVE_FACTOR_ADMIN_CHECK,\\n        SET_RESERVE_FACTOR_FRESH_CHECK,\\n        SET_RESERVE_FACTOR_BOUNDS_CHECK,\\n        TRANSFER_COMPTROLLER_REJECTION,\\n        TRANSFER_NOT_ALLOWED,\\n        TRANSFER_NOT_ENOUGH,\\n        TRANSFER_TOO_MUCH,\\n        ADD_RESERVES_ACCRUE_INTEREST_FAILED,\\n        ADD_RESERVES_FRESH_CHECK,\\n        ADD_RESERVES_TRANSFER_IN_NOT_POSSIBLE,\\n        TOKEN_GET_UNDERLYING_PRICE_ERROR,\\n        REPAY_VAI_COMPTROLLER_REJECTION,\\n        REPAY_VAI_FRESHNESS_CHECK,\\n        VAI_MINT_EXCHANGE_CALCULATION_FAILED,\\n        SFT_MINT_NEW_ACCOUNT_BALANCE_CALCULATION_FAILED\\n    }\\n\\n    /**\\n     * @dev `error` corresponds to enum Error; `info` corresponds to enum FailureInfo, and `detail` is an arbitrary\\n     * contract-specific code that enables us to report opaque error codes from upgradeable contracts.\\n     **/\\n    event Failure(uint error, uint info, uint detail);\\n\\n    /**\\n     * @dev use this when reporting a known error from the money market or a non-upgradeable collaborator\\n     */\\n    function fail(Error err, FailureInfo info) internal returns (uint) {\\n        emit Failure(uint(err), uint(info), 0);\\n\\n        return uint(err);\\n    }\\n\\n    /**\\n     * @dev use this when reporting an opaque error from an upgradeable collaborator contract\\n     */\\n    function failOpaque(Error err, FailureInfo info, uint opaqueError) internal returns (uint) {\\n        emit Failure(uint(err), uint(info), opaqueError);\\n\\n        return uint(err);\\n    }\\n}\\n\\ncontract VAIControllerErrorReporter {\\n    enum Error {\\n        NO_ERROR,\\n        UNAUTHORIZED, // The sender is not authorized to perform this action.\\n        REJECTION, // The action would violate the comptroller, vaicontroller policy.\\n        SNAPSHOT_ERROR, // The comptroller could not get the account borrows and exchange rate from the market.\\n        PRICE_ERROR, // The comptroller could not obtain a required price of an asset.\\n        MATH_ERROR, // A math calculation error occurred.\\n        INSUFFICIENT_BALANCE_FOR_VAI // Caller does not have sufficient balance to mint VAI.\\n    }\\n\\n    enum FailureInfo {\\n        SET_PENDING_ADMIN_OWNER_CHECK,\\n        SET_PENDING_IMPLEMENTATION_OWNER_CHECK,\\n        SET_COMPTROLLER_OWNER_CHECK,\\n        ACCEPT_ADMIN_PENDING_ADMIN_CHECK,\\n        ACCEPT_PENDING_IMPLEMENTATION_ADDRESS_CHECK,\\n        VAI_MINT_REJECTION,\\n        VAI_BURN_REJECTION,\\n        VAI_LIQUIDATE_ACCRUE_BORROW_INTEREST_FAILED,\\n        VAI_LIQUIDATE_ACCRUE_COLLATERAL_INTEREST_FAILED,\\n        VAI_LIQUIDATE_COLLATERAL_FRESHNESS_CHECK,\\n        VAI_LIQUIDATE_COMPTROLLER_REJECTION,\\n        VAI_LIQUIDATE_COMPTROLLER_CALCULATE_AMOUNT_SEIZE_FAILED,\\n        VAI_LIQUIDATE_CLOSE_AMOUNT_IS_UINT_MAX,\\n        VAI_LIQUIDATE_CLOSE_AMOUNT_IS_ZERO,\\n        VAI_LIQUIDATE_FRESHNESS_CHECK,\\n        VAI_LIQUIDATE_LIQUIDATOR_IS_BORROWER,\\n        VAI_LIQUIDATE_REPAY_BORROW_FRESH_FAILED,\\n        VAI_LIQUIDATE_SEIZE_BALANCE_INCREMENT_FAILED,\\n        VAI_LIQUIDATE_SEIZE_BALANCE_DECREMENT_FAILED,\\n        VAI_LIQUIDATE_SEIZE_COMPTROLLER_REJECTION,\\n        VAI_LIQUIDATE_SEIZE_LIQUIDATOR_IS_BORROWER,\\n        VAI_LIQUIDATE_SEIZE_TOO_MUCH,\\n        MINT_FEE_CALCULATION_FAILED,\\n        SET_TREASURY_OWNER_CHECK\\n    }\\n\\n    /**\\n     * @dev `error` corresponds to enum Error; `info` corresponds to enum FailureInfo, and `detail` is an arbitrary\\n     * contract-specific code that enables us to report opaque error codes from upgradeable contracts.\\n     **/\\n    event Failure(uint error, uint info, uint detail);\\n\\n    /**\\n     * @dev use this when reporting a known error from the money market or a non-upgradeable collaborator\\n     */\\n    function fail(Error err, FailureInfo info) internal returns (uint) {\\n        emit Failure(uint(err), uint(info), 0);\\n\\n        return uint(err);\\n    }\\n\\n    /**\\n     * @dev use this when reporting an opaque error from an upgradeable collaborator contract\\n     */\\n    function failOpaque(Error err, FailureInfo info, uint opaqueError) internal returns (uint) {\\n        emit Failure(uint(err), uint(info), opaqueError);\\n\\n        return uint(err);\\n    }\\n}\\n\",\"keccak256\":\"0x1b802358748c4d29d3197d09212e21aa2d7819a2b7f61ec96538cde027508962\",\"license\":\"BSD-3-Clause\"},\"contracts/Utils/Exponential.sol\":{\"content\":\"// SPDX-License-Identifier: BSD-3-Clause\\npragma solidity 0.8.25;\\n\\nimport { CarefulMath } from \\\"./CarefulMath.sol\\\";\\nimport { ExponentialNoError } from \\\"./ExponentialNoError.sol\\\";\\n\\n/**\\n * @title Exponential module for storing fixed-precision decimals\\n * @author Venus\\n * @notice Exp is a struct which stores decimals with a fixed precision of 18 decimal places.\\n *         Thus, if we wanted to store the 5.1, mantissa would store 5.1e18. That is:\\n *         `Exp({mantissa: 5100000000000000000})`.\\n */\\ncontract Exponential is CarefulMath, ExponentialNoError {\\n    /**\\n     * @dev Creates an exponential from numerator and denominator values.\\n     *      Note: Returns an error if (`num` * 10e18) > MAX_INT,\\n     *            or if `denom` is zero.\\n     */\\n    function getExp(uint num, uint denom) internal pure returns (MathError, Exp memory) {\\n        (MathError err0, uint scaledNumerator) = mulUInt(num, expScale);\\n        if (err0 != MathError.NO_ERROR) {\\n            return (err0, Exp({ mantissa: 0 }));\\n        }\\n\\n        (MathError err1, uint rational) = divUInt(scaledNumerator, denom);\\n        if (err1 != MathError.NO_ERROR) {\\n            return (err1, Exp({ mantissa: 0 }));\\n        }\\n\\n        return (MathError.NO_ERROR, Exp({ mantissa: rational }));\\n    }\\n\\n    /**\\n     * @dev Adds two exponentials, returning a new exponential.\\n     */\\n    function addExp(Exp memory a, Exp memory b) internal pure returns (MathError, Exp memory) {\\n        (MathError error, uint result) = addUInt(a.mantissa, b.mantissa);\\n\\n        return (error, Exp({ mantissa: result }));\\n    }\\n\\n    /**\\n     * @dev Subtracts two exponentials, returning a new exponential.\\n     */\\n    function subExp(Exp memory a, Exp memory b) internal pure returns (MathError, Exp memory) {\\n        (MathError error, uint result) = subUInt(a.mantissa, b.mantissa);\\n\\n        return (error, Exp({ mantissa: result }));\\n    }\\n\\n    /**\\n     * @dev Multiply an Exp by a scalar, returning a new Exp.\\n     */\\n    function mulScalar(Exp memory a, uint scalar) internal pure returns (MathError, Exp memory) {\\n        (MathError err0, uint scaledMantissa) = mulUInt(a.mantissa, scalar);\\n        if (err0 != MathError.NO_ERROR) {\\n            return (err0, Exp({ mantissa: 0 }));\\n        }\\n\\n        return (MathError.NO_ERROR, Exp({ mantissa: scaledMantissa }));\\n    }\\n\\n    /**\\n     * @dev Multiply an Exp by a scalar, then truncate to return an unsigned integer.\\n     */\\n    function mulScalarTruncate(Exp memory a, uint scalar) internal pure returns (MathError, uint) {\\n        (MathError err, Exp memory product) = mulScalar(a, scalar);\\n        if (err != MathError.NO_ERROR) {\\n            return (err, 0);\\n        }\\n\\n        return (MathError.NO_ERROR, truncate(product));\\n    }\\n\\n    /**\\n     * @dev Multiply an Exp by a scalar, truncate, then add an to an unsigned integer, returning an unsigned integer.\\n     */\\n    function mulScalarTruncateAddUInt(Exp memory a, uint scalar, uint addend) internal pure returns (MathError, uint) {\\n        (MathError err, Exp memory product) = mulScalar(a, scalar);\\n        if (err != MathError.NO_ERROR) {\\n            return (err, 0);\\n        }\\n\\n        return addUInt(truncate(product), addend);\\n    }\\n\\n    /**\\n     * @dev Divide an Exp by a scalar, returning a new Exp.\\n     */\\n    function divScalar(Exp memory a, uint scalar) internal pure returns (MathError, Exp memory) {\\n        (MathError err0, uint descaledMantissa) = divUInt(a.mantissa, scalar);\\n        if (err0 != MathError.NO_ERROR) {\\n            return (err0, Exp({ mantissa: 0 }));\\n        }\\n\\n        return (MathError.NO_ERROR, Exp({ mantissa: descaledMantissa }));\\n    }\\n\\n    /**\\n     * @dev Divide a scalar by an Exp, returning a new Exp.\\n     */\\n    function divScalarByExp(uint scalar, Exp memory divisor) internal pure returns (MathError, Exp memory) {\\n        /*\\n          We are doing this as:\\n          getExp(mulUInt(expScale, scalar), divisor.mantissa)\\n\\n          How it works:\\n          Exp = a / b;\\n          Scalar = s;\\n          `s / (a / b)` = `b * s / a` and since for an Exp `a = mantissa, b = expScale`\\n        */\\n        (MathError err0, uint numerator) = mulUInt(expScale, scalar);\\n        if (err0 != MathError.NO_ERROR) {\\n            return (err0, Exp({ mantissa: 0 }));\\n        }\\n        return getExp(numerator, divisor.mantissa);\\n    }\\n\\n    /**\\n     * @dev Divide a scalar by an Exp, then truncate to return an unsigned integer.\\n     */\\n    function divScalarByExpTruncate(uint scalar, Exp memory divisor) internal pure returns (MathError, uint) {\\n        (MathError err, Exp memory fraction) = divScalarByExp(scalar, divisor);\\n        if (err != MathError.NO_ERROR) {\\n            return (err, 0);\\n        }\\n\\n        return (MathError.NO_ERROR, truncate(fraction));\\n    }\\n\\n    /**\\n     * @dev Multiplies two exponentials, returning a new exponential.\\n     */\\n    function mulExp(Exp memory a, Exp memory b) internal pure returns (MathError, Exp memory) {\\n        (MathError err0, uint doubleScaledProduct) = mulUInt(a.mantissa, b.mantissa);\\n        if (err0 != MathError.NO_ERROR) {\\n            return (err0, Exp({ mantissa: 0 }));\\n        }\\n\\n        // We add half the scale before dividing so that we get rounding instead of truncation.\\n        //  See \\\"Listing 6\\\" and text above it at https://accu.org/index.php/journals/1717\\n        // Without this change, a result like 6.6...e-19 will be truncated to 0 instead of being rounded to 1e-18.\\n        (MathError err1, uint doubleScaledProductWithHalfScale) = addUInt(halfExpScale, doubleScaledProduct);\\n        if (err1 != MathError.NO_ERROR) {\\n            return (err1, Exp({ mantissa: 0 }));\\n        }\\n\\n        (MathError err2, uint product) = divUInt(doubleScaledProductWithHalfScale, expScale);\\n        // The only error `div` can return is MathError.DIVISION_BY_ZERO but we control `expScale` and it is not zero.\\n        assert(err2 == MathError.NO_ERROR);\\n\\n        return (MathError.NO_ERROR, Exp({ mantissa: product }));\\n    }\\n\\n    /**\\n     * @dev Multiplies two exponentials given their mantissas, returning a new exponential.\\n     */\\n    function mulExp(uint a, uint b) internal pure returns (MathError, Exp memory) {\\n        return mulExp(Exp({ mantissa: a }), Exp({ mantissa: b }));\\n    }\\n\\n    /**\\n     * @dev Multiplies three exponentials, returning a new exponential.\\n     */\\n    function mulExp3(Exp memory a, Exp memory b, Exp memory c) internal pure returns (MathError, Exp memory) {\\n        (MathError err, Exp memory ab) = mulExp(a, b);\\n        if (err != MathError.NO_ERROR) {\\n            return (err, ab);\\n        }\\n        return mulExp(ab, c);\\n    }\\n\\n    /**\\n     * @dev Divides two exponentials, returning a new exponential.\\n     *     (a/scale) / (b/scale) = (a/scale) * (scale/b) = a/b,\\n     *  which we can scale as an Exp by calling getExp(a.mantissa, b.mantissa)\\n     */\\n    function divExp(Exp memory a, Exp memory b) internal pure returns (MathError, Exp memory) {\\n        return getExp(a.mantissa, b.mantissa);\\n    }\\n}\\n\",\"keccak256\":\"0x6b9b293a09a3ec69ac16f58dce449a553b44121eb9aad666a777d8f6f4ae83f0\",\"license\":\"BSD-3-Clause\"},\"contracts/Utils/ExponentialNoError.sol\":{\"content\":\"// SPDX-License-Identifier: BSD-3-Clause\\npragma solidity 0.8.25;\\n\\n/**\\n * @title Exponential module for storing fixed-precision decimals\\n * @author Compound\\n * @notice Exp is a struct which stores decimals with a fixed precision of 18 decimal places.\\n *         Thus, if we wanted to store the 5.1, mantissa would store 5.1e18. That is:\\n *         `Exp({mantissa: 5100000000000000000})`.\\n */\\ncontract ExponentialNoError {\\n    uint internal constant expScale = 1e18;\\n    uint internal constant doubleScale = 1e36;\\n    uint internal constant halfExpScale = expScale / 2;\\n    uint internal constant mantissaOne = expScale;\\n\\n    struct Exp {\\n        uint mantissa;\\n    }\\n\\n    struct Double {\\n        uint mantissa;\\n    }\\n\\n    /**\\n     * @dev Truncates the given exp to a whole number value.\\n     *      For example, truncate(Exp{mantissa: 15 * expScale}) = 15\\n     */\\n    function truncate(Exp memory exp) internal pure returns (uint) {\\n        // Note: We are not using careful math here as we're performing a division that cannot fail\\n        return exp.mantissa / expScale;\\n    }\\n\\n    /**\\n     * @dev Multiply an Exp by a scalar, then truncate to return an unsigned integer.\\n     */\\n    function mul_ScalarTruncate(Exp memory a, uint scalar) internal pure returns (uint) {\\n        Exp memory product = mul_(a, scalar);\\n        return truncate(product);\\n    }\\n\\n    /**\\n     * @dev Multiply an Exp by a scalar, truncate, then add an to an unsigned integer, returning an unsigned integer.\\n     */\\n    function mul_ScalarTruncateAddUInt(Exp memory a, uint scalar, uint addend) internal pure returns (uint) {\\n        Exp memory product = mul_(a, scalar);\\n        return add_(truncate(product), addend);\\n    }\\n\\n    /**\\n     * @dev Checks if first Exp is less than second Exp.\\n     */\\n    function lessThanExp(Exp memory left, Exp memory right) internal pure returns (bool) {\\n        return left.mantissa < right.mantissa;\\n    }\\n\\n    /**\\n     * @dev Checks if left Exp <= right Exp.\\n     */\\n    function lessThanOrEqualExp(Exp memory left, Exp memory right) internal pure returns (bool) {\\n        return left.mantissa <= right.mantissa;\\n    }\\n\\n    /**\\n     * @dev Checks if left Exp > right Exp.\\n     */\\n    function greaterThanExp(Exp memory left, Exp memory right) internal pure returns (bool) {\\n        return left.mantissa > right.mantissa;\\n    }\\n\\n    /**\\n     * @dev returns true if Exp is exactly zero\\n     */\\n    function isZeroExp(Exp memory value) internal pure returns (bool) {\\n        return value.mantissa == 0;\\n    }\\n\\n    function safe224(uint n, string memory errorMessage) internal pure returns (uint224) {\\n        require(n < 2 ** 224, errorMessage);\\n        return uint224(n);\\n    }\\n\\n    function safe32(uint n, string memory errorMessage) internal pure returns (uint32) {\\n        require(n < 2 ** 32, errorMessage);\\n        return uint32(n);\\n    }\\n\\n    function add_(Exp memory a, Exp memory b) internal pure returns (Exp memory) {\\n        return Exp({ mantissa: add_(a.mantissa, b.mantissa) });\\n    }\\n\\n    function add_(Double memory a, Double memory b) internal pure returns (Double memory) {\\n        return Double({ mantissa: add_(a.mantissa, b.mantissa) });\\n    }\\n\\n    function add_(uint a, uint b) internal pure returns (uint) {\\n        return add_(a, b, \\\"addition overflow\\\");\\n    }\\n\\n    function add_(uint a, uint b, string memory errorMessage) internal pure returns (uint) {\\n        uint c = a + b;\\n        require(c >= a, errorMessage);\\n        return c;\\n    }\\n\\n    function sub_(Exp memory a, Exp memory b) internal pure returns (Exp memory) {\\n        return Exp({ mantissa: sub_(a.mantissa, b.mantissa) });\\n    }\\n\\n    function sub_(Double memory a, Double memory b) internal pure returns (Double memory) {\\n        return Double({ mantissa: sub_(a.mantissa, b.mantissa) });\\n    }\\n\\n    function sub_(uint a, uint b) internal pure returns (uint) {\\n        return sub_(a, b, \\\"subtraction underflow\\\");\\n    }\\n\\n    function sub_(uint a, uint b, string memory errorMessage) internal pure returns (uint) {\\n        require(b <= a, errorMessage);\\n        return a - b;\\n    }\\n\\n    function mul_(Exp memory a, Exp memory b) internal pure returns (Exp memory) {\\n        return Exp({ mantissa: mul_(a.mantissa, b.mantissa) / expScale });\\n    }\\n\\n    function mul_(Exp memory a, uint b) internal pure returns (Exp memory) {\\n        return Exp({ mantissa: mul_(a.mantissa, b) });\\n    }\\n\\n    function mul_(uint a, Exp memory b) internal pure returns (uint) {\\n        return mul_(a, b.mantissa) / expScale;\\n    }\\n\\n    function mul_(Double memory a, Double memory b) internal pure returns (Double memory) {\\n        return Double({ mantissa: mul_(a.mantissa, b.mantissa) / doubleScale });\\n    }\\n\\n    function mul_(Double memory a, uint b) internal pure returns (Double memory) {\\n        return Double({ mantissa: mul_(a.mantissa, b) });\\n    }\\n\\n    function mul_(uint a, Double memory b) internal pure returns (uint) {\\n        return mul_(a, b.mantissa) / doubleScale;\\n    }\\n\\n    function mul_(uint a, uint b) internal pure returns (uint) {\\n        return mul_(a, b, \\\"multiplication overflow\\\");\\n    }\\n\\n    function mul_(uint a, uint b, string memory errorMessage) internal pure returns (uint) {\\n        if (a == 0 || b == 0) {\\n            return 0;\\n        }\\n        uint c = a * b;\\n        require(c / a == b, errorMessage);\\n        return c;\\n    }\\n\\n    function div_(Exp memory a, Exp memory b) internal pure returns (Exp memory) {\\n        return Exp({ mantissa: div_(mul_(a.mantissa, expScale), b.mantissa) });\\n    }\\n\\n    function div_(Exp memory a, uint b) internal pure returns (Exp memory) {\\n        return Exp({ mantissa: div_(a.mantissa, b) });\\n    }\\n\\n    function div_(uint a, Exp memory b) internal pure returns (uint) {\\n        return div_(mul_(a, expScale), b.mantissa);\\n    }\\n\\n    function div_(Double memory a, Double memory b) internal pure returns (Double memory) {\\n        return Double({ mantissa: div_(mul_(a.mantissa, doubleScale), b.mantissa) });\\n    }\\n\\n    function div_(Double memory a, uint b) internal pure returns (Double memory) {\\n        return Double({ mantissa: div_(a.mantissa, b) });\\n    }\\n\\n    function div_(uint a, Double memory b) internal pure returns (uint) {\\n        return div_(mul_(a, doubleScale), b.mantissa);\\n    }\\n\\n    function div_(uint a, uint b) internal pure returns (uint) {\\n        return div_(a, b, \\\"divide by zero\\\");\\n    }\\n\\n    function div_(uint a, uint b, string memory errorMessage) internal pure returns (uint) {\\n        require(b > 0, errorMessage);\\n        return a / b;\\n    }\\n\\n    function fraction(uint a, uint b) internal pure returns (Double memory) {\\n        return Double({ mantissa: div_(mul_(a, doubleScale), b) });\\n    }\\n}\\n\",\"keccak256\":\"0xce75802a56763fb96b2046b374127f080a425cfe3634670767ec040ccb6ea7e0\",\"license\":\"BSD-3-Clause\"},\"contracts/external/IProtocolShareReserve.sol\":{\"content\":\"// SPDX-License-Identifier: BSD-3-Clause\\n\\npragma solidity 0.8.25;\\n\\ninterface IProtocolShareReserve {\\n    enum IncomeType {\\n        SPREAD,\\n        LIQUIDATION,\\n        FLASHLOAN\\n    }\\n\\n    function updateAssetsState(address comptroller, address asset, IncomeType incomeType) external;\\n}\\n\",\"keccak256\":\"0x01b2f2afbc3fa148f93d4563fa06e0639899b04599f3d95a3df79eaff79db137\",\"license\":\"BSD-3-Clause\"}},\"version\":1}",
  "bytecode": "0x6080604052348015600e575f80fd5b50615c568061001c5f395ff3fe608060405234801561000f575f80fd5b5060043610610422575f3560e01c8063738439621161022c578063bd6d894d11610135578063e0847e5c116100bf578063f3fdb15a11610084578063f3fdb15a1461090a578063f5e3c4621461091d578063f851a44014610930578063f8f9da2814610948578063fca7820b14610950575f80fd5b8063e0847e5c146108c1578063e4c26305146108d4578063e9a44fd9146108dc578063e9c714f2146108ef578063f2b3abbd146108f7575f80fd5b8063d310dce511610105578063d310dce51461083d578063db006a7514610850578063dd5f608514610863578063dd62ed3e14610876578063df3a516e146108ae575f80fd5b8063bd6d894d146107e6578063c37f68e2146107ee578063c5ebeaec14610821578063d1109c2f14610834575f80fd5b8063a6afed95116101b6578063ae96f14111610186578063ae96f1411461079c578063ae9d70b0146107a5578063b2a02ff1146107ad578063b4a0bdf3146107c0578063b71d1a0c146107d3575f80fd5b8063a6afed9514610764578063a9059cbb1461076c578063aa5af0fd1461077f578063ae3fcb1f14610788575f80fd5b80638f840ddd116101fc5780638f840ddd1461071a57806395d89b411461072357806395dd91931461072b57806399d8c1b41461073e578063a0712d6814610751575f80fd5b806373843962146106e357806373acee98146106ec578063852a12e3146106f4578063856e5bb314610707575f80fd5b806328e2dc6c1161032e5780635635a689116102b8578063601a0bf111610288578063601a0bf1146106645780636c540baf146106775780636f307dc31461068057806370a082311461069357806371507cd5146106bb575f80fd5b80635635a6891461061857806356e677281461062b5780635c60da1b1461063e5780635fe3b56714610651575f80fd5b80633c86778e116102fe5780633c86778e146105ce5780633d9ea3a1146105e15780633e941010146105e95780634576b5db146105fc57806347bd37181461060f575f80fd5b806328e2dc6c1461058b578063313ce567146105945780633af9e669146105b35780633b1d21a2146105c6575f80fd5b8063182df0f5116103af57806323323e031161037f57806323323e031461051457806323b872dd146105275780632464176b1461053a5780632608f8181461054d5780632678224714610560575f80fd5b8063182df0f5146104dd5780631a31d465146104e5578063210bc052146104f8578063217e7de21461050b575f80fd5b8063107568df116103f5578063107568df1461049b578063153ab505146104b0578063173b9904146104b857806317bfdfbc146104c157806318160ddd146104d4575f80fd5b806306fdde0314610426578063095ea7b3146104445780630e32cb86146104675780630e75270214610488575b5f80fd5b61042e610963565b60405161043b9190615316565b60405180910390f35b61045761045236600461533c565b6109ef565b604051901515815260200161043b565b61047a610475366004615366565b610a5b565b60405190815260200161043b565b61047a610496366004615381565b610ad7565b6104ae6104a9366004615366565b610aea565b005b6104ae610b57565b61047a60085481565b61047a6104cf366004615366565b610bd3565b61047a600d5481565b61047a610c40565b6104ae6104f3366004615452565b610c58565b61047a61050636600461533c565b610ceb565b61047a60185481565b61047a61052236600461533c565b610d8a565b610457610535366004615501565b610d9f565b6104ae610548366004615381565b610dec565b61047a61055b36600461533c565b610e8d565b600454610573906001600160a01b031681565b6040516001600160a01b03909116815260200161043b565b61047a60175481565b6003546105a19060ff1681565b60405160ff909116815260200161043b565b61047a6105c1366004615366565b610e99565b61047a610eee565b61047a6105dc36600461553f565b610efc565b610457600181565b61047a6105f7366004615381565b610f79565b61047a61060a366004615366565b610f83565b61047a600b5481565b6104ae61062636600461533c565b6110a0565b6104ae61063936600461555f565b61115d565b601254610573906001600160a01b031681565b600554610573906001600160a01b031681565b61047a610672366004615381565b6111d5565b61047a60095481565b601154610573906001600160a01b031681565b61047a6106a1366004615366565b6001600160a01b03165f908152600e602052604090205490565b6106ce6106c9366004615381565b611261565b6040805192835260208301919091520161043b565b61047a60195481565b61047a6112c1565b61047a610702366004615381565b611324565b61047a61071536600461533c565b611330565b61047a600c5481565b61042e6113c8565b61047a610739366004615366565b6113d5565b6104ae61074c3660046155a4565b6113ee565b61047a61075f366004615381565b61154b565b61047a611556565b61045761077a36600461533c565b6118aa565b61047a600a5481565b60165461045790600160a01b900460ff1681565b61047a60145481565b61047a6118f6565b61047a6107bb366004615501565b61198b565b601654610573906001600160a01b031681565b61047a6107e1366004615366565b6119d7565b61047a611a44565b6108016107fc366004615366565b611aad565b60408051948552602085019390935291830152606082015260800161043b565b61047a61082f366004615381565b611b45565b61047a60135481565b61047a61084b36600461533c565b611b51565b61047a61085e366004615381565b611b95565b61047a61087136600461533c565b611ba1565b61047a610884366004615640565b6001600160a01b039182165f908152600f6020908152604080832093909416825291909152205490565b61047a6108bc36600461533c565b611c91565b61047a6108cf366004615677565b611d29565b61047a612035565b601554610573906001600160a01b031681565b61047a6120cf565b61047a610905366004615366565b6121b7565b600654610573906001600160a01b031681565b61047a61092b36600461570e565b61220a565b6003546105739061010090046001600160a01b031681565b61047a612221565b61047a61095e366004615381565b612273565b600180546109709061574d565b80601f016020809104026020016040519081016040528092919081815260200182805461099c9061574d565b80156109e75780601f106109be576101008083540402835291602001916109e7565b820191905f5260205f20905b8154815290600101906020018083116109ca57829003601f168201915b505050505081565b335f818152600f602090815260408083206001600160a01b038716808552925280832085905551919290917f8c5be1e5ebec7d5bd14f71427d1e84f3dd0314c0f7b2291e5b200ac8c7c3b92590610a499086815260200190565b60405180910390a35060015b92915050565b5f610a65336122ef565b610a6e82612340565b6016546040517f66fd58e82f7b31a2a5c30e0888f3093efe4e111b00cd2b0c31fe014601293aa091610aad916001600160a01b0390911690859061577f565b60405180910390a1601680546001600160a01b0319166001600160a01b0384161790555f92915050565b5f80610ae283612385565b509392505050565b610af3336122ef565b610afc81612340565b6015546040516001600160a01b038084169216907fafec95c8612496c3ecf5dddc71e393528fe29bd145fbaf9c6b496d78d7e2d79b905f90a3601580546001600160a01b0319166001600160a01b0392909216919091179055565b60035461010090046001600160a01b03163314610bd15760405162461bcd60e51b815260206004820152602d60248201527f6f6e6c79207468652061646d696e206d61792063616c6c205f72657369676e4960448201526c36b83632b6b2b73a30ba34b7b760991b60648201526084015b60405180910390fd5b565b5f805460ff16610bf55760405162461bcd60e51b8152600401610bc8906157ad565b5f805460ff19168155610c06611556565b14610c235760405162461bcd60e51b8152600401610bc8906157d1565b610c2c826113d5565b90505b5f805460ff19166001179055919050565b5f805f610c4b6123df565b91509150610a558261249f565b610c668686868686866113ee565b601180546001600160a01b0319166001600160a01b038916908117909155604080516318160ddd60e01b815290516318160ddd916004808201926020929091908290030181865afa158015610cbd573d5f803e3d5ffd5b505050506040513d601f19601f82011682018060405250810190610ce19190615801565b5050505050505050565b600554604051630217306760e31b81525f916001600160a01b0316906310b9833890610d1d908690339060040161577f565b602060405180830381865afa158015610d38573d5f803e3d5ffd5b505050506040513d601f19601f82011682018060405250810190610d5c9190615818565b610d785760405162461bcd60e51b8152600401610bc890615837565b610d838333846124ec565b9392505050565b5f80610d96848461252e565b50949350505050565b5f805460ff16610dc15760405162461bcd60e51b8152600401610bc8906157ad565b5f805460ff19168155610dd63386868661258a565b1490505f805460ff191660011790559392505050565b5f8111610e2b5760405162461bcd60e51b815260206004820152600d60248201526c125b9d985b1a5908125b9c1d5d609a1b6044820152606401610bc8565b610e4c604051806060016040528060248152602001615bb560249139612872565b60135460408051918252602082018390527fc2ac513cdb57f91eb2bef4db918c285829524f549682b99717c6cb06cc011183910160405180910390a1601355565b5f80610d96848461291f565b5f806040518060200160405280610eae611a44565b90526001600160a01b0384165f908152600e6020526040812054919250908190610ed9908490612962565b91509150610ee68261249f565b949350505050565b5f610ef76129b0565b905090565b5f610f1e604051806060016040528060288152602001615bd960289139612872565b6017546018546040805192835260208301869052820152606081018390527f2dad8739cf01e920af3ac912c516b0d9f2bb61b3ae0df6751ac15b4ce499b00c9060800160405180910390a1601783905560188290555f610d83565b5f610a55826129e0565b5f610f8d336122ef565b816001600160a01b0316627e3dd26040518163ffffffff1660e01b8152600401602060405180830381865afa158015610fc8573d5f803e3d5ffd5b505050506040513d601f19601f82011682018060405250810190610fec9190615818565b6110385760405162461bcd60e51b815260206004820152601c60248201527f6d61726b6572206d6574686f642072657475726e65642066616c7365000000006044820152606401610bc8565b6005546040517f7ac369dbd14fa5ea3f473ed67cc9d598964a77501540ba6751eb0b3decf5870d91611077916001600160a01b0390911690859061577f565b60405180910390a1600580546001600160a01b0319166001600160a01b0384161790555f610a55565b5f5460ff166110c15760405162461bcd60e51b8152600401610bc8906157ad565b5f805460ff191690556005546001600160a01b031633146110f5576040516383aebebd60e01b815260040160405180910390fd5b6110ff8282612a35565b505f6019556011546040517f68b82a3660c18f42f79224a889197b758371b130ef33e93ecdbcf6bdd687b49391611145916001600160a01b03909116908590859061586e565b60405180910390a150505f805460ff19166001179055565b60035461010090046001600160a01b031633146111d25760405162461bcd60e51b815260206004820152602d60248201527f6f6e6c79207468652061646d696e206d61792063616c6c205f6265636f6d654960448201526c36b83632b6b2b73a30ba34b7b760991b6064820152608401610bc8565b50565b5f805460ff166111f75760405162461bcd60e51b8152600401610bc8906157ad565b5f805460ff1916905560408051808201909152601881527f5f72656475636552657365727665732875696e74323536290000000000000000602082015261123d90612872565b6112476031612b38565b50436014540361125857505f610c2f565b610c2c82612b6b565b5f805f805f611280604051806020016040528088815250601754612962565b909350915061128e8361249f565b6112a8604051806020016040528084815250601854612962565b90935090506112b68361249f565b909590945092505050565b5f805460ff166112e35760405162461bcd60e51b8152600401610bc8906157ad565b5f805460ff191681556112f4611556565b146113115760405162461bcd60e51b8152600401610bc8906157d1565b50600b545f805460ff1916600117905590565b5f610a55333384612ca5565b600554604051630217306760e31b81525f916001600160a01b0316906310b9833890611362908690339060040161577f565b602060405180830381865afa15801561137d573d5f803e3d5ffd5b505050506040513d601f19601f820116820180604052508101906113a19190615818565b6113bd5760405162461bcd60e51b8152600401610bc890615837565b610d83833384612ce7565b600280546109709061574d565b5f805f6113e184612d2a565b91509150610d838261249f565b6113f7336122ef565b6009541580156114075750600a54155b801561141257505f84115b61146a5760405162461bcd60e51b815260206004820152602360248201527f6d61726b6574206d6179206f6e6c7920626520696e697469616c697a6564206f6044820152626e636560e81b6064820152608401610bc8565b60078490555f61147987610f83565b43600955670de0b6b3a7640000600a5590505f61149587612ddd565b9050811580156114a3575080155b61150b5760405162461bcd60e51b815260206004820152603360248201527f636f6d7074726f6c6c6572206f7220696e746572657374206d6f64656c20696e6044820152721a5d1a585b1a5e985d1a5bdb8819985a5b1959606a1b6064820152608401610bc8565b600161151786826158dd565b50600261152485826158dd565b50506003805460ff90931660ff19938416179055505f805490911660011790555050505050565b5f80610ae283612f07565b6009545f90439081810361156d575f5b9250505090565b5f6115766129b0565b600b54600c54600a546006546040516315f2405360e01b81526004810186905260248101859052604481018490529495509293919290915f916001600160a01b0316906315f2405390606401602060405180830381865afa1580156115dd573d5f803e3d5ffd5b505050506040513d601f19601f820116820180604052508101906116019190615801565b905065048c273950008111156116595760405162461bcd60e51b815260206004820152601c60248201527f626f72726f772072617465206973206162737572646c792068696768000000006044820152606401610bc8565b5f806116658989612f49565b915091506116728261249f565b60408051602081019091525f81525f805f8061169c60405180602001604052808a81525087612f69565b90975094505f8760038111156116b4576116b4615799565b146116ea576116d7600960068960038111156116d2576116d2615799565b612fde565b9e50505050505050505050505050505090565b6116f4858c612962565b90975093505f87600381111561170c5761170c615799565b1461172a576116d7600960018960038111156116d2576116d2615799565b611734848c613055565b90975092505f87600381111561174c5761174c615799565b1461176a576116d7600960048960038111156116d2576116d2615799565b6117856040518060200160405280600854815250858c613078565b90975091505f87600381111561179d5761179d615799565b146117bb576116d7600960058960038111156116d2576116d2615799565b6117c6858a8b613078565b90975090505f8760038111156117de576117de615799565b146117fc576116d7600960038960038111156116d2576116d2615799565b60098e9055600a819055600b839055600c82905560145461181e908f90612f49565b909750955061182c8761249f565b601354861061185c5760148e9055818c10156118515761184b8c612b6b565b5061185c565b61185a82612b6b565b505b604080518d815260208101869052908101829052606081018490527f4dec04e750ca11537cabcd8a9eab06494de08da3735bc8871cd41250e190bc049060800160405180910390a15f6116d7565b5f805460ff166118cc5760405162461bcd60e51b8152600401610bc8906157ad565b5f805460ff191681556118e13333868661258a565b1490505f805460ff1916600117905592915050565b6006545f906001600160a01b031663b81688166119116129b0565b600b54600c546008546040516001600160e01b031960e087901b16815260048101949094526024840192909252604483015260648201526084015b602060405180830381865afa158015611967573d5f803e3d5ffd5b505050506040513d601f19601f82011682018060405250810190610ef79190615801565b5f805460ff166119ad5760405162461bcd60e51b8152600401610bc8906157ad565b5f805460ff191690556119c2338585856130cf565b90505f805460ff191660011790559392505050565b5f6119e1336122ef565b600480546001600160a01b038481166001600160a01b03198316179092556040519116907fca4f2f25d0898edd99413412fb94012f9e54ec8142f9b093e7720646a95b16a990611a34908390869061577f565b60405180910390a15f9392505050565b5f805460ff16611a665760405162461bcd60e51b8152600401610bc8906157ad565b5f805460ff19168155611a77611556565b14611a945760405162461bcd60e51b8152600401610bc8906157d1565b611a9c610c40565b90505f805460ff1916600117905590565b5f805f805f805f611abd88612d2a565b935090505f816003811115611ad457611ad4615799565b14611aef5760095b5f805f9650965096509650505050611b3e565b611af76123df565b925090505f816003811115611b0e57611b0e615799565b14611b1a576009611adc565b506001600160a01b0387165f908152600e6020526040812054909650945090925090505b9193509193565b5f610a55333384612ce7565b6005545f906001600160a01b03163314611b7e576040516383aebebd60e01b815260040160405180910390fd5b611b886008612b38565b50610d83835f845f61330d565b5f610a553333846124ec565b5f805460ff16611bc35760405162461bcd60e51b8152600401610bc8906157ad565b5f805460ff191690556005546001600160a01b03163314611bf7576040516383aebebd60e01b815260040160405180910390fd5b6015546001600160a01b03848116911614611c23578160195f828254611c1d91906159b1565b90915550505b611c2d83836135bc565b611c356129b0565b6011546040519192507f2ea8652d94d7f92e51969d27c6b12db2cf1bcafb0ef824ce90eb1488f4d1f77891611c77916001600160a01b0316908690869061586e565b60405180910390a15f805460ff1916600117905592915050565b600554604051630217306760e31b81525f916001600160a01b0316906310b9833890611cc3908690339060040161577f565b602060405180830381865afa158015611cde573d5f803e3d5ffd5b505050506040513d601f19601f82011682018060405250810190611d029190615818565b611d1e5760405162461bcd60e51b8152600401610bc890615837565b610d83833384612ca5565b5f805460ff16611d4b5760405162461bcd60e51b8152600401610bc8906157ad565b5f805460ff19169055601654600160a01b900460ff16611d7e57604051630a3fad8360e01b815260040160405180910390fd5b611d8785612340565b60055460405163e0f6123d60e01b81526001600160a01b0388811660048301529091169063e0f6123d90602401602060405180830381865afa158015611dcf573d5f803e3d5ffd5b505050506040513d601f19601f82011682018060405250810190611df39190615818565b611e1b57604051630b59dd5360e21b81526001600160a01b0387166004820152602401610bc8565b8360195f828254611e2c91906159b1565b90915550611e3c905085856135bc565b5f611e456129b0565b90505f80611e5287611261565b90925090505f611e6283896159b1565b601154604051631b11d0ff60e01b81529192506001600160a01b03808c1692631b11d0ff92611e9f9216908c90889033908e908e906004016159c4565b6020604051808303815f875af1158015611ebb573d5f803e3d5ffd5b505050506040513d601f19601f82011682018060405250810190611edf9190615818565b611efc57604051635a3b2cbb60e11b815260040160405180910390fd5b611f068982612a35565b508760195f828254611f189190615a1e565b9091555081905084611f286129b0565b611f329190615a1e565b1015611f5157604051630443f54160e21b815260040160405180910390fd5b601554611f67906001600160a01b0316836135bc565b6015546005546011546040516305bebb3b60e21b81526001600160a01b03938416936316faecec93611fa59390821692911690600290600401615a31565b5f604051808303815f87803b158015611fbc575f80fd5b505af1158015611fce573d5f803e3d5ffd5b50506011546040517fd9695a91e344c843728f8b129d7a8f4b5d524af23f18b18dceb82c7381867957935061201192508c916001600160a01b0316908c9061586e565b60405180910390a15f9450505050505f805460ff1916600117905595945050505050565b5f61206860405180604001604052806011815260200170746f67676c65466c6173684c6f616e282960781b815250612872565b6016805460ff600160a01b808304821615810260ff60a01b199093169290921792839055604080519290930416158082521560208201527f1b65e31cf631906dfb880bc178d7fa09439e2e97c2e344793609a80ac5b4a8ca910160405180910390a1505f90565b6004545f906001600160a01b031633146120ee57610ef760015f6135d8565b60038054600480546001600160a01b03818116610100818102610100600160a81b0319871617968790556001600160a01b03199093169093556040519382900481169492937ff9ffabca9c8276e99321725bcb43fb076a6c66a54b7f21c4e8146d8519b417dc936121649387939104169061577f565b60405180910390a16004546040517fca4f2f25d0898edd99413412fb94012f9e54ec8142f9b093e7720646a95b16a9916121a99184916001600160a01b03169061577f565b60405180910390a15f611566565b5f6121f66040518060400160405280601e81526020017f5f736574496e746572657374526174654d6f64656c2861646472657373290000815250612872565b6122006041612b38565b50610a5582612ddd565b5f8061221785858561364f565b5095945050505050565b6006545f906001600160a01b03166315f2405361223c6129b0565b600b54600c546040516001600160e01b031960e086901b16815260048101939093526024830191909152604482015260640161194c565b5f805460ff166122955760405162461bcd60e51b8152600401610bc8906157ad565b5f805460ff1916905560408051808201909152601a81527f5f73657452657365727665466163746f722875696e743235362900000000000060208201526122db90612872565b6122e56047612b38565b50610c2c82613740565b6003546001600160a01b0382811661010090920416146111d25760405162461bcd60e51b815260206004820152600c60248201526b155b985d5d1a1bdc9a5e995960a21b6044820152606401610bc8565b6001600160a01b0381166111d25760405162461bcd60e51b815260206004820152600c60248201526b7a65726f206164647265737360a01b6044820152606401610bc8565b5f8054819060ff166123a95760405162461bcd60e51b8152600401610bc8906157ad565b5f805460ff191690556123bc6037612b38565b506123c83333856137b0565b915091505f805460ff191660011790559092909150565b600d545f9081908082036123f95750506007545f92909150565b5f6124026129b0565b90505f61241a60405180602001604052805f81525090565b5f6124376019548561242c91906159b1565b600b54600c54613b09565b935090505f81600381111561244e5761244e615799565b1461245f57965f9650945050505050565b6124698386613b49565b925090505f81600381111561248057612480615799565b1461249157965f9650945050505050565b50515f969095509350505050565b5f8160038111156124b2576124b2615799565b146111d25760405162461bcd60e51b815260206004820152600a60248201526936b0ba341032b93937b960b11b6044820152606401610bc8565b5f805460ff1661250e5760405162461bcd60e51b8152600401610bc8906157ad565b5f805460ff191690556125216027612b38565b506119c28484845f613c0b565b5f8054819060ff166125525760405162461bcd60e51b8152600401610bc8906157ad565b5f805460ff19169055612565601e612b38565b5061257133858561426d565b915091505f805460ff1916600117905590939092509050565b6005546040516317b9b84b60e31b81525f9182916001600160a01b039091169063bdcdc258906125c4903090899089908990600401615a73565b6020604051808303815f875af11580156125e0573d5f803e3d5ffd5b505050506040513d601f19601f820116820180604052508101906126049190615801565b90508015612621576126196003604b83612fde565b915050610ee6565b836001600160a01b0316856001600160a01b031603612646576126196002604c6135d8565b5f856001600160a01b0316876001600160a01b03160361266857505f1961268f565b506001600160a01b038086165f908152600f60209081526040808320938a16835292905220545b5f805f8061269d8589612f49565b90945092505f8460038111156126b5576126b5615799565b146126d3576126c66009604c6135d8565b9650505050505050610ee6565b6001600160a01b038a165f908152600e60205260409020546126f59089612f49565b90945091505f84600381111561270d5761270d615799565b1461271e576126c66009604d6135d8565b6001600160a01b0389165f908152600e60205260409020546127409089613055565b90945090505f84600381111561275857612758615799565b14612769576126c66009604e6135d8565b6001600160a01b03808b165f908152600e6020526040808220859055918b168152208190555f1985146127be576001600160a01b03808b165f908152600f60209081526040808320938f168352929052208390555b886001600160a01b03168a6001600160a01b03165f80516020615c018339815191528a6040516127f091815260200190565b60405180910390a360055460405163352b4a3f60e11b81526001600160a01b0390911690636a56947e9061282e9030908e908e908e90600401615a73565b5f604051808303815f87803b158015612845575f80fd5b505af1158015612857573d5f803e3d5ffd5b505f9250612863915050565b9b9a5050505050505050505050565b6016546040516318c5e8ab60e01b81526001600160a01b03909116906318c5e8ab906128a49033908590600401615a9d565b602060405180830381865afa1580156128bf573d5f803e3d5ffd5b505050506040513d601f19601f820116820180604052508101906128e39190615818565b6111d25760405162461bcd60e51b815260206004820152600d60248201526c1858d8d95cdcc819195b9a5959609a1b6044820152606401610bc8565b5f8054819060ff166129435760405162461bcd60e51b8152600401610bc8906157ad565b5f805460ff191690556129566036612b38565b506125713385856137b0565b5f805f806129708686612f69565b90925090505f82600381111561298857612988615799565b14612998575091505f90506129a9565b5f6129a28261460d565b9350935050505b9250929050565b6011546040516370a0823160e01b81523060048201525f916001600160a01b0316906370a082319060240161194c565b5f805460ff16612a025760405162461bcd60e51b8152600401610bc8906157ad565b5f805460ff19169055612a15604f612b38565b505f612a2083614624565b509150505f805460ff19166001179055919050565b6011546040516370a0823160e01b81523060048201525f916001600160a01b031690829082906370a0823190602401602060405180830381865afa158015612a7f573d5f803e3d5ffd5b505050506040513d601f19601f82011682018060405250810190612aa39190615801565b9050612aba6001600160a01b038316863087614701565b6040516370a0823160e01b81523060048201525f906001600160a01b038416906370a0823190602401602060405180830381865afa158015612afe573d5f803e3d5ffd5b505050506040513d601f19601f82011682018060405250810190612b229190615801565b9050612b2e8282615a1e565b9695505050505050565b5f80612b42611556565b90508015612b6557610d83816011811115612b5f57612b5f615799565b846135d8565b50919050565b5f815f03612b79575f610a55565b4360095414612b8e57610a55600a60346135d8565b81612b976129b0565b1015612ba957610a55600e60336135d8565b600c54821115612bbf57610a55600260356135d8565b81600c54612bcd9190615a1e565b600c55601554612be6906001600160a01b0316836135bc565b6015546005546011546040516305bebb3b60e21b81526001600160a01b03938416936316faecec93612c2393908216929116905f90600401615a31565b5f604051808303815f87803b158015612c3a575f80fd5b505af1158015612c4c573d5f803e3d5ffd5b5050601554600c54604080516001600160a01b039093168352602083018790528201527f3bad0c59cf2f06e7314077049f48a93578cd16f5ef92329f1dab1420a99c177e9250606001905060405180910390a15f610a55565b5f805460ff16612cc75760405162461bcd60e51b8152600401610bc8906157ad565b5f805460ff19169055612cda6027612b38565b506119c284845f85613c0b565b5f805460ff16612d095760405162461bcd60e51b8152600401610bc8906157ad565b5f805460ff19169055612d1c6008612b38565b506119c2848484600161330d565b6001600160a01b0381165f908152601060205260408120805482918291829182918203612d5f57505f96879650945050505050565b612d6e815f0154600a5461475f565b90945092505f846003811115612d8657612d86615799565b14612d98575091955f95509350505050565b612da683826001015461479c565b90945091505f846003811115612dbe57612dbe615799565b14612dd0575091955f95509350505050565b505f969095509350505050565b5f4360095414612df357610a55600a60426135d8565b816001600160a01b0316632191f92a6040518163ffffffff1660e01b8152600401602060405180830381865afa158015612e2f573d5f803e3d5ffd5b505050506040513d601f19601f82011682018060405250810190612e539190615818565b612e9f5760405162461bcd60e51b815260206004820152601c60248201527f6d61726b6572206d6574686f642072657475726e65642066616c7365000000006044820152606401610bc8565b6006546040517fedffc32e068c7c95dfd4bdfd5c4d939a084d6b11c4199eac8436ed234d72f92691612ede916001600160a01b0390911690859061577f565b60405180910390a1600680546001600160a01b0319166001600160a01b0384161790555f610a55565b5f8054819060ff16612f2b5760405162461bcd60e51b8152600401610bc8906157ad565b5f805460ff19169055612f3e601e612b38565b506123c833846147c6565b5f80838311612f5e57505f90508183036129a9565b50600390505f6129a9565b5f612f7f60405180602001604052805f81525090565b5f80612f8e865f01518661475f565b90925090505f826003811115612fa657612fa6615799565b14612fc4575060408051602081019091525f815290925090506129a9565b60408051602081019091529081525f969095509350505050565b5f7f45b96fe442630264581b197e84bbada861235052c5a1aadfff9ea4e40a969aa084601181111561301257613012615799565b84605681111561302457613024615799565b604080519283526020830191909152810184905260600160405180910390a1836011811115610ee657610ee6615799565b5f8083830184811061306b575f925090506129a9565b60025f92509250506129a9565b5f805f806130868787612f69565b90925090505f82600381111561309e5761309e615799565b146130ae575091505f90506130c7565b6130c06130ba8261460d565b86613055565b9350935050505b935093915050565b60055460405163d02f735160e01b81525f9182916001600160a01b039091169063d02f73519061310b9030908a908a908a908a90600401615ac0565b6020604051808303815f875af1158015613127573d5f803e3d5ffd5b505050506040513d601f19601f8201168201806040525081019061314b9190615801565b90508015613160576126196003601b83612fde565b846001600160a01b0316846001600160a01b031603613185576126196006601c6135d8565b6001600160a01b0384165f908152600e6020526040812054819081906131ab9087612f49565b90935091505f8360038111156131c3576131c3615799565b146131ec576131e16009601a8560038111156116d2576116d2615799565b945050505050610ee6565b6001600160a01b0388165f908152600e602052604090205461320e9087613055565b90935090505f83600381111561322657613226615799565b14613244576131e1600960198560038111156116d2576116d2615799565b6001600160a01b038088165f818152600e6020526040808220869055928b168082529083902084905591515f80516020615c018339815191529061328b908a815260200190565b60405180910390a3600554604051636d35bf9160e01b81526001600160a01b0390911690636d35bf91906132cb9030908d908d908d908d90600401615ac0565b5f604051808303815f87803b1580156132e2575f80fd5b505af11580156132f4573d5f803e3d5ffd5b505f9250613300915050565b9998505050505050505050565b60055460405163368f515360e21b81525f9182916001600160a01b039091169063da3d454c906133459030908a90899060040161586e565b6020604051808303815f875af1158015613361573d5f803e3d5ffd5b505050506040513d601f19601f820116820180604052508101906133859190615801565b9050801561339a576126196003600e83612fde565b43600954146133ae57612619600a806135d8565b836133b76129b0565b10156133c957612619600e60096135d8565b6133f16040805160808101909152805f81526020015f81526020015f81526020015f81525090565b6133fa87612d2a565b602083018190528282600381111561341457613414615799565b600381111561342557613425615799565b9052505080516134349061249f565b613442816020015186613055565b604083018190528282600381111561345c5761345c615799565b600381111561346d5761346d615799565b90525050805161347c9061249f565b613488600b5486613055565b60608301819052828260038111156134a2576134a2615799565b60038111156134b3576134b3615799565b9052505080516134c29061249f565b6040808201516001600160a01b0389165f908152601060205291909120908155600a546001909101556060810151600b5583156135035761350386866135bc565b7f13ed6866d4e1ee6da46f845c46d7e54120883d75c5ea9a2dacc1c4ca8984ab808786836040015184606001516040516135409493929190615af3565b60405180910390a1600554604051635c77860560e01b81526001600160a01b0390911690635c7786059061357c9030908b908a9060040161586e565b5f604051808303815f87803b158015613593575f80fd5b505af11580156135a5573d5f803e3d5ffd5b505f92506135b1915050565b979650505050505050565b6011546001600160a01b03166135d3818484614b38565b505050565b5f7f45b96fe442630264581b197e84bbada861235052c5a1aadfff9ea4e40a969aa083601181111561360c5761360c615799565b83605681111561361e5761361e615799565b6040805192835260208301919091525f9082015260600160405180910390a1826011811115610d8357610d83615799565b5f8054819060ff166136735760405162461bcd60e51b8152600401610bc8906157ad565b5f805460ff19169055613686600f612b38565b505f836001600160a01b031663a6afed956040518163ffffffff1660e01b81526004016020604051808303815f875af11580156136c5573d5f803e3d5ffd5b505050506040513d601f19601f820116820180604052508101906136e99190615801565b905080156137185761370d81601181111561370657613706615799565b60106135d8565b5f925092505061372a565b61372433878787614b68565b92509250505b5f805460ff191660011790559094909350915050565b5f436009541461375657610a55600a60496135d8565b670de0b6b3a764000082111561377257610a556002604a6135d8565b600880549083905560408051828152602081018590527faaa68312e2ea9d50e16af5068410ab56e1a1fd06037b1a35664812c30f8214609101611a34565b600554604051631200453160e11b81525f91829182916001600160a01b0316906324008a62906137ea9030908a908a908a90600401615a73565b6020604051808303815f875af1158015613806573d5f803e3d5ffd5b505050506040513d601f19601f8201168201806040525081019061382a9190615801565b9050801561384a5761383f6003603983612fde565b5f92509250506130c7565b436009541461385f5761383f600a603a6135d8565b6138a0604080516101008101909152805f81526020015f81526020015f81526020015f81526020015f81526020015f81526020015f81526020015f81525090565b6001600160a01b0386165f9081526010602052604090206001015460608201526138c986612d2a565b60808301819052602083018260038111156138e6576138e6615799565b60038111156138f7576138f7615799565b8152505050613909816020015161249f565b5f1985036139205760808101516040820152613928565b604081018590525b613936878260400151612a35565b60e08201819052608082015161394b91612f49565b60a083018190526020830182600381111561396857613968615799565b600381111561397957613979615799565b815250505061398b816020015161249f565b61399b600b548260e00151612f49565b60c08301819052602083018260038111156139b8576139b8615799565b60038111156139c9576139c9615799565b81525050506139db816020015161249f565b60a081810180516001600160a01b038981165f81815260106020908152604091829020948555600a5460019095019490945560c0870151600b81905560e088015195518251948f16855294840192909252820193909352606081019190915260808101919091527f1a2a22cb034d26d1854bdc6666a5b91fe25efbbb5dcad3b0355478d6f5c362a1910160405180910390a160055460e08201516060830151604051631ededc9160e01b81523060048201526001600160a01b038b811660248301528a8116604483015260648201939093526084810191909152911690631ededc919060a4015f604051808303815f87803b158015613ad8575f80fd5b505af1158015613aea573d5f803e3d5ffd5b505f9250613af6915050565b8160e00151935093505050935093915050565b5f805f80613b178787613055565b90925090505f826003811115613b2f57613b2f615799565b14613b3f575091505f90506130c7565b6130c08186612f49565b5f613b5f60405180602001604052805f81525090565b5f80613b7386670de0b6b3a764000061475f565b90925090505f826003811115613b8b57613b8b615799565b14613ba9575060408051602081019091525f815290925090506129a9565b5f80613bb5838861479c565b90925090505f826003811115613bcd57613bcd615799565b14613bef578160405180602001604052805f81525095509550505050506129a9565b60408051602081019091529081525f9890975095505050505050565b5f821580613c17575081155b613c805760405162461bcd60e51b815260206004820152603460248201527f6f6e65206f662072656465656d546f6b656e73496e206f722072656465656d416044820152736d6f756e74496e206d757374206265207a65726f60601b6064820152608401610bc8565b613c886152b7565b613c906123df565b6020830181905282826003811115613caa57613caa615799565b6003811115613cbb57613cbb615799565b905250508051613cca9061249f565b8315613d3157604080820185905280516020808201909252908201518152613cf29085612962565b6060830181905282826003811115613d0c57613d0c615799565b6003811115613d1d57613d1d615799565b905250508051613d2c9061249f565b613d8f565b613d4d836040518060200160405280846020015181525061505c565b6040830181905282826003811115613d6757613d67615799565b6003811115613d7857613d78615799565b905250508051613d879061249f565b606081018390525b600554604080830151905163eabe7d9160e01b81525f926001600160a01b03169163eabe7d9191613dc79130918c919060040161586e565b6020604051808303815f875af1158015613de3573d5f803e3d5ffd5b505050506040513d601f19601f82011682018060405250810190613e079190615801565b90508015613e2557613e1c6003602883612fde565b92505050610ee6565b4360095414613e3a57613e1c600a602d6135d8565b613e4a600d548360400151612f49565b6080840181905283826003811115613e6457613e64615799565b6003811115613e7557613e75615799565b905250508151613e849061249f565b6001600160a01b0387165f908152600e6020526040908190205490830151613eac9190612f49565b60a0840181905283826003811115613ec657613ec6615799565b6003811115613ed757613ed7615799565b905250508151613ee69061249f565b8160600151613ef36129b0565b1015613f0557613e1c600e60296135d8565b6080820151600d5560a08201516001600160a01b038089165f908152600e60209081526040808320949094556005548451629df3ab60e31b815294519294859491909116926304ef9d58926004808401939192918290030181865afa158015613f70573d5f803e3d5ffd5b505050506040513d601f19601f82011682018060405250810190613f949190615801565b1561419b57606084015160055460408051629df3ab60e31b8152905161401093926001600160a01b0316916304ef9d589160048083019260209291908290030181865afa158015613fe7573d5f803e3d5ffd5b505050506040513d601f19601f8201168201806040525081019061400b9190615801565b61475f565b9250828582600381111561402657614026615799565b600381111561403757614037615799565b9052505083516140469061249f565b61405882670de0b6b3a764000061479c565b9250828582600381111561406e5761406e615799565b600381111561407f5761407f615799565b90525050835161408e9061249f565b61409c846060015183612f49565b915081858260038111156140b2576140b2615799565b60038111156140c3576140c3615799565b9052505083516140d29061249f565b6005546040805163c5f956af60e01b815290515f926001600160a01b03169163c5f956af9160048083019260209291908290030181865afa158015614119573d5f803e3d5ffd5b505050506040513d601f19601f8201168201806040525081019061413d9190615b19565b905061414981846135bc565b60408086015181516001600160a01b038d16815260208101869052918201527fccf8e53b86a99b7e9ecf796342c165764d66154780f638c08e6241d711fba6d49060600160405180910390a1506141a2565b5060608301515b6141ac88826135bc565b306001600160a01b0316896001600160a01b03165f80516020615c0183398151915286604001516040516141e291815260200190565b60405180910390a37fbd5034ffbd47e4e72a94baa2cdb74c6fad73cb3bcdc13036b72ec8306f5a7646898286604001518760a001516040516142279493929190615af3565b60405180910390a1600554606085015160408087015190516351dff98960e01b81526001600160a01b03909316926351dff989926132cb9230928f929190600401615b34565b5f8061427884612340565b600554604051634ef4c3e160e01b81525f916001600160a01b031690634ef4c3e1906142ac9030908990899060040161586e565b6020604051808303815f875af11580156142c8573d5f803e3d5ffd5b505050506040513d601f19601f820116820180604052508101906142ec9190615801565b905080156143015761383f6003601f83612fde565b43600954146143165761383f600a60226135d8565b61431e6152b7565b6143266123df565b602083018190528282600381111561434057614340615799565b600381111561435157614351615799565b9052505f90508151600381111561436a5761436a615799565b146143975761438b60096021835f015160038111156116d2576116d2615799565b5f9350935050506130c7565b6143a18786612a35565b60a082018190526040805160208082019092529083015181526143c4919061505c565b60408301819052828260038111156143de576143de615799565b60038111156143ef576143ef615799565b9052505080516143fe9061249f565b61440e600d548260400151613055565b606083018190528282600381111561442857614428615799565b600381111561443957614439615799565b9052505080516144489061249f565b6001600160a01b0386165f908152600e60205260409081902054908201516144709190613055565b608083018190528282600381111561448a5761448a615799565b600381111561449b5761449b615799565b9052505080516144aa9061249f565b6060810151600d556080810180516001600160a01b0388165f908152600e6020526040908190209190915560a083015181840151925191517fa24ddbdf0865ba440d364725c062eac72a908faeedffc33fe64d4640c82e3ab893614541938c938c93909291906001600160a01b03958616815293909416602084015260408301919091526060820152608081019190915260a00190565b60405180910390a1856001600160a01b0316306001600160a01b03165f80516020615c01833981519152836040015160405161457f91815260200190565b60405180910390a360055460a082015160408084015190516341c728b960e01b81526001600160a01b03909316926341c728b9926145c59230928c929190600401615b34565b5f604051808303815f87803b1580156145dc575f80fd5b505af11580156145ee573d5f803e3d5ffd5b505f92506145fa915050565b8160a00151935093505050935093915050565b80515f90610a5590670de0b6b3a764000090615b5d565b5f805f8043600954146146475761463d600a60506135d8565b9590945092505050565b6146513386612a35565b905080600c5461466191906159b1565b9150600c548210156146b55760405162461bcd60e51b815260206004820181905260248201527f61646420726573657276657320756e6578706563746564206f766572666c6f776044820152606401610bc8565b600c82905560408051338152602081018390529081018390527fa91e67c5ea634cd43a12c5a482724b03de01e85ca68702a53d0c2f45cb7c1dc59060600160405180910390a15f61463d565b614759846323b872dd60e01b8585856040516024016147229392919061586e565b60408051601f198184030181529190526020810180516001600160e01b03166001600160e01b03199093169290921790915261506a565b50505050565b5f80835f0361477257505f9050806129a9565b838302836147808683615b5d565b146147925760025f92509250506129a9565b5f925090506129a9565b5f80825f036147b05750600190505f6129a9565b5f6147bb8486615b5d565b915091509250929050565b600554604051634ef4c3e160e01b81525f91829182916001600160a01b031690634ef4c3e1906147fe9030908990899060040161586e565b6020604051808303815f875af115801561481a573d5f803e3d5ffd5b505050506040513d601f19601f8201168201806040525081019061483e9190615801565b9050801561485e576148536003601f83612fde565b5f92509250506129a9565b436009541461487357614853600a60226135d8565b61487b6152b7565b6148836123df565b602083018190528282600381111561489d5761489d615799565b60038111156148ae576148ae615799565b9052505f9050815160038111156148c7576148c7615799565b146148f4576148e860096021835f015160038111156116d2576116d2615799565b5f9350935050506129a9565b6148fe8686612a35565b60a08201819052604080516020808201909252908301518152614921919061505c565b604083018190528282600381111561493b5761493b615799565b600381111561494c5761494c615799565b90525050805161495b9061249f565b61496b600d548260400151613055565b606083018190528282600381111561498557614985615799565b600381111561499657614996615799565b9052505080516149a59061249f565b6001600160a01b0386165f908152600e60205260409081902054908201516149cd9190613055565b60808301819052828260038111156149e7576149e7615799565b60038111156149f8576149f8615799565b905250508051614a079061249f565b6060810151600d556080810180516001600160a01b0388165f908152600e6020526040908190209190915560a083015181840151925191517fb4c03061fb5b7fed76389d5af8f2e0ddb09f8c70d1333abbb62582835e10accb93614a6d938b9392615af3565b60405180910390a1856001600160a01b0316306001600160a01b03165f80516020615c018339815191528360400151604051614aab91815260200190565b60405180910390a360055460a082015160408084015190516341c728b960e01b81526001600160a01b03909316926341c728b992614af19230928c929190600401615b34565b5f604051808303815f87803b158015614b08575f80fd5b505af1158015614b1a573d5f803e3d5ffd5b505f9250614b26915050565b8160a001519350935050509250929050565b6040516001600160a01b0383166024820152604481018290526135d390849063a9059cbb60e01b90606401614722565b600554604051632fe3f38f60e11b81525f91829182916001600160a01b031690635fc7e71e90614ba490309088908c908c908c90600401615ac0565b6020604051808303815f875af1158015614bc0573d5f803e3d5ffd5b505050506040513d601f19601f82011682018060405250810190614be49190615801565b90508015614c0457614bf96003601283612fde565b5f9250925050615053565b4360095414614c1957614bf9600a60166135d8565b43846001600160a01b0316636c540baf6040518163ffffffff1660e01b8152600401602060405180830381865afa158015614c56573d5f803e3d5ffd5b505050506040513d601f19601f82011682018060405250810190614c7a9190615801565b14614c8b57614bf9600a60116135d8565b866001600160a01b0316866001600160a01b031603614cb057614bf9600660176135d8565b845f03614cc357614bf9600760156135d8565b5f198503614cd757614bf9600760146135d8565b5f80614ce48989896137b0565b90925090508115614d1857614d0b826011811115614d0457614d04615799565b60186135d8565b5f94509450505050615053565b600554604051630779996560e11b81525f916001600160a01b031690630ef332ca90614d4e908c9030908c908890600401615a73565b6040805180830381865afa158015614d68573d5f803e3d5ffd5b505050506040513d601f19601f82011682018060405250810190614d8c9190615b7c565b91505082158015614e0657506040516370a0823160e01b81526001600160a01b038a811660048301528291908916906370a0823190602401602060405180830381865afa158015614ddf573d5f803e3d5ffd5b505050506040513d601f19601f82011682018060405250810190614e039190615801565b10155b614e905760405162461bcd60e51b815260206004820152604f60248201527f4c49515549444154455f434f4d5054524f4c4c45525f43414c43554c4154455f60448201527f414d4f554e545f5345495a455f4641494c4544206f72204c495155494441544560648201526e0bea68a92b48abea89e9ebe9aaa869608b1b608482015260a401610bc8565b306001600160a01b03881603614eb357614eac308b8b846130cf565b9250614f26565b60405163b2a02ff160e01b81526001600160a01b0388169063b2a02ff190614ee3908d908d90869060040161586e565b6020604051808303815f875af1158015614eff573d5f803e3d5ffd5b505050506040513d601f19601f82011682018060405250810190614f239190615801565b92505b8215614f6b5760405162461bcd60e51b81526020600482015260146024820152731d1bdad95b881cd95a5e9d5c994819985a5b195960621b6044820152606401610bc8565b604080516001600160a01b038c811682528b81166020830152818301859052891660608201526080810183905290517f298637f684da70674f26509b10f07ec2fbc77a335ab1e7d6215a4b2484d8bb529181900360a00190a16005546040516347ef3b3b60e01b81523060048201526001600160a01b0389811660248301528c811660448301528b811660648301526084820185905260a48201849052909116906347ef3b3b9060c4015f604051808303815f87803b15801561502c575f80fd5b505af115801561503e573d5f803e3d5ffd5b505f925061504a915050565b95509093505050505b94509492505050565b5f805f80612970868661513d565b5f6150be826040518060400160405280602081526020017f5361666545524332303a206c6f772d6c6576656c2063616c6c206661696c6564815250856001600160a01b03166151aa9092919063ffffffff16565b905080515f14806150de5750808060200190518101906150de9190615818565b6135d35760405162461bcd60e51b815260206004820152602a60248201527f5361666545524332303a204552433230206f7065726174696f6e20646964206e6044820152691bdd081cdd58d8d9595960b21b6064820152608401610bc8565b5f61515360405180602001604052805f81525090565b5f80615167670de0b6b3a76400008761475f565b90925090505f82600381111561517f5761517f615799565b1461519d575060408051602081019091525f815290925090506129a9565b6129a281865f0151613b49565b6060610ee684845f85855f80866001600160a01b031685876040516151cf9190615b9e565b5f6040518083038185875af1925050503d805f8114615209576040519150601f19603f3d011682016040523d82523d5f602084013e61520e565b606091505b50915091506135b187838387606083156152885782515f03615281576001600160a01b0385163b6152815760405162461bcd60e51b815260206004820152601d60248201527f416464726573733a2063616c6c20746f206e6f6e2d636f6e74726163740000006044820152606401610bc8565b5081610ee6565b610ee6838381511561529d5781518083602001fd5b8060405162461bcd60e51b8152600401610bc89190615316565b6040805160c08101909152805f81526020015f81526020015f81526020015f81526020015f81526020015f81525090565b5f81518084528060208401602086015e5f602082860101526020601f19601f83011685010191505092915050565b602081525f610d8360208301846152e8565b6001600160a01b03811681146111d2575f80fd5b5f806040838503121561534d575f80fd5b823561535881615328565b946020939093013593505050565b5f60208284031215615376575f80fd5b8135610d8381615328565b5f60208284031215615391575f80fd5b5035919050565b634e487b7160e01b5f52604160045260245ffd5b5f67ffffffffffffffff808411156153c6576153c6615398565b604051601f8501601f19908116603f011681019082821181831017156153ee576153ee615398565b81604052809350858152868686011115615406575f80fd5b858560208301375f602087830101525050509392505050565b5f82601f83011261542e575f80fd5b610d83838335602085016153ac565b803560ff8116811461544d575f80fd5b919050565b5f805f805f805f60e0888a031215615468575f80fd5b873561547381615328565b9650602088013561548381615328565b9550604088013561549381615328565b945060608801359350608088013567ffffffffffffffff808211156154b6575f80fd5b6154c28b838c0161541f565b945060a08a01359150808211156154d7575f80fd5b506154e48a828b0161541f565b9250506154f360c0890161543d565b905092959891949750929550565b5f805f60608486031215615513575f80fd5b833561551e81615328565b9250602084013561552e81615328565b929592945050506040919091013590565b5f8060408385031215615550575f80fd5b50508035926020909101359150565b5f6020828403121561556f575f80fd5b813567ffffffffffffffff811115615585575f80fd5b8201601f81018413615595575f80fd5b610ee6848235602084016153ac565b5f805f805f8060c087890312156155b9575f80fd5b86356155c481615328565b955060208701356155d481615328565b945060408701359350606087013567ffffffffffffffff808211156155f7575f80fd5b6156038a838b0161541f565b94506080890135915080821115615618575f80fd5b5061562589828a0161541f565b92505061563460a0880161543d565b90509295509295509295565b5f8060408385031215615651575f80fd5b823561565c81615328565b9150602083013561566c81615328565b809150509250929050565b5f805f805f6080868803121561568b575f80fd5b853561569681615328565b945060208601356156a681615328565b935060408601359250606086013567ffffffffffffffff808211156156c9575f80fd5b818801915088601f8301126156dc575f80fd5b8135818111156156ea575f80fd5b8960208285010111156156fb575f80fd5b9699959850939650602001949392505050565b5f805f60608486031215615720575f80fd5b833561572b81615328565b925060208401359150604084013561574281615328565b809150509250925092565b600181811c9082168061576157607f821691505b602082108103612b6557634e487b7160e01b5f52602260045260245ffd5b6001600160a01b0392831681529116602082015260400190565b634e487b7160e01b5f52602160045260245ffd5b6020808252600a90820152691c994b595b9d195c995960b21b604082015260600190565b6020808252601690820152751858d8dc9d59481a5b9d195c995cdd0819985a5b195960521b604082015260600190565b5f60208284031215615811575f80fd5b5051919050565b5f60208284031215615828575f80fd5b81518015158114610d83575f80fd5b60208082526018908201527f6e6f7420616e20617070726f7665642064656c65676174650000000000000000604082015260600190565b6001600160a01b039384168152919092166020820152604081019190915260600190565b601f8211156135d357805f5260205f20601f840160051c810160208510156158b75750805b601f840160051c820191505b818110156158d6575f81556001016158c3565b5050505050565b815167ffffffffffffffff8111156158f7576158f7615398565b61590b81615905845461574d565b84615892565b602080601f83116001811461593e575f84156159275750858301515b5f19600386901b1c1916600185901b178555615995565b5f85815260208120601f198616915b8281101561596c5788860151825594840194600190910190840161594d565b508582101561598957878501515f19600388901b60f8161c191681555b505060018460011b0185555b505050505050565b634e487b7160e01b5f52601160045260245ffd5b80820180821115610a5557610a5561599d565b6001600160a01b03878116825260208201879052604082018690528416606082015260a06080820181905281018290525f828460c08401375f60c0848401015260c0601f19601f8501168301019050979650505050505050565b81810381811115610a5557610a5561599d565b6001600160a01b038481168252831660208201526060810160038310615a6557634e487b7160e01b5f52602160045260245ffd5b826040830152949350505050565b6001600160a01b039485168152928416602084015292166040820152606081019190915260800190565b6001600160a01b03831681526040602082018190525f90610ee6908301846152e8565b6001600160a01b039586168152938516602085015291841660408401529092166060820152608081019190915260a00190565b6001600160a01b0394909416845260208401929092526040830152606082015260800190565b5f60208284031215615b29575f80fd5b8151610d8381615328565b6001600160a01b0394851681529290931660208301526040820152606081019190915260800190565b5f82615b7757634e487b7160e01b5f52601260045260245ffd5b500490565b5f8060408385031215615b8d575f80fd5b505080516020909101519092909150565b5f82518060208501845e5f92019182525091905056fe7365745265647563655265736572766573426c6f636b44656c74612875696e7432353629736574466c6173684c6f616e4665654d616e74697373612875696e743235362c75696e7432353629ddf252ad1be2c89b69c2b068fc378daa952ba7f163c4a11628f55a4df523b3efa26469706673582212202ce591fb2eaf3d6ba9279e37f4546bf79309125aaf4b0adfd7a96d3d2010280664736f6c63430008190033",
  "deployedBytecode": "0x608060405234801561000f575f80fd5b5060043610610422575f3560e01c8063738439621161022c578063bd6d894d11610135578063e0847e5c116100bf578063f3fdb15a11610084578063f3fdb15a1461090a578063f5e3c4621461091d578063f851a44014610930578063f8f9da2814610948578063fca7820b14610950575f80fd5b8063e0847e5c146108c1578063e4c26305146108d4578063e9a44fd9146108dc578063e9c714f2146108ef578063f2b3abbd146108f7575f80fd5b8063d310dce511610105578063d310dce51461083d578063db006a7514610850578063dd5f608514610863578063dd62ed3e14610876578063df3a516e146108ae575f80fd5b8063bd6d894d146107e6578063c37f68e2146107ee578063c5ebeaec14610821578063d1109c2f14610834575f80fd5b8063a6afed95116101b6578063ae96f14111610186578063ae96f1411461079c578063ae9d70b0146107a5578063b2a02ff1146107ad578063b4a0bdf3146107c0578063b71d1a0c146107d3575f80fd5b8063a6afed9514610764578063a9059cbb1461076c578063aa5af0fd1461077f578063ae3fcb1f14610788575f80fd5b80638f840ddd116101fc5780638f840ddd1461071a57806395d89b411461072357806395dd91931461072b57806399d8c1b41461073e578063a0712d6814610751575f80fd5b806373843962146106e357806373acee98146106ec578063852a12e3146106f4578063856e5bb314610707575f80fd5b806328e2dc6c1161032e5780635635a689116102b8578063601a0bf111610288578063601a0bf1146106645780636c540baf146106775780636f307dc31461068057806370a082311461069357806371507cd5146106bb575f80fd5b80635635a6891461061857806356e677281461062b5780635c60da1b1461063e5780635fe3b56714610651575f80fd5b80633c86778e116102fe5780633c86778e146105ce5780633d9ea3a1146105e15780633e941010146105e95780634576b5db146105fc57806347bd37181461060f575f80fd5b806328e2dc6c1461058b578063313ce567146105945780633af9e669146105b35780633b1d21a2146105c6575f80fd5b8063182df0f5116103af57806323323e031161037f57806323323e031461051457806323b872dd146105275780632464176b1461053a5780632608f8181461054d5780632678224714610560575f80fd5b8063182df0f5146104dd5780631a31d465146104e5578063210bc052146104f8578063217e7de21461050b575f80fd5b8063107568df116103f5578063107568df1461049b578063153ab505146104b0578063173b9904146104b857806317bfdfbc146104c157806318160ddd146104d4575f80fd5b806306fdde0314610426578063095ea7b3146104445780630e32cb86146104675780630e75270214610488575b5f80fd5b61042e610963565b60405161043b9190615316565b60405180910390f35b61045761045236600461533c565b6109ef565b604051901515815260200161043b565b61047a610475366004615366565b610a5b565b60405190815260200161043b565b61047a610496366004615381565b610ad7565b6104ae6104a9366004615366565b610aea565b005b6104ae610b57565b61047a60085481565b61047a6104cf366004615366565b610bd3565b61047a600d5481565b61047a610c40565b6104ae6104f3366004615452565b610c58565b61047a61050636600461533c565b610ceb565b61047a60185481565b61047a61052236600461533c565b610d8a565b610457610535366004615501565b610d9f565b6104ae610548366004615381565b610dec565b61047a61055b36600461533c565b610e8d565b600454610573906001600160a01b031681565b6040516001600160a01b03909116815260200161043b565b61047a60175481565b6003546105a19060ff1681565b60405160ff909116815260200161043b565b61047a6105c1366004615366565b610e99565b61047a610eee565b61047a6105dc36600461553f565b610efc565b610457600181565b61047a6105f7366004615381565b610f79565b61047a61060a366004615366565b610f83565b61047a600b5481565b6104ae61062636600461533c565b6110a0565b6104ae61063936600461555f565b61115d565b601254610573906001600160a01b031681565b600554610573906001600160a01b031681565b61047a610672366004615381565b6111d5565b61047a60095481565b601154610573906001600160a01b031681565b61047a6106a1366004615366565b6001600160a01b03165f908152600e602052604090205490565b6106ce6106c9366004615381565b611261565b6040805192835260208301919091520161043b565b61047a60195481565b61047a6112c1565b61047a610702366004615381565b611324565b61047a61071536600461533c565b611330565b61047a600c5481565b61042e6113c8565b61047a610739366004615366565b6113d5565b6104ae61074c3660046155a4565b6113ee565b61047a61075f366004615381565b61154b565b61047a611556565b61045761077a36600461533c565b6118aa565b61047a600a5481565b60165461045790600160a01b900460ff1681565b61047a60145481565b61047a6118f6565b61047a6107bb366004615501565b61198b565b601654610573906001600160a01b031681565b61047a6107e1366004615366565b6119d7565b61047a611a44565b6108016107fc366004615366565b611aad565b60408051948552602085019390935291830152606082015260800161043b565b61047a61082f366004615381565b611b45565b61047a60135481565b61047a61084b36600461533c565b611b51565b61047a61085e366004615381565b611b95565b61047a61087136600461533c565b611ba1565b61047a610884366004615640565b6001600160a01b039182165f908152600f6020908152604080832093909416825291909152205490565b61047a6108bc36600461533c565b611c91565b61047a6108cf366004615677565b611d29565b61047a612035565b601554610573906001600160a01b031681565b61047a6120cf565b61047a610905366004615366565b6121b7565b600654610573906001600160a01b031681565b61047a61092b36600461570e565b61220a565b6003546105739061010090046001600160a01b031681565b61047a612221565b61047a61095e366004615381565b612273565b600180546109709061574d565b80601f016020809104026020016040519081016040528092919081815260200182805461099c9061574d565b80156109e75780601f106109be576101008083540402835291602001916109e7565b820191905f5260205f20905b8154815290600101906020018083116109ca57829003601f168201915b505050505081565b335f818152600f602090815260408083206001600160a01b038716808552925280832085905551919290917f8c5be1e5ebec7d5bd14f71427d1e84f3dd0314c0f7b2291e5b200ac8c7c3b92590610a499086815260200190565b60405180910390a35060015b92915050565b5f610a65336122ef565b610a6e82612340565b6016546040517f66fd58e82f7b31a2a5c30e0888f3093efe4e111b00cd2b0c31fe014601293aa091610aad916001600160a01b0390911690859061577f565b60405180910390a1601680546001600160a01b0319166001600160a01b0384161790555f92915050565b5f80610ae283612385565b509392505050565b610af3336122ef565b610afc81612340565b6015546040516001600160a01b038084169216907fafec95c8612496c3ecf5dddc71e393528fe29bd145fbaf9c6b496d78d7e2d79b905f90a3601580546001600160a01b0319166001600160a01b0392909216919091179055565b60035461010090046001600160a01b03163314610bd15760405162461bcd60e51b815260206004820152602d60248201527f6f6e6c79207468652061646d696e206d61792063616c6c205f72657369676e4960448201526c36b83632b6b2b73a30ba34b7b760991b60648201526084015b60405180910390fd5b565b5f805460ff16610bf55760405162461bcd60e51b8152600401610bc8906157ad565b5f805460ff19168155610c06611556565b14610c235760405162461bcd60e51b8152600401610bc8906157d1565b610c2c826113d5565b90505b5f805460ff19166001179055919050565b5f805f610c4b6123df565b91509150610a558261249f565b610c668686868686866113ee565b601180546001600160a01b0319166001600160a01b038916908117909155604080516318160ddd60e01b815290516318160ddd916004808201926020929091908290030181865afa158015610cbd573d5f803e3d5ffd5b505050506040513d601f19601f82011682018060405250810190610ce19190615801565b5050505050505050565b600554604051630217306760e31b81525f916001600160a01b0316906310b9833890610d1d908690339060040161577f565b602060405180830381865afa158015610d38573d5f803e3d5ffd5b505050506040513d601f19601f82011682018060405250810190610d5c9190615818565b610d785760405162461bcd60e51b8152600401610bc890615837565b610d838333846124ec565b9392505050565b5f80610d96848461252e565b50949350505050565b5f805460ff16610dc15760405162461bcd60e51b8152600401610bc8906157ad565b5f805460ff19168155610dd63386868661258a565b1490505f805460ff191660011790559392505050565b5f8111610e2b5760405162461bcd60e51b815260206004820152600d60248201526c125b9d985b1a5908125b9c1d5d609a1b6044820152606401610bc8565b610e4c604051806060016040528060248152602001615bb560249139612872565b60135460408051918252602082018390527fc2ac513cdb57f91eb2bef4db918c285829524f549682b99717c6cb06cc011183910160405180910390a1601355565b5f80610d96848461291f565b5f806040518060200160405280610eae611a44565b90526001600160a01b0384165f908152600e6020526040812054919250908190610ed9908490612962565b91509150610ee68261249f565b949350505050565b5f610ef76129b0565b905090565b5f610f1e604051806060016040528060288152602001615bd960289139612872565b6017546018546040805192835260208301869052820152606081018390527f2dad8739cf01e920af3ac912c516b0d9f2bb61b3ae0df6751ac15b4ce499b00c9060800160405180910390a1601783905560188290555f610d83565b5f610a55826129e0565b5f610f8d336122ef565b816001600160a01b0316627e3dd26040518163ffffffff1660e01b8152600401602060405180830381865afa158015610fc8573d5f803e3d5ffd5b505050506040513d601f19601f82011682018060405250810190610fec9190615818565b6110385760405162461bcd60e51b815260206004820152601c60248201527f6d61726b6572206d6574686f642072657475726e65642066616c7365000000006044820152606401610bc8565b6005546040517f7ac369dbd14fa5ea3f473ed67cc9d598964a77501540ba6751eb0b3decf5870d91611077916001600160a01b0390911690859061577f565b60405180910390a1600580546001600160a01b0319166001600160a01b0384161790555f610a55565b5f5460ff166110c15760405162461bcd60e51b8152600401610bc8906157ad565b5f805460ff191690556005546001600160a01b031633146110f5576040516383aebebd60e01b815260040160405180910390fd5b6110ff8282612a35565b505f6019556011546040517f68b82a3660c18f42f79224a889197b758371b130ef33e93ecdbcf6bdd687b49391611145916001600160a01b03909116908590859061586e565b60405180910390a150505f805460ff19166001179055565b60035461010090046001600160a01b031633146111d25760405162461bcd60e51b815260206004820152602d60248201527f6f6e6c79207468652061646d696e206d61792063616c6c205f6265636f6d654960448201526c36b83632b6b2b73a30ba34b7b760991b6064820152608401610bc8565b50565b5f805460ff166111f75760405162461bcd60e51b8152600401610bc8906157ad565b5f805460ff1916905560408051808201909152601881527f5f72656475636552657365727665732875696e74323536290000000000000000602082015261123d90612872565b6112476031612b38565b50436014540361125857505f610c2f565b610c2c82612b6b565b5f805f805f611280604051806020016040528088815250601754612962565b909350915061128e8361249f565b6112a8604051806020016040528084815250601854612962565b90935090506112b68361249f565b909590945092505050565b5f805460ff166112e35760405162461bcd60e51b8152600401610bc8906157ad565b5f805460ff191681556112f4611556565b146113115760405162461bcd60e51b8152600401610bc8906157d1565b50600b545f805460ff1916600117905590565b5f610a55333384612ca5565b600554604051630217306760e31b81525f916001600160a01b0316906310b9833890611362908690339060040161577f565b602060405180830381865afa15801561137d573d5f803e3d5ffd5b505050506040513d601f19601f820116820180604052508101906113a19190615818565b6113bd5760405162461bcd60e51b8152600401610bc890615837565b610d83833384612ce7565b600280546109709061574d565b5f805f6113e184612d2a565b91509150610d838261249f565b6113f7336122ef565b6009541580156114075750600a54155b801561141257505f84115b61146a5760405162461bcd60e51b815260206004820152602360248201527f6d61726b6574206d6179206f6e6c7920626520696e697469616c697a6564206f6044820152626e636560e81b6064820152608401610bc8565b60078490555f61147987610f83565b43600955670de0b6b3a7640000600a5590505f61149587612ddd565b9050811580156114a3575080155b61150b5760405162461bcd60e51b815260206004820152603360248201527f636f6d7074726f6c6c6572206f7220696e746572657374206d6f64656c20696e6044820152721a5d1a585b1a5e985d1a5bdb8819985a5b1959606a1b6064820152608401610bc8565b600161151786826158dd565b50600261152485826158dd565b50506003805460ff90931660ff19938416179055505f805490911660011790555050505050565b5f80610ae283612f07565b6009545f90439081810361156d575f5b9250505090565b5f6115766129b0565b600b54600c54600a546006546040516315f2405360e01b81526004810186905260248101859052604481018490529495509293919290915f916001600160a01b0316906315f2405390606401602060405180830381865afa1580156115dd573d5f803e3d5ffd5b505050506040513d601f19601f820116820180604052508101906116019190615801565b905065048c273950008111156116595760405162461bcd60e51b815260206004820152601c60248201527f626f72726f772072617465206973206162737572646c792068696768000000006044820152606401610bc8565b5f806116658989612f49565b915091506116728261249f565b60408051602081019091525f81525f805f8061169c60405180602001604052808a81525087612f69565b90975094505f8760038111156116b4576116b4615799565b146116ea576116d7600960068960038111156116d2576116d2615799565b612fde565b9e50505050505050505050505050505090565b6116f4858c612962565b90975093505f87600381111561170c5761170c615799565b1461172a576116d7600960018960038111156116d2576116d2615799565b611734848c613055565b90975092505f87600381111561174c5761174c615799565b1461176a576116d7600960048960038111156116d2576116d2615799565b6117856040518060200160405280600854815250858c613078565b90975091505f87600381111561179d5761179d615799565b146117bb576116d7600960058960038111156116d2576116d2615799565b6117c6858a8b613078565b90975090505f8760038111156117de576117de615799565b146117fc576116d7600960038960038111156116d2576116d2615799565b60098e9055600a819055600b839055600c82905560145461181e908f90612f49565b909750955061182c8761249f565b601354861061185c5760148e9055818c10156118515761184b8c612b6b565b5061185c565b61185a82612b6b565b505b604080518d815260208101869052908101829052606081018490527f4dec04e750ca11537cabcd8a9eab06494de08da3735bc8871cd41250e190bc049060800160405180910390a15f6116d7565b5f805460ff166118cc5760405162461bcd60e51b8152600401610bc8906157ad565b5f805460ff191681556118e13333868661258a565b1490505f805460ff1916600117905592915050565b6006545f906001600160a01b031663b81688166119116129b0565b600b54600c546008546040516001600160e01b031960e087901b16815260048101949094526024840192909252604483015260648201526084015b602060405180830381865afa158015611967573d5f803e3d5ffd5b505050506040513d601f19601f82011682018060405250810190610ef79190615801565b5f805460ff166119ad5760405162461bcd60e51b8152600401610bc8906157ad565b5f805460ff191690556119c2338585856130cf565b90505f805460ff191660011790559392505050565b5f6119e1336122ef565b600480546001600160a01b038481166001600160a01b03198316179092556040519116907fca4f2f25d0898edd99413412fb94012f9e54ec8142f9b093e7720646a95b16a990611a34908390869061577f565b60405180910390a15f9392505050565b5f805460ff16611a665760405162461bcd60e51b8152600401610bc8906157ad565b5f805460ff19168155611a77611556565b14611a945760405162461bcd60e51b8152600401610bc8906157d1565b611a9c610c40565b90505f805460ff1916600117905590565b5f805f805f805f611abd88612d2a565b935090505f816003811115611ad457611ad4615799565b14611aef5760095b5f805f9650965096509650505050611b3e565b611af76123df565b925090505f816003811115611b0e57611b0e615799565b14611b1a576009611adc565b506001600160a01b0387165f908152600e6020526040812054909650945090925090505b9193509193565b5f610a55333384612ce7565b6005545f906001600160a01b03163314611b7e576040516383aebebd60e01b815260040160405180910390fd5b611b886008612b38565b50610d83835f845f61330d565b5f610a553333846124ec565b5f805460ff16611bc35760405162461bcd60e51b8152600401610bc8906157ad565b5f805460ff191690556005546001600160a01b03163314611bf7576040516383aebebd60e01b815260040160405180910390fd5b6015546001600160a01b03848116911614611c23578160195f828254611c1d91906159b1565b90915550505b611c2d83836135bc565b611c356129b0565b6011546040519192507f2ea8652d94d7f92e51969d27c6b12db2cf1bcafb0ef824ce90eb1488f4d1f77891611c77916001600160a01b0316908690869061586e565b60405180910390a15f805460ff1916600117905592915050565b600554604051630217306760e31b81525f916001600160a01b0316906310b9833890611cc3908690339060040161577f565b602060405180830381865afa158015611cde573d5f803e3d5ffd5b505050506040513d601f19601f82011682018060405250810190611d029190615818565b611d1e5760405162461bcd60e51b8152600401610bc890615837565b610d83833384612ca5565b5f805460ff16611d4b5760405162461bcd60e51b8152600401610bc8906157ad565b5f805460ff19169055601654600160a01b900460ff16611d7e57604051630a3fad8360e01b815260040160405180910390fd5b611d8785612340565b60055460405163e0f6123d60e01b81526001600160a01b0388811660048301529091169063e0f6123d90602401602060405180830381865afa158015611dcf573d5f803e3d5ffd5b505050506040513d601f19601f82011682018060405250810190611df39190615818565b611e1b57604051630b59dd5360e21b81526001600160a01b0387166004820152602401610bc8565b8360195f828254611e2c91906159b1565b90915550611e3c905085856135bc565b5f611e456129b0565b90505f80611e5287611261565b90925090505f611e6283896159b1565b601154604051631b11d0ff60e01b81529192506001600160a01b03808c1692631b11d0ff92611e9f9216908c90889033908e908e906004016159c4565b6020604051808303815f875af1158015611ebb573d5f803e3d5ffd5b505050506040513d601f19601f82011682018060405250810190611edf9190615818565b611efc57604051635a3b2cbb60e11b815260040160405180910390fd5b611f068982612a35565b508760195f828254611f189190615a1e565b9091555081905084611f286129b0565b611f329190615a1e565b1015611f5157604051630443f54160e21b815260040160405180910390fd5b601554611f67906001600160a01b0316836135bc565b6015546005546011546040516305bebb3b60e21b81526001600160a01b03938416936316faecec93611fa59390821692911690600290600401615a31565b5f604051808303815f87803b158015611fbc575f80fd5b505af1158015611fce573d5f803e3d5ffd5b50506011546040517fd9695a91e344c843728f8b129d7a8f4b5d524af23f18b18dceb82c7381867957935061201192508c916001600160a01b0316908c9061586e565b60405180910390a15f9450505050505f805460ff1916600117905595945050505050565b5f61206860405180604001604052806011815260200170746f67676c65466c6173684c6f616e282960781b815250612872565b6016805460ff600160a01b808304821615810260ff60a01b199093169290921792839055604080519290930416158082521560208201527f1b65e31cf631906dfb880bc178d7fa09439e2e97c2e344793609a80ac5b4a8ca910160405180910390a1505f90565b6004545f906001600160a01b031633146120ee57610ef760015f6135d8565b60038054600480546001600160a01b03818116610100818102610100600160a81b0319871617968790556001600160a01b03199093169093556040519382900481169492937ff9ffabca9c8276e99321725bcb43fb076a6c66a54b7f21c4e8146d8519b417dc936121649387939104169061577f565b60405180910390a16004546040517fca4f2f25d0898edd99413412fb94012f9e54ec8142f9b093e7720646a95b16a9916121a99184916001600160a01b03169061577f565b60405180910390a15f611566565b5f6121f66040518060400160405280601e81526020017f5f736574496e746572657374526174654d6f64656c2861646472657373290000815250612872565b6122006041612b38565b50610a5582612ddd565b5f8061221785858561364f565b5095945050505050565b6006545f906001600160a01b03166315f2405361223c6129b0565b600b54600c546040516001600160e01b031960e086901b16815260048101939093526024830191909152604482015260640161194c565b5f805460ff166122955760405162461bcd60e51b8152600401610bc8906157ad565b5f805460ff1916905560408051808201909152601a81527f5f73657452657365727665466163746f722875696e743235362900000000000060208201526122db90612872565b6122e56047612b38565b50610c2c82613740565b6003546001600160a01b0382811661010090920416146111d25760405162461bcd60e51b815260206004820152600c60248201526b155b985d5d1a1bdc9a5e995960a21b6044820152606401610bc8565b6001600160a01b0381166111d25760405162461bcd60e51b815260206004820152600c60248201526b7a65726f206164647265737360a01b6044820152606401610bc8565b5f8054819060ff166123a95760405162461bcd60e51b8152600401610bc8906157ad565b5f805460ff191690556123bc6037612b38565b506123c83333856137b0565b915091505f805460ff191660011790559092909150565b600d545f9081908082036123f95750506007545f92909150565b5f6124026129b0565b90505f61241a60405180602001604052805f81525090565b5f6124376019548561242c91906159b1565b600b54600c54613b09565b935090505f81600381111561244e5761244e615799565b1461245f57965f9650945050505050565b6124698386613b49565b925090505f81600381111561248057612480615799565b1461249157965f9650945050505050565b50515f969095509350505050565b5f8160038111156124b2576124b2615799565b146111d25760405162461bcd60e51b815260206004820152600a60248201526936b0ba341032b93937b960b11b6044820152606401610bc8565b5f805460ff1661250e5760405162461bcd60e51b8152600401610bc8906157ad565b5f805460ff191690556125216027612b38565b506119c28484845f613c0b565b5f8054819060ff166125525760405162461bcd60e51b8152600401610bc8906157ad565b5f805460ff19169055612565601e612b38565b5061257133858561426d565b915091505f805460ff1916600117905590939092509050565b6005546040516317b9b84b60e31b81525f9182916001600160a01b039091169063bdcdc258906125c4903090899089908990600401615a73565b6020604051808303815f875af11580156125e0573d5f803e3d5ffd5b505050506040513d601f19601f820116820180604052508101906126049190615801565b90508015612621576126196003604b83612fde565b915050610ee6565b836001600160a01b0316856001600160a01b031603612646576126196002604c6135d8565b5f856001600160a01b0316876001600160a01b03160361266857505f1961268f565b506001600160a01b038086165f908152600f60209081526040808320938a16835292905220545b5f805f8061269d8589612f49565b90945092505f8460038111156126b5576126b5615799565b146126d3576126c66009604c6135d8565b9650505050505050610ee6565b6001600160a01b038a165f908152600e60205260409020546126f59089612f49565b90945091505f84600381111561270d5761270d615799565b1461271e576126c66009604d6135d8565b6001600160a01b0389165f908152600e60205260409020546127409089613055565b90945090505f84600381111561275857612758615799565b14612769576126c66009604e6135d8565b6001600160a01b03808b165f908152600e6020526040808220859055918b168152208190555f1985146127be576001600160a01b03808b165f908152600f60209081526040808320938f168352929052208390555b886001600160a01b03168a6001600160a01b03165f80516020615c018339815191528a6040516127f091815260200190565b60405180910390a360055460405163352b4a3f60e11b81526001600160a01b0390911690636a56947e9061282e9030908e908e908e90600401615a73565b5f604051808303815f87803b158015612845575f80fd5b505af1158015612857573d5f803e3d5ffd5b505f9250612863915050565b9b9a5050505050505050505050565b6016546040516318c5e8ab60e01b81526001600160a01b03909116906318c5e8ab906128a49033908590600401615a9d565b602060405180830381865afa1580156128bf573d5f803e3d5ffd5b505050506040513d601f19601f820116820180604052508101906128e39190615818565b6111d25760405162461bcd60e51b815260206004820152600d60248201526c1858d8d95cdcc819195b9a5959609a1b6044820152606401610bc8565b5f8054819060ff166129435760405162461bcd60e51b8152600401610bc8906157ad565b5f805460ff191690556129566036612b38565b506125713385856137b0565b5f805f806129708686612f69565b90925090505f82600381111561298857612988615799565b14612998575091505f90506129a9565b5f6129a28261460d565b9350935050505b9250929050565b6011546040516370a0823160e01b81523060048201525f916001600160a01b0316906370a082319060240161194c565b5f805460ff16612a025760405162461bcd60e51b8152600401610bc8906157ad565b5f805460ff19169055612a15604f612b38565b505f612a2083614624565b509150505f805460ff19166001179055919050565b6011546040516370a0823160e01b81523060048201525f916001600160a01b031690829082906370a0823190602401602060405180830381865afa158015612a7f573d5f803e3d5ffd5b505050506040513d601f19601f82011682018060405250810190612aa39190615801565b9050612aba6001600160a01b038316863087614701565b6040516370a0823160e01b81523060048201525f906001600160a01b038416906370a0823190602401602060405180830381865afa158015612afe573d5f803e3d5ffd5b505050506040513d601f19601f82011682018060405250810190612b229190615801565b9050612b2e8282615a1e565b9695505050505050565b5f80612b42611556565b90508015612b6557610d83816011811115612b5f57612b5f615799565b846135d8565b50919050565b5f815f03612b79575f610a55565b4360095414612b8e57610a55600a60346135d8565b81612b976129b0565b1015612ba957610a55600e60336135d8565b600c54821115612bbf57610a55600260356135d8565b81600c54612bcd9190615a1e565b600c55601554612be6906001600160a01b0316836135bc565b6015546005546011546040516305bebb3b60e21b81526001600160a01b03938416936316faecec93612c2393908216929116905f90600401615a31565b5f604051808303815f87803b158015612c3a575f80fd5b505af1158015612c4c573d5f803e3d5ffd5b5050601554600c54604080516001600160a01b039093168352602083018790528201527f3bad0c59cf2f06e7314077049f48a93578cd16f5ef92329f1dab1420a99c177e9250606001905060405180910390a15f610a55565b5f805460ff16612cc75760405162461bcd60e51b8152600401610bc8906157ad565b5f805460ff19169055612cda6027612b38565b506119c284845f85613c0b565b5f805460ff16612d095760405162461bcd60e51b8152600401610bc8906157ad565b5f805460ff19169055612d1c6008612b38565b506119c2848484600161330d565b6001600160a01b0381165f908152601060205260408120805482918291829182918203612d5f57505f96879650945050505050565b612d6e815f0154600a5461475f565b90945092505f846003811115612d8657612d86615799565b14612d98575091955f95509350505050565b612da683826001015461479c565b90945091505f846003811115612dbe57612dbe615799565b14612dd0575091955f95509350505050565b505f969095509350505050565b5f4360095414612df357610a55600a60426135d8565b816001600160a01b0316632191f92a6040518163ffffffff1660e01b8152600401602060405180830381865afa158015612e2f573d5f803e3d5ffd5b505050506040513d601f19601f82011682018060405250810190612e539190615818565b612e9f5760405162461bcd60e51b815260206004820152601c60248201527f6d61726b6572206d6574686f642072657475726e65642066616c7365000000006044820152606401610bc8565b6006546040517fedffc32e068c7c95dfd4bdfd5c4d939a084d6b11c4199eac8436ed234d72f92691612ede916001600160a01b0390911690859061577f565b60405180910390a1600680546001600160a01b0319166001600160a01b0384161790555f610a55565b5f8054819060ff16612f2b5760405162461bcd60e51b8152600401610bc8906157ad565b5f805460ff19169055612f3e601e612b38565b506123c833846147c6565b5f80838311612f5e57505f90508183036129a9565b50600390505f6129a9565b5f612f7f60405180602001604052805f81525090565b5f80612f8e865f01518661475f565b90925090505f826003811115612fa657612fa6615799565b14612fc4575060408051602081019091525f815290925090506129a9565b60408051602081019091529081525f969095509350505050565b5f7f45b96fe442630264581b197e84bbada861235052c5a1aadfff9ea4e40a969aa084601181111561301257613012615799565b84605681111561302457613024615799565b604080519283526020830191909152810184905260600160405180910390a1836011811115610ee657610ee6615799565b5f8083830184811061306b575f925090506129a9565b60025f92509250506129a9565b5f805f806130868787612f69565b90925090505f82600381111561309e5761309e615799565b146130ae575091505f90506130c7565b6130c06130ba8261460d565b86613055565b9350935050505b935093915050565b60055460405163d02f735160e01b81525f9182916001600160a01b039091169063d02f73519061310b9030908a908a908a908a90600401615ac0565b6020604051808303815f875af1158015613127573d5f803e3d5ffd5b505050506040513d601f19601f8201168201806040525081019061314b9190615801565b90508015613160576126196003601b83612fde565b846001600160a01b0316846001600160a01b031603613185576126196006601c6135d8565b6001600160a01b0384165f908152600e6020526040812054819081906131ab9087612f49565b90935091505f8360038111156131c3576131c3615799565b146131ec576131e16009601a8560038111156116d2576116d2615799565b945050505050610ee6565b6001600160a01b0388165f908152600e602052604090205461320e9087613055565b90935090505f83600381111561322657613226615799565b14613244576131e1600960198560038111156116d2576116d2615799565b6001600160a01b038088165f818152600e6020526040808220869055928b168082529083902084905591515f80516020615c018339815191529061328b908a815260200190565b60405180910390a3600554604051636d35bf9160e01b81526001600160a01b0390911690636d35bf91906132cb9030908d908d908d908d90600401615ac0565b5f604051808303815f87803b1580156132e2575f80fd5b505af11580156132f4573d5f803e3d5ffd5b505f9250613300915050565b9998505050505050505050565b60055460405163368f515360e21b81525f9182916001600160a01b039091169063da3d454c906133459030908a90899060040161586e565b6020604051808303815f875af1158015613361573d5f803e3d5ffd5b505050506040513d601f19601f820116820180604052508101906133859190615801565b9050801561339a576126196003600e83612fde565b43600954146133ae57612619600a806135d8565b836133b76129b0565b10156133c957612619600e60096135d8565b6133f16040805160808101909152805f81526020015f81526020015f81526020015f81525090565b6133fa87612d2a565b602083018190528282600381111561341457613414615799565b600381111561342557613425615799565b9052505080516134349061249f565b613442816020015186613055565b604083018190528282600381111561345c5761345c615799565b600381111561346d5761346d615799565b90525050805161347c9061249f565b613488600b5486613055565b60608301819052828260038111156134a2576134a2615799565b60038111156134b3576134b3615799565b9052505080516134c29061249f565b6040808201516001600160a01b0389165f908152601060205291909120908155600a546001909101556060810151600b5583156135035761350386866135bc565b7f13ed6866d4e1ee6da46f845c46d7e54120883d75c5ea9a2dacc1c4ca8984ab808786836040015184606001516040516135409493929190615af3565b60405180910390a1600554604051635c77860560e01b81526001600160a01b0390911690635c7786059061357c9030908b908a9060040161586e565b5f604051808303815f87803b158015613593575f80fd5b505af11580156135a5573d5f803e3d5ffd5b505f92506135b1915050565b979650505050505050565b6011546001600160a01b03166135d3818484614b38565b505050565b5f7f45b96fe442630264581b197e84bbada861235052c5a1aadfff9ea4e40a969aa083601181111561360c5761360c615799565b83605681111561361e5761361e615799565b6040805192835260208301919091525f9082015260600160405180910390a1826011811115610d8357610d83615799565b5f8054819060ff166136735760405162461bcd60e51b8152600401610bc8906157ad565b5f805460ff19169055613686600f612b38565b505f836001600160a01b031663a6afed956040518163ffffffff1660e01b81526004016020604051808303815f875af11580156136c5573d5f803e3d5ffd5b505050506040513d601f19601f820116820180604052508101906136e99190615801565b905080156137185761370d81601181111561370657613706615799565b60106135d8565b5f925092505061372a565b61372433878787614b68565b92509250505b5f805460ff191660011790559094909350915050565b5f436009541461375657610a55600a60496135d8565b670de0b6b3a764000082111561377257610a556002604a6135d8565b600880549083905560408051828152602081018590527faaa68312e2ea9d50e16af5068410ab56e1a1fd06037b1a35664812c30f8214609101611a34565b600554604051631200453160e11b81525f91829182916001600160a01b0316906324008a62906137ea9030908a908a908a90600401615a73565b6020604051808303815f875af1158015613806573d5f803e3d5ffd5b505050506040513d601f19601f8201168201806040525081019061382a9190615801565b9050801561384a5761383f6003603983612fde565b5f92509250506130c7565b436009541461385f5761383f600a603a6135d8565b6138a0604080516101008101909152805f81526020015f81526020015f81526020015f81526020015f81526020015f81526020015f81526020015f81525090565b6001600160a01b0386165f9081526010602052604090206001015460608201526138c986612d2a565b60808301819052602083018260038111156138e6576138e6615799565b60038111156138f7576138f7615799565b8152505050613909816020015161249f565b5f1985036139205760808101516040820152613928565b604081018590525b613936878260400151612a35565b60e08201819052608082015161394b91612f49565b60a083018190526020830182600381111561396857613968615799565b600381111561397957613979615799565b815250505061398b816020015161249f565b61399b600b548260e00151612f49565b60c08301819052602083018260038111156139b8576139b8615799565b60038111156139c9576139c9615799565b81525050506139db816020015161249f565b60a081810180516001600160a01b038981165f81815260106020908152604091829020948555600a5460019095019490945560c0870151600b81905560e088015195518251948f16855294840192909252820193909352606081019190915260808101919091527f1a2a22cb034d26d1854bdc6666a5b91fe25efbbb5dcad3b0355478d6f5c362a1910160405180910390a160055460e08201516060830151604051631ededc9160e01b81523060048201526001600160a01b038b811660248301528a8116604483015260648201939093526084810191909152911690631ededc919060a4015f604051808303815f87803b158015613ad8575f80fd5b505af1158015613aea573d5f803e3d5ffd5b505f9250613af6915050565b8160e00151935093505050935093915050565b5f805f80613b178787613055565b90925090505f826003811115613b2f57613b2f615799565b14613b3f575091505f90506130c7565b6130c08186612f49565b5f613b5f60405180602001604052805f81525090565b5f80613b7386670de0b6b3a764000061475f565b90925090505f826003811115613b8b57613b8b615799565b14613ba9575060408051602081019091525f815290925090506129a9565b5f80613bb5838861479c565b90925090505f826003811115613bcd57613bcd615799565b14613bef578160405180602001604052805f81525095509550505050506129a9565b60408051602081019091529081525f9890975095505050505050565b5f821580613c17575081155b613c805760405162461bcd60e51b815260206004820152603460248201527f6f6e65206f662072656465656d546f6b656e73496e206f722072656465656d416044820152736d6f756e74496e206d757374206265207a65726f60601b6064820152608401610bc8565b613c886152b7565b613c906123df565b6020830181905282826003811115613caa57613caa615799565b6003811115613cbb57613cbb615799565b905250508051613cca9061249f565b8315613d3157604080820185905280516020808201909252908201518152613cf29085612962565b6060830181905282826003811115613d0c57613d0c615799565b6003811115613d1d57613d1d615799565b905250508051613d2c9061249f565b613d8f565b613d4d836040518060200160405280846020015181525061505c565b6040830181905282826003811115613d6757613d67615799565b6003811115613d7857613d78615799565b905250508051613d879061249f565b606081018390525b600554604080830151905163eabe7d9160e01b81525f926001600160a01b03169163eabe7d9191613dc79130918c919060040161586e565b6020604051808303815f875af1158015613de3573d5f803e3d5ffd5b505050506040513d601f19601f82011682018060405250810190613e079190615801565b90508015613e2557613e1c6003602883612fde565b92505050610ee6565b4360095414613e3a57613e1c600a602d6135d8565b613e4a600d548360400151612f49565b6080840181905283826003811115613e6457613e64615799565b6003811115613e7557613e75615799565b905250508151613e849061249f565b6001600160a01b0387165f908152600e6020526040908190205490830151613eac9190612f49565b60a0840181905283826003811115613ec657613ec6615799565b6003811115613ed757613ed7615799565b905250508151613ee69061249f565b8160600151613ef36129b0565b1015613f0557613e1c600e60296135d8565b6080820151600d5560a08201516001600160a01b038089165f908152600e60209081526040808320949094556005548451629df3ab60e31b815294519294859491909116926304ef9d58926004808401939192918290030181865afa158015613f70573d5f803e3d5ffd5b505050506040513d601f19601f82011682018060405250810190613f949190615801565b1561419b57606084015160055460408051629df3ab60e31b8152905161401093926001600160a01b0316916304ef9d589160048083019260209291908290030181865afa158015613fe7573d5f803e3d5ffd5b505050506040513d601f19601f8201168201806040525081019061400b9190615801565b61475f565b9250828582600381111561402657614026615799565b600381111561403757614037615799565b9052505083516140469061249f565b61405882670de0b6b3a764000061479c565b9250828582600381111561406e5761406e615799565b600381111561407f5761407f615799565b90525050835161408e9061249f565b61409c846060015183612f49565b915081858260038111156140b2576140b2615799565b60038111156140c3576140c3615799565b9052505083516140d29061249f565b6005546040805163c5f956af60e01b815290515f926001600160a01b03169163c5f956af9160048083019260209291908290030181865afa158015614119573d5f803e3d5ffd5b505050506040513d601f19601f8201168201806040525081019061413d9190615b19565b905061414981846135bc565b60408086015181516001600160a01b038d16815260208101869052918201527fccf8e53b86a99b7e9ecf796342c165764d66154780f638c08e6241d711fba6d49060600160405180910390a1506141a2565b5060608301515b6141ac88826135bc565b306001600160a01b0316896001600160a01b03165f80516020615c0183398151915286604001516040516141e291815260200190565b60405180910390a37fbd5034ffbd47e4e72a94baa2cdb74c6fad73cb3bcdc13036b72ec8306f5a7646898286604001518760a001516040516142279493929190615af3565b60405180910390a1600554606085015160408087015190516351dff98960e01b81526001600160a01b03909316926351dff989926132cb9230928f929190600401615b34565b5f8061427884612340565b600554604051634ef4c3e160e01b81525f916001600160a01b031690634ef4c3e1906142ac9030908990899060040161586e565b6020604051808303815f875af11580156142c8573d5f803e3d5ffd5b505050506040513d601f19601f820116820180604052508101906142ec9190615801565b905080156143015761383f6003601f83612fde565b43600954146143165761383f600a60226135d8565b61431e6152b7565b6143266123df565b602083018190528282600381111561434057614340615799565b600381111561435157614351615799565b9052505f90508151600381111561436a5761436a615799565b146143975761438b60096021835f015160038111156116d2576116d2615799565b5f9350935050506130c7565b6143a18786612a35565b60a082018190526040805160208082019092529083015181526143c4919061505c565b60408301819052828260038111156143de576143de615799565b60038111156143ef576143ef615799565b9052505080516143fe9061249f565b61440e600d548260400151613055565b606083018190528282600381111561442857614428615799565b600381111561443957614439615799565b9052505080516144489061249f565b6001600160a01b0386165f908152600e60205260409081902054908201516144709190613055565b608083018190528282600381111561448a5761448a615799565b600381111561449b5761449b615799565b9052505080516144aa9061249f565b6060810151600d556080810180516001600160a01b0388165f908152600e6020526040908190209190915560a083015181840151925191517fa24ddbdf0865ba440d364725c062eac72a908faeedffc33fe64d4640c82e3ab893614541938c938c93909291906001600160a01b03958616815293909416602084015260408301919091526060820152608081019190915260a00190565b60405180910390a1856001600160a01b0316306001600160a01b03165f80516020615c01833981519152836040015160405161457f91815260200190565b60405180910390a360055460a082015160408084015190516341c728b960e01b81526001600160a01b03909316926341c728b9926145c59230928c929190600401615b34565b5f604051808303815f87803b1580156145dc575f80fd5b505af11580156145ee573d5f803e3d5ffd5b505f92506145fa915050565b8160a00151935093505050935093915050565b80515f90610a5590670de0b6b3a764000090615b5d565b5f805f8043600954146146475761463d600a60506135d8565b9590945092505050565b6146513386612a35565b905080600c5461466191906159b1565b9150600c548210156146b55760405162461bcd60e51b815260206004820181905260248201527f61646420726573657276657320756e6578706563746564206f766572666c6f776044820152606401610bc8565b600c82905560408051338152602081018390529081018390527fa91e67c5ea634cd43a12c5a482724b03de01e85ca68702a53d0c2f45cb7c1dc59060600160405180910390a15f61463d565b614759846323b872dd60e01b8585856040516024016147229392919061586e565b60408051601f198184030181529190526020810180516001600160e01b03166001600160e01b03199093169290921790915261506a565b50505050565b5f80835f0361477257505f9050806129a9565b838302836147808683615b5d565b146147925760025f92509250506129a9565b5f925090506129a9565b5f80825f036147b05750600190505f6129a9565b5f6147bb8486615b5d565b915091509250929050565b600554604051634ef4c3e160e01b81525f91829182916001600160a01b031690634ef4c3e1906147fe9030908990899060040161586e565b6020604051808303815f875af115801561481a573d5f803e3d5ffd5b505050506040513d601f19601f8201168201806040525081019061483e9190615801565b9050801561485e576148536003601f83612fde565b5f92509250506129a9565b436009541461487357614853600a60226135d8565b61487b6152b7565b6148836123df565b602083018190528282600381111561489d5761489d615799565b60038111156148ae576148ae615799565b9052505f9050815160038111156148c7576148c7615799565b146148f4576148e860096021835f015160038111156116d2576116d2615799565b5f9350935050506129a9565b6148fe8686612a35565b60a08201819052604080516020808201909252908301518152614921919061505c565b604083018190528282600381111561493b5761493b615799565b600381111561494c5761494c615799565b90525050805161495b9061249f565b61496b600d548260400151613055565b606083018190528282600381111561498557614985615799565b600381111561499657614996615799565b9052505080516149a59061249f565b6001600160a01b0386165f908152600e60205260409081902054908201516149cd9190613055565b60808301819052828260038111156149e7576149e7615799565b60038111156149f8576149f8615799565b905250508051614a079061249f565b6060810151600d556080810180516001600160a01b0388165f908152600e6020526040908190209190915560a083015181840151925191517fb4c03061fb5b7fed76389d5af8f2e0ddb09f8c70d1333abbb62582835e10accb93614a6d938b9392615af3565b60405180910390a1856001600160a01b0316306001600160a01b03165f80516020615c018339815191528360400151604051614aab91815260200190565b60405180910390a360055460a082015160408084015190516341c728b960e01b81526001600160a01b03909316926341c728b992614af19230928c929190600401615b34565b5f604051808303815f87803b158015614b08575f80fd5b505af1158015614b1a573d5f803e3d5ffd5b505f9250614b26915050565b8160a001519350935050509250929050565b6040516001600160a01b0383166024820152604481018290526135d390849063a9059cbb60e01b90606401614722565b600554604051632fe3f38f60e11b81525f91829182916001600160a01b031690635fc7e71e90614ba490309088908c908c908c90600401615ac0565b6020604051808303815f875af1158015614bc0573d5f803e3d5ffd5b505050506040513d601f19601f82011682018060405250810190614be49190615801565b90508015614c0457614bf96003601283612fde565b5f9250925050615053565b4360095414614c1957614bf9600a60166135d8565b43846001600160a01b0316636c540baf6040518163ffffffff1660e01b8152600401602060405180830381865afa158015614c56573d5f803e3d5ffd5b505050506040513d601f19601f82011682018060405250810190614c7a9190615801565b14614c8b57614bf9600a60116135d8565b866001600160a01b0316866001600160a01b031603614cb057614bf9600660176135d8565b845f03614cc357614bf9600760156135d8565b5f198503614cd757614bf9600760146135d8565b5f80614ce48989896137b0565b90925090508115614d1857614d0b826011811115614d0457614d04615799565b60186135d8565b5f94509450505050615053565b600554604051630779996560e11b81525f916001600160a01b031690630ef332ca90614d4e908c9030908c908890600401615a73565b6040805180830381865afa158015614d68573d5f803e3d5ffd5b505050506040513d601f19601f82011682018060405250810190614d8c9190615b7c565b91505082158015614e0657506040516370a0823160e01b81526001600160a01b038a811660048301528291908916906370a0823190602401602060405180830381865afa158015614ddf573d5f803e3d5ffd5b505050506040513d601f19601f82011682018060405250810190614e039190615801565b10155b614e905760405162461bcd60e51b815260206004820152604f60248201527f4c49515549444154455f434f4d5054524f4c4c45525f43414c43554c4154455f60448201527f414d4f554e545f5345495a455f4641494c4544206f72204c495155494441544560648201526e0bea68a92b48abea89e9ebe9aaa869608b1b608482015260a401610bc8565b306001600160a01b03881603614eb357614eac308b8b846130cf565b9250614f26565b60405163b2a02ff160e01b81526001600160a01b0388169063b2a02ff190614ee3908d908d90869060040161586e565b6020604051808303815f875af1158015614eff573d5f803e3d5ffd5b505050506040513d601f19601f82011682018060405250810190614f239190615801565b92505b8215614f6b5760405162461bcd60e51b81526020600482015260146024820152731d1bdad95b881cd95a5e9d5c994819985a5b195960621b6044820152606401610bc8565b604080516001600160a01b038c811682528b81166020830152818301859052891660608201526080810183905290517f298637f684da70674f26509b10f07ec2fbc77a335ab1e7d6215a4b2484d8bb529181900360a00190a16005546040516347ef3b3b60e01b81523060048201526001600160a01b0389811660248301528c811660448301528b811660648301526084820185905260a48201849052909116906347ef3b3b9060c4015f604051808303815f87803b15801561502c575f80fd5b505af115801561503e573d5f803e3d5ffd5b505f925061504a915050565b95509093505050505b94509492505050565b5f805f80612970868661513d565b5f6150be826040518060400160405280602081526020017f5361666545524332303a206c6f772d6c6576656c2063616c6c206661696c6564815250856001600160a01b03166151aa9092919063ffffffff16565b905080515f14806150de5750808060200190518101906150de9190615818565b6135d35760405162461bcd60e51b815260206004820152602a60248201527f5361666545524332303a204552433230206f7065726174696f6e20646964206e6044820152691bdd081cdd58d8d9595960b21b6064820152608401610bc8565b5f61515360405180602001604052805f81525090565b5f80615167670de0b6b3a76400008761475f565b90925090505f82600381111561517f5761517f615799565b1461519d575060408051602081019091525f815290925090506129a9565b6129a281865f0151613b49565b6060610ee684845f85855f80866001600160a01b031685876040516151cf9190615b9e565b5f6040518083038185875af1925050503d805f8114615209576040519150601f19603f3d011682016040523d82523d5f602084013e61520e565b606091505b50915091506135b187838387606083156152885782515f03615281576001600160a01b0385163b6152815760405162461bcd60e51b815260206004820152601d60248201527f416464726573733a2063616c6c20746f206e6f6e2d636f6e74726163740000006044820152606401610bc8565b5081610ee6565b610ee6838381511561529d5781518083602001fd5b8060405162461bcd60e51b8152600401610bc89190615316565b6040805160c08101909152805f81526020015f81526020015f81526020015f81526020015f81526020015f81525090565b5f81518084528060208401602086015e5f602082860101526020601f19601f83011685010191505092915050565b602081525f610d8360208301846152e8565b6001600160a01b03811681146111d2575f80fd5b5f806040838503121561534d575f80fd5b823561535881615328565b946020939093013593505050565b5f60208284031215615376575f80fd5b8135610d8381615328565b5f60208284031215615391575f80fd5b5035919050565b634e487b7160e01b5f52604160045260245ffd5b5f67ffffffffffffffff808411156153c6576153c6615398565b604051601f8501601f19908116603f011681019082821181831017156153ee576153ee615398565b81604052809350858152868686011115615406575f80fd5b858560208301375f602087830101525050509392505050565b5f82601f83011261542e575f80fd5b610d83838335602085016153ac565b803560ff8116811461544d575f80fd5b919050565b5f805f805f805f60e0888a031215615468575f80fd5b873561547381615328565b9650602088013561548381615328565b9550604088013561549381615328565b945060608801359350608088013567ffffffffffffffff808211156154b6575f80fd5b6154c28b838c0161541f565b945060a08a01359150808211156154d7575f80fd5b506154e48a828b0161541f565b9250506154f360c0890161543d565b905092959891949750929550565b5f805f60608486031215615513575f80fd5b833561551e81615328565b9250602084013561552e81615328565b929592945050506040919091013590565b5f8060408385031215615550575f80fd5b50508035926020909101359150565b5f6020828403121561556f575f80fd5b813567ffffffffffffffff811115615585575f80fd5b8201601f81018413615595575f80fd5b610ee6848235602084016153ac565b5f805f805f8060c087890312156155b9575f80fd5b86356155c481615328565b955060208701356155d481615328565b945060408701359350606087013567ffffffffffffffff808211156155f7575f80fd5b6156038a838b0161541f565b94506080890135915080821115615618575f80fd5b5061562589828a0161541f565b92505061563460a0880161543d565b90509295509295509295565b5f8060408385031215615651575f80fd5b823561565c81615328565b9150602083013561566c81615328565b809150509250929050565b5f805f805f6080868803121561568b575f80fd5b853561569681615328565b945060208601356156a681615328565b935060408601359250606086013567ffffffffffffffff808211156156c9575f80fd5b818801915088601f8301126156dc575f80fd5b8135818111156156ea575f80fd5b8960208285010111156156fb575f80fd5b9699959850939650602001949392505050565b5f805f60608486031215615720575f80fd5b833561572b81615328565b925060208401359150604084013561574281615328565b809150509250925092565b600181811c9082168061576157607f821691505b602082108103612b6557634e487b7160e01b5f52602260045260245ffd5b6001600160a01b0392831681529116602082015260400190565b634e487b7160e01b5f52602160045260245ffd5b6020808252600a90820152691c994b595b9d195c995960b21b604082015260600190565b6020808252601690820152751858d8dc9d59481a5b9d195c995cdd0819985a5b195960521b604082015260600190565b5f60208284031215615811575f80fd5b5051919050565b5f60208284031215615828575f80fd5b81518015158114610d83575f80fd5b60208082526018908201527f6e6f7420616e20617070726f7665642064656c65676174650000000000000000604082015260600190565b6001600160a01b039384168152919092166020820152604081019190915260600190565b601f8211156135d357805f5260205f20601f840160051c810160208510156158b75750805b601f840160051c820191505b818110156158d6575f81556001016158c3565b5050505050565b815167ffffffffffffffff8111156158f7576158f7615398565b61590b81615905845461574d565b84615892565b602080601f83116001811461593e575f84156159275750858301515b5f19600386901b1c1916600185901b178555615995565b5f85815260208120601f198616915b8281101561596c5788860151825594840194600190910190840161594d565b508582101561598957878501515f19600388901b60f8161c191681555b505060018460011b0185555b505050505050565b634e487b7160e01b5f52601160045260245ffd5b80820180821115610a5557610a5561599d565b6001600160a01b03878116825260208201879052604082018690528416606082015260a06080820181905281018290525f828460c08401375f60c0848401015260c0601f19601f8501168301019050979650505050505050565b81810381811115610a5557610a5561599d565b6001600160a01b038481168252831660208201526060810160038310615a6557634e487b7160e01b5f52602160045260245ffd5b826040830152949350505050565b6001600160a01b039485168152928416602084015292166040820152606081019190915260800190565b6001600160a01b03831681526040602082018190525f90610ee6908301846152e8565b6001600160a01b039586168152938516602085015291841660408401529092166060820152608081019190915260a00190565b6001600160a01b0394909416845260208401929092526040830152606082015260800190565b5f60208284031215615b29575f80fd5b8151610d8381615328565b6001600160a01b0394851681529290931660208301526040820152606081019190915260800190565b5f82615b7757634e487b7160e01b5f52601260045260245ffd5b500490565b5f8060408385031215615b8d575f80fd5b505080516020909101519092909150565b5f82518060208501845e5f92019182525091905056fe7365745265647563655265736572766573426c6f636b44656c74612875696e7432353629736574466c6173684c6f616e4665654d616e74697373612875696e743235362c75696e7432353629ddf252ad1be2c89b69c2b068fc378daa952ba7f163c4a11628f55a4df523b3efa26469706673582212202ce591fb2eaf3d6ba9279e37f4546bf79309125aaf4b0adfd7a96d3d2010280664736f6c63430008190033",
  "devdoc": {
    "author": "Venus",
    "events": {
      "Failure(uint256,uint256,uint256)": {
        "details": "`error` corresponds to enum Error; `info` corresponds to enum FailureInfo, and `detail` is an arbitrary contract-specific code that enables us to report opaque error codes from upgradeable contracts.*"
      }
    },
    "kind": "dev",
    "methods": {
      "_acceptAdmin()": {
        "details": "Admin function for pending admin to accept role and update admin",
        "returns": {
          "_0": "uint Returns 0 on success, otherwise returns a failure code (see ErrorReporter.sol for details)."
        }
      },
      "_addReserves(uint256)": {
        "params": {
          "addAmount": "The amount of underlying tokens to add as reserves"
        },
        "returns": {
          "_0": "uint Returns 0 on success, otherwise returns a failure code (see ErrorReporter.sol for details)."
        }
      },
      "_becomeImplementation(bytes)": {
        "params": {
          "data": "The encoded bytes data for any initialization"
        }
      },
      "_reduceReserves(uint256)": {
        "params": {
          "reduceAmount_": "Amount of reduction to reserves"
        },
        "returns": {
          "_0": "uint Returns 0 on success, otherwise returns a failure code (see ErrorReporter.sol for details)."
        }
      },
      "_setComptroller(address)": {
        "details": "Admin function to set a new comptroller",
        "returns": {
          "_0": "uint Returns 0 on success, otherwise returns a failure code (see ErrorReporter.sol for details)."
        }
      },
      "_setInterestRateModel(address)": {
        "details": "Governance function to accrue interest and update the interest rate model",
        "params": {
          "newInterestRateModel_": "The new interest rate model to use"
        },
        "returns": {
          "_0": "uint Returns 0 on success, otherwise returns a failure code (see ErrorReporter.sol for details)."
        }
      },
      "_setPendingAdmin(address)": {
        "details": "Admin function to begin change of admin. The newPendingAdmin must call `_acceptAdmin` to finalize the transfer.",
        "params": {
          "newPendingAdmin": "New pending admin."
        },
        "returns": {
          "_0": "uint Returns 0 on success, otherwise returns a failure code (see ErrorReporter.sol for details)."
        }
      },
      "_setReserveFactor(uint256)": {
        "details": "Governor function to accrue interest and set a new reserve factor",
        "returns": {
          "_0": "uint Returns 0 on success, otherwise returns a failure code (see ErrorReporter.sol for details)."
        }
      },
      "accrueInterest()": {
        "details": "This calculates interest accrued from the last checkpointed block up to the current block and writes new checkpoint to storage and reduce spread reserves to protocol share reserve if currentBlock - reduceReservesBlockNumber >= blockDelta"
      },
      "allowance(address,address)": {
        "params": {
          "owner": "The address of the account which owns the tokens to be spent",
          "spender": "The address of the account which may transfer tokens"
        },
        "returns": {
          "_0": "The number of tokens allowed to be spent (type(uint256).max means infinite)"
        }
      },
      "approve(address,uint256)": {
        "details": "This will overwrite the approval amount for `spender`  and is subject to issues noted [here](https://eips.ethereum.org/EIPS/eip-20#approve)",
        "params": {
          "amount": "The number of tokens that are approved (type(uint256).max means infinite)",
          "spender": "The address of the account which may transfer tokens"
        },
        "returns": {
          "_0": "Whether or not the approval succeeded"
        }
      },
      "balanceOf(address)": {
        "params": {
          "owner": "The address of the account to query"
        },
        "returns": {
          "_0": "The number of tokens owned by `owner`"
        }
      },
      "balanceOfUnderlying(address)": {
        "details": "This also accrues interest in a transaction",
        "params": {
          "owner": "The address of the account to query"
        },
        "returns": {
          "_0": "The amount of underlying owned by `owner`"
        }
      },
      "borrow(uint256)": {
        "params": {
          "borrowAmount": "The amount of the underlying asset to borrow"
        },
        "returns": {
          "_0": "uint Returns 0 on success, otherwise returns a failure code (see ErrorReporter.sol for details)."
        }
      },
      "borrowBalanceCurrent(address)": {
        "params": {
          "account": "The address whose balance should be calculated after updating borrowIndex"
        },
        "returns": {
          "_0": "The calculated balance"
        }
      },
      "borrowBalanceStored(address)": {
        "params": {
          "account": "The address whose balance should be calculated"
        },
        "returns": {
          "_0": "The calculated balance"
        }
      },
      "borrowBehalf(address,uint256)": {
        "params": {
          "borrowAmount": "The amount of the underlying asset to borrow",
          "borrower": "The borrower, on behalf of whom to borrow."
        },
        "returns": {
          "_0": "uint Returns 0 on success, otherwise returns a failure code (see ErrorReporter.sol for details)."
        }
      },
      "borrowDebtPosition(address,uint256)": {
        "custom:error": "InvalidComptroller is thrown if the caller is not the Comptroller.",
        "details": "This function checks if the borrow is allowed, accrues interest, and updates the borrower's balance.      It also emits a Borrow event and calls the comptroller's borrowVerify function.      It reverts if the borrow is not allowed, if the market's block number is not current, or if the protocol has insufficient cash.",
        "params": {
          "borrowAmount": "The amount of underlying asset to borrow",
          "borrower": "The address of the borrower"
        },
        "returns": {
          "_0": "uint Returns 0 on success, otherwise returns a failure code (see ErrorReporter.sol for details)."
        }
      },
      "borrowRatePerBlock()": {
        "returns": {
          "_0": "The borrow interest rate per block, scaled by 1e18"
        }
      },
      "calculateFlashLoanFee(uint256)": {
        "params": {
          "amount": "The amount of the flash loan."
        },
        "returns": {
          "_0": "totalFee The total fee for the flash loan.",
          "_1": "protocolFee The portion of the total fee allocated to the protocol."
        }
      },
      "exchangeRateCurrent()": {
        "returns": {
          "_0": "Calculated exchange rate scaled by 1e18"
        }
      },
      "exchangeRateStored()": {
        "details": "This function does not accrue interest before calculating the exchange rate",
        "returns": {
          "_0": "Calculated exchange rate scaled by 1e18"
        }
      },
      "executeFlashLoan(address,address,uint256,bytes)": {
        "custom:error": "FlashLoanNotEnabled is thrown if flash loans are disabled for the asset.SenderNotAuthorized is thrown if the initiator is not authorized to execute flash loan.ExecuteFlashLoanFailed is thrown if the receiver contract fails to execute the operation.InsufficientRepayment is thrown if the repayment (amount + fee) is insufficient after the operation.",
        "custom:event": "Emits FlashLoanExecuted event on success",
        "details": "Transfers the amount to the receiver contract and ensures that the total repayment (amount + fee)      is returned by the receiver contract after the operation. The function performs checks to ensure the validity      of parameters, that flashLoan is enabled for the given asset, and that the total repayment is sufficient.      Reverts on invalid parameters, disabled flashLoans, or insufficient repayment.      requirements      - The `receiver` address must not be the zero address.      - FlashLoans must be enabled for the asset.      - The `receiver` contract must repay the loan with the appropriate fee.",
        "params": {
          "amount": "The amount of asset to be loaned.",
          "initiator": "The address that initiated the flash loan.",
          "param": "Additional encoded parameters passed with the flash loan.",
          "receiver": "The address of the contract that will receive the flashLoan and execute the operation."
        }
      },
      "getAccountSnapshot(address)": {
        "details": "This is used by comptroller to more efficiently perform liquidity checks.",
        "params": {
          "account": "Address of the account to snapshot"
        },
        "returns": {
          "_0": "(possible error, token balance, borrow balance, exchange rate mantissa)"
        }
      },
      "getCash()": {
        "returns": {
          "_0": "The quantity of underlying asset owned by this contract"
        }
      },
      "initialize(address,address,address,uint256,string,string,uint8)": {
        "params": {
          "comptroller_": "The address of the Comptroller",
          "decimals_": "BEP-20 decimal precision of this token",
          "initialExchangeRateMantissa_": "The initial exchange rate, scaled by 1e18",
          "interestRateModel_": "The address of the interest rate model",
          "name_": "BEP-20 name of this token",
          "symbol_": "BEP-20 symbol of this token",
          "underlying_": "The address of the underlying asset"
        }
      },
      "initialize(address,address,uint256,string,string,uint8)": {
        "params": {
          "comptroller_": "The address of the Comptroller",
          "decimals_": "EIP-20 decimal precision of this token",
          "initialExchangeRateMantissa_": "The initial exchange rate, scaled by 1e18",
          "interestRateModel_": "The address of the interest rate model",
          "name_": "EIP-20 name of this token",
          "symbol_": "EIP-20 symbol of this token"
        }
      },
      "liquidateBorrow(address,uint256,address)": {
        "params": {
          "borrower": "The borrower of this vToken to be liquidated",
          "repayAmount": "The amount of the underlying borrowed asset to repay",
          "vTokenCollateral": "The market in which to seize collateral from the borrower"
        },
        "returns": {
          "_0": "uint Returns 0 on success, otherwise returns a failure code (see ErrorReporter.sol for details)."
        }
      },
      "mint(uint256)": {
        "details": "Accrues interest whether or not the operation succeeds, unless reverted",
        "params": {
          "mintAmount": "The amount of the underlying asset to supply"
        },
        "returns": {
          "_0": "uint Returns 0 on success, otherwise returns a failure code (see ErrorReporter.sol for details)."
        }
      },
      "mintBehalf(address,uint256)": {
        "details": "Accrues interest whether or not the operation succeeds, unless reverted",
        "params": {
          "mintAmount": "The amount of the underlying asset to supply",
          "receiver": "The account which is receiving the vTokens"
        },
        "returns": {
          "_0": "uint Returns 0 on success, otherwise returns a failure code (see ErrorReporter.sol for details)."
        }
      },
      "redeem(uint256)": {
        "details": "Accrues interest whether or not the operation succeeds, unless reverted",
        "params": {
          "redeemTokens": "The number of vTokens to redeem into underlying"
        },
        "returns": {
          "_0": "uint Returns 0 on success, otherwise returns a failure code (see ErrorReporter.sol for details)."
        }
      },
      "redeemBehalf(address,uint256)": {
        "details": "Accrues interest whether or not the operation succeeds, unless reverted",
        "params": {
          "redeemTokens": "The number of vTokens to redeem into underlying",
          "redeemer": "The user on behalf of whom to redeem"
        },
        "returns": {
          "_0": "uint Returns 0 on success, otherwise returns a failure code (see ErrorReporter.sol for details)."
        }
      },
      "redeemUnderlying(uint256)": {
        "details": "Accrues interest whether or not the operation succeeds, unless reverted",
        "params": {
          "redeemAmount": "The amount of underlying to redeem"
        },
        "returns": {
          "_0": "uint Returns 0 on success, otherwise returns a failure code (see ErrorReporter.sol for details)."
        }
      },
      "redeemUnderlyingBehalf(address,uint256)": {
        "details": "Accrues interest whether or not the operation succeeds, unless reverted",
        "params": {
          "redeemAmount": "The amount of underlying to receive from redeeming vTokens",
          "redeemer": ", on behalf of whom to redeem"
        },
        "returns": {
          "_0": "uint Returns 0 on success, otherwise returns a failure code (see ErrorReporter.sol for details)."
        }
      },
      "repayBorrow(uint256)": {
        "params": {
          "repayAmount": "The amount to repay"
        },
        "returns": {
          "_0": "uint Returns 0 on success, otherwise returns a failure code (see ErrorReporter.sol for details)."
        }
      },
      "repayBorrowBehalf(address,uint256)": {
        "params": {
          "borrower": "The account with the debt being payed off",
          "repayAmount": "The amount to repay"
        },
        "returns": {
          "_0": "uint Returns 0 on success, otherwise returns a failure code (see ErrorReporter.sol for details)."
        }
      },
      "seize(address,address,uint256)": {
        "details": "Will fail unless called by another vToken during the process of liquidation.  Its absolutely critical to use msg.sender as the borrowed vToken and not a parameter.",
        "params": {
          "borrower": "The account having collateral seized",
          "liquidator": "The account receiving seized collateral",
          "seizeTokens": "The number of vTokens to seize"
        },
        "returns": {
          "_0": "uint Returns 0 on success, otherwise returns a failure code (see ErrorReporter.sol for details)."
        }
      },
      "setAccessControlManager(address)": {
        "details": "Admin function to set the access control address",
        "params": {
          "newAccessControlManagerAddress": "New address for the access control"
        },
        "returns": {
          "_0": "uint 0=success, otherwise will revert"
        }
      },
      "setFlashLoanFeeMantissa(uint256,uint256)": {
        "custom:access": "Only Governance",
        "custom:event": "Emits FlashLoanFeeUpdated event on success",
        "params": {
          "flashLoanFeeMantissa_": "FlashLoan fee, scaled by 1e18",
          "flashLoanProtocolShare_": "FlashLoan protocol fee share, transferred to protocol share reserve"
        },
        "returns": {
          "_0": "uint Returns 0 on success, otherwise returns a failure code (see ErrorReporter.sol for details)."
        }
      },
      "setProtocolShareReserve(address)": {
        "params": {
          "protcolShareReserve_": "The address of protocol share reserve contract"
        }
      },
      "setReduceReservesBlockDelta(uint256)": {
        "params": {
          "newReduceReservesBlockDelta_": "block difference value"
        }
      },
      "supplyRatePerBlock()": {
        "returns": {
          "_0": "The supply interest rate per block, scaled by 1e18"
        }
      },
      "toggleFlashLoan()": {
        "custom:access": "Only Governance",
        "custom:event": "Emits ToggleFlashLoanEnabled event on success"
      },
      "totalBorrowsCurrent()": {
        "returns": {
          "_0": "The total borrows with interest"
        }
      },
      "transfer(address,uint256)": {
        "params": {
          "amount": "The number of tokens to transfer",
          "dst": "The address of the destination account"
        },
        "returns": {
          "_0": "Whether or not the transfer succeeded"
        }
      },
      "transferFrom(address,address,uint256)": {
        "params": {
          "amount": "The number of tokens to transfer",
          "dst": "The address of the destination account",
          "src": "The address of the source account"
        },
        "returns": {
          "_0": "Whether or not the transfer succeeded"
        }
      },
      "transferInUnderlyingAndVerify(address,uint256)": {
        "custom:error": "InvalidComptroller is thrown if the caller is not the Comptroller.",
        "custom:event": "Emits TransferInUnderlyingAndVerify event on successful transfer of amount from the receiver to the vToken",
        "details": "Can only be called by the Comptroller contract. This function performs the actual transfer of the underlying      asset by calling the `doTransferIn` internal function.      - The caller must be the Comptroller contract.",
        "params": {
          "amountRepayed": "The amount of the underlying asset to transfer.",
          "from": "The address from which the underlying asset is to be transferred."
        }
      },
      "transferOutUnderlying(address,uint256)": {
        "custom:error": "InvalidComptroller is thrown if the caller is not the Comptroller.",
        "custom:event": "Emits TransferOutUnderlying event on successful transfer of amount to receiver",
        "details": "Can only be called by the Comptroller contract. This function performs the actual transfer of the underlying      asset by calling the `doTransferOut` internal function.      - The caller must be the Comptroller contract.      - If the `to` address is not the protocol share reserve, the flashLoanAmount is incremented by the amount transferred out.",
        "params": {
          "amount": "The amount of the underlying asset to transfer.",
          "to": "The address to which the underlying asset is to be transferred."
        },
        "returns": {
          "balanceBeforeRepayFlashloan": "Cash balance after transfer out for comparison in flash loan verification."
        }
      }
    },
    "title": "Venus's VBep20Delegate Contract",
    "version": 1
  },
  "userdoc": {
    "events": {
      "AccrueInterest(uint256,uint256,uint256,uint256)": {
        "notice": "Event emitted when interest is accrued"
      },
      "Approval(address,address,uint256)": {
        "notice": "EIP20 Approval event"
      },
      "Borrow(address,uint256,uint256,uint256)": {
        "notice": "Event emitted when underlying is borrowed"
      },
      "FlashLoanExecuted(address,address,uint256)": {
        "notice": "Event emitted when flashLoan is executed"
      },
      "FlashLoanFeeUpdated(uint256,uint256,uint256,uint256)": {
        "notice": "Event emitted when flashLoan fee mantissa is updated"
      },
      "LiquidateBorrow(address,address,uint256,address,uint256)": {
        "notice": "Event emitted when a borrow is liquidated"
      },
      "Mint(address,uint256,uint256,uint256)": {
        "notice": "Event emitted when tokens are minted"
      },
      "MintBehalf(address,address,uint256,uint256,uint256)": {
        "notice": "Event emitted when tokens are minted behalf by payer to receiver"
      },
      "NewAccessControlManager(address,address)": {
        "notice": "Emitted when access control address is changed by admin"
      },
      "NewAdmin(address,address)": {
        "notice": "Event emitted when pendingAdmin is accepted, which means admin has been updated"
      },
      "NewComptroller(address,address)": {
        "notice": "Event emitted when comptroller is changed"
      },
      "NewMarketInterestRateModel(address,address)": {
        "notice": "Event emitted when interestRateModel is changed"
      },
      "NewPendingAdmin(address,address)": {
        "notice": "Event emitted when pendingAdmin is changed"
      },
      "NewProtocolShareReserve(address,address)": {
        "notice": "Event emitted when address of ProtocolShareReserve contract get updated"
      },
      "NewReduceReservesBlockDelta(uint256,uint256)": {
        "notice": "Event emitted when block delta for reduce reserves get updated"
      },
      "NewReserveFactor(uint256,uint256)": {
        "notice": "Event emitted when the reserve factor is changed"
      },
      "Redeem(address,uint256,uint256,uint256)": {
        "notice": "Event emitted when tokens are redeemed"
      },
      "RedeemFee(address,uint256,uint256)": {
        "notice": "Event emitted when tokens are redeemed and fee is transferred"
      },
      "RepayBorrow(address,address,uint256,uint256,uint256)": {
        "notice": "Event emitted when a borrow is repaid"
      },
      "ReservesAdded(address,uint256,uint256)": {
        "notice": "Event emitted when the reserves are added"
      },
      "ReservesReduced(address,uint256,uint256)": {
        "notice": "Event emitted when the reserves are reduced"
      },
      "ToggleFlashLoanEnabled(bool,bool)": {
        "notice": "Event emitted when flashLoanEnabled status is changed"
      },
      "Transfer(address,address,uint256)": {
        "notice": "EIP20 Transfer event"
      },
      "TransferInUnderlyingAndVerify(address,address,uint256)": {
        "notice": "Event emitted when asset is transferred from sender and verified"
      },
      "TransferOutUnderlying(address,address,uint256)": {
        "notice": "Event emitted when asset is transferred to receiver"
      }
    },
    "kind": "user",
    "methods": {
      "_acceptAdmin()": {
        "notice": "Accepts transfer of admin rights. msg.sender must be pendingAdmin"
      },
      "_addReserves(uint256)": {
        "notice": "The sender adds to reserves."
      },
      "_becomeImplementation(bytes)": {
        "notice": "Called by the delegator on a delegate to initialize it for duty"
      },
      "_reduceReserves(uint256)": {
        "notice": "Accrues interest and reduces reserves by transferring to protocol share reserve"
      },
      "_resignImplementation()": {
        "notice": "Called by the delegator on a delegate to forfeit its responsibility"
      },
      "_setComptroller(address)": {
        "notice": "Sets a new comptroller for the market"
      },
      "_setInterestRateModel(address)": {
        "notice": "Accrues interest and updates the interest rate model using _setInterestRateModelFresh"
      },
      "_setPendingAdmin(address)": {
        "notice": "Begins transfer of admin rights. The newPendingAdmin must call `_acceptAdmin` to finalize the transfer."
      },
      "_setReserveFactor(uint256)": {
        "notice": "accrues interest and sets a new reserve factor for the protocol using `_setReserveFactorFresh`"
      },
      "accessControlManager()": {
        "notice": "address of accessControlManager"
      },
      "accrualBlockNumber()": {
        "notice": "Block number that interest was last accrued at"
      },
      "accrueInterest()": {
        "notice": "Applies accrued interest to total borrows and reserves"
      },
      "admin()": {
        "notice": "Administrator for this contract"
      },
      "allowance(address,address)": {
        "notice": "Get the current allowance from `owner` for `spender`"
      },
      "approve(address,uint256)": {
        "notice": "Approve `spender` to transfer up to `amount` from `src`"
      },
      "balanceOf(address)": {
        "notice": "Get the token balance of the `owner`"
      },
      "balanceOfUnderlying(address)": {
        "notice": "Get the underlying balance of the `owner`"
      },
      "borrow(uint256)": {
        "notice": "Sender borrows assets from the protocol to their own address"
      },
      "borrowBalanceCurrent(address)": {
        "notice": "Accrue interest to updated borrowIndex and then calculate account's borrow balance using the updated borrowIndex"
      },
      "borrowBalanceStored(address)": {
        "notice": "Return the borrow balance of account based on stored data"
      },
      "borrowBehalf(address,uint256)": {
        "notice": "Sender borrows assets on behalf of some other address. This function is only available   for senders, explicitly marked as delegates of the borrower using `comptroller.updateDelegate`"
      },
      "borrowDebtPosition(address,uint256)": {
        "notice": "open a debt position for the borrower"
      },
      "borrowIndex()": {
        "notice": "Accumulator of the total earned interest rate since the opening of the market"
      },
      "borrowRatePerBlock()": {
        "notice": "Returns the current per-block borrow interest rate for this vToken"
      },
      "calculateFlashLoanFee(uint256)": {
        "notice": "Calculates the total fee and protocol fee for a flash loan.."
      },
      "comptroller()": {
        "notice": "Contract which oversees inter-vToken operations"
      },
      "constructor": {
        "notice": "Construct an empty delegate"
      },
      "decimals()": {
        "notice": "EIP-20 token decimals for this token"
      },
      "exchangeRateCurrent()": {
        "notice": "Accrue interest then return the up-to-date exchange rate"
      },
      "exchangeRateStored()": {
        "notice": "Calculates the exchange rate from the underlying to the VToken"
      },
      "executeFlashLoan(address,address,uint256,bytes)": {
        "notice": "Executes a flashLoan operation."
      },
      "flashLoanAmount()": {
        "notice": "Amount of flashLoan taken by the receiver"
      },
      "flashLoanFeeMantissa()": {
        "notice": "total fee percentage collected on flashLoan (scaled by 1e18)"
      },
      "flashLoanProtocolShareMantissa()": {
        "notice": "fee percentage of flashLoan that goes to protocol (scaled by 1e18)"
      },
      "getAccountSnapshot(address)": {
        "notice": "Get a snapshot of the account's balances, and the cached exchange rate"
      },
      "getCash()": {
        "notice": "Get cash balance of this vToken in the underlying asset"
      },
      "implementation()": {
        "notice": "Implementation address for this contract"
      },
      "initialize(address,address,address,uint256,string,string,uint8)": {
        "notice": "Initialize the new money market"
      },
      "initialize(address,address,uint256,string,string,uint8)": {
        "notice": "Initialize the money market"
      },
      "interestRateModel()": {
        "notice": "Model which tells what the current interest rate should be"
      },
      "isFlashLoanEnabled()": {
        "notice": "flashLoan is enabled for this market or not"
      },
      "isVToken()": {
        "notice": "Indicator that this is a vToken contract (for inspection)"
      },
      "liquidateBorrow(address,uint256,address)": {
        "notice": "The sender liquidates the borrowers collateral.  The collateral seized is transferred to the liquidator."
      },
      "mint(uint256)": {
        "notice": "Sender supplies assets into the market and receives vTokens in exchange"
      },
      "mintBehalf(address,uint256)": {
        "notice": "Sender supplies assets into the market and receiver receives vTokens in exchange"
      },
      "name()": {
        "notice": "EIP-20 token name for this token"
      },
      "pendingAdmin()": {
        "notice": "Pending administrator for this contract"
      },
      "protocolShareReserve()": {
        "notice": "address of protocol share reserve contract"
      },
      "redeem(uint256)": {
        "notice": "Sender redeems vTokens in exchange for the underlying asset"
      },
      "redeemBehalf(address,uint256)": {
        "notice": "Sender redeems assets on behalf of some other address. This function is only available   for senders, explicitly marked as delegates of the supplier using `comptroller.updateDelegate`"
      },
      "redeemUnderlying(uint256)": {
        "notice": "Sender redeems vTokens in exchange for a specified amount of underlying asset"
      },
      "redeemUnderlyingBehalf(address,uint256)": {
        "notice": "Sender redeems underlying assets on behalf of some other address. This function is only available   for senders, explicitly marked as delegates of the supplier using `comptroller.updateDelegate`"
      },
      "reduceReservesBlockDelta()": {
        "notice": "delta block after which reserves will be reduced"
      },
      "reduceReservesBlockNumber()": {
        "notice": "last block number at which reserves were reduced"
      },
      "repayBorrow(uint256)": {
        "notice": "Sender repays their own borrow"
      },
      "repayBorrowBehalf(address,uint256)": {
        "notice": "Sender repays a borrow belonging to another borrowing account"
      },
      "reserveFactorMantissa()": {
        "notice": "Fraction of interest currently set aside for reserves"
      },
      "seize(address,address,uint256)": {
        "notice": "Transfers collateral tokens (this market) to the liquidator."
      },
      "setAccessControlManager(address)": {
        "notice": "Sets the address of the access control manager of this contract"
      },
      "setFlashLoanFeeMantissa(uint256,uint256)": {
        "notice": "Update flashLoan fee mantissa"
      },
      "setProtocolShareReserve(address)": {
        "notice": "Sets protocol share reserve contract address"
      },
      "setReduceReservesBlockDelta(uint256)": {
        "notice": "Governance function to set new threshold of block difference after which funds will be sent to the protocol share reserve"
      },
      "supplyRatePerBlock()": {
        "notice": "Returns the current per-block supply interest rate for this vToken"
      },
      "symbol()": {
        "notice": "EIP-20 token symbol for this token"
      },
      "toggleFlashLoan()": {
        "notice": "Enables or disables flash loan for the market"
      },
      "totalBorrows()": {
        "notice": "Total amount of outstanding borrows of the underlying in this market"
      },
      "totalBorrowsCurrent()": {
        "notice": "Returns the current total borrows plus accrued interest"
      },
      "totalReserves()": {
        "notice": "Total amount of reserves of the underlying held in this market"
      },
      "totalSupply()": {
        "notice": "Total number of tokens in circulation"
      },
      "transfer(address,uint256)": {
        "notice": "Transfer `amount` tokens from `msg.sender` to `dst`"
      },
      "transferFrom(address,address,uint256)": {
        "notice": "Transfer `amount` tokens from `src` to `dst`"
      },
      "transferInUnderlyingAndVerify(address,uint256)": {
        "notice": "Transfers the underlying asset from the specified address."
      },
      "transferOutUnderlying(address,uint256)": {
        "notice": "Transfers the underlying asset to the specified address."
      },
      "underlying()": {
        "notice": "Underlying asset for this VToken"
      }
    },
    "notice": "VTokens which wrap an EIP-20 underlying and are delegated to",
    "version": 1
  },
  "storageLayout": {
    "storage": [
      {
        "astId": 32069,
        "contract": "contracts/Tokens/VTokens/VBep20Delegate.sol:VBep20Delegate",
        "label": "_notEntered",
        "offset": 0,
        "slot": "0",
        "type": "t_bool"
      },
      {
        "astId": 32072,
        "contract": "contracts/Tokens/VTokens/VBep20Delegate.sol:VBep20Delegate",
        "label": "name",
        "offset": 0,
        "slot": "1",
        "type": "t_string_storage"
      },
      {
        "astId": 32075,
        "contract": "contracts/Tokens/VTokens/VBep20Delegate.sol:VBep20Delegate",
        "label": "symbol",
        "offset": 0,
        "slot": "2",
        "type": "t_string_storage"
      },
      {
        "astId": 32078,
        "contract": "contracts/Tokens/VTokens/VBep20Delegate.sol:VBep20Delegate",
        "label": "decimals",
        "offset": 0,
        "slot": "3",
        "type": "t_uint8"
      },
      {
        "astId": 32089,
        "contract": "contracts/Tokens/VTokens/VBep20Delegate.sol:VBep20Delegate",
        "label": "admin",
        "offset": 1,
        "slot": "3",
        "type": "t_address_payable"
      },
      {
        "astId": 32092,
        "contract": "contracts/Tokens/VTokens/VBep20Delegate.sol:VBep20Delegate",
        "label": "pendingAdmin",
        "offset": 0,
        "slot": "4",
        "type": "t_address_payable"
      },
      {
        "astId": 32096,
        "contract": "contracts/Tokens/VTokens/VBep20Delegate.sol:VBep20Delegate",
        "label": "comptroller",
        "offset": 0,
        "slot": "5",
        "type": "t_contract(ComptrollerInterface)1537"
      },
      {
        "astId": 32100,
        "contract": "contracts/Tokens/VTokens/VBep20Delegate.sol:VBep20Delegate",
        "label": "interestRateModel",
        "offset": 0,
        "slot": "6",
        "type": "t_contract(InterestRateModelV8)19321"
      },
      {
        "astId": 32103,
        "contract": "contracts/Tokens/VTokens/VBep20Delegate.sol:VBep20Delegate",
        "label": "initialExchangeRateMantissa",
        "offset": 0,
        "slot": "7",
        "type": "t_uint256"
      },
      {
        "astId": 32106,
        "contract": "contracts/Tokens/VTokens/VBep20Delegate.sol:VBep20Delegate",
        "label": "reserveFactorMantissa",
        "offset": 0,
        "slot": "8",
        "type": "t_uint256"
      },
      {
        "astId": 32109,
        "contract": "contracts/Tokens/VTokens/VBep20Delegate.sol:VBep20Delegate",
        "label": "accrualBlockNumber",
        "offset": 0,
        "slot": "9",
        "type": "t_uint256"
      },
      {
        "astId": 32112,
        "contract": "contracts/Tokens/VTokens/VBep20Delegate.sol:VBep20Delegate",
        "label": "borrowIndex",
        "offset": 0,
        "slot": "10",
        "type": "t_uint256"
      },
      {
        "astId": 32115,
        "contract": "contracts/Tokens/VTokens/VBep20Delegate.sol:VBep20Delegate",
        "label": "totalBorrows",
        "offset": 0,
        "slot": "11",
        "type": "t_uint256"
      },
      {
        "astId": 32118,
        "contract": "contracts/Tokens/VTokens/VBep20Delegate.sol:VBep20Delegate",
        "label": "totalReserves",
        "offset": 0,
        "slot": "12",
        "type": "t_uint256"
      },
      {
        "astId": 32121,
        "contract": "contracts/Tokens/VTokens/VBep20Delegate.sol:VBep20Delegate",
        "label": "totalSupply",
        "offset": 0,
        "slot": "13",
        "type": "t_uint256"
      },
      {
        "astId": 32126,
        "contract": "contracts/Tokens/VTokens/VBep20Delegate.sol:VBep20Delegate",
        "label": "accountTokens",
        "offset": 0,
        "slot": "14",
        "type": "t_mapping(t_address,t_uint256)"
      },
      {
        "astId": 32133,
        "contract": "contracts/Tokens/VTokens/VBep20Delegate.sol:VBep20Delegate",
        "label": "transferAllowances",
        "offset": 0,
        "slot": "15",
        "type": "t_mapping(t_address,t_mapping(t_address,t_uint256))"
      },
      {
        "astId": 32139,
        "contract": "contracts/Tokens/VTokens/VBep20Delegate.sol:VBep20Delegate",
        "label": "accountBorrows",
        "offset": 0,
        "slot": "16",
        "type": "t_mapping(t_address,t_struct(BorrowSnapshot)32066_storage)"
      },
      {
        "astId": 32142,
        "contract": "contracts/Tokens/VTokens/VBep20Delegate.sol:VBep20Delegate",
        "label": "underlying",
        "offset": 0,
        "slot": "17",
        "type": "t_address"
      },
      {
        "astId": 32145,
        "contract": "contracts/Tokens/VTokens/VBep20Delegate.sol:VBep20Delegate",
        "label": "implementation",
        "offset": 0,
        "slot": "18",
        "type": "t_address"
      },
      {
        "astId": 32148,
        "contract": "contracts/Tokens/VTokens/VBep20Delegate.sol:VBep20Delegate",
        "label": "reduceReservesBlockDelta",
        "offset": 0,
        "slot": "19",
        "type": "t_uint256"
      },
      {
        "astId": 32151,
        "contract": "contracts/Tokens/VTokens/VBep20Delegate.sol:VBep20Delegate",
        "label": "reduceReservesBlockNumber",
        "offset": 0,
        "slot": "20",
        "type": "t_uint256"
      },
      {
        "astId": 32154,
        "contract": "contracts/Tokens/VTokens/VBep20Delegate.sol:VBep20Delegate",
        "label": "protocolShareReserve",
        "offset": 0,
        "slot": "21",
        "type": "t_address_payable"
      },
      {
        "astId": 32157,
        "contract": "contracts/Tokens/VTokens/VBep20Delegate.sol:VBep20Delegate",
        "label": "accessControlManager",
        "offset": 0,
        "slot": "22",
        "type": "t_address"
      },
      {
        "astId": 32163,
        "contract": "contracts/Tokens/VTokens/VBep20Delegate.sol:VBep20Delegate",
        "label": "isFlashLoanEnabled",
        "offset": 20,
        "slot": "22",
        "type": "t_bool"
      },
      {
        "astId": 32166,
        "contract": "contracts/Tokens/VTokens/VBep20Delegate.sol:VBep20Delegate",
        "label": "flashLoanFeeMantissa",
        "offset": 0,
        "slot": "23",
        "type": "t_uint256"
      },
      {
        "astId": 32169,
        "contract": "contracts/Tokens/VTokens/VBep20Delegate.sol:VBep20Delegate",
        "label": "flashLoanProtocolShareMantissa",
        "offset": 0,
        "slot": "24",
        "type": "t_uint256"
      },
      {
        "astId": 32172,
        "contract": "contracts/Tokens/VTokens/VBep20Delegate.sol:VBep20Delegate",
        "label": "flashLoanAmount",
        "offset": 0,
        "slot": "25",
        "type": "t_uint256"
      },
      {
        "astId": 32177,
        "contract": "contracts/Tokens/VTokens/VBep20Delegate.sol:VBep20Delegate",
        "label": "__gap",
        "offset": 0,
        "slot": "26",
        "type": "t_array(t_uint256)46_storage"
      }
    ],
    "types": {
      "t_address": {
        "encoding": "inplace",
        "label": "address",
        "numberOfBytes": "20"
      },
      "t_address_payable": {
        "encoding": "inplace",
        "label": "address payable",
        "numberOfBytes": "20"
      },
      "t_array(t_uint256)46_storage": {
        "base": "t_uint256",
        "encoding": "inplace",
        "label": "uint256[46]",
        "numberOfBytes": "1472"
      },
      "t_bool": {
        "encoding": "inplace",
        "label": "bool",
        "numberOfBytes": "1"
      },
      "t_contract(ComptrollerInterface)1537": {
        "encoding": "inplace",
        "label": "contract ComptrollerInterface",
        "numberOfBytes": "20"
      },
      "t_contract(InterestRateModelV8)19321": {
        "encoding": "inplace",
        "label": "contract InterestRateModelV8",
        "numberOfBytes": "20"
      },
      "t_mapping(t_address,t_mapping(t_address,t_uint256))": {
        "encoding": "mapping",
        "key": "t_address",
        "label": "mapping(address => mapping(address => uint256))",
        "numberOfBytes": "32",
        "value": "t_mapping(t_address,t_uint256)"
      },
      "t_mapping(t_address,t_struct(BorrowSnapshot)32066_storage)": {
        "encoding": "mapping",
        "key": "t_address",
        "label": "mapping(address => struct VTokenStorageBase.BorrowSnapshot)",
        "numberOfBytes": "32",
        "value": "t_struct(BorrowSnapshot)32066_storage"
      },
      "t_mapping(t_address,t_uint256)": {
        "encoding": "mapping",
        "key": "t_address",
        "label": "mapping(address => uint256)",
        "numberOfBytes": "32",
        "value": "t_uint256"
      },
      "t_string_storage": {
        "encoding": "bytes",
        "label": "string",
        "numberOfBytes": "32"
      },
      "t_struct(BorrowSnapshot)32066_storage": {
        "encoding": "inplace",
        "label": "struct VTokenStorageBase.BorrowSnapshot",
        "members": [
          {
            "astId": 32063,
            "contract": "contracts/Tokens/VTokens/VBep20Delegate.sol:VBep20Delegate",
            "label": "principal",
            "offset": 0,
            "slot": "0",
            "type": "t_uint256"
          },
          {
            "astId": 32065,
            "contract": "contracts/Tokens/VTokens/VBep20Delegate.sol:VBep20Delegate",
            "label": "interestIndex",
            "offset": 0,
            "slot": "1",
            "type": "t_uint256"
          }
        ],
        "numberOfBytes": "64"
      },
      "t_uint256": {
        "encoding": "inplace",
        "label": "uint256",
        "numberOfBytes": "32"
      },
      "t_uint8": {
        "encoding": "inplace",
        "label": "uint8",
        "numberOfBytes": "1"
      }
    }
  }
}